[
  {
    "id": "50354730766",
    "owner": "54968894@N00",
    "title": "2G8A7007",
    "realname": "Sammi Fang",
    "ownername": "sammifang",
    "datetaken": "2020-09-16 18:30:44",
    "max_width": 5464,
    "max_height": 8192,
    "url_max": "https://live.staticflickr.com/65535/50354730766_c0f03efd88_o.jpg?s=eyJpIjo1MDM1NDczMDc2NiwiZSI6MTc2NDcxMjg0MSwicyI6IjUxNGM2MzAzZTg1MTVjMTkzZTI2MDI1OTUyZDViZGZjOTJmZjQwZGQiLCJ2IjoxfQ",
    "max_width_2000": 1366,
    "max_height_2000": 2048,
    "url_max_2000": "https://live.staticflickr.com/65535/50354730766_32e85336ae_k.jpg?s=eyJpIjo1MDM1NDczMDc2NiwiZSI6MTc2NDcxMjg0MSwicyI6IjU3NTA3Mjg4YWQyOWRhMTc3MjIwYWYyYTg3ZTcwNWQzMGZiZmJjMDUiLCJ2IjoxfQ",
    "flickr_page": "https://www.flickr.com/photos/54968894@N00/50354730766",
    "count_view": "3963"
  },
  {
    "id": "50329013586",
    "owner": "54968894@N00",
    "title": "",
    "realname": "Sammi Fang",
    "ownername": "sammifang",
    "datetaken": "2020-07-29 09:40:18",
    "max_width": 9600,
    "max_height": 2160,
    "url_max": "https://live.staticflickr.com/65535/50329013586_235ef926b8_o.jpg?s=eyJpIjo1MDMyOTAxMzU4NiwiZSI6MTc2NDcxMjg0MSwicyI6ImNhZDBiZmYyNzM4YmQ3ZTgzNjhjNjgwNzIyY2FjYmNiYTcwYzkxMGQiLCJ2IjoxfQ",
    "max_width_2000": 1600,
    "max_height_2000": 360,
    "url_max_2000": "https://live.staticflickr.com/65535/50329013586_d61e9be3d3_h.jpg?s=eyJpIjo1MDMyOTAxMzU4NiwiZSI6MTc2NDcxMjg0MSwicyI6IjM0OTA5ODliM2U1MGYxMzA0MDhhNDMyNWFjYjhiYzM0MWQ5ZmNjNTIiLCJ2IjoxfQ",
    "flickr_page": "https://www.flickr.com/photos/54968894@N00/50329013586",
    "count_view": "735"
  },
  {
    "id": "1193452921",
    "owner": "54968894@N00",
    "title": "09/09/2006 16:10",
    "realname": "Sammi Fang",
    "ownername": "sammifang",
    "datetaken": "2006-09-09 16:10:13",
    "max_width": 4000,
    "max_height": 2666,
    "url_max": "https://live.staticflickr.com/1104/1193452921_b553e03bf5_4k.jpg?s=eyJpIjoxMTkzNDUyOTIxLCJlIjoxNzY0NzIyMTkwLCJzIjoiN2FkMTRlNjJlM2MzYjIxZTBhYTYyODgwMDY1NmQzMTg1ODlmYWNhZSIsInYiOjF9",
    "max_width_2000": 1600,
    "max_height_2000": 1066,
    "url_max_2000": "https://live.staticflickr.com/1104/1193452921_931aa1e063_h.jpg?s=eyJpIjoxMTkzNDUyOTIxLCJlIjoxNzY0NzIyMTkwLCJzIjoiZGQ0NjBjMmNmZDEyMzZmOThjZGM5YjJkMmY4MzU1YmQ0YzE0NDA0ZCIsInYiOjF9",
    "flickr_page": "https://www.flickr.com/photos/54968894@N00/1193452921",
    "count_view": "273"
  },
  {
    "id": "1193953100",
    "owner": "54968894@N00",
    "title": "04/09/2006 17:02",
    "realname": "Sammi Fang",
    "ownername": "sammifang",
    "datetaken": "2006-09-04 17:02:28",
    "max_width": 4372,
    "max_height": 2906,
    "url_max": "https://live.staticflickr.com/1083/1193953100_0a71a18dd0_o.jpg?s=eyJpIjoxMTkzOTUzMTAwLCJlIjoxNzY0NzIyMTkwLCJzIjoiYTk2NDUyMGM0MDc3YTgyNjllYTQwMTJkMTYwNTYyNmFmOWMxZTA0ZSIsInYiOjF9",
    "max_width_2000": 1600,
    "max_height_2000": 1063,
    "url_max_2000": "https://live.staticflickr.com/1083/1193953100_dafc081290_h.jpg?s=eyJpIjoxMTkzOTUzMTAwLCJlIjoxNzY0NzIyMTkwLCJzIjoiMjlmZTllNWQ2YWY5NWZjMTg1YWQ0ZmE0YzJjODFjODcwOTMzN2E0OSIsInYiOjF9",
    "flickr_page": "https://www.flickr.com/photos/54968894@N00/1193953100",
    "count_view": "27"
  },
  {
    "id": "1193700734",
    "owner": "54968894@N00",
    "title": "03/09/2006 15:39",
    "realname": "Sammi Fang",
    "ownername": "sammifang",
    "datetaken": "2006-09-03 15:39:39",
    "max_width": 4000,
    "max_height": 2666,
    "url_max": "https://live.staticflickr.com/1369/1193700734_2cced85a03_4k.jpg?s=eyJpIjoxMTkzNzAwNzM0LCJlIjoxNzY0NzIyMTkwLCJzIjoiMzUxMDEyZjE1ODkyMDZhMThiYmRiNjBlN2EyNWFjMzFmNWMxZTdmOCIsInYiOjF9",
    "max_width_2000": 1600,
    "max_height_2000": 1066,
    "url_max_2000": "https://live.staticflickr.com/1369/1193700734_01788b355b_h.jpg?s=eyJpIjoxMTkzNzAwNzM0LCJlIjoxNzY0NzIyMTkwLCJzIjoiZDQ4MzYxNmE3NmI5MWFkMGI5N2E4MzFiNmExZWYwNDg1NWM1YWNkNiIsInYiOjF9",
    "flickr_page": "https://www.flickr.com/photos/54968894@N00/1193700734",
    "count_view": "45"
  },
  {
    "id": "1192666257",
    "owner": "54968894@N00",
    "title": "03/09/2006 13:30",
    "realname": "Sammi Fang",
    "ownername": "sammifang",
    "datetaken": "2006-09-03 13:30:41",
    "max_width": 2666,
    "max_height": 4000,
    "url_max": "https://live.staticflickr.com/1084/1192666257_cf9cca3867_4k.jpg?s=eyJpIjoxMTkyNjY2MjU3LCJlIjoxNzY0NzIyMTkwLCJzIjoiZjA1ZDhjYzhiNGRhZDk2MmNhZDU0ZWUzMWVjMTUyZGY1ZDM3MTRhZiIsInYiOjF9",
    "max_width_2000": 1365,
    "max_height_2000": 2048,
    "url_max_2000": "https://live.staticflickr.com/1084/1192666257_b6d7d8948a_k.jpg?s=eyJpIjoxMTkyNjY2MjU3LCJlIjoxNzY0NzIyMTkwLCJzIjoiMWNjMjdmMGMxZDI5ZGZkMGFjN2E4OTJiYjVjN2U1YjJhNTA2YmNmMSIsInYiOjF9",
    "flickr_page": "https://www.flickr.com/photos/54968894@N00/1192666257",
    "count_view": "51"
  },
  {
    "id": "1192613805",
    "owner": "54968894@N00",
    "title": "03/09/2006 15:23",
    "realname": "Sammi Fang",
    "ownername": "sammifang",
    "datetaken": "2006-09-03 15:23:35",
    "max_width": 2666,
    "max_height": 4000,
    "url_max": "https://live.staticflickr.com/1412/1192613805_301d6c978a_4k.jpg?s=eyJpIjoxMTkyNjEzODA1LCJlIjoxNzY0NzIyMTkwLCJzIjoiNjRmNTA3NTdhYzlmY2FlZTQyYjZmNmFkMWY3NDAwNjgyYmM1Mzc2ZCIsInYiOjF9",
    "max_width_2000": 1365,
    "max_height_2000": 2048,
    "url_max_2000": "https://live.staticflickr.com/1412/1192613805_26d0580e8b_k.jpg?s=eyJpIjoxMTkyNjEzODA1LCJlIjoxNzY0NzIyMTkwLCJzIjoiODc0ZGRlNmMxZjM4OTgwM2U1MTVlYWIxOTZlZTUzZjFhMGNiZjlhMiIsInYiOjF9",
    "flickr_page": "https://www.flickr.com/photos/54968894@N00/1192613805",
    "count_view": "55"
  },
  {
    "id": "1192533571",
    "owner": "54968894@N00",
    "title": "03/09/2006 14:39",
    "realname": "Sammi Fang",
    "ownername": "sammifang",
    "datetaken": "2006-09-03 14:39:32",
    "max_width": 4000,
    "max_height": 2666,
    "url_max": "https://live.staticflickr.com/1015/1192533571_022739d359_4k.jpg?s=eyJpIjoxMTkyNTMzNTcxLCJlIjoxNzY0NzIyMTkwLCJzIjoiZjAzYWY5ZGM3ZDBlNDFhYWJjZWE3MDc3OGFlNjMyYTZmMmMxMjM3ZSIsInYiOjF9",
    "max_width_2000": 1600,
    "max_height_2000": 1066,
    "url_max_2000": "https://live.staticflickr.com/1015/1192533571_ce9bff9f87_h.jpg?s=eyJpIjoxMTkyNTMzNTcxLCJlIjoxNzY0NzIyMTkwLCJzIjoiNzY2YmU5YmYxM2FmNjVmODk4MTMzMzIyMzhlMzk4MDAzMmQ1OTRiOSIsInYiOjF9",
    "flickr_page": "https://www.flickr.com/photos/54968894@N00/1192533571",
    "count_view": "26"
  },
  {
    "id": "1193380156",
    "owner": "54968894@N00",
    "title": "03/09/2006 14:35",
    "realname": "Sammi Fang",
    "ownername": "sammifang",
    "datetaken": "2006-09-03 14:35:53",
    "max_width": 4000,
    "max_height": 2666,
    "url_max": "https://live.staticflickr.com/1058/1193380156_a58f121337_4k.jpg?s=eyJpIjoxMTkzMzgwMTU2LCJlIjoxNzY0NzIyMTkwLCJzIjoiYWU5NTA2ZGJmNzBmNmM0NGQ3YzUxMDdiZjY0YTRkNTkxZWJkMDdhOCIsInYiOjF9",
    "max_width_2000": 1600,
    "max_height_2000": 1066,
    "url_max_2000": "https://live.staticflickr.com/1058/1193380156_adc4bfc383_h.jpg?s=eyJpIjoxMTkzMzgwMTU2LCJlIjoxNzY0NzIyMTkwLCJzIjoiZTM5MWY0MGI0YmVlNTlkMzY5NTQwNTAwMzE3ZjdlNDQyYmQwNDE4OSIsInYiOjF9",
    "flickr_page": "https://www.flickr.com/photos/54968894@N00/1193380156",
    "count_view": "29"
  },
  {
    "id": "1193308640",
    "owner": "54968894@N00",
    "title": "03/09/2006 13:57",
    "realname": "Sammi Fang",
    "ownername": "sammifang",
    "datetaken": "2006-09-03 13:57:52",
    "max_width": 4000,
    "max_height": 2666,
    "url_max": "https://live.staticflickr.com/1223/1193308640_03deacf632_4k.jpg?s=eyJpIjoxMTkzMzA4NjQwLCJlIjoxNzY0NzIyMTkwLCJzIjoiM2JlNWZlNDQzZDdiM2JkMDEwZjRjYmY1M2ZhYWMwOGVjMzFmYTQzYiIsInYiOjF9",
    "max_width_2000": 1600,
    "max_height_2000": 1066,
    "url_max_2000": "https://live.staticflickr.com/1223/1193308640_c8f5800bfe_h.jpg?s=eyJpIjoxMTkzMzA4NjQwLCJlIjoxNzY0NzIyMTkwLCJzIjoiMTQyNmRiNWRkNGM1M2Y5ZDZhNTViOGIxN2FlOWNjZWNlNGM5MGMwMyIsInYiOjF9",
    "flickr_page": "https://www.flickr.com/photos/54968894@N00/1193308640",
    "count_view": "32"
  },
  {
    "id": "1192391045",
    "owner": "54968894@N00",
    "title": "03/09/2006 13:33",
    "realname": "Sammi Fang",
    "ownername": "sammifang",
    "datetaken": "2006-09-03 13:33:20",
    "max_width": 2666,
    "max_height": 4000,
    "url_max": "https://live.staticflickr.com/1284/1192391045_76525e151c_4k.jpg?s=eyJpIjoxMTkyMzkxMDQ1LCJlIjoxNzY0NzIyMTkwLCJzIjoiZGU0OGFlMzBlOTNkMDAyNzcwZTFiZGU5M2YzYmQ4NDc0Yzc1OTRmNSIsInYiOjF9",
    "max_width_2000": 1365,
    "max_height_2000": 2048,
    "url_max_2000": "https://live.staticflickr.com/1284/1192391045_57b87c7437_k.jpg?s=eyJpIjoxMTkyMzkxMDQ1LCJlIjoxNzY0NzIyMTkwLCJzIjoiYzEyNDJkODIzYTJjMzhmNWE3YTI3YzRjMWE4ZGM0MmQ1YzM0NzczMSIsInYiOjF9",
    "flickr_page": "https://www.flickr.com/photos/54968894@N00/1192391045",
    "count_view": "393"
  },
  {
    "id": "1192215701",
    "owner": "54968894@N00",
    "title": "31/08/2006 17:20",
    "realname": "Sammi Fang",
    "ownername": "sammifang",
    "datetaken": "2006-08-31 17:20:36",
    "max_width": 4000,
    "max_height": 2666,
    "url_max": "https://live.staticflickr.com/1405/1192215701_9d534f4bf9_4k.jpg?s=eyJpIjoxMTkyMjE1NzAxLCJlIjoxNzY0NzIyMTkwLCJzIjoiZDNiMGUwMDIzNjU0MmY4ZmI2ZjAxZTZjOTEwZDdmZDIyMGIyODYzYSIsInYiOjF9",
    "max_width_2000": 1600,
    "max_height_2000": 1066,
    "url_max_2000": "https://live.staticflickr.com/1405/1192215701_7cb724ca31_h.jpg?s=eyJpIjoxMTkyMjE1NzAxLCJlIjoxNzY0NzIyMTkwLCJzIjoiYjk5MGIyNDZjMWI4Yjk0MGMwNTliNWY0MDg3MTg2MjA2Nzg3YTAwOCIsInYiOjF9",
    "flickr_page": "https://www.flickr.com/photos/54968894@N00/1192215701",
    "count_view": "21"
  },
  {
    "id": "1191992639",
    "owner": "54968894@N00",
    "title": "29/08/2006 14:21",
    "realname": "Sammi Fang",
    "ownername": "sammifang",
    "datetaken": "2006-08-29 14:21:36",
    "max_width": 4000,
    "max_height": 2666,
    "url_max": "https://live.staticflickr.com/1211/1191992639_7844bc902c_4k.jpg?s=eyJpIjoxMTkxOTkyNjM5LCJlIjoxNzY0NzIyMTkwLCJzIjoiNTkxNmNkYWZiZDQ4ZTdkYWMzMjlkZWZjYTY2YmUzZGI4ODRjODM4ZiIsInYiOjF9",
    "max_width_2000": 1600,
    "max_height_2000": 1066,
    "url_max_2000": "https://live.staticflickr.com/1211/1191992639_b4be88244f_h.jpg?s=eyJpIjoxMTkxOTkyNjM5LCJlIjoxNzY0NzIyMTkwLCJzIjoiZjRiZjk2MTVkYTdlM2M2ZGI3YjcyOTJjM2Q3ODk1ZWM3Mzc0OGQ3OSIsInYiOjF9",
    "flickr_page": "https://www.flickr.com/photos/54968894@N00/1191992639",
    "count_view": "84"
  },
  {
    "id": "1192836658",
    "owner": "54968894@N00",
    "title": "29/08/2006 14:16",
    "realname": "Sammi Fang",
    "ownername": "sammifang",
    "datetaken": "2006-08-29 14:16:26",
    "max_width": 2666,
    "max_height": 4000,
    "url_max": "https://live.staticflickr.com/1088/1192836658_181d76c879_4k.jpg?s=eyJpIjoxMTkyODM2NjU4LCJlIjoxNzY0NzIyMTkwLCJzIjoiMDA5OTA5MjI0MmE2ZDE0ODg4NmYyZWU5Y2Y3NTk2YzI5ZTUwMzVmNyIsInYiOjF9",
    "max_width_2000": 1365,
    "max_height_2000": 2048,
    "url_max_2000": "https://live.staticflickr.com/1088/1192836658_14d3f481a8_k.jpg?s=eyJpIjoxMTkyODM2NjU4LCJlIjoxNzY0NzIyMTkwLCJzIjoiYTg0ZWEwODlmOTc2Y2E3MGE3Y2UyMGIxNWZhNmYyMmRhZjQ0ZDllOSIsInYiOjF9",
    "flickr_page": "https://www.flickr.com/photos/54968894@N00/1192836658",
    "count_view": "324"
  },
  {
    "id": "1165826044",
    "owner": "54968894@N00",
    "title": "11/09/2006 15:48",
    "realname": "Sammi Fang",
    "ownername": "sammifang",
    "datetaken": "2006-09-11 15:48:19",
    "max_width": 4000,
    "max_height": 2666,
    "url_max": "https://live.staticflickr.com/1160/1165826044_2f559b1878_4k.jpg?s=eyJpIjoxMTY1ODI2MDQ0LCJlIjoxNzY0NzIyMTk0LCJzIjoiN2QwMDYwNWEzOWYxNWI3MjEyNGRlOTlkZDBmOWE3MDU2MDI4ZTgxYiIsInYiOjF9",
    "max_width_2000": 1600,
    "max_height_2000": 1066,
    "url_max_2000": "https://live.staticflickr.com/1160/1165826044_fe92a9a8da_h.jpg?s=eyJpIjoxMTY1ODI2MDQ0LCJlIjoxNzY0NzIyMTk0LCJzIjoiNGRmNTkzZGU2MWM4NDg2MjYzZjBmNGIyMGUwMmU0YTAxNTM4NzRiNCIsInYiOjF9",
    "flickr_page": "https://www.flickr.com/photos/54968894@N00/1165826044",
    "count_view": "25"
  },
  {
    "id": "1164961079",
    "owner": "54968894@N00",
    "title": "11/09/2006 15:47",
    "realname": "Sammi Fang",
    "ownername": "sammifang",
    "datetaken": "2006-09-11 15:47:33",
    "max_width": 4000,
    "max_height": 2666,
    "url_max": "https://live.staticflickr.com/1136/1164961079_ab99612e71_4k.jpg?s=eyJpIjoxMTY0OTYxMDc5LCJlIjoxNzY0NzIyMTk0LCJzIjoiMTgwNzQ2NzY4Nzc4ZTY2NTJmZGE1MjliZmE0Mjk2M2Y0YWYyZmQ0ZCIsInYiOjF9",
    "max_width_2000": 1600,
    "max_height_2000": 1066,
    "url_max_2000": "https://live.staticflickr.com/1136/1164961079_92c1254455_h.jpg?s=eyJpIjoxMTY0OTYxMDc5LCJlIjoxNzY0NzIyMTk0LCJzIjoiYzJjYzYyZDNlMjQwMzcxNzE5YjQ0M2MxODkyZTQ5NmM3OGJmZjZmOSIsInYiOjF9",
    "flickr_page": "https://www.flickr.com/photos/54968894@N00/1164961079",
    "count_view": "26"
  },
  {
    "id": "1164952973",
    "owner": "54968894@N00",
    "title": "11/09/2006 15:46",
    "realname": "Sammi Fang",
    "ownername": "sammifang",
    "datetaken": "2006-09-11 15:46:35",
    "max_width": 2666,
    "max_height": 4000,
    "url_max": "https://live.staticflickr.com/1102/1164952973_77ee20a978_4k.jpg?s=eyJpIjoxMTY0OTUyOTczLCJlIjoxNzY0NzIyMTk0LCJzIjoiYzRmODEwZmRiZDc0MDk4YmRmOWMwZmJmYTBhMzM2MTU1Y2UxNGU2ZCIsInYiOjF9",
    "max_width_2000": 1365,
    "max_height_2000": 2048,
    "url_max_2000": "https://live.staticflickr.com/1102/1164952973_b09956ff9e_k.jpg?s=eyJpIjoxMTY0OTUyOTczLCJlIjoxNzY0NzIyMTk0LCJzIjoiMDQ4MTNmNWNlMmM4MzAzZTg4NDUxYzkxZjY2MTFhYzFhZjYxZGU0ZCIsInYiOjF9",
    "flickr_page": "https://www.flickr.com/photos/54968894@N00/1164952973",
    "count_view": "27"
  },
  {
    "id": "1164944457",
    "owner": "54968894@N00",
    "title": "11/09/2006 15:46",
    "realname": "Sammi Fang",
    "ownername": "sammifang",
    "datetaken": "2006-09-11 15:46:08",
    "max_width": 4000,
    "max_height": 2666,
    "url_max": "https://live.staticflickr.com/1256/1164944457_81702c39b5_4k.jpg?s=eyJpIjoxMTY0OTQ0NDU3LCJlIjoxNzY0NzIyMTk0LCJzIjoiOTUxMjViNTQwMWI0NzcwYWMzMTgyOGE1MGMyN2NiMjhmMmE0ZmNhMiIsInYiOjF9",
    "max_width_2000": 1600,
    "max_height_2000": 1066,
    "url_max_2000": "https://live.staticflickr.com/1256/1164944457_c2a2c24522_h.jpg?s=eyJpIjoxMTY0OTQ0NDU3LCJlIjoxNzY0NzIyMTk0LCJzIjoiNWFjZTYyMjkxMTRjZDAzMjcyODUyMWFlYWM5MTIxNjdlNDgwYzBiMyIsInYiOjF9",
    "flickr_page": "https://www.flickr.com/photos/54968894@N00/1164944457",
    "count_view": "29"
  },
  {
    "id": "1165788984",
    "owner": "54968894@N00",
    "title": "11/09/2006 15:46",
    "realname": "Sammi Fang",
    "ownername": "sammifang",
    "datetaken": "2006-09-11 15:46:00",
    "max_width": 4000,
    "max_height": 2666,
    "url_max": "https://live.staticflickr.com/1434/1165788984_1aa001e66d_4k.jpg?s=eyJpIjoxMTY1Nzg4OTg0LCJlIjoxNzY0NzIyMTk1LCJzIjoiNDU4NzJiOWRiZjBjNTkyZjhiYzUzMDFjOTQ4YTA1NDllMGUxYjRjZSIsInYiOjF9",
    "max_width_2000": 1600,
    "max_height_2000": 1066,
    "url_max_2000": "https://live.staticflickr.com/1434/1165788984_2fb59a04e6_h.jpg?s=eyJpIjoxMTY1Nzg4OTg0LCJlIjoxNzY0NzIyMTk1LCJzIjoiYTFhZTc4NjkyMmI1ZTNlOWQxZTEzOTYyOWJhMWJjY2Y2MWU5YWEyMCIsInYiOjF9",
    "flickr_page": "https://www.flickr.com/photos/54968894@N00/1165788984",
    "count_view": "29"
  },
  {
    "id": "1164920597",
    "owner": "54968894@N00",
    "title": "11/09/2006 15:45",
    "realname": "Sammi Fang",
    "ownername": "sammifang",
    "datetaken": "2006-09-11 15:45:52",
    "max_width": 4000,
    "max_height": 2666,
    "url_max": "https://live.staticflickr.com/1113/1164920597_0f59eaf446_4k.jpg?s=eyJpIjoxMTY0OTIwNTk3LCJlIjoxNzY0NzIyMTk1LCJzIjoiNzJjMTI4Yzc2NDkzMmI4MDhhNDYxZWI3Nzg1Y2I0MTA5ZWRhMjBmNCIsInYiOjF9",
    "max_width_2000": 1600,
    "max_height_2000": 1066,
    "url_max_2000": "https://live.staticflickr.com/1113/1164920597_5dd5fd8ec7_h.jpg?s=eyJpIjoxMTY0OTIwNTk3LCJlIjoxNzY0NzIyMTk1LCJzIjoiNjdlMWJhNzUzZTgzZTNlYzFkYzZiZmVmOWQxZjVhOTMzYzZlZjM1ZCIsInYiOjF9",
    "flickr_page": "https://www.flickr.com/photos/54968894@N00/1164920597",
    "count_view": "143"
  },
  {
    "id": "1164908787",
    "owner": "54968894@N00",
    "title": "11/09/2006 15:45",
    "realname": "Sammi Fang",
    "ownername": "sammifang",
    "datetaken": "2006-09-11 15:45:40",
    "max_width": 2666,
    "max_height": 4000,
    "url_max": "https://live.staticflickr.com/1106/1164908787_f518b234d0_4k.jpg?s=eyJpIjoxMTY0OTA4Nzg3LCJlIjoxNzY0NzIyMTk1LCJzIjoiOTM1ZTgxNWNjNTAxM2E4ZTg1ZTM0ZmY2MDY4NTUxNTI3OGRiNjUwNSIsInYiOjF9",
    "max_width_2000": 1365,
    "max_height_2000": 2048,
    "url_max_2000": "https://live.staticflickr.com/1106/1164908787_660ae41526_k.jpg?s=eyJpIjoxMTY0OTA4Nzg3LCJlIjoxNzY0NzIyMTk1LCJzIjoiNzg4NDM2Yjc5ZWNlYmYzZTE4YmNkMzRmOWYxYzkxOWMxNmUwYjljYSIsInYiOjF9",
    "flickr_page": "https://www.flickr.com/photos/54968894@N00/1164908787",
    "count_view": "112"
  },
  {
    "id": "1165752892",
    "owner": "54968894@N00",
    "title": "11/09/2006 15:45",
    "realname": "Sammi Fang",
    "ownername": "sammifang",
    "datetaken": "2006-09-11 15:45:25",
    "max_width": 4000,
    "max_height": 2666,
    "url_max": "https://live.staticflickr.com/1064/1165752892_97553aba71_4k.jpg?s=eyJpIjoxMTY1NzUyODkyLCJlIjoxNzY0NzIyMTk1LCJzIjoiZTc1ODQzMjA0YjY0YTQ4NDY3Zjk2NTM2YjlhZDgyMDlhY2ZkY2U0OCIsInYiOjF9",
    "max_width_2000": 1600,
    "max_height_2000": 1066,
    "url_max_2000": "https://live.staticflickr.com/1064/1165752892_f0402c6bd3_h.jpg?s=eyJpIjoxMTY1NzUyODkyLCJlIjoxNzY0NzIyMTk1LCJzIjoiZmI3OGUwNGM3MjE5ZDkyN2VjYjg1ZGVkOGNlMzc3MDZjYTVjNmVlOSIsInYiOjF9",
    "flickr_page": "https://www.flickr.com/photos/54968894@N00/1165752892",
    "count_view": "55"
  },
  {
    "id": "1164888159",
    "owner": "54968894@N00",
    "title": "11/09/2006 15:45",
    "realname": "Sammi Fang",
    "ownername": "sammifang",
    "datetaken": "2006-09-11 15:45:09",
    "max_width": 4000,
    "max_height": 2666,
    "url_max": "https://live.staticflickr.com/1256/1164888159_021a11fb5d_4k.jpg?s=eyJpIjoxMTY0ODg4MTU5LCJlIjoxNzY0NzIyMTk1LCJzIjoiMzJkOGEyNTAyMDgzODM0NTJjMzBiNDU2ODFlNGFlOGE5OGFhZGVmNyIsInYiOjF9",
    "max_width_2000": 1600,
    "max_height_2000": 1066,
    "url_max_2000": "https://live.staticflickr.com/1256/1164888159_680464dbf6_h.jpg?s=eyJpIjoxMTY0ODg4MTU5LCJlIjoxNzY0NzIyMTk1LCJzIjoiMmY0YmNjYzAyOWJhZDc5OTg2NzdjYTAzZWU1MTAxMGRhZjE4NGI2NiIsInYiOjF9",
    "flickr_page": "https://www.flickr.com/photos/54968894@N00/1164888159",
    "count_view": "51"
  },
  {
    "id": "1164877885",
    "owner": "54968894@N00",
    "title": "11/09/2006 15:44",
    "realname": "Sammi Fang",
    "ownername": "sammifang",
    "datetaken": "2006-09-11 15:44:19",
    "max_width": 4000,
    "max_height": 2666,
    "url_max": "https://live.staticflickr.com/1417/1164877885_e5c23ef492_4k.jpg?s=eyJpIjoxMTY0ODc3ODg1LCJlIjoxNzY0NzIyMTk1LCJzIjoiZjMzOTUzZTM4ZTk3NjdmMTkzNTdkNzkwYzNmNmQwMDcxZmZiMzMyZiIsInYiOjF9",
    "max_width_2000": 1600,
    "max_height_2000": 1066,
    "url_max_2000": "https://live.staticflickr.com/1417/1164877885_0e3cec5a6c_h.jpg?s=eyJpIjoxMTY0ODc3ODg1LCJlIjoxNzY0NzIyMTk1LCJzIjoiZmNlMjdiNzJmMjQzZmY2YzAyOTBiMmExYjVmZDk4MDgwZTAxN2QwNiIsInYiOjF9",
    "flickr_page": "https://www.flickr.com/photos/54968894@N00/1164877885",
    "count_view": "25"
  },
  {
    "id": "1164868421",
    "owner": "54968894@N00",
    "title": "11/09/2006 15:44",
    "realname": "Sammi Fang",
    "ownername": "sammifang",
    "datetaken": "2006-09-11 15:44:05",
    "max_width": 4000,
    "max_height": 2666,
    "url_max": "https://live.staticflickr.com/1068/1164868421_d7932fc356_4k.jpg?s=eyJpIjoxMTY0ODY4NDIxLCJlIjoxNzY0NzIyMTk1LCJzIjoiMTcyZTRhMzFjNTFjNzllMTBkZDdjYTFhZTgzZGNmMzgyY2I4NWEwOCIsInYiOjF9",
    "max_width_2000": 1600,
    "max_height_2000": 1066,
    "url_max_2000": "https://live.staticflickr.com/1068/1164868421_f8588b40db_h.jpg?s=eyJpIjoxMTY0ODY4NDIxLCJlIjoxNzY0NzIyMTk1LCJzIjoiOTg0OGE1YzUyYWY3NDQyZDJhNzI5OGQ3YzdjNWVhYTMyZTI0M2EzZiIsInYiOjF9",
    "flickr_page": "https://www.flickr.com/photos/54968894@N00/1164868421",
    "count_view": "29"
  },
  {
    "id": "1164858441",
    "owner": "54968894@N00",
    "title": "11/09/2006 15:43",
    "realname": "Sammi Fang",
    "ownername": "sammifang",
    "datetaken": "2006-09-11 15:43:56",
    "max_width": 4000,
    "max_height": 2666,
    "url_max": "https://live.staticflickr.com/1189/1164858441_e0cba13c75_4k.jpg?s=eyJpIjoxMTY0ODU4NDQxLCJlIjoxNzY0NzIyMTk1LCJzIjoiM2YyYWJlYWIxYTM5ZjNlNWM0OWQ0ODcyYzFlYmYxOGZiMWMwMWE5YiIsInYiOjF9",
    "max_width_2000": 1600,
    "max_height_2000": 1066,
    "url_max_2000": "https://live.staticflickr.com/1189/1164858441_28bae9fab3_h.jpg?s=eyJpIjoxMTY0ODU4NDQxLCJlIjoxNzY0NzIyMTk1LCJzIjoiM2VkMjgzZDcxOGRlYzYyZjgwYjZkZTJjZmZhODgxNTlkZGQ2NzBmNyIsInYiOjF9",
    "flickr_page": "https://www.flickr.com/photos/54968894@N00/1164858441",
    "count_view": "27"
  },
  {
    "id": "1165703462",
    "owner": "54968894@N00",
    "title": "11/09/2006 15:43",
    "realname": "Sammi Fang",
    "ownername": "sammifang",
    "datetaken": "2006-09-11 15:43:35",
    "max_width": 4000,
    "max_height": 2666,
    "url_max": "https://live.staticflickr.com/1132/1165703462_02c045fb23_4k.jpg?s=eyJpIjoxMTY1NzAzNDYyLCJlIjoxNzY0NzIyMTk1LCJzIjoiZjhkMDg4ZTE4NGJmYzRjZWRlODcwYzA3NTE4NzU3ZDdkNWFjNzMzMSIsInYiOjF9",
    "max_width_2000": 1600,
    "max_height_2000": 1066,
    "url_max_2000": "https://live.staticflickr.com/1132/1165703462_83cd551e39_h.jpg?s=eyJpIjoxMTY1NzAzNDYyLCJlIjoxNzY0NzIyMTk1LCJzIjoiNDFkN2JkZmUxZTEwMTgxMTg5YjI5NjdhMGRkYjBmYWZlZDdmY2M2NCIsInYiOjF9",
    "flickr_page": "https://www.flickr.com/photos/54968894@N00/1165703462",
    "count_view": "29"
  },
  {
    "id": "1164839115",
    "owner": "54968894@N00",
    "title": "11/09/2006 15:41",
    "realname": "Sammi Fang",
    "ownername": "sammifang",
    "datetaken": "2006-09-11 15:41:26",
    "max_width": 4000,
    "max_height": 2666,
    "url_max": "https://live.staticflickr.com/1202/1164839115_c52f202a7d_4k.jpg?s=eyJpIjoxMTY0ODM5MTE1LCJlIjoxNzY0NzIyMTk1LCJzIjoiNzJkZmU1M2IxZjg4ZmZmMTA2YmQ5YjBkZjYzOTFiMjg3YjZlZWVhMCIsInYiOjF9",
    "max_width_2000": 1600,
    "max_height_2000": 1066,
    "url_max_2000": "https://live.staticflickr.com/1202/1164839115_294e3f2dcc_h.jpg?s=eyJpIjoxMTY0ODM5MTE1LCJlIjoxNzY0NzIyMTk1LCJzIjoiZWVhZTI4OTU5NGFkMmRlZGM5ZWUwYzE3ZTc4NDI0MWJmM2MxYzA4MiIsInYiOjF9",
    "flickr_page": "https://www.flickr.com/photos/54968894@N00/1164839115",
    "count_view": "24"
  },
  {
    "id": "1164830781",
    "owner": "54968894@N00",
    "title": "11/09/2006 15:40",
    "realname": "Sammi Fang",
    "ownername": "sammifang",
    "datetaken": "2006-09-11 15:40:59",
    "max_width": 4000,
    "max_height": 2666,
    "url_max": "https://live.staticflickr.com/1133/1164830781_dfdc6ed987_4k.jpg?s=eyJpIjoxMTY0ODMwNzgxLCJlIjoxNzY0NzIyMTk1LCJzIjoiMmFhYTdiNzZhNWJkMDQ1ZDYxZjE1MjM0Mzk3MWVmMmI3ZGRkMTJlOCIsInYiOjF9",
    "max_width_2000": 1600,
    "max_height_2000": 1066,
    "url_max_2000": "https://live.staticflickr.com/1133/1164830781_c06d321783_h.jpg?s=eyJpIjoxMTY0ODMwNzgxLCJlIjoxNzY0NzIyMTk1LCJzIjoiMmIxZTUwZDU5ZDkzMDljYmFmODQ4ZDQwYTA1MmQzZDYyMjY0NjljNCIsInYiOjF9",
    "flickr_page": "https://www.flickr.com/photos/54968894@N00/1164830781",
    "count_view": "26"
  },
  {
    "id": "1164820273",
    "owner": "54968894@N00",
    "title": "11/09/2006 15:40",
    "realname": "Sammi Fang",
    "ownername": "sammifang",
    "datetaken": "2006-09-11 15:40:39",
    "max_width": 4000,
    "max_height": 2666,
    "url_max": "https://live.staticflickr.com/1304/1164820273_ed101baf33_4k.jpg?s=eyJpIjoxMTY0ODIwMjczLCJlIjoxNzY0NzIyMTk1LCJzIjoiYzM3MDc3MjU3Zjk3OTZkOWQ5MmE3ODRiZWIzMWQ1MTgxYWI3YzE2NCIsInYiOjF9",
    "max_width_2000": 1600,
    "max_height_2000": 1066,
    "url_max_2000": "https://live.staticflickr.com/1304/1164820273_ec033216af_h.jpg?s=eyJpIjoxMTY0ODIwMjczLCJlIjoxNzY0NzIyMTk1LCJzIjoiNmUzMzM0ZTA1YjU4M2NmNDg5MWVkOGJiMTI2NzQ1ZDMzY2IyZDg3MCIsInYiOjF9",
    "flickr_page": "https://www.flickr.com/photos/54968894@N00/1164820273",
    "count_view": "21"
  },
  {
    "id": "1164809235",
    "owner": "54968894@N00",
    "title": "11/09/2006 15:31",
    "realname": "Sammi Fang",
    "ownername": "sammifang",
    "datetaken": "2006-09-11 15:31:56",
    "max_width": 4000,
    "max_height": 2666,
    "url_max": "https://live.staticflickr.com/1077/1164809235_90a54455d2_4k.jpg?s=eyJpIjoxMTY0ODA5MjM1LCJlIjoxNzY0NzIyMTk1LCJzIjoiNjM0ZTRkZTQ2N2FhNzQwZmY4NjQ3NWZiZmRlMzVhNmU2MDQ5ODc0NCIsInYiOjF9",
    "max_width_2000": 1600,
    "max_height_2000": 1066,
    "url_max_2000": "https://live.staticflickr.com/1077/1164809235_977862e7e9_h.jpg?s=eyJpIjoxMTY0ODA5MjM1LCJlIjoxNzY0NzIyMTk1LCJzIjoiYTQzNzY0NTU1MWI2OTIwNTVlOWZhMTY5ZGY0NjgwYmU1MjY1ODkyNyIsInYiOjF9",
    "flickr_page": "https://www.flickr.com/photos/54968894@N00/1164809235",
    "count_view": "25"
  },
  {
    "id": "1165658922",
    "owner": "54968894@N00",
    "title": "11/09/2006 15:31",
    "realname": "Sammi Fang",
    "ownername": "sammifang",
    "datetaken": "2006-09-11 15:31:43",
    "max_width": 4000,
    "max_height": 2666,
    "url_max": "https://live.staticflickr.com/1387/1165658922_834f52b587_4k.jpg?s=eyJpIjoxMTY1NjU4OTIyLCJlIjoxNzY0NzIyMTk1LCJzIjoiMTJhNTc4N2VkZTA4YWRjZmU0MjY3MjFjY2NiNjBlOTM5ODk3MjUwYSIsInYiOjF9",
    "max_width_2000": 1600,
    "max_height_2000": 1066,
    "url_max_2000": "https://live.staticflickr.com/1387/1165658922_141df9d3d2_h.jpg?s=eyJpIjoxMTY1NjU4OTIyLCJlIjoxNzY0NzIyMTk1LCJzIjoiMzMwOGM2M2RmYmIwMWQyNDliMmFkMDBmZWI3NTNkMGJkMGUzN2ZhOCIsInYiOjF9",
    "flickr_page": "https://www.flickr.com/photos/54968894@N00/1165658922",
    "count_view": "27"
  },
  {
    "id": "1164795843",
    "owner": "54968894@N00",
    "title": "11/09/2006 15:30",
    "realname": "Sammi Fang",
    "ownername": "sammifang",
    "datetaken": "2006-09-11 15:30:32",
    "max_width": 2666,
    "max_height": 4000,
    "url_max": "https://live.staticflickr.com/1095/1164795843_47f41e36e6_4k.jpg?s=eyJpIjoxMTY0Nzk1ODQzLCJlIjoxNzY0NzIyMTk1LCJzIjoiOGNhMTA4NmQxZGMwMzQxZjNiNDYyN2I1MTEwZWJhYmE1YzkzMzI1MSIsInYiOjF9",
    "max_width_2000": 1365,
    "max_height_2000": 2048,
    "url_max_2000": "https://live.staticflickr.com/1095/1164795843_9570a8081d_k.jpg?s=eyJpIjoxMTY0Nzk1ODQzLCJlIjoxNzY0NzIyMTk1LCJzIjoiZDMzNWNkMTUzMWIyOGJkMzEzYWMzNmJlMzM0NGYwMzkyNmNmMDVmMiIsInYiOjF9",
    "flickr_page": "https://www.flickr.com/photos/54968894@N00/1164795843",
    "count_view": "36"
  },
  {
    "id": "1165642520",
    "owner": "54968894@N00",
    "title": "11/09/2006 15:29",
    "realname": "Sammi Fang",
    "ownername": "sammifang",
    "datetaken": "2006-09-11 15:29:58",
    "max_width": 4000,
    "max_height": 2666,
    "url_max": "https://live.staticflickr.com/1013/1165642520_d954bf222c_4k.jpg?s=eyJpIjoxMTY1NjQyNTIwLCJlIjoxNzY0NzIyMTk1LCJzIjoiMDQ4MTYyYzFkNTQ1MDllZGEwZTZiNzkzZmY2YTZkOTgwMWM1ZWQyOSIsInYiOjF9",
    "max_width_2000": 1600,
    "max_height_2000": 1066,
    "url_max_2000": "https://live.staticflickr.com/1013/1165642520_684bf605b8_h.jpg?s=eyJpIjoxMTY1NjQyNTIwLCJlIjoxNzY0NzIyMTk1LCJzIjoiODhkYWFlZTZiN2MzMTM3ZjdhMmYwYjkzYjg3OGY0NTJhYjcwYmUzNyIsInYiOjF9",
    "flickr_page": "https://www.flickr.com/photos/54968894@N00/1165642520",
    "count_view": "22"
  },
  {
    "id": "1165635688",
    "owner": "54968894@N00",
    "title": "11/09/2006 15:29",
    "realname": "Sammi Fang",
    "ownername": "sammifang",
    "datetaken": "2006-09-11 15:29:45",
    "max_width": 4000,
    "max_height": 2666,
    "url_max": "https://live.staticflickr.com/1277/1165635688_e869088906_4k.jpg?s=eyJpIjoxMTY1NjM1Njg4LCJlIjoxNzY0NzIyMTk1LCJzIjoiNDQ4NmJlZGNlMjQ5OTU3YjBmNDAzMTUxODAyOTBkYWRiNzMwM2ViMSIsInYiOjF9",
    "max_width_2000": 1600,
    "max_height_2000": 1066,
    "url_max_2000": "https://live.staticflickr.com/1277/1165635688_c3ae6caa21_h.jpg?s=eyJpIjoxMTY1NjM1Njg4LCJlIjoxNzY0NzIyMTk1LCJzIjoiMjFmZmRkNWUxN2FjOGVkYWU3NWM0ZWRiMThiM2NlNDBmMTY5NWIxZiIsInYiOjF9",
    "flickr_page": "https://www.flickr.com/photos/54968894@N00/1165635688",
    "count_view": "32"
  },
  {
    "id": "1164774257",
    "owner": "54968894@N00",
    "title": "11/09/2006 15:29",
    "realname": "Sammi Fang",
    "ownername": "sammifang",
    "datetaken": "2006-09-11 15:29:17",
    "max_width": 4000,
    "max_height": 2666,
    "url_max": "https://live.staticflickr.com/1049/1164774257_abda72a5c5_4k.jpg?s=eyJpIjoxMTY0Nzc0MjU3LCJlIjoxNzY0NzIyMTk1LCJzIjoiN2ZhMTU1ZTJmODIxN2U0ZjI2OTQyY2IyOWY3YzE3YzdiMGFhMWY3ZCIsInYiOjF9",
    "max_width_2000": 1600,
    "max_height_2000": 1066,
    "url_max_2000": "https://live.staticflickr.com/1049/1164774257_ab5d71eeda_h.jpg?s=eyJpIjoxMTY0Nzc0MjU3LCJlIjoxNzY0NzIyMTk1LCJzIjoiNWYzNDRlNDM5NGUzMjYwMjU1ODg0N2FjZDI2OTQzODUyNWM5Yzk1ZCIsInYiOjF9",
    "flickr_page": "https://www.flickr.com/photos/54968894@N00/1164774257",
    "count_view": "27"
  },
  {
    "id": "1165592664",
    "owner": "54968894@N00",
    "title": "11/09/2006 16:12",
    "realname": "Sammi Fang",
    "ownername": "sammifang",
    "datetaken": "2006-09-11 16:12:57",
    "max_width": 2666,
    "max_height": 4000,
    "url_max": "https://live.staticflickr.com/1061/1165592664_6048aa5e84_4k.jpg?s=eyJpIjoxMTY1NTkyNjY0LCJlIjoxNzY0NzIyMTk1LCJzIjoiMTE3MThhMmVmYjNkNDM5Nzg4MzlmN2Y3M2M1YmIzMWQzMjM0N2I4ZSIsInYiOjF9",
    "max_width_2000": 1365,
    "max_height_2000": 2048,
    "url_max_2000": "https://live.staticflickr.com/1061/1165592664_75f36af8a3_k.jpg?s=eyJpIjoxMTY1NTkyNjY0LCJlIjoxNzY0NzIyMTk1LCJzIjoiMDM5NmVmMjE1NWE5ODZlM2YzODU1ODE2YmVmZTBhMWIxMTU5Yjk3ZCIsInYiOjF9",
    "flickr_page": "https://www.flickr.com/photos/54968894@N00/1165592664",
    "count_view": "31"
  },
  {
    "id": "1165582088",
    "owner": "54968894@N00",
    "title": "11/09/2006 16:03",
    "realname": "Sammi Fang",
    "ownername": "sammifang",
    "datetaken": "2006-09-11 16:03:11",
    "max_width": 2666,
    "max_height": 4000,
    "url_max": "https://live.staticflickr.com/1309/1165582088_59752ceb9b_4k.jpg?s=eyJpIjoxMTY1NTgyMDg4LCJlIjoxNzY0NzIyMTk1LCJzIjoiODkzMzIyNDRkZGQxNzMwMDFhYjYxZWI3MjNiMzgyYTQ2MDNhNTg5OCIsInYiOjF9",
    "max_width_2000": 1365,
    "max_height_2000": 2048,
    "url_max_2000": "https://live.staticflickr.com/1309/1165582088_2b571ef979_k.jpg?s=eyJpIjoxMTY1NTgyMDg4LCJlIjoxNzY0NzIyMTk1LCJzIjoiNGIxM2Q5OWU3ZjlhOWE3YmI5MGJkODk5NzdlNjUyYjk2OTQ0OWEzYyIsInYiOjF9",
    "flickr_page": "https://www.flickr.com/photos/54968894@N00/1165582088",
    "count_view": "24"
  },
  {
    "id": "1164718699",
    "owner": "54968894@N00",
    "title": "11/09/2006 15:48",
    "realname": "Sammi Fang",
    "ownername": "sammifang",
    "datetaken": "2006-09-11 15:48:57",
    "max_width": 4000,
    "max_height": 2666,
    "url_max": "https://live.staticflickr.com/1129/1164718699_3bcf902ccb_4k.jpg?s=eyJpIjoxMTY0NzE4Njk5LCJlIjoxNzY0NzIyMTk1LCJzIjoiYmIyZmUyYjk2NzAzYmUzYjBiODI0ODM4NjQ0ZTQyZGJkNjlmMDJkMyIsInYiOjF9",
    "max_width_2000": 1600,
    "max_height_2000": 1066,
    "url_max_2000": "https://live.staticflickr.com/1129/1164718699_ae6f86ae9e_h.jpg?s=eyJpIjoxMTY0NzE4Njk5LCJlIjoxNzY0NzIyMTk1LCJzIjoiNDNhMDFjZTIzNjY5Y2VlMTRlMWFmMTVmNjMwYTRlZWE3YmE3MWE0YyIsInYiOjF9",
    "flickr_page": "https://www.flickr.com/photos/54968894@N00/1164718699",
    "count_view": "26"
  },
  {
    "id": "1165558196",
    "owner": "54968894@N00",
    "title": "11/09/2006 15:48",
    "realname": "Sammi Fang",
    "ownername": "sammifang",
    "datetaken": "2006-09-11 15:48:46",
    "max_width": 4000,
    "max_height": 2666,
    "url_max": "https://live.staticflickr.com/1435/1165558196_a1f7b28fac_4k.jpg?s=eyJpIjoxMTY1NTU4MTk2LCJlIjoxNzY0NzIyMTk1LCJzIjoiYWIwMTI0MTQ0ZmNjYzg1NzY0ZWJhOGQ0ZmNkNDE4YjA1NDIzYTQ1MyIsInYiOjF9",
    "max_width_2000": 1600,
    "max_height_2000": 1066,
    "url_max_2000": "https://live.staticflickr.com/1435/1165558196_1b7e21e81b_h.jpg?s=eyJpIjoxMTY1NTU4MTk2LCJlIjoxNzY0NzIyMTk1LCJzIjoiZTY1NDY0NTczN2U4YTE1ODNkMTgyYWY5OWE0NzExYjM2YmFmMzBjNCIsInYiOjF9",
    "flickr_page": "https://www.flickr.com/photos/54968894@N00/1165558196",
    "count_view": "28"
  },
  {
    "id": "1165523322",
    "owner": "54968894@N00",
    "title": "11/09/2006 16:16",
    "realname": "Sammi Fang",
    "ownername": "sammifang",
    "datetaken": "2006-09-11 16:16:27",
    "max_width": 4368,
    "max_height": 2912,
    "url_max": "https://live.staticflickr.com/1003/1165523322_5f9d68546e_o.jpg?s=eyJpIjoxMTY1NTIzMzIyLCJlIjoxNzY0NzIyMTk1LCJzIjoiYjUzMTNkZWRmM2NlZDQ3MTI2ZmY5YTAxM2VhODI0NWViM2Q0ZDlkYiIsInYiOjF9",
    "max_width_2000": 1600,
    "max_height_2000": 1067,
    "url_max_2000": "https://live.staticflickr.com/1003/1165523322_64c1cab3c5_h.jpg?s=eyJpIjoxMTY1NTIzMzIyLCJlIjoxNzY0NzIyMTk1LCJzIjoiZTdiNjFiOTExYmJmOTRmYmYxODE3ZTY2ODJlOGQyYzZjN2FhZTllYiIsInYiOjF9",
    "flickr_page": "https://www.flickr.com/photos/54968894@N00/1165523322",
    "count_view": "20"
  },
  {
    "id": "1165452858",
    "owner": "54968894@N00",
    "title": "11/09/2006 16:07",
    "realname": "Sammi Fang",
    "ownername": "sammifang",
    "datetaken": "2006-09-11 16:07:44",
    "max_width": 4368,
    "max_height": 2912,
    "url_max": "https://live.staticflickr.com/1143/1165452858_6fcc185a09_o.jpg?s=eyJpIjoxMTY1NDUyODU4LCJlIjoxNzY0NzIyMTk1LCJzIjoiN2Y4NTAwMTZkMDA4Y2QyNGE0NzlhOTJmMjZjMDUyZmM2MWE4ZjM1ZSIsInYiOjF9",
    "max_width_2000": 1600,
    "max_height_2000": 1067,
    "url_max_2000": "https://live.staticflickr.com/1143/1165452858_1190b0c730_h.jpg?s=eyJpIjoxMTY1NDUyODU4LCJlIjoxNzY0NzIyMTk1LCJzIjoiYTZjNGRmNzYzYjkzN2RjMjNlOTY3ZWQ5N2Q2ZDg1YjM3NTgyNGJlMiIsInYiOjF9",
    "flickr_page": "https://www.flickr.com/photos/54968894@N00/1165452858",
    "count_view": "28"
  },
  {
    "id": "1164567625",
    "owner": "54968894@N00",
    "title": "11/09/2006 16:06",
    "realname": "Sammi Fang",
    "ownername": "sammifang",
    "datetaken": "2006-09-11 16:06:39",
    "max_width": 4368,
    "max_height": 2912,
    "url_max": "https://live.staticflickr.com/1244/1164567625_edd31310e5_o.jpg?s=eyJpIjoxMTY0NTY3NjI1LCJlIjoxNzY0NzIyMTk1LCJzIjoiYzFiMWMzMDE5NjMxYWUyNmJkNWViYjNkOTAzMTI0OTU4NzE3ZmU3ZCIsInYiOjF9",
    "max_width_2000": 1600,
    "max_height_2000": 1067,
    "url_max_2000": "https://live.staticflickr.com/1244/1164567625_1a2ea540d8_h.jpg?s=eyJpIjoxMTY0NTY3NjI1LCJlIjoxNzY0NzIyMTk1LCJzIjoiNTM1MDdmMzcwMDY3OTQ1M2I3ZDU5MDM3ZWJkMzE3OTY5YzI4MmFkZCIsInYiOjF9",
    "flickr_page": "https://www.flickr.com/photos/54968894@N00/1164567625",
    "count_view": "25"
  },
  {
    "id": "1165397364",
    "owner": "54968894@N00",
    "title": "11/09/2006 16:05",
    "realname": "Sammi Fang",
    "ownername": "sammifang",
    "datetaken": "2006-09-11 16:05:28",
    "max_width": 2912,
    "max_height": 4368,
    "url_max": "https://live.staticflickr.com/1014/1165397364_7bbc97da28_o.jpg?s=eyJpIjoxMTY1Mzk3MzY0LCJlIjoxNzY0NzIyMTk3LCJzIjoiOWJmNzNhMWFkZTdkZTQxM2IwN2IxNjA5YTRkMDE3MWMxZTJkMjc3YyIsInYiOjF9",
    "max_width_2000": 1365,
    "max_height_2000": 2048,
    "url_max_2000": "https://live.staticflickr.com/1014/1165397364_6c7d69df1f_k.jpg?s=eyJpIjoxMTY1Mzk3MzY0LCJlIjoxNzY0NzIyMTk3LCJzIjoiMDI0NTYwZTUyMjk2Y2NkZDEyMjMyYzBjMTYwN2M5M2IxMTUxMTIyZSIsInYiOjF9",
    "flickr_page": "https://www.flickr.com/photos/54968894@N00/1165397364",
    "count_view": "29"
  },
  {
    "id": "1164474143",
    "owner": "54968894@N00",
    "title": "11/09/2006 15:50",
    "realname": "Sammi Fang",
    "ownername": "sammifang",
    "datetaken": "2006-09-11 15:50:46",
    "max_width": 4368,
    "max_height": 2912,
    "url_max": "https://live.staticflickr.com/1405/1164474143_88f793c405_o.jpg?s=eyJpIjoxMTY0NDc0MTQzLCJlIjoxNzY0NzIyMTk3LCJzIjoiYjgwODk4YmVkYzE2MDNlZjZmYTk1ZmRjYjhkZjA3YWMxMGVhY2ExYSIsInYiOjF9",
    "max_width_2000": 1600,
    "max_height_2000": 1067,
    "url_max_2000": "https://live.staticflickr.com/1405/1164474143_db1ab1da1f_h.jpg?s=eyJpIjoxMTY0NDc0MTQzLCJlIjoxNzY0NzIyMTk3LCJzIjoiOTVmMDM1OWFhZGMwYjNmMDkxNDIyN2UyOGQ4MzRlMjliZTBmYmRhMSIsInYiOjF9",
    "flickr_page": "https://www.flickr.com/photos/54968894@N00/1164474143",
    "count_view": "50"
  },
  {
    "id": "1165304424",
    "owner": "54968894@N00",
    "title": "11/09/2006 15:49",
    "realname": "Sammi Fang",
    "ownername": "sammifang",
    "datetaken": "2006-09-11 15:49:50",
    "max_width": 4368,
    "max_height": 2912,
    "url_max": "https://live.staticflickr.com/1324/1165304424_43d125bbe5_o.jpg?s=eyJpIjoxMTY1MzA0NDI0LCJlIjoxNzY0NzIyMTk3LCJzIjoiNWY1Mzk5OTExNDNkMGY5ODU0ZGY3MjZhMThlZDk4ODc1ZjE2ZjM5NiIsInYiOjF9",
    "max_width_2000": 1600,
    "max_height_2000": 1067,
    "url_max_2000": "https://live.staticflickr.com/1324/1165304424_2a9b69ff3e_h.jpg?s=eyJpIjoxMTY1MzA0NDI0LCJlIjoxNzY0NzIyMTk3LCJzIjoiYWU1MjkyM2E2MWYyOTY5OTJmYjZkZDI4MzU1ODY2NmI2NTkyODk0YiIsInYiOjF9",
    "flickr_page": "https://www.flickr.com/photos/54968894@N00/1165304424",
    "count_view": "38"
  },
  {
    "id": "1164227741",
    "owner": "54968894@N00",
    "title": "09/09/2006 15:42",
    "realname": "Sammi Fang",
    "ownername": "sammifang",
    "datetaken": "2006-09-09 15:42:06",
    "max_width": 4368,
    "max_height": 2912,
    "url_max": "https://live.staticflickr.com/1296/1164227741_6dd2df4d24_o.jpg?s=eyJpIjoxMTY0MjI3NzQxLCJlIjoxNzY0NzIyMTk3LCJzIjoiZDcyNjQ3YTE1M2EwNjRhMTgzNjExNWQzZDA3ODIyNTYyMGJlMDM2YiIsInYiOjF9",
    "max_width_2000": 1600,
    "max_height_2000": 1067,
    "url_max_2000": "https://live.staticflickr.com/1296/1164227741_e9d6db0bca_h.jpg?s=eyJpIjoxMTY0MjI3NzQxLCJlIjoxNzY0NzIyMTk3LCJzIjoiYTYyZGRhZWMzMGRmNjIxMmQxN2FlM2I5OTFjNzRlMTVlYzg0ZjllZCIsInYiOjF9",
    "flickr_page": "https://www.flickr.com/photos/54968894@N00/1164227741",
    "count_view": "27"
  },
  {
    "id": "1164180007",
    "owner": "54968894@N00",
    "title": "09/09/2006 15:14",
    "realname": "Sammi Fang",
    "ownername": "sammifang",
    "datetaken": "2006-09-09 15:14:41",
    "max_width": 2912,
    "max_height": 4368,
    "url_max": "https://live.staticflickr.com/1188/1164180007_1e7b61b624_o.jpg?s=eyJpIjoxMTY0MTgwMDA3LCJlIjoxNzY0NzIyMTk3LCJzIjoiM2RjOTBjMDRlNGU4NjAzYmQ2OWFjOWQ2ZDBmODRiMDcwMjZjODIzYyIsInYiOjF9",
    "max_width_2000": 1365,
    "max_height_2000": 2048,
    "url_max_2000": "https://live.staticflickr.com/1188/1164180007_b790f5b368_k.jpg?s=eyJpIjoxMTY0MTgwMDA3LCJlIjoxNzY0NzIyMTk3LCJzIjoiZDlkNWY4MmFjMjI3ZDc3ZWM0MTEzMzY0OTc0NDdlMGZmOWM5MWM2MCIsInYiOjF9",
    "flickr_page": "https://www.flickr.com/photos/54968894@N00/1164180007",
    "count_view": "35"
  },
  {
    "id": "1107412900",
    "owner": "54968894@N00",
    "title": "2006-08-02 083052AM",
    "realname": "Sammi Fang",
    "ownername": "sammifang",
    "datetaken": "2006-08-02 08:30:50",
    "max_width": 4372,
    "max_height": 2906,
    "url_max": "https://live.staticflickr.com/1163/1107412900_56abc3e734_o.jpg?s=eyJpIjoxMTA3NDEyOTAwLCJlIjoxNzY0NzIyMjA0LCJzIjoiNDE2MzZhZDBkNDM3ZjI5NDgzZGY4YmEyYTEwYmRkMTYyZmU2MmEyOCIsInYiOjF9",
    "max_width_2000": 1600,
    "max_height_2000": 1063,
    "url_max_2000": "https://live.staticflickr.com/1163/1107412900_dda1c1b596_h.jpg?s=eyJpIjoxMTA3NDEyOTAwLCJlIjoxNzY0NzIyMjA0LCJzIjoiZWIzZDM4NTMyODYwNmFmNzJhNDUyNGUxOTMyMjM4YWRiNTc4Yjg3YiIsInYiOjF9",
    "flickr_page": "https://www.flickr.com/photos/54968894@N00/1107412900",
    "count_view": "278"
  },
  {
    "id": "1107162128",
    "owner": "54968894@N00",
    "title": "2006-08-02 083022AM",
    "realname": "Sammi Fang",
    "ownername": "sammifang",
    "datetaken": "2006-08-02 08:30:20",
    "max_width": 4372,
    "max_height": 2906,
    "url_max": "https://live.staticflickr.com/1173/1107162128_7cf3fc7c47_o.jpg?s=eyJpIjoxMTA3MTYyMTI4LCJlIjoxNzY0NzIyMjA0LCJzIjoiOTNjNzAxMTQzNjEwZDFjY2M3MjA3ZWMzMGQ0NTVmODg4N2I1ZmM5OSIsInYiOjF9",
    "max_width_2000": 1600,
    "max_height_2000": 1063,
    "url_max_2000": "https://live.staticflickr.com/1173/1107162128_62ddab25f3_h.jpg?s=eyJpIjoxMTA3MTYyMTI4LCJlIjoxNzY0NzIyMjA0LCJzIjoiZjk0MTNjZmM1YjdjNGQ4ZmI1M2NjYzU1OWM4OWQ1ZTBhNmJkNGExOSIsInYiOjF9",
    "flickr_page": "https://www.flickr.com/photos/54968894@N00/1107162128",
    "count_view": "31"
  },
  {
    "id": "1105847003",
    "owner": "54968894@N00",
    "title": "2006-08-02 091528AM",
    "realname": "Sammi Fang",
    "ownername": "sammifang",
    "datetaken": "2006-08-02 09:15:24",
    "max_width": 4372,
    "max_height": 2906,
    "url_max": "https://live.staticflickr.com/1387/1105847003_c5b63d94b1_o.jpg?s=eyJpIjoxMTA1ODQ3MDAzLCJlIjoxNzY0NzIyMjA0LCJzIjoiYWM4ZWFhMjA0YzI2NzdkZDdiOTc4ZDZmOGY3YjNlZGM5MGVjNTM4ZiIsInYiOjF9",
    "max_width_2000": 1600,
    "max_height_2000": 1063,
    "url_max_2000": "https://live.staticflickr.com/1387/1105847003_4e48f80dd4_h.jpg?s=eyJpIjoxMTA1ODQ3MDAzLCJlIjoxNzY0NzIyMjA0LCJzIjoiMTc0NGIzYzk4YjZkNjRjNDgxODEwZjJhZTNlZjM3ZmIwYjFlZmE0NiIsInYiOjF9",
    "flickr_page": "https://www.flickr.com/photos/54968894@N00/1105847003",
    "count_view": "32"
  },
  {
    "id": "50180210528",
    "owner": "54968894@N00",
    "title": "SHFA8403",
    "realname": "Sammi Fang",
    "ownername": "sammifang",
    "datetaken": "2020-07-27 14:55:54",
    "max_width": 4896,
    "max_height": 3264,
    "url_max": "https://live.staticflickr.com/65535/50180210528_bc14f01f10_5k.jpg?s=eyJpIjo1MDE4MDIxMDUyOCwiZSI6MTc2NDcxMjg0MiwicyI6IjhiNjg1OTcwOTM0NjVhMTYyOTI1NmRkN2Y1MTQ4MjBkMjg0YTJiMDkiLCJ2IjoxfQ",
    "max_width_2000": 1600,
    "max_height_2000": 1067,
    "url_max_2000": "https://live.staticflickr.com/65535/50180210528_fa58bd738b_h.jpg?s=eyJpIjo1MDE4MDIxMDUyOCwiZSI6MTc2NDcxMjg0MiwicyI6IjgxNzE0ZTg3NjAxMTFkOWNkNzY3MDdmNTk1ZTg1NGQwMmQ3ODhjNjUiLCJ2IjoxfQ",
    "flickr_page": "https://www.flickr.com/photos/54968894@N00/50180210528",
    "count_view": "820"
  },
  {
    "id": "50180751381",
    "owner": "54968894@N00",
    "title": "SHFA8404",
    "realname": "Sammi Fang",
    "ownername": "sammifang",
    "datetaken": "2020-07-27 14:56:18",
    "max_width": 4896,
    "max_height": 3264,
    "url_max": "https://live.staticflickr.com/65535/50180751381_313eba4ef5_5k.jpg?s=eyJpIjo1MDE4MDc1MTM4MSwiZSI6MTc2NDcxMjg0MiwicyI6IjYzZTQzNGM3MzFmY2JhZTVjMzk4NTM4ZGMzN2VhM2ZiZWEyYThkMmMiLCJ2IjoxfQ",
    "max_width_2000": 1600,
    "max_height_2000": 1067,
    "url_max_2000": "https://live.staticflickr.com/65535/50180751381_2cd440609e_h.jpg?s=eyJpIjo1MDE4MDc1MTM4MSwiZSI6MTc2NDcxMjg0MiwicyI6IjNlZjNmYjZjNmNkYWMzOTY0ODg3NmU5YjcwNWIxZjUzM2Y4YjhjNmQiLCJ2IjoxfQ",
    "flickr_page": "https://www.flickr.com/photos/54968894@N00/50180751381",
    "count_view": "811"
  },
  {
    "id": "50180751766",
    "owner": "54968894@N00",
    "title": "SHFA8405",
    "realname": "Sammi Fang",
    "ownername": "sammifang",
    "datetaken": "2020-07-27 14:58:59",
    "max_width": 4896,
    "max_height": 3264,
    "url_max": "https://live.staticflickr.com/65535/50180751766_ab62063a14_5k.jpg?s=eyJpIjo1MDE4MDc1MTc2NiwiZSI6MTc2NDcxMjg0MiwicyI6ImJhYTkxNzgxYmJjY2QyNGFiODljNTAwZjgyZWQ5NDg5YTE3MThjM2MiLCJ2IjoxfQ",
    "max_width_2000": 1600,
    "max_height_2000": 1067,
    "url_max_2000": "https://live.staticflickr.com/65535/50180751766_798b1ac01f_h.jpg?s=eyJpIjo1MDE4MDc1MTc2NiwiZSI6MTc2NDcxMjg0MiwicyI6ImE4YTI2ODYzNWUwNTZkNjU3ZWVlYjIyZjZkNTE4MWNhNGRkYTcyMmUiLCJ2IjoxfQ",
    "flickr_page": "https://www.flickr.com/photos/54968894@N00/50180751766",
    "count_view": "760"
  },
  {
    "id": "50180751906",
    "owner": "54968894@N00",
    "title": "SHFA8406",
    "realname": "Sammi Fang",
    "ownername": "sammifang",
    "datetaken": "2020-07-27 14:59:41",
    "max_width": 4896,
    "max_height": 3264,
    "url_max": "https://live.staticflickr.com/65535/50180751906_fdc38fda01_5k.jpg?s=eyJpIjo1MDE4MDc1MTkwNiwiZSI6MTc2NDcxMjg0MiwicyI6IjYyYTIxM2EzZGFhYjA5OWVmODFjYzVmZmI3NDcwMmU2OGRmOTE2NmIiLCJ2IjoxfQ",
    "max_width_2000": 1600,
    "max_height_2000": 1067,
    "url_max_2000": "https://live.staticflickr.com/65535/50180751906_9cabfb30ba_h.jpg?s=eyJpIjo1MDE4MDc1MTkwNiwiZSI6MTc2NDcxMjg0MiwicyI6IjNlNTYyNzgwY2I3ODJhOWVmYzNkNjM5ZjhlMmUxYTcyMmNmZmVlMjMiLCJ2IjoxfQ",
    "flickr_page": "https://www.flickr.com/photos/54968894@N00/50180751906",
    "count_view": "620"
  },
  {
    "id": "50181007542",
    "owner": "54968894@N00",
    "title": "SHFA8407",
    "realname": "Sammi Fang",
    "ownername": "sammifang",
    "datetaken": "2020-07-27 14:59:58",
    "max_width": 4896,
    "max_height": 3264,
    "url_max": "https://live.staticflickr.com/65535/50181007542_9e6ae6551e_5k.jpg?s=eyJpIjo1MDE4MTAwNzU0MiwiZSI6MTc2NDcxMjg0MiwicyI6ImExNTNkYzllZGRhOTRkYTBjNDAxNDQzMzFiZWRhYTQ4ZjY1MjJkNWUiLCJ2IjoxfQ",
    "max_width_2000": 1600,
    "max_height_2000": 1067,
    "url_max_2000": "https://live.staticflickr.com/65535/50181007542_92616c6ddf_h.jpg?s=eyJpIjo1MDE4MTAwNzU0MiwiZSI6MTc2NDcxMjg0MiwicyI6ImMzNTU4ZWZjYmY5YzIwZTA4Yjk5ZWZmZDdjMDAxNDU3MWU4NGQxMTMiLCJ2IjoxfQ",
    "flickr_page": "https://www.flickr.com/photos/54968894@N00/50181007542",
    "count_view": "521"
  },
  {
    "id": "50181007752",
    "owner": "54968894@N00",
    "title": "SHFA8408",
    "realname": "Sammi Fang",
    "ownername": "sammifang",
    "datetaken": "2020-07-27 15:00:56",
    "max_width": 4896,
    "max_height": 3264,
    "url_max": "https://live.staticflickr.com/65535/50181007752_488a53462f_5k.jpg?s=eyJpIjo1MDE4MTAwNzc1MiwiZSI6MTc2NDcxMjg0MiwicyI6ImM4ZTU2OWMyNzE3NGM1Yzk2ZjA5NGY2ZjEyZGMxNzc3MThlMzYxZDEiLCJ2IjoxfQ",
    "max_width_2000": 1600,
    "max_height_2000": 1067,
    "url_max_2000": "https://live.staticflickr.com/65535/50181007752_0262af9432_h.jpg?s=eyJpIjo1MDE4MTAwNzc1MiwiZSI6MTc2NDcxMjg0MiwicyI6IjgzODNlOGM3ODIzMDM1MjVkY2VjZGVkOGFlY2Y2YmNhMzEzYjhmYzEiLCJ2IjoxfQ",
    "flickr_page": "https://www.flickr.com/photos/54968894@N00/50181007752",
    "count_view": "510"
  },
  {
    "id": "50181007917",
    "owner": "54968894@N00",
    "title": "SHFA8409",
    "realname": "Sammi Fang",
    "ownername": "sammifang",
    "datetaken": "2020-07-27 15:01:57",
    "max_width": 4896,
    "max_height": 3264,
    "url_max": "https://live.staticflickr.com/65535/50181007917_c244e5ea7d_5k.jpg?s=eyJpIjo1MDE4MTAwNzkxNywiZSI6MTc2NDcxMjg0MiwicyI6IjNlZDNkMjgzYmU3MzllOTY4M2QxNmNmN2NlNTBlMzU2ODg5ZTY2Y2UiLCJ2IjoxfQ",
    "max_width_2000": 1600,
    "max_height_2000": 1067,
    "url_max_2000": "https://live.staticflickr.com/65535/50181007917_3eb2414bcf_h.jpg?s=eyJpIjo1MDE4MTAwNzkxNywiZSI6MTc2NDcxMjg0MiwicyI6IjFmOGFjOWRlMDQxMmI0YjE0ZTgwYTNjNTg3YTU4ZTM4NDg2YmRlZjkiLCJ2IjoxfQ",
    "flickr_page": "https://www.flickr.com/photos/54968894@N00/50181007917",
    "count_view": "483"
  },
  {
    "id": "50181008277",
    "owner": "54968894@N00",
    "title": "SHFA8410",
    "realname": "Sammi Fang",
    "ownername": "sammifang",
    "datetaken": "2020-07-27 15:49:49",
    "max_width": 3264,
    "max_height": 4896,
    "url_max": "https://live.staticflickr.com/65535/50181008277_29ad5c9aaa_5k.jpg?s=eyJpIjo1MDE4MTAwODI3NywiZSI6MTc2NDcxMjg0MiwicyI6IjVmN2RiZGQwNGExZWM3YzNmNGZjOTNlMWJkMmRkYjkxZTYyYmQ1MGMiLCJ2IjoxfQ",
    "max_width_2000": 1365,
    "max_height_2000": 2048,
    "url_max_2000": "https://live.staticflickr.com/65535/50181008277_1cdc62923f_k.jpg?s=eyJpIjo1MDE4MTAwODI3NywiZSI6MTc2NDcxMjg0MiwicyI6IjU3ODUyY2I2NTEwODc4MTZmNWVhZTY5MTVkM2ZjY2ZiZDAxY2JjYjAiLCJ2IjoxfQ",
    "flickr_page": "https://www.flickr.com/photos/54968894@N00/50181008277",
    "count_view": "1078"
  },
  {
    "id": "50181008407",
    "owner": "54968894@N00",
    "title": "SHFA8411",
    "realname": "Sammi Fang",
    "ownername": "sammifang",
    "datetaken": "2020-07-27 15:52:50",
    "max_width": 3264,
    "max_height": 4896,
    "url_max": "https://live.staticflickr.com/65535/50181008407_0d1765b715_5k.jpg?s=eyJpIjo1MDE4MTAwODQwNywiZSI6MTc2NDcxMjg0MiwicyI6ImI5ZWUwMzQ0ZDJiNjA2YjI1ODg5NDQyMjJjNjM3NjFkZjlkZTk3N2MiLCJ2IjoxfQ",
    "max_width_2000": 1365,
    "max_height_2000": 2048,
    "url_max_2000": "https://live.staticflickr.com/65535/50181008407_19b07fbc96_k.jpg?s=eyJpIjo1MDE4MTAwODQwNywiZSI6MTc2NDcxMjg0MiwicyI6ImZhZDlkYmRmODJjNDdlYzc5NDlkZjY1YTVlYzNjZDZkYTExMjI2ZmEiLCJ2IjoxfQ",
    "flickr_page": "https://www.flickr.com/photos/54968894@N00/50181008407",
    "count_view": "487"
  },
  {
    "id": "50180212458",
    "owner": "54968894@N00",
    "title": "SHFA8412",
    "realname": "Sammi Fang",
    "ownername": "sammifang",
    "datetaken": "2020-07-27 16:17:51",
    "max_width": 3051,
    "max_height": 4577,
    "url_max": "https://live.staticflickr.com/65535/50180212458_fcd01fe31f_o.jpg?s=eyJpIjo1MDE4MDIxMjQ1OCwiZSI6MTc2NDcxMjg0MiwicyI6IjlhNGM5MzUyMjYzMTc0YzcwYTgyMzU1MWI3NDM3YjdhYmZlZDNhYmYiLCJ2IjoxfQ",
    "max_width_2000": 1365,
    "max_height_2000": 2048,
    "url_max_2000": "https://live.staticflickr.com/65535/50180212458_830945c4b0_k.jpg?s=eyJpIjo1MDE4MDIxMjQ1OCwiZSI6MTc2NDcxMjg0MiwicyI6ImU3MTNjZGZiYmJlMDFhM2I1MTgwZGMxZDVlYzAxYWIwY2QxMmQ0NDMiLCJ2IjoxfQ",
    "flickr_page": "https://www.flickr.com/photos/54968894@N00/50180212458",
    "count_view": "475"
  },
  {
    "id": "50181008817",
    "owner": "54968894@N00",
    "title": "SHFA8413",
    "realname": "Sammi Fang",
    "ownername": "sammifang",
    "datetaken": "2020-07-27 16:18:20",
    "max_width": 4896,
    "max_height": 3264,
    "url_max": "https://live.staticflickr.com/65535/50181008817_1c54c3fe81_5k.jpg?s=eyJpIjo1MDE4MTAwODgxNywiZSI6MTc2NDcxMjg0MiwicyI6IjMzMGI0OTYyZmE4YTA4Y2M2YTU0YjExMWM2OTU3MmY4ZTcxYTM2MjEiLCJ2IjoxfQ",
    "max_width_2000": 1600,
    "max_height_2000": 1067,
    "url_max_2000": "https://live.staticflickr.com/65535/50181008817_7c7a196ea7_h.jpg?s=eyJpIjo1MDE4MTAwODgxNywiZSI6MTc2NDcxMjg0MiwicyI6IjU2NjkxYWIzYmJmYmM4OGY2MzE2Njg2OGZkN2FkMDZlOTRlZmJiMTAiLCJ2IjoxfQ",
    "flickr_page": "https://www.flickr.com/photos/54968894@N00/50181008817",
    "count_view": "471"
  },
  {
    "id": "50180212968",
    "owner": "54968894@N00",
    "title": "SHFA8414",
    "realname": "Sammi Fang",
    "ownername": "sammifang",
    "datetaken": "2020-07-27 17:33:46",
    "max_width": 4896,
    "max_height": 3264,
    "url_max": "https://live.staticflickr.com/65535/50180212968_5bd8ae2362_5k.jpg?s=eyJpIjo1MDE4MDIxMjk2OCwiZSI6MTc2NDcxMjg0MiwicyI6IjIwNDA3ZjI2N2VkNDkwMGI0YmU2YjVhYTQyMTE5OGJjOGU0Y2Q1ODQiLCJ2IjoxfQ",
    "max_width_2000": 1600,
    "max_height_2000": 1067,
    "url_max_2000": "https://live.staticflickr.com/65535/50180212968_798dd0008b_h.jpg?s=eyJpIjo1MDE4MDIxMjk2OCwiZSI6MTc2NDcxMjg0MiwicyI6ImU2MjNhODY0M2MyMzJlNzhkMGJhNTg1MjhhZjIyNGJmOWNiMjVjMjAiLCJ2IjoxfQ",
    "flickr_page": "https://www.flickr.com/photos/54968894@N00/50180212968",
    "count_view": "489"
  },
  {
    "id": "50140175727",
    "owner": "54968894@N00",
    "title": "SAMF7746",
    "realname": "Sammi Fang",
    "ownername": "sammifang",
    "datetaken": "2020-07-16 11:11:10",
    "max_width": 6720,
    "max_height": 4480,
    "url_max": "https://live.staticflickr.com/65535/50140175727_b065572653_o.jpg?s=eyJpIjo1MDE0MDE3NTcyNywiZSI6MTc2NDcxMjg0MiwicyI6ImU2MmU4ZTE3YjkzZjJiMDQ4ODRlZTU0ZWE3MTkyMzFjYjBkMDUwMjUiLCJ2IjoxfQ",
    "max_width_2000": 1600,
    "max_height_2000": 1067,
    "url_max_2000": "https://live.staticflickr.com/65535/50140175727_595a5e6dcb_h.jpg?s=eyJpIjo1MDE0MDE3NTcyNywiZSI6MTc2NDcxMjg0MiwicyI6IjljMDFhOTkwOGFjMTVmNDhlOTNhNThmMTNiOTY5MzhmM2NmNzExNmQiLCJ2IjoxfQ",
    "flickr_page": "https://www.flickr.com/photos/54968894@N00/50140175727",
    "count_view": "786"
  },
  {
    "id": "50096716391",
    "owner": "54968894@N00",
    "title": "SAMF1978",
    "realname": "Sammi Fang",
    "ownername": "sammifang",
    "datetaken": "2020-04-20 14:34:39",
    "max_width": 4480,
    "max_height": 6720,
    "url_max": "https://live.staticflickr.com/65535/50096716391_6f87f1ebb4_o.jpg?s=eyJpIjo1MDA5NjcxNjM5MSwiZSI6MTc2NDcxMjg0MiwicyI6IjY0NTBjZDdlZTRjNDYxY2NkNTk2NTRhM2RiZjg0OWQ5ZTQyODdkMjAiLCJ2IjoxfQ",
    "max_width_2000": 1365,
    "max_height_2000": 2048,
    "url_max_2000": "https://live.staticflickr.com/65535/50096716391_7d27f1d4e7_k.jpg?s=eyJpIjo1MDA5NjcxNjM5MSwiZSI6MTc2NDcxMjg0MiwicyI6IjVkMjMxNWJhNTI2ZWRjZTc0N2ZlN2FlZTQ3NjE0MjJjMmFiNTRmNjYiLCJ2IjoxfQ",
    "flickr_page": "https://www.flickr.com/photos/54968894@N00/50096716391",
    "count_view": "1325"
  },
  {
    "id": "50079798912",
    "owner": "54968894@N00",
    "title": "IMG_7475",
    "realname": "Sammi Fang",
    "ownername": "sammifang",
    "datetaken": "2019-06-19 21:30:12",
    "max_width": 6000,
    "max_height": 4000,
    "url_max": "https://live.staticflickr.com/65535/50079798912_36ba178956_6k.jpg?s=eyJpIjo1MDA3OTc5ODkxMiwiZSI6MTc2NDcxMjg0MiwicyI6IjRkMjJkZjJhZWU4YmJiMGRlNDk5NDU0ZjgzYmQ4MDIxYzFmZTdjMDEiLCJ2IjoxfQ",
    "max_width_2000": 1600,
    "max_height_2000": 1067,
    "url_max_2000": "https://live.staticflickr.com/65535/50079798912_7e7347935f_h.jpg?s=eyJpIjo1MDA3OTc5ODkxMiwiZSI6MTc2NDcxMjg0MiwicyI6ImNlNGI3MGIxOGZmMzk5MTRlODAxMmIwMmJmOTU0NmQ0ZmEwMzFkMmMiLCJ2IjoxfQ",
    "flickr_page": "https://www.flickr.com/photos/54968894@N00/50079798912",
    "count_view": "1790"
  },
  {
    "id": "1064021001",
    "owner": "54968894@N00",
    "title": "20070809 Farnham 012",
    "realname": "Sammi Fang",
    "ownername": "sammifang",
    "datetaken": "2007-08-09 16:32:15",
    "max_width": 4224,
    "max_height": 2376,
    "url_max": "https://live.staticflickr.com/1249/1064021001_5ece4c31a9_o.jpg?s=eyJpIjoxMDY0MDIxMDAxLCJlIjoxNzY0NzIyMjEwLCJzIjoiMDczMmE2YmNjZjIzZDRiYzU1OWI0YmI3MGVjOTI2NDMyOGRhMDQ1ZiIsInYiOjF9",
    "max_width_2000": 1600,
    "max_height_2000": 900,
    "url_max_2000": "https://live.staticflickr.com/1249/1064021001_07c301ecf4_h.jpg?s=eyJpIjoxMDY0MDIxMDAxLCJlIjoxNzY0NzIyMjEwLCJzIjoiYWY2NDQwOTRkMDRmM2VjYzkwMzNjMzYxMmYwNDI3NDM2YTMzMDY2NCIsInYiOjF9",
    "flickr_page": "https://www.flickr.com/photos/54968894@N00/1064021001",
    "count_view": "14"
  },
  {
    "id": "1064003427",
    "owner": "54968894@N00",
    "title": "20070809 Farnham 011",
    "realname": "Sammi Fang",
    "ownername": "sammifang",
    "datetaken": "2007-08-09 16:28:05",
    "max_width": 4224,
    "max_height": 2376,
    "url_max": "https://live.staticflickr.com/1321/1064003427_ba00a3f22a_o.jpg?s=eyJpIjoxMDY0MDAzNDI3LCJlIjoxNzY0NzIyMjEwLCJzIjoiZjNiMTZkODFlMzNlMTAzNzMzMTNiMTk3YjA2OTllMTIyMjZmZjY3ZSIsInYiOjF9",
    "max_width_2000": 1600,
    "max_height_2000": 900,
    "url_max_2000": "https://live.staticflickr.com/1321/1064003427_7a200ec6b6_h.jpg?s=eyJpIjoxMDY0MDAzNDI3LCJlIjoxNzY0NzIyMjEwLCJzIjoiMmYzZDNjMWU5YjQ0MGJjZGQwOGIxNTRjZmQyY2RiYmZlMDFlNzBhNCIsInYiOjF9",
    "flickr_page": "https://www.flickr.com/photos/54968894@N00/1064003427",
    "count_view": "21"
  },
  {
    "id": "1063889197",
    "owner": "54968894@N00",
    "title": "20070809 Farnham 003",
    "realname": "Sammi Fang",
    "ownername": "sammifang",
    "datetaken": "2007-08-09 16:20:52",
    "max_width": 4224,
    "max_height": 2376,
    "url_max": "https://live.staticflickr.com/1093/1063889197_c8fcedf284_o.jpg?s=eyJpIjoxMDYzODg5MTk3LCJlIjoxNzY0NzIyMjEwLCJzIjoiNTQ0OTA3ZDAzNzg5YWQ4MzliNGExZjQwZDBmYzZjMGRjYThlMGU3MCIsInYiOjF9",
    "max_width_2000": 1600,
    "max_height_2000": 900,
    "url_max_2000": "https://live.staticflickr.com/1093/1063889197_84108257b9_h.jpg?s=eyJpIjoxMDYzODg5MTk3LCJlIjoxNzY0NzIyMjEwLCJzIjoiZTlhNGJhMzVhYmVjZjA0ODExMWZkNTVjM2U2ZmI0NDdkOWM1ZWUwMCIsInYiOjF9",
    "flickr_page": "https://www.flickr.com/photos/54968894@N00/1063889197",
    "count_view": "19"
  },
  {
    "id": "1049983596",
    "owner": "54968894@N00",
    "title": "08/07/2006 18:44",
    "realname": "Sammi Fang",
    "ownername": "sammifang",
    "datetaken": "2006-07-08 18:44:48",
    "max_width": 2666,
    "max_height": 4000,
    "url_max": "https://live.staticflickr.com/1416/1049983596_bb1fef570c_4k.jpg?s=eyJpIjoxMDQ5OTgzNTk2LCJlIjoxNzY0NzIyMjEwLCJzIjoiOTIwMDAwOWYyMDI4ZjQ1ZDcyNDM5ZjRmYzZkNTNkMjg4M2JjYTdiZiIsInYiOjF9",
    "max_width_2000": 1365,
    "max_height_2000": 2048,
    "url_max_2000": "https://live.staticflickr.com/1416/1049983596_c5fa1d29bd_k.jpg?s=eyJpIjoxMDQ5OTgzNTk2LCJlIjoxNzY0NzIyMjEwLCJzIjoiMzE4ZmU1MTZlNGRhOTZkZTE4MjI3N2FlOTVhOWI1ZjRhNmExZjA4OSIsInYiOjF9",
    "flickr_page": "https://www.flickr.com/photos/54968894@N00/1049983596",
    "count_view": "378"
  },
  {
    "id": "1044569041",
    "owner": "54968894@N00",
    "title": "09/07/2006 18:20",
    "realname": "Sammi Fang",
    "ownername": "sammifang",
    "datetaken": "2006-07-09 18:20:00",
    "max_width": 4000,
    "max_height": 2666,
    "url_max": "https://live.staticflickr.com/1203/1044569041_3c9fc64937_4k.jpg?s=eyJpIjoxMDQ0NTY5MDQxLCJlIjoxNzY0NzIyMjEwLCJzIjoiOTNiMWYxYTk5M2UyY2E1MDllMDBjM2NhOTRjNzMzZjgzZjVlZTk5MiIsInYiOjF9",
    "max_width_2000": 1600,
    "max_height_2000": 1066,
    "url_max_2000": "https://live.staticflickr.com/1203/1044569041_3658e231e3_h.jpg?s=eyJpIjoxMDQ0NTY5MDQxLCJlIjoxNzY0NzIyMjEwLCJzIjoiNjE0M2UxZTU1NjIwMzI2NjEzNGMwOTQwZThlZThiMjk3MDk2ZDZjMyIsInYiOjF9",
    "flickr_page": "https://www.flickr.com/photos/54968894@N00/1044569041",
    "count_view": "294"
  },
  {
    "id": "1045414624",
    "owner": "54968894@N00",
    "title": "09/07/2006 18:22",
    "realname": "Sammi Fang",
    "ownername": "sammifang",
    "datetaken": "2006-07-09 18:22:06",
    "max_width": 4000,
    "max_height": 2632,
    "url_max": "https://live.staticflickr.com/1137/1045414624_8abfd3b15b_4k.jpg?s=eyJpIjoxMDQ1NDE0NjI0LCJlIjoxNzY0NzIyMjEwLCJzIjoiYTdlZjNkYWY4MTI3MGM1NGM0ZTdkZmUzOTc1YTEyZjU0MDAyNTY5MSIsInYiOjF9",
    "max_width_2000": 1600,
    "max_height_2000": 1053,
    "url_max_2000": "https://live.staticflickr.com/1137/1045414624_f322c3ccac_h.jpg?s=eyJpIjoxMDQ1NDE0NjI0LCJlIjoxNzY0NzIyMjEwLCJzIjoiNDgwMjI0OTdkYWEwYmE0NDdjYmM3N2MxNzE5YWY4YjVjNGVhYjlhNiIsInYiOjF9",
    "flickr_page": "https://www.flickr.com/photos/54968894@N00/1045414624",
    "count_view": "53"
  },
  {
    "id": "1044493477",
    "owner": "54968894@N00",
    "title": "09/07/2006 18:09",
    "realname": "Sammi Fang",
    "ownername": "sammifang",
    "datetaken": "2006-07-09 18:09:16",
    "max_width": 4000,
    "max_height": 2666,
    "url_max": "https://live.staticflickr.com/1220/1044493477_8068f8c8ef_4k.jpg?s=eyJpIjoxMDQ0NDkzNDc3LCJlIjoxNzY0NzIyMjExLCJzIjoiYzE0ZGVhYmRkNDM2NzAyNzhiODZlNzk3OWNlMzJkNDUwYTdmYzg5ZSIsInYiOjF9",
    "max_width_2000": 1600,
    "max_height_2000": 1066,
    "url_max_2000": "https://live.staticflickr.com/1220/1044493477_f80214d89d_h.jpg?s=eyJpIjoxMDQ0NDkzNDc3LCJlIjoxNzY0NzIyMjExLCJzIjoiZWI3NmFkODIxODI3YjBmYjkyZGRkZmQ1OTAxZjliOTc0OWFhMzBlMSIsInYiOjF9",
    "flickr_page": "https://www.flickr.com/photos/54968894@N00/1044493477",
    "count_view": "44"
  },
  {
    "id": "1044371519",
    "owner": "54968894@N00",
    "title": "09/07/2006 17:40",
    "realname": "Sammi Fang",
    "ownername": "sammifang",
    "datetaken": "2006-07-09 17:40:08",
    "max_width": 2666,
    "max_height": 4000,
    "url_max": "https://live.staticflickr.com/1110/1044371519_07b187bfe6_4k.jpg?s=eyJpIjoxMDQ0MzcxNTE5LCJlIjoxNzY0NzIyMjEyLCJzIjoiM2U3YzIxZmMyOTcxYjJiM2I1ODFjNjFjYTExMjE1NzJiYjY2MjA2YyIsInYiOjF9",
    "max_width_2000": 1365,
    "max_height_2000": 2048,
    "url_max_2000": "https://live.staticflickr.com/1110/1044371519_bf303c4559_k.jpg?s=eyJpIjoxMDQ0MzcxNTE5LCJlIjoxNzY0NzIyMjEyLCJzIjoiMzZkYTIxODViODNhNzBjNzI2MGEyMDVhYTc5ZjllY2FiZjg2OTM5MyIsInYiOjF9",
    "flickr_page": "https://www.flickr.com/photos/54968894@N00/1044371519",
    "count_view": "57"
  },
  {
    "id": "1045086832",
    "owner": "54968894@N00",
    "title": "09/07/2006 17:27",
    "realname": "Sammi Fang",
    "ownername": "sammifang",
    "datetaken": "2006-07-09 17:27:38",
    "max_width": 4000,
    "max_height": 2738,
    "url_max": "https://live.staticflickr.com/1063/1045086832_e39564636a_4k.jpg?s=eyJpIjoxMDQ1MDg2ODMyLCJlIjoxNzY0NzIyMjEyLCJzIjoiYTgwOGEyYzE4Y2I2NTA1ODBhYzAwNjAxZWFjMTkzMjYxZGMxNmI4MiIsInYiOjF9",
    "max_width_2000": 1600,
    "max_height_2000": 1095,
    "url_max_2000": "https://live.staticflickr.com/1063/1045086832_1d0124fadb_h.jpg?s=eyJpIjoxMDQ1MDg2ODMyLCJlIjoxNzY0NzIyMjEyLCJzIjoiN2MyMWExMjQwODMyMjJhZDE3ZGVlODU5ODFiMWQ2YzUxYWUyNWNjMyIsInYiOjF9",
    "flickr_page": "https://www.flickr.com/photos/54968894@N00/1045086832",
    "count_view": "58"
  },
  {
    "id": "1045049222",
    "owner": "54968894@N00",
    "title": "09/07/2006 17:27",
    "realname": "Sammi Fang",
    "ownername": "sammifang",
    "datetaken": "2006-07-09 17:27:03",
    "max_width": 4000,
    "max_height": 2666,
    "url_max": "https://live.staticflickr.com/1269/1045049222_9c100e1809_4k.jpg?s=eyJpIjoxMDQ1MDQ5MjIyLCJlIjoxNzY0NzIyMjEyLCJzIjoiMDljODBhNjRmZTc2ZDEyZDMyMzVjMjQ4M2U3MDIwYjU0ZTExNDZiYyIsInYiOjF9",
    "max_width_2000": 1600,
    "max_height_2000": 1066,
    "url_max_2000": "https://live.staticflickr.com/1269/1045049222_34ac72b06d_h.jpg?s=eyJpIjoxMDQ1MDQ5MjIyLCJlIjoxNzY0NzIyMjEyLCJzIjoiZTYzNjNiODUzZTk3M2M1ZDNjZjkwODUxYTE5YWE3ZTUxYTg5YjU0NiIsInYiOjF9",
    "flickr_page": "https://www.flickr.com/photos/54968894@N00/1045049222",
    "count_view": "289"
  },
  {
    "id": "1044758926",
    "owner": "54968894@N00",
    "title": "04/07/2006 19:17",
    "realname": "Sammi Fang",
    "ownername": "sammifang",
    "datetaken": "2006-07-04 19:17:55",
    "max_width": 4000,
    "max_height": 2666,
    "url_max": "https://live.staticflickr.com/1435/1044758926_f9d66c4221_4k.jpg?s=eyJpIjoxMDQ0NzU4OTI2LCJlIjoxNzY0NzIyMjEyLCJzIjoiZTk5MmI4ZjJmMDNjOWVkZjE1MDU3MTExYzIyMmFhY2Y2ZTI4NTJiMyIsInYiOjF9",
    "max_width_2000": 1600,
    "max_height_2000": 1066,
    "url_max_2000": "https://live.staticflickr.com/1435/1044758926_776406b98e_h.jpg?s=eyJpIjoxMDQ0NzU4OTI2LCJlIjoxNzY0NzIyMjEyLCJzIjoiMjAyOGY3NjczYjkwYzM5YzVhOTE1YjVlZWRhYTczNjllNTY5MjgzMSIsInYiOjF9",
    "flickr_page": "https://www.flickr.com/photos/54968894@N00/1044758926",
    "count_view": "279"
  },
  {
    "id": "1038357192",
    "owner": "54968894@N00",
    "title": "p1320121 ACR",
    "realname": "Sammi Fang",
    "ownername": "sammifang",
    "datetaken": "2007-08-06 19:02:39",
    "max_width": 4224,
    "max_height": 2376,
    "url_max": "https://live.staticflickr.com/1131/1038357192_923b77d58e_o.jpg?s=eyJpIjoxMDM4MzU3MTkyLCJlIjoxNzY0NzIyMjEyLCJzIjoiNzdmZjA4OGU3MmFhMTk0OGM4MjViODdjZDRhNTVjNjMxZjA4NDEyMyIsInYiOjF9",
    "max_width_2000": 1600,
    "max_height_2000": 900,
    "url_max_2000": "https://live.staticflickr.com/1131/1038357192_cb5aae50b4_h.jpg?s=eyJpIjoxMDM4MzU3MTkyLCJlIjoxNzY0NzIyMjEyLCJzIjoiYzA0NjBmNmEzNGZhNTY0NjgwMTU2MGQ0ZDNmY2Y0Mzc5NDg0M2Y1ZSIsInYiOjF9",
    "flickr_page": "https://www.flickr.com/photos/54968894@N00/1038357192",
    "count_view": "22"
  },
  {
    "id": "1037489293",
    "owner": "54968894@N00",
    "title": "p1320049 ACR",
    "realname": "Sammi Fang",
    "ownername": "sammifang",
    "datetaken": "2007-08-06 12:43:33",
    "max_width": 4224,
    "max_height": 2376,
    "url_max": "https://live.staticflickr.com/1078/1037489293_268a762e7b_o.jpg?s=eyJpIjoxMDM3NDg5MjkzLCJlIjoxNzY0NzIyMjEyLCJzIjoiZmFhMWRkNTdhMjZmNWU1NGUxMmU0MzcyMjFhM2JhZjEzNmJjYzgyMiIsInYiOjF9",
    "max_width_2000": 1600,
    "max_height_2000": 900,
    "url_max_2000": "https://live.staticflickr.com/1078/1037489293_02704ea5a1_h.jpg?s=eyJpIjoxMDM3NDg5MjkzLCJlIjoxNzY0NzIyMjEyLCJzIjoiMjg3M2YxZDQ5NTc5MmU0ZjY1ZDc3NjFkNzcyMjliZjk4N2I2MDBmNiIsInYiOjF9",
    "flickr_page": "https://www.flickr.com/photos/54968894@N00/1037489293",
    "count_view": "18"
  },
  {
    "id": "1038331626",
    "owner": "54968894@N00",
    "title": "p1320024 ACR",
    "realname": "Sammi Fang",
    "ownername": "sammifang",
    "datetaken": "2007-08-06 12:24:08",
    "max_width": 4224,
    "max_height": 2376,
    "url_max": "https://live.staticflickr.com/1211/1038331626_72ef54656a_o.jpg?s=eyJpIjoxMDM4MzMxNjI2LCJlIjoxNzY0NzIyMjEyLCJzIjoiNTdkZmU3NzlhYzg0ZTMzZDkwZWU1ODU3MTU3NTRlZjIxODAzZjU0MyIsInYiOjF9",
    "max_width_2000": 1600,
    "max_height_2000": 900,
    "url_max_2000": "https://live.staticflickr.com/1211/1038331626_66f0a32eb2_h.jpg?s=eyJpIjoxMDM4MzMxNjI2LCJlIjoxNzY0NzIyMjEyLCJzIjoiNjZiYWY3OGQ4YjgzNTI2ZmNmZjYzMzY2NWYzNDQ4YzdjN2RhNDk5NSIsInYiOjF9",
    "flickr_page": "https://www.flickr.com/photos/54968894@N00/1038331626",
    "count_view": "29"
  },
  {
    "id": "1037994782",
    "owner": "54968894@N00",
    "title": "P1320087",
    "realname": "Sammi Fang",
    "ownername": "sammifang",
    "datetaken": "2007-08-06 14:16:52",
    "max_width": 2376,
    "max_height": 4224,
    "url_max": "https://live.staticflickr.com/1177/1037994782_8d2990b53a_o.jpg?s=eyJpIjoxMDM3OTk0NzgyLCJlIjoxNzY0NzIyMjEyLCJzIjoiZDlmNjBmZDY0M2YzMDRiMDcyYzVlYTFkODZjNzg5MDFkODI0ODk5NCIsInYiOjF9",
    "max_width_2000": 1728,
    "max_height_2000": 3072,
    "url_max_2000": "https://live.staticflickr.com/1177/1037994782_b204c3c210_3k.jpg?s=eyJpIjoxMDM3OTk0NzgyLCJlIjoxNzY0NzIyMjEyLCJzIjoiMGM4NmU4MDlkMDUxYmNjYTU3ZDRhOTI5NDgzYzM1NTI2MzU2ODc4MCIsInYiOjF9",
    "flickr_page": "https://www.flickr.com/photos/54968894@N00/1037994782",
    "count_view": "21"
  },
  {
    "id": "1037121359",
    "owner": "54968894@N00",
    "title": "P1320084",
    "realname": "Sammi Fang",
    "ownername": "sammifang",
    "datetaken": "2007-08-06 14:13:25",
    "max_width": 2376,
    "max_height": 4224,
    "url_max": "https://live.staticflickr.com/1426/1037121359_29e6679041_o.jpg?s=eyJpIjoxMDM3MTIxMzU5LCJlIjoxNzY0NzIyMjEyLCJzIjoiZTI1MDk5Nzc2NDQyYTQ0MDQ4YWU1YjYwZGM4ZDBlMWE3YTBlNTNhNyIsInYiOjF9",
    "max_width_2000": 1728,
    "max_height_2000": 3072,
    "url_max_2000": "https://live.staticflickr.com/1426/1037121359_7bc234e3fa_3k.jpg?s=eyJpIjoxMDM3MTIxMzU5LCJlIjoxNzY0NzIyMjEyLCJzIjoiMzY4ZDQyZWI4YzhkYjYyNTU3ODkwNzAyZDljY2RkZjJhZTk2MDgxMCIsInYiOjF9",
    "flickr_page": "https://www.flickr.com/photos/54968894@N00/1037121359",
    "count_view": "17"
  },
  {
    "id": "1037536166",
    "owner": "54968894@N00",
    "title": "P1320012",
    "realname": "Sammi Fang",
    "ownername": "sammifang",
    "datetaken": "2007-08-06 12:14:20",
    "max_width": 2376,
    "max_height": 4224,
    "url_max": "https://live.staticflickr.com/1193/1037536166_5760b821a0_o.jpg?s=eyJpIjoxMDM3NTM2MTY2LCJlIjoxNzY0NzIyMjEyLCJzIjoiYjYxMjlmYjJlOGQ3NDgxMDNjNmFhNDcwNTBjZGJiMGNmNDFiOTQwYiIsInYiOjF9",
    "max_width_2000": 1728,
    "max_height_2000": 3072,
    "url_max_2000": "https://live.staticflickr.com/1193/1037536166_98d9174ac5_3k.jpg?s=eyJpIjoxMDM3NTM2MTY2LCJlIjoxNzY0NzIyMjEyLCJzIjoiMjdkNmYxNzIwNDRhOGM0M2JiNmVhMzk1ZmI4ZDg2MzljZjg5MDdiNyIsInYiOjF9",
    "flickr_page": "https://www.flickr.com/photos/54968894@N00/1037536166",
    "count_view": "23"
  },
  {
    "id": "1037526178",
    "owner": "54968894@N00",
    "title": "P1320008",
    "realname": "Sammi Fang",
    "ownername": "sammifang",
    "datetaken": "2007-08-06 12:08:49",
    "max_width": 2376,
    "max_height": 4224,
    "url_max": "https://live.staticflickr.com/1206/1037526178_dba1f639af_o.jpg?s=eyJpIjoxMDM3NTI2MTc4LCJlIjoxNzY0NzIyMjEyLCJzIjoiMDQ3NTJkZDY5ZWU3MTE2MWJjNTBmMDY3ODI1Mzg5YmEwMDExYTBjNiIsInYiOjF9",
    "max_width_2000": 1728,
    "max_height_2000": 3072,
    "url_max_2000": "https://live.staticflickr.com/1206/1037526178_0c028e68e4_3k.jpg?s=eyJpIjoxMDM3NTI2MTc4LCJlIjoxNzY0NzIyMjEyLCJzIjoiZTJkNTM3MGEzMTM3ZDQ0ZTIxNTJhZjE2MzNlNWQ2ZjliMzhmYjE0MCIsInYiOjF9",
    "flickr_page": "https://www.flickr.com/photos/54968894@N00/1037526178",
    "count_view": "20"
  },
  {
    "id": "1014799277",
    "owner": "54968894@N00",
    "title": "25/05/2006 20:27",
    "realname": "Sammi Fang",
    "ownername": "sammifang",
    "datetaken": "2006-05-25 20:27:31",
    "max_width": 4000,
    "max_height": 2250,
    "url_max": "https://live.staticflickr.com/1110/1014799277_2486671e1f_4k.jpg?s=eyJpIjoxMDE0Nzk5Mjc3LCJlIjoxNzY0NzIyMjE2LCJzIjoiMDY3ODhlNGEwMWNmZDYwYTcwMzg3MjNjYzU5NzM0NjNhYWRiYmVlZSIsInYiOjF9",
    "max_width_2000": 1600,
    "max_height_2000": 900,
    "url_max_2000": "https://live.staticflickr.com/1110/1014799277_15c797c653_h.jpg?s=eyJpIjoxMDE0Nzk5Mjc3LCJlIjoxNzY0NzIyMjE2LCJzIjoiMDNkMDA5Y2RmMWVkNGZjNGEzZGVmZTBhYTM5NTY3ZTU0OTJjZjBiZSIsInYiOjF9",
    "flickr_page": "https://www.flickr.com/photos/54968894@N00/1014799277",
    "count_view": "260"
  },
  {
    "id": "1014794597",
    "owner": "54968894@N00",
    "title": "25/05/2006 20:26",
    "realname": "Sammi Fang",
    "ownername": "sammifang",
    "datetaken": "2006-05-25 20:26:32",
    "max_width": 4000,
    "max_height": 2666,
    "url_max": "https://live.staticflickr.com/1210/1014794597_d46446b3c3_4k.jpg?s=eyJpIjoxMDE0Nzk0NTk3LCJlIjoxNzY0NzIyMjE2LCJzIjoiMTUzNTViYjdhMTcwNTE1NDFlZTE2ZGNlNWUwYmEwYzIxZDhhMGZiMSIsInYiOjF9",
    "max_width_2000": 1600,
    "max_height_2000": 1066,
    "url_max_2000": "https://live.staticflickr.com/1210/1014794597_844f610764_h.jpg?s=eyJpIjoxMDE0Nzk0NTk3LCJlIjoxNzY0NzIyMjE2LCJzIjoiOTA1NjJhM2I1NGU3NDI2ZTE3NTNkMTA1ZTExY2JjOGY2MzY1MGEwMiIsInYiOjF9",
    "flickr_page": "https://www.flickr.com/photos/54968894@N00/1014794597",
    "count_view": "25"
  },
  {
    "id": "1015653110",
    "owner": "54968894@N00",
    "title": "25/05/2006 20:26",
    "realname": "Sammi Fang",
    "ownername": "sammifang",
    "datetaken": "2006-05-25 20:26:22",
    "max_width": 4000,
    "max_height": 2666,
    "url_max": "https://live.staticflickr.com/1072/1015653110_e9ac168b8e_4k.jpg?s=eyJpIjoxMDE1NjUzMTEwLCJlIjoxNzY0NzIyMjE2LCJzIjoiMjI0NWEyNDU1OWI2YWFlOWMzMjNiMDI3MDQ0NDBmYTViNzk0YTAyNCIsInYiOjF9",
    "max_width_2000": 1600,
    "max_height_2000": 1066,
    "url_max_2000": "https://live.staticflickr.com/1072/1015653110_5518f7d195_h.jpg?s=eyJpIjoxMDE1NjUzMTEwLCJlIjoxNzY0NzIyMjE2LCJzIjoiOTE4N2Y5MGViYmZkOGQ0NjIwN2JhYzA1YjYwMjVjMGVmOTRlNzA3MCIsInYiOjF9",
    "flickr_page": "https://www.flickr.com/photos/54968894@N00/1015653110",
    "count_view": "22"
  },
  {
    "id": "1014782647",
    "owner": "54968894@N00",
    "title": "25/05/2006 20:25",
    "realname": "Sammi Fang",
    "ownername": "sammifang",
    "datetaken": "2006-05-25 20:25:56",
    "max_width": 4000,
    "max_height": 2666,
    "url_max": "https://live.staticflickr.com/1002/1014782647_01b576c27d_4k.jpg?s=eyJpIjoxMDE0NzgyNjQ3LCJlIjoxNzY0NzIyMjE2LCJzIjoiZDQyZGNkNjMyM2UwNzNmYmM3YzU0OTkzOWU3ZjVkNGQyYzJkODg1OCIsInYiOjF9",
    "max_width_2000": 1600,
    "max_height_2000": 1066,
    "url_max_2000": "https://live.staticflickr.com/1002/1014782647_4d5a037ff7_h.jpg?s=eyJpIjoxMDE0NzgyNjQ3LCJlIjoxNzY0NzIyMjE2LCJzIjoiMTYwNWZkZTgwNjY2Yzc0ODZkMmEyZDQyMzkwN2FiYTJkNGFhZDNjZSIsInYiOjF9",
    "flickr_page": "https://www.flickr.com/photos/54968894@N00/1014782647",
    "count_view": "25"
  },
  {
    "id": "1015641216",
    "owner": "54968894@N00",
    "title": "25/05/2006 20:25",
    "realname": "Sammi Fang",
    "ownername": "sammifang",
    "datetaken": "2006-05-25 20:25:43",
    "max_width": 4000,
    "max_height": 2250,
    "url_max": "https://live.staticflickr.com/1213/1015641216_7b054f5c3c_4k.jpg?s=eyJpIjoxMDE1NjQxMjE2LCJlIjoxNzY0NzIyMjE2LCJzIjoiMmIzZjViODczMzg2ZDVmN2E1NjRmMmNjZWU1NzhmZWZiM2JmMzFkMiIsInYiOjF9",
    "max_width_2000": 1600,
    "max_height_2000": 900,
    "url_max_2000": "https://live.staticflickr.com/1213/1015641216_2fdfe83a34_h.jpg?s=eyJpIjoxMDE1NjQxMjE2LCJlIjoxNzY0NzIyMjE2LCJzIjoiMzA3NDUxNzBkM2JmYmFlMTI3MjcxZjhmMWUzMDEyMmU5OTFjMTM4MyIsInYiOjF9",
    "flickr_page": "https://www.flickr.com/photos/54968894@N00/1015641216",
    "count_view": "27"
  },
  {
    "id": "1014766283",
    "owner": "54968894@N00",
    "title": "25/05/2006 20:21",
    "realname": "Sammi Fang",
    "ownername": "sammifang",
    "datetaken": "2006-05-25 20:21:25",
    "max_width": 4000,
    "max_height": 2250,
    "url_max": "https://live.staticflickr.com/1357/1014766283_35fd5bcd20_4k.jpg?s=eyJpIjoxMDE0NzY2MjgzLCJlIjoxNzY0NzIyMjE2LCJzIjoiOGMzZjBkZGQxODM3NzY2NjMxNmYyODE4NjU1ZjRjYmNiZmY5NGZlMSIsInYiOjF9",
    "max_width_2000": 1600,
    "max_height_2000": 900,
    "url_max_2000": "https://live.staticflickr.com/1357/1014766283_9071187e29_h.jpg?s=eyJpIjoxMDE0NzY2MjgzLCJlIjoxNzY0NzIyMjE2LCJzIjoiY2RjMDRjY2ZlOGU4YmZkZTIzYzMzMTE4Njg5ZjhjNTFiZjljNTU2ZCIsInYiOjF9",
    "flickr_page": "https://www.flickr.com/photos/54968894@N00/1014766283",
    "count_view": "22"
  },
  {
    "id": "1015626420",
    "owner": "54968894@N00",
    "title": "25/05/2006 20:18",
    "realname": "Sammi Fang",
    "ownername": "sammifang",
    "datetaken": "2006-05-25 20:18:20",
    "max_width": 4000,
    "max_height": 2250,
    "url_max": "https://live.staticflickr.com/1017/1015626420_4d0425c748_4k.jpg?s=eyJpIjoxMDE1NjI2NDIwLCJlIjoxNzY0NzIyMjE2LCJzIjoiODEyYjY4NGIwOTc4OWMxMWIyNGQ3MWJmNWJmOGEwMjM2NjYyZDE5OCIsInYiOjF9",
    "max_width_2000": 1600,
    "max_height_2000": 900,
    "url_max_2000": "https://live.staticflickr.com/1017/1015626420_47bfec8062_h.jpg?s=eyJpIjoxMDE1NjI2NDIwLCJlIjoxNzY0NzIyMjE2LCJzIjoiNTk4MDUxZmNiMDQzOTlkMjViNzk3OGVhNTRiMjZkNDU1ZTAwOTMxMSIsInYiOjF9",
    "flickr_page": "https://www.flickr.com/photos/54968894@N00/1015626420",
    "count_view": "22"
  },
  {
    "id": "1014748245",
    "owner": "54968894@N00",
    "title": "25/05/2006 20:07",
    "realname": "Sammi Fang",
    "ownername": "sammifang",
    "datetaken": "2006-05-25 20:07:45",
    "max_width": 4000,
    "max_height": 2666,
    "url_max": "https://live.staticflickr.com/1435/1014748245_556fad385a_4k.jpg?s=eyJpIjoxMDE0NzQ4MjQ1LCJlIjoxNzY0NzIyMjE2LCJzIjoiZmVlODRkYzcxYzdiNDdhMzVmMDJiZjEwMTNhOTQxMDg2NTU0NTk1NSIsInYiOjF9",
    "max_width_2000": 1600,
    "max_height_2000": 1066,
    "url_max_2000": "https://live.staticflickr.com/1435/1014748245_546e7a6337_h.jpg?s=eyJpIjoxMDE0NzQ4MjQ1LCJlIjoxNzY0NzIyMjE2LCJzIjoiZWNlOGVhZGFhMThlN2ZiYWFiNjBkM2NkYzhkODdlNzVmMmUwNzE4MCIsInYiOjF9",
    "flickr_page": "https://www.flickr.com/photos/54968894@N00/1014748245",
    "count_view": "19"
  },
  {
    "id": "1010597935",
    "owner": "54968894@N00",
    "title": "11/05/2006 18:03",
    "realname": "Sammi Fang",
    "ownername": "sammifang",
    "datetaken": "2006-05-11 18:03:28",
    "max_width": 2667,
    "max_height": 4000,
    "url_max": "https://live.staticflickr.com/1422/1010597935_17d6f53151_4k.jpg?s=eyJpIjoxMDEwNTk3OTM1LCJlIjoxNzY0NzIyMjE2LCJzIjoiYzVjNTc2NmI3OTI3ZDA5YTJhMjUzZmZhN2Y3MTA0YTVlYjIxYTYxOSIsInYiOjF9",
    "max_width_2000": 1366,
    "max_height_2000": 2048,
    "url_max_2000": "https://live.staticflickr.com/1422/1010597935_8a40a00ac1_k.jpg?s=eyJpIjoxMDEwNTk3OTM1LCJlIjoxNzY0NzIyMjE2LCJzIjoiOTNiMTBhMzgwY2MwYjBkZGNlMzliY2RiMTZkZWE4NTZiZjNkNzVkZiIsInYiOjF9",
    "flickr_page": "https://www.flickr.com/photos/54968894@N00/1010597935",
    "count_view": "15"
  },
  {
    "id": "1011447398",
    "owner": "54968894@N00",
    "title": "11/05/2006 18:02",
    "realname": "Sammi Fang",
    "ownername": "sammifang",
    "datetaken": "2006-05-11 18:02:53",
    "max_width": 4000,
    "max_height": 2666,
    "url_max": "https://live.staticflickr.com/1010/1011447398_0fc25c4853_4k.jpg?s=eyJpIjoxMDExNDQ3Mzk4LCJlIjoxNzY0NzIyMjE2LCJzIjoiZTc4YzYxNzE4Y2NmZWQyZWM4ZjNjMDBmOTBlMDZiYWYzMzMxZmQxMCIsInYiOjF9",
    "max_width_2000": 1600,
    "max_height_2000": 1066,
    "url_max_2000": "https://live.staticflickr.com/1010/1011447398_ccb1a43189_h.jpg?s=eyJpIjoxMDExNDQ3Mzk4LCJlIjoxNzY0NzIyMjE2LCJzIjoiMWNmM2UzOTIyNDljMjVkY2MyYjcxNWRhY2E2ZjJiODJiNjA1Y2VmNSIsInYiOjF9",
    "flickr_page": "https://www.flickr.com/photos/54968894@N00/1011447398",
    "count_view": "32"
  },
  {
    "id": "1010456277",
    "owner": "54968894@N00",
    "title": "11/05/2006 15:59",
    "realname": "Sammi Fang",
    "ownername": "sammifang",
    "datetaken": "2006-05-11 15:59:25",
    "max_width": 4000,
    "max_height": 2666,
    "url_max": "https://live.staticflickr.com/1115/1010456277_815616949f_4k.jpg?s=eyJpIjoxMDEwNDU2Mjc3LCJlIjoxNzY0NzIyMjE2LCJzIjoiNDRkZjkwMzNhMGFkZjhiMTIwNjc0MjA3ODM2YzljY2E2ZDkwY2IxNiIsInYiOjF9",
    "max_width_2000": 1600,
    "max_height_2000": 1066,
    "url_max_2000": "https://live.staticflickr.com/1115/1010456277_444e4ddc80_h.jpg?s=eyJpIjoxMDEwNDU2Mjc3LCJlIjoxNzY0NzIyMjE2LCJzIjoiNDVjYjNlZTRiYzIzMGY1NjAwZDMzYjQyMzUzZDExYmQ0NzY4MGY0MCIsInYiOjF9",
    "flickr_page": "https://www.flickr.com/photos/54968894@N00/1010456277",
    "count_view": "18"
  },
  {
    "id": "1011272146",
    "owner": "54968894@N00",
    "title": "11/05/2006 15:57",
    "realname": "Sammi Fang",
    "ownername": "sammifang",
    "datetaken": "2006-05-11 15:57:32",
    "max_width": 2666,
    "max_height": 4000,
    "url_max": "https://live.staticflickr.com/1367/1011272146_74fc1d8fcf_4k.jpg?s=eyJpIjoxMDExMjcyMTQ2LCJlIjoxNzY0NzIyMjE2LCJzIjoiODYyZGEyODBlOGRkZjI5NTA3Yzg0NDk2NWQzNWIxZjYzYTQxZTYyYyIsInYiOjF9",
    "max_width_2000": 1365,
    "max_height_2000": 2048,
    "url_max_2000": "https://live.staticflickr.com/1367/1011272146_5407505460_k.jpg?s=eyJpIjoxMDExMjcyMTQ2LCJlIjoxNzY0NzIyMjE2LCJzIjoiNDNhYWFiOTRiNzM1ZDIzZTUyMWQyYjVmZDVkOTM5YWQ0OTQ4ZjY5NSIsInYiOjF9",
    "flickr_page": "https://www.flickr.com/photos/54968894@N00/1011272146",
    "count_view": "14"
  },
  {
    "id": "1011253646",
    "owner": "54968894@N00",
    "title": "11/05/2006 16:06",
    "realname": "Sammi Fang",
    "ownername": "sammifang",
    "datetaken": "2006-05-11 16:06:31",
    "max_width": 4000,
    "max_height": 2666,
    "url_max": "https://live.staticflickr.com/1081/1011253646_00a97152d5_4k.jpg?s=eyJpIjoxMDExMjUzNjQ2LCJlIjoxNzY0NzIyMjE2LCJzIjoiNDIzYTVlZjlmNTg3OThhYTExNjA3MjcxZTE2NGE5YzJjMTlkN2JhNyIsInYiOjF9",
    "max_width_2000": 1600,
    "max_height_2000": 1066,
    "url_max_2000": "https://live.staticflickr.com/1081/1011253646_16a548d0be_h.jpg?s=eyJpIjoxMDExMjUzNjQ2LCJlIjoxNzY0NzIyMjE2LCJzIjoiNDVlM2NiZGJjZTJjN2M1ZTA1NzM5ZTZiMDBiMDAxMjVmNmMxNzgzMyIsInYiOjF9",
    "flickr_page": "https://www.flickr.com/photos/54968894@N00/1011253646",
    "count_view": "16"
  },
  {
    "id": "1011234390",
    "owner": "54968894@N00",
    "title": "11/05/2006 15:42",
    "realname": "Sammi Fang",
    "ownername": "sammifang",
    "datetaken": "2006-05-11 15:42:14",
    "max_width": 4000,
    "max_height": 2666,
    "url_max": "https://live.staticflickr.com/1285/1011234390_46018a3a09_4k.jpg?s=eyJpIjoxMDExMjM0MzkwLCJlIjoxNzY0NzIyMjE2LCJzIjoiN2FkODQ1Yjc5MzU5NTZjMDBjYmU5ZTA1OTAxODZhMGJiNzQwZWQ1OSIsInYiOjF9",
    "max_width_2000": 1600,
    "max_height_2000": 1066,
    "url_max_2000": "https://live.staticflickr.com/1285/1011234390_e0b9c5f216_h.jpg?s=eyJpIjoxMDExMjM0MzkwLCJlIjoxNzY0NzIyMjE2LCJzIjoiZmFmZDdmYTRjMTYyMjBjNDU2ZjIzOTk2YWMyNDI2ZmFkYzk3ZjY2MiIsInYiOjF9",
    "flickr_page": "https://www.flickr.com/photos/54968894@N00/1011234390",
    "count_view": "22"
  },
  {
    "id": "1009956659",
    "owner": "54968894@N00",
    "title": "10/05/2006 19:03",
    "realname": "Sammi Fang",
    "ownername": "sammifang",
    "datetaken": "2006-05-10 19:03:23",
    "max_width": 4000,
    "max_height": 2438,
    "url_max": "https://live.staticflickr.com/1134/1009956659_ef00126ff2_4k.jpg?s=eyJpIjoxMDA5OTU2NjU5LCJlIjoxNzY0NzIyMjE2LCJzIjoiZWM1YzM3ZDViMTRjOWE5MGU2NTdiY2I1YWNkNDM2ZmEwNzU3YzIyZSIsInYiOjF9",
    "max_width_2000": 1600,
    "max_height_2000": 975,
    "url_max_2000": "https://live.staticflickr.com/1134/1009956659_af17974502_h.jpg?s=eyJpIjoxMDA5OTU2NjU5LCJlIjoxNzY0NzIyMjE2LCJzIjoiZmUxZGMyZTMxYmQ4NzE3YzE3ZTRmOTM1NjlmNDZjNTIwNDE4MmQ0NCIsInYiOjF9",
    "flickr_page": "https://www.flickr.com/photos/54968894@N00/1009956659",
    "count_view": "54"
  },
  {
    "id": "1010780976",
    "owner": "54968894@N00",
    "title": "10/05/2006 18:54",
    "realname": "Sammi Fang",
    "ownername": "sammifang",
    "datetaken": "2006-05-10 18:54:28",
    "max_width": 4000,
    "max_height": 2666,
    "url_max": "https://live.staticflickr.com/1388/1010780976_0bc6e4992b_4k.jpg?s=eyJpIjoxMDEwNzgwOTc2LCJlIjoxNzY0NzIyMjE2LCJzIjoiNDI3Yjk4ZDEwNzIxMDAxMGUyMDRkMzc3MWIxYTMxOTA0YTI2ZTZjNCIsInYiOjF9",
    "max_width_2000": 1600,
    "max_height_2000": 1066,
    "url_max_2000": "https://live.staticflickr.com/1388/1010780976_817200f644_h.jpg?s=eyJpIjoxMDEwNzgwOTc2LCJlIjoxNzY0NzIyMjE2LCJzIjoiYjI3ZDNkZWY2NmZhOTFmZmIyZjFlZjdhMTUzMTY5ZWQwZDYxM2Y4YSIsInYiOjF9",
    "flickr_page": "https://www.flickr.com/photos/54968894@N00/1010780976",
    "count_view": "40"
  }
]