[
  {
    "id": "49661901832",
    "owner": "54968894@N00",
    "title": "Cici_0401",
    "realname": "Sammi Fang",
    "ownername": "sammifang",
    "datetaken": "2020-03-08 13:37:09",
    "max_width": 4472,
    "max_height": 6708,
    "url_max": "https://live.staticflickr.com/65535/49661901832_cd2e6320b2_o.jpg?s=eyJpIjo0OTY2MTkwMTgzMiwiZSI6MTc2NDcxMjg0MywicyI6ImNjZDdhOTgzMDA1MGYyNGMwYWU4NTQyOWEwZGU0MzU3Yjk1NjNlNTAiLCJ2IjoxfQ",
    "max_width_2000": 1365,
    "max_height_2000": 2048,
    "url_max_2000": "https://live.staticflickr.com/65535/49661901832_5f1028fb2b_k.jpg?s=eyJpIjo0OTY2MTkwMTgzMiwiZSI6MTc2NDcxMjg0MywicyI6IjIwNGY1OTRiZmIzNjQ1ZmYwYWE0ZmIyN2MzOWQyNDRmNzk1MjkxNWIiLCJ2IjoxfQ",
    "flickr_page": "https://www.flickr.com/photos/54968894@N00/49661901832",
    "count_view": "987"
  },
  {
    "id": "49661080233",
    "owner": "54968894@N00",
    "title": "Cici_0426",
    "realname": "Sammi Fang",
    "ownername": "sammifang",
    "datetaken": "2020-03-08 13:38:13",
    "max_width": 6708,
    "max_height": 4472,
    "url_max": "https://live.staticflickr.com/65535/49661080233_f4ed20a5d6_o.jpg?s=eyJpIjo0OTY2MTA4MDIzMywiZSI6MTc2NDcxMjg0MywicyI6IjNlMzk3ZWJkNjMyMmM5YzkwOTI0NmI5MWQzYzljOTA5MjU5MjZkOTAiLCJ2IjoxfQ",
    "max_width_2000": 1600,
    "max_height_2000": 1067,
    "url_max_2000": "https://live.staticflickr.com/65535/49661080233_61a64a42ad_h.jpg?s=eyJpIjo0OTY2MTA4MDIzMywiZSI6MTc2NDcxMjg0MywicyI6IjAyN2UzZWQ4MGU2OWRmNzNlMTY1YTU1OWMxN2IyMDUyYjM2NGY3MzIiLCJ2IjoxfQ",
    "flickr_page": "https://www.flickr.com/photos/54968894@N00/49661080233",
    "count_view": "876"
  },
  {
    "id": "49661623941",
    "owner": "54968894@N00",
    "title": "Cici_0439",
    "realname": "Sammi Fang",
    "ownername": "sammifang",
    "datetaken": "2020-03-08 13:38:22",
    "max_width": 6708,
    "max_height": 4472,
    "url_max": "https://live.staticflickr.com/65535/49661623941_60ae62a34b_o.jpg?s=eyJpIjo0OTY2MTYyMzk0MSwiZSI6MTc2NDcxMjg0MywicyI6IjNmODllNTdlNGE0Yzc4N2M3MWE3ZjdmZTIxYWJkMjM3ZDBmYTViNmMiLCJ2IjoxfQ",
    "max_width_2000": 1600,
    "max_height_2000": 1067,
    "url_max_2000": "https://live.staticflickr.com/65535/49661623941_bbd97d7035_h.jpg?s=eyJpIjo0OTY2MTYyMzk0MSwiZSI6MTc2NDcxMjg0MywicyI6ImYwM2M5NjBlYjE1MGZhNmE2NDk0YTVjZTU1NzcyNzQzZTlkNzMyNjIiLCJ2IjoxfQ",
    "flickr_page": "https://www.flickr.com/photos/54968894@N00/49661623941",
    "count_view": "154"
  },
  {
    "id": "49661083948",
    "owner": "54968894@N00",
    "title": "Cici_0444",
    "realname": "Sammi Fang",
    "ownername": "sammifang",
    "datetaken": "2020-03-08 13:38:26",
    "max_width": 6708,
    "max_height": 4472,
    "url_max": "https://live.staticflickr.com/65535/49661083948_2e21e359b1_o.jpg?s=eyJpIjo0OTY2MTA4Mzk0OCwiZSI6MTc2NDcxMjg0MywicyI6IjBhYjFhM2NiNGFjNzhmNDYxMDY5OTIyN2EwNzU4ZDdmM2I0ZTFkYTMiLCJ2IjoxfQ",
    "max_width_2000": 1600,
    "max_height_2000": 1067,
    "url_max_2000": "https://live.staticflickr.com/65535/49661083948_55088dd979_h.jpg?s=eyJpIjo0OTY2MTA4Mzk0OCwiZSI6MTc2NDcxMjg0MywicyI6IjMzYjBhYTA0YmQ0YTBhMjZhZDAyODljYTIzZTRiMDhjNzEyNzAyZjIiLCJ2IjoxfQ",
    "flickr_page": "https://www.flickr.com/photos/54968894@N00/49661083948",
    "count_view": "112"
  },
  {
    "id": "49661909297",
    "owner": "54968894@N00",
    "title": "Cici_0449",
    "realname": "Sammi Fang",
    "ownername": "sammifang",
    "datetaken": "2020-03-08 13:38:34",
    "max_width": 4472,
    "max_height": 6708,
    "url_max": "https://live.staticflickr.com/65535/49661909297_4709df7ef9_o.jpg?s=eyJpIjo0OTY2MTkwOTI5NywiZSI6MTc2NDcxMjg0MywicyI6ImUxYjc3ZTQ1ZDU2MmRiYzM3YTljZDI2ZGQ5MzcxOGI1NzNhOTNkZTMiLCJ2IjoxfQ",
    "max_width_2000": 1365,
    "max_height_2000": 2048,
    "url_max_2000": "https://live.staticflickr.com/65535/49661909297_1d69d71272_k.jpg?s=eyJpIjo0OTY2MTkwOTI5NywiZSI6MTc2NDcxMjg0MywicyI6IjJlNzM3MjQwOWM5OGE5NGM1NmFiMjYwYTZlYjRhYWU1ZDVkNjBlNTciLCJ2IjoxfQ",
    "flickr_page": "https://www.flickr.com/photos/54968894@N00/49661909297",
    "count_view": "1081"
  },
  {
    "id": "49661911532",
    "owner": "54968894@N00",
    "title": "Cici_0483",
    "realname": "Sammi Fang",
    "ownername": "sammifang",
    "datetaken": "2020-03-08 13:41:01",
    "max_width": 4472,
    "max_height": 6708,
    "url_max": "https://live.staticflickr.com/65535/49661911532_4cecaff2fc_o.jpg?s=eyJpIjo0OTY2MTkxMTUzMiwiZSI6MTc2NDcxMjg0MywicyI6IjAwN2NlZWFmYWRhY2JlMmVkYWNjNjlmMmNlNjllZmEyNTE4ZTdhYTMiLCJ2IjoxfQ",
    "max_width_2000": 1365,
    "max_height_2000": 2048,
    "url_max_2000": "https://live.staticflickr.com/65535/49661911532_6f5a752d2a_k.jpg?s=eyJpIjo0OTY2MTkxMTUzMiwiZSI6MTc2NDcxMjg0MywicyI6IjNiNzdiYmNhMWFmN2FmOTRlNjg0NGE3Mjg0YTY3NjU5MTExZWQ5MzYiLCJ2IjoxfQ",
    "flickr_page": "https://www.flickr.com/photos/54968894@N00/49661911532",
    "count_view": "935"
  },
  {
    "id": "49661093943",
    "owner": "54968894@N00",
    "title": "Cici_0491",
    "realname": "Sammi Fang",
    "ownername": "sammifang",
    "datetaken": "2020-03-08 13:45:31",
    "max_width": 4472,
    "max_height": 6708,
    "url_max": "https://live.staticflickr.com/65535/49661093943_4c51e63497_o.jpg?s=eyJpIjo0OTY2MTA5Mzk0MywiZSI6MTc2NDcxMjg0MywicyI6IjUyODNlNWMwMDNhMGJmZjE0NTY4ZmE2MmVmODg5ODIxYTZmNTMzMzIiLCJ2IjoxfQ",
    "max_width_2000": 1365,
    "max_height_2000": 2048,
    "url_max_2000": "https://live.staticflickr.com/65535/49661093943_dce3c9f440_k.jpg?s=eyJpIjo0OTY2MTA5Mzk0MywiZSI6MTc2NDcxMjg0MywicyI6IjA1MGFjNDM0ODliMDIyYWJkNWIxNzg0MmQ5MzZhNDY0ZmJmY2MyN2EiLCJ2IjoxfQ",
    "flickr_page": "https://www.flickr.com/photos/54968894@N00/49661093943",
    "count_view": "795"
  },
  {
    "id": "928858849",
    "owner": "54968894@N00",
    "title": "17/03/2006 16:02",
    "realname": "Sammi Fang",
    "ownername": "sammifang",
    "datetaken": "2006-03-17 16:02:39",
    "max_width": 4000,
    "max_height": 2666,
    "url_max": "https://live.staticflickr.com/1084/928858849_967a2a4a4f_4k.jpg?s=eyJpIjo5Mjg4NTg4NDksImUiOjE3NjQ3MjIyMjgsInMiOiJiMzI1MDcwMjExZTNkNThiODI4NGY2MjU3OWYxZjY0ZTk0N2Q0NjY0IiwidiI6MX0",
    "max_width_2000": 1600,
    "max_height_2000": 1066,
    "url_max_2000": "https://live.staticflickr.com/1084/928858849_10aa396470_h.jpg?s=eyJpIjo5Mjg4NTg4NDksImUiOjE3NjQ3MjIyMjgsInMiOiJiYzViMjkyNDY4ODc3NWVjMzhlNDkxOTQ3NDliMDZjOTNiY2Q5YjMyIiwidiI6MX0",
    "flickr_page": "https://www.flickr.com/photos/54968894@N00/928858849",
    "count_view": "20"
  },
  {
    "id": "929692712",
    "owner": "54968894@N00",
    "title": "17/03/2006 15:51",
    "realname": "Sammi Fang",
    "ownername": "sammifang",
    "datetaken": "2006-03-17 15:51:31",
    "max_width": 2666,
    "max_height": 4000,
    "url_max": "https://live.staticflickr.com/1203/929692712_898e443079_4k.jpg?s=eyJpIjo5Mjk2OTI3MTIsImUiOjE3NjQ3MjIyMjgsInMiOiJiM2Q3MzZmMzUyMzFhOTUxOTMxOWVmMGQ0N2Y3MzQ2YTE5Y2FmMjcwIiwidiI6MX0",
    "max_width_2000": 1365,
    "max_height_2000": 2048,
    "url_max_2000": "https://live.staticflickr.com/1203/929692712_23df14769a_k.jpg?s=eyJpIjo5Mjk2OTI3MTIsImUiOjE3NjQ3MjIyMjgsInMiOiI3OWJiZTdjM2VlMzI4YjAyNWY2MDM2NjcyYTU1ZDdlMGYxNzhiNmU2IiwidiI6MX0",
    "flickr_page": "https://www.flickr.com/photos/54968894@N00/929692712",
    "count_view": "21"
  },
  {
    "id": "929684540",
    "owner": "54968894@N00",
    "title": "17/03/2006 15:49",
    "realname": "Sammi Fang",
    "ownername": "sammifang",
    "datetaken": "2006-03-17 15:49:49",
    "max_width": 2666,
    "max_height": 4000,
    "url_max": "https://live.staticflickr.com/1032/929684540_dd97e91bc2_4k.jpg?s=eyJpIjo5Mjk2ODQ1NDAsImUiOjE3NjQ3MjIyMjgsInMiOiJkYWZhY2MzZjBkNTc5NTk1NmY0YTA2YTFjODQ0MGMyYzI3N2I2MjZhIiwidiI6MX0",
    "max_width_2000": 1365,
    "max_height_2000": 2048,
    "url_max_2000": "https://live.staticflickr.com/1032/929684540_8ff5282a66_k.jpg?s=eyJpIjo5Mjk2ODQ1NDAsImUiOjE3NjQ3MjIyMjgsInMiOiJjMzZiZWQ2OGNkNzU4MTNmMjZkNmE3YmE3OGE0ZDZmNTJiZDkyODY5IiwidiI6MX0",
    "flickr_page": "https://www.flickr.com/photos/54968894@N00/929684540",
    "count_view": "21"
  },
  {
    "id": "929675444",
    "owner": "54968894@N00",
    "title": "17/03/2006 15:38",
    "realname": "Sammi Fang",
    "ownername": "sammifang",
    "datetaken": "2006-03-17 15:38:04",
    "max_width": 4000,
    "max_height": 2662,
    "url_max": "https://live.staticflickr.com/1083/929675444_99487e0df4_4k.jpg?s=eyJpIjo5Mjk2NzU0NDQsImUiOjE3NjQ3MjIyMjgsInMiOiIxMDBhODdiNjYwMzQxOTI4Mzk2Zjc5ZTYwN2NiZDNkMjc5OTczMmExIiwidiI6MX0",
    "max_width_2000": 1600,
    "max_height_2000": 1065,
    "url_max_2000": "https://live.staticflickr.com/1083/929675444_2179b572ac_h.jpg?s=eyJpIjo5Mjk2NzU0NDQsImUiOjE3NjQ3MjIyMjgsInMiOiJkM2YwZjJlMGViZDMxZDg3YTA2OTI1YjNiOTFhNTE5YmNiNGE4MjA1IiwidiI6MX0",
    "flickr_page": "https://www.flickr.com/photos/54968894@N00/929675444",
    "count_view": "17"
  },
  {
    "id": "929659380",
    "owner": "54968894@N00",
    "title": "17/03/2006 15:08",
    "realname": "Sammi Fang",
    "ownername": "sammifang",
    "datetaken": "2006-03-17 15:08:07",
    "max_width": 4000,
    "max_height": 2666,
    "url_max": "https://live.staticflickr.com/1110/929659380_03246ed96b_4k.jpg?s=eyJpIjo5Mjk2NTkzODAsImUiOjE3NjQ3MjIyMjgsInMiOiI0NzU0YzliNmM3NWZhYTQzMmMxZjExNWJmODhlZmRjNDY2ZTUyYzRhIiwidiI6MX0",
    "max_width_2000": 1600,
    "max_height_2000": 1066,
    "url_max_2000": "https://live.staticflickr.com/1110/929659380_7770413bf7_h.jpg?s=eyJpIjo5Mjk2NTkzODAsImUiOjE3NjQ3MjIyMjgsInMiOiI3OWFhOTQxOTlmNWRiYTE0MWI5ZDI1ZjU1MjdhMDhjZGJjNzNlYjdlIiwidiI6MX0",
    "flickr_page": "https://www.flickr.com/photos/54968894@N00/929659380",
    "count_view": "22"
  },
  {
    "id": "928795737",
    "owner": "54968894@N00",
    "title": "17/03/2006 14:55",
    "realname": "Sammi Fang",
    "ownername": "sammifang",
    "datetaken": "2006-03-17 14:55:23",
    "max_width": 4000,
    "max_height": 2666,
    "url_max": "https://live.staticflickr.com/1230/928795737_6d3d736c48_4k.jpg?s=eyJpIjo5Mjg3OTU3MzcsImUiOjE3NjQ3MjIyMjgsInMiOiI5OTUyOTJjYTkwN2U5MjcyZjNhZjg5MmUwZTM4NmQyZGYwMmUxZDgzIiwidiI6MX0",
    "max_width_2000": 1600,
    "max_height_2000": 1066,
    "url_max_2000": "https://live.staticflickr.com/1230/928795737_9bf70ff5c7_h.jpg?s=eyJpIjo5Mjg3OTU3MzcsImUiOjE3NjQ3MjIyMjgsInMiOiI5MjBjYzUwMDYyNTc2NDllMDVkZjEwYzc4MWFkYjZmYjczNjIwNGJjIiwidiI6MX0",
    "flickr_page": "https://www.flickr.com/photos/54968894@N00/928795737",
    "count_view": "25"
  },
  {
    "id": "928787047",
    "owner": "54968894@N00",
    "title": "17/03/2006 14:41",
    "realname": "Sammi Fang",
    "ownername": "sammifang",
    "datetaken": "2006-03-17 14:41:26",
    "max_width": 4000,
    "max_height": 2666,
    "url_max": "https://live.staticflickr.com/1058/928787047_978e398c50_4k.jpg?s=eyJpIjo5Mjg3ODcwNDcsImUiOjE3NjQ3MjIyMjgsInMiOiIxNjVlMjNlY2RhNzU2YTBkYThmNmIyMzRmMjhhMmMyNmIyMWE3YTRhIiwidiI6MX0",
    "max_width_2000": 1600,
    "max_height_2000": 1066,
    "url_max_2000": "https://live.staticflickr.com/1058/928787047_857915f4de_h.jpg?s=eyJpIjo5Mjg3ODcwNDcsImUiOjE3NjQ3MjIyMjgsInMiOiJiZDRlOWU5ZGE4ZDczOTBjNGE4YzkwNDA0MGIwYTNiMTQ0YjZhNGYxIiwidiI6MX0",
    "flickr_page": "https://www.flickr.com/photos/54968894@N00/928787047",
    "count_view": "18"
  },
  {
    "id": "928775599",
    "owner": "54968894@N00",
    "title": "17/03/2006 14:41",
    "realname": "Sammi Fang",
    "ownername": "sammifang",
    "datetaken": "2006-03-17 14:41:21",
    "max_width": 4000,
    "max_height": 2666,
    "url_max": "https://live.staticflickr.com/1253/928775599_5fe81b1167_4k.jpg?s=eyJpIjo5Mjg3NzU1OTksImUiOjE3NjQ3MjIyMjgsInMiOiJmOTEwZTlkYzVlY2E3MjY1ZTBhNzZmNDJkNjk5NjNlMGFlYTQwZjdjIiwidiI6MX0",
    "max_width_2000": 1600,
    "max_height_2000": 1066,
    "url_max_2000": "https://live.staticflickr.com/1253/928775599_26168bad19_h.jpg?s=eyJpIjo5Mjg3NzU1OTksImUiOjE3NjQ3MjIyMjgsInMiOiJlNjNkOGM5MmZhMDBjNjBiNmE1MWM4ODA2YzAyMGVmZDdlMjk3Y2QyIiwidiI6MX0",
    "flickr_page": "https://www.flickr.com/photos/54968894@N00/928775599",
    "count_view": "16"
  },
  {
    "id": "927052501",
    "owner": "54968894@N00",
    "title": "18/03/2006 15:37",
    "realname": "Sammi Fang",
    "ownername": "sammifang",
    "datetaken": "2006-03-18 15:37:57",
    "max_width": 2666,
    "max_height": 4000,
    "url_max": "https://live.staticflickr.com/1263/927052501_7a7dc6f348_4k.jpg?s=eyJpIjo5MjcwNTI1MDEsImUiOjE3NjQ3MjIyMjgsInMiOiJkZTdkMTQ5NjlmOGQwMTQzNTBmMWM4ZTgyYzRiZDM0MDIwMjk5OWQ3IiwidiI6MX0",
    "max_width_2000": 1365,
    "max_height_2000": 2048,
    "url_max_2000": "https://live.staticflickr.com/1263/927052501_13e45d4872_k.jpg?s=eyJpIjo5MjcwNTI1MDEsImUiOjE3NjQ3MjIyMjgsInMiOiJhZWFhZDk0NDM1ZWQ0NmVjNzllMzg1MWI3YTU0YWUxZDg2MzYyMmE1IiwidiI6MX0",
    "flickr_page": "https://www.flickr.com/photos/54968894@N00/927052501",
    "count_view": "20"
  },
  {
    "id": "926886693",
    "owner": "54968894@N00",
    "title": "18/03/2006 14:32",
    "realname": "Sammi Fang",
    "ownername": "sammifang",
    "datetaken": "2006-03-18 14:32:39",
    "max_width": 4000,
    "max_height": 2666,
    "url_max": "https://live.staticflickr.com/1100/926886693_2ec3cda8a8_4k.jpg?s=eyJpIjo5MjY4ODY2OTMsImUiOjE3NjQ3MjIyMjgsInMiOiJhZDE4NTVjYzlmMzRmZTAwYTIyYzgwYmFmODVkMDRjN2FlYmMyOGVmIiwidiI6MX0",
    "max_width_2000": 1600,
    "max_height_2000": 1066,
    "url_max_2000": "https://live.staticflickr.com/1100/926886693_f5d8da6a44_h.jpg?s=eyJpIjo5MjY4ODY2OTMsImUiOjE3NjQ3MjIyMjgsInMiOiJjZGM5YmY2MjJkNWY2MzBlMmZjZjBlZTRiYjExNTk4ODExNjZhMjE0IiwidiI6MX0",
    "flickr_page": "https://www.flickr.com/photos/54968894@N00/926886693",
    "count_view": "16"
  },
  {
    "id": "927542040",
    "owner": "54968894@N00",
    "title": "18/03/2006 14:15",
    "realname": "Sammi Fang",
    "ownername": "sammifang",
    "datetaken": "2006-03-18 14:15:54",
    "max_width": 4000,
    "max_height": 2666,
    "url_max": "https://live.staticflickr.com/1135/927542040_bb468a7ad2_4k.jpg?s=eyJpIjo5Mjc1NDIwNDAsImUiOjE3NjQ3MjIyMjgsInMiOiJmZDdiM2VhZGRlMzQ0NzRkYmUyZDE3MjFhZGYzNzg5Njk5NTdiYTBkIiwidiI6MX0",
    "max_width_2000": 1600,
    "max_height_2000": 1066,
    "url_max_2000": "https://live.staticflickr.com/1135/927542040_e7902e88e9_h.jpg?s=eyJpIjo5Mjc1NDIwNDAsImUiOjE3NjQ3MjIyMjgsInMiOiI3YzQ1YTc2MDBkOTY0NGU3OGMzZDlhODg4ZDA2N2RjYmYyYmNmMGNkIiwidiI6MX0",
    "flickr_page": "https://www.flickr.com/photos/54968894@N00/927542040",
    "count_view": "17"
  },
  {
    "id": "926690186",
    "owner": "54968894@N00",
    "title": "17/03/2006 17:41",
    "realname": "Sammi Fang",
    "ownername": "sammifang",
    "datetaken": "2006-03-17 17:41:27",
    "max_width": 2912,
    "max_height": 4368,
    "url_max": "https://live.staticflickr.com/1404/926690186_f80c6bbdab_o.jpg?s=eyJpIjo5MjY2OTAxODYsImUiOjE3NjQ3MjIyMjgsInMiOiI4ZTE3OWZjOTY4NDk0NGRiNDc2MWMxY2EyZDhmYzQwYmE0MzdhZDYyIiwidiI6MX0",
    "max_width_2000": 1365,
    "max_height_2000": 2048,
    "url_max_2000": "https://live.staticflickr.com/1404/926690186_88eb6f827c_k.jpg?s=eyJpIjo5MjY2OTAxODYsImUiOjE3NjQ3MjIyMjgsInMiOiJmZDRkZGY0MzUwYWUyYjJlYWRiYTM1ODk4M2U2YzQ4MzVkNWYxZTE4IiwidiI6MX0",
    "flickr_page": "https://www.flickr.com/photos/54968894@N00/926690186",
    "count_view": "248"
  },
  {
    "id": "926672110",
    "owner": "54968894@N00",
    "title": "17/03/2006 17:40",
    "realname": "Sammi Fang",
    "ownername": "sammifang",
    "datetaken": "2006-03-17 17:40:34",
    "max_width": 4368,
    "max_height": 2912,
    "url_max": "https://live.staticflickr.com/1032/926672110_1a1cb88cfc_o.jpg?s=eyJpIjo5MjY2NzIxMTAsImUiOjE3NjQ3MjIyMjgsInMiOiI3NWFiZTFjOWE5ZmU5ZjAyYmQyNDg5ZjNhYWM0YjY3OTg5ZmNkYjAwIiwidiI6MX0",
    "max_width_2000": 1600,
    "max_height_2000": 1067,
    "url_max_2000": "https://live.staticflickr.com/1032/926672110_dea35bd641_h.jpg?s=eyJpIjo5MjY2NzIxMTAsImUiOjE3NjQ3MjIyMjgsInMiOiIzZmViMGYzNjljMjQ3Y2NkZDcyMTM5YTk5YjU4ODI4NDcyNDNlZTdhIiwidiI6MX0",
    "flickr_page": "https://www.flickr.com/photos/54968894@N00/926672110",
    "count_view": "22"
  },
  {
    "id": "926592636",
    "owner": "54968894@N00",
    "title": "17/03/2006 17:34",
    "realname": "Sammi Fang",
    "ownername": "sammifang",
    "datetaken": "2006-03-17 17:34:19",
    "max_width": 4368,
    "max_height": 2912,
    "url_max": "https://live.staticflickr.com/1258/926592636_2dd262c601_o.jpg?s=eyJpIjo5MjY1OTI2MzYsImUiOjE3NjQ3MjIyMjgsInMiOiJjZGNlZWMyMWQyNTM1OWU5MDE2YTMzZGJiZWM5M2YzNTUyZWE0NTQ5IiwidiI6MX0",
    "max_width_2000": 1600,
    "max_height_2000": 1067,
    "url_max_2000": "https://live.staticflickr.com/1258/926592636_a889349b29_h.jpg?s=eyJpIjo5MjY1OTI2MzYsImUiOjE3NjQ3MjIyMjgsInMiOiI4ZWZlOTNjNTVhY2JiMDFlNmM0OTRkNDYwMGM3OGMwODQxOGMxMDBlIiwidiI6MX0",
    "flickr_page": "https://www.flickr.com/photos/54968894@N00/926592636",
    "count_view": "42"
  },
  {
    "id": "925740178",
    "owner": "54968894@N00",
    "title": "05/03/2006 17:13",
    "realname": "Sammi Fang",
    "ownername": "sammifang",
    "datetaken": "2006-03-05 17:13:25",
    "max_width": 4000,
    "max_height": 2625,
    "url_max": "https://live.staticflickr.com/1354/925740178_3efad0b337_4k.jpg?s=eyJpIjo5MjU3NDAxNzgsImUiOjE3NjQ3MjIyMjgsInMiOiJjNTIzNDBkOTlkYzI1OTE2ZDViNGJiMWQ2MTFkM2Q5NjkzYTFmNDVkIiwidiI6MX0",
    "max_width_2000": 1600,
    "max_height_2000": 1050,
    "url_max_2000": "https://live.staticflickr.com/1354/925740178_d410b6adac_h.jpg?s=eyJpIjo5MjU3NDAxNzgsImUiOjE3NjQ3MjIyMjgsInMiOiIzZTRmODUxYjY2YjM5YTJhOTZiNmE1NzdiMmRlNzdhMzhmOWQ3NjgxIiwidiI6MX0",
    "flickr_page": "https://www.flickr.com/photos/54968894@N00/925740178",
    "count_view": "178"
  },
  {
    "id": "922194202",
    "owner": "54968894@N00",
    "title": "05/03/2006 17:08",
    "realname": "Sammi Fang",
    "ownername": "sammifang",
    "datetaken": "2006-03-05 17:08:59",
    "max_width": 4236,
    "max_height": 2730,
    "url_max": "https://live.staticflickr.com/1378/922194202_e962c4979c_o.jpg?s=eyJpIjo5MjIxOTQyMDIsImUiOjE3NjQ3MjIyMjgsInMiOiI4M2RlYWM1MWVlM2I4NTZlOTU0MmEyODg5YzU1M2ZiODRhNGVmY2RhIiwidiI6MX0",
    "max_width_2000": 1600,
    "max_height_2000": 1031,
    "url_max_2000": "https://live.staticflickr.com/1378/922194202_fd1a79bb6b_h.jpg?s=eyJpIjo5MjIxOTQyMDIsImUiOjE3NjQ3MjIyMjgsInMiOiI1OWE0NGMzMzA0YWY3ZGRjOTBhN2QzYzBiOGUyNTU5NDZlM2ZlODdjIiwidiI6MX0",
    "flickr_page": "https://www.flickr.com/photos/54968894@N00/922194202",
    "count_view": "16"
  },
  {
    "id": "921286219",
    "owner": "54968894@N00",
    "title": "05/03/2006 17:07",
    "realname": "Sammi Fang",
    "ownername": "sammifang",
    "datetaken": "2006-03-05 17:07:13",
    "max_width": 4315,
    "max_height": 2883,
    "url_max": "https://live.staticflickr.com/1031/921286219_d8edd1e158_o.jpg?s=eyJpIjo5MjEyODYyMTksImUiOjE3NjQ3MjIyMjgsInMiOiI4YTkzMGY0YWI4ZjExZDFiODc2ODIwNjFkN2ZiMGU4OTc2NWYwOWUxIiwidiI6MX0",
    "max_width_2000": 1600,
    "max_height_2000": 1069,
    "url_max_2000": "https://live.staticflickr.com/1031/921286219_542821877e_h.jpg?s=eyJpIjo5MjEyODYyMTksImUiOjE3NjQ3MjIyMjgsInMiOiJlOWFlZjYxM2EzY2Y0M2EzYTdjYTE4NDE4ZjJmMTdiYmZkMzU1YTdiIiwidiI6MX0",
    "flickr_page": "https://www.flickr.com/photos/54968894@N00/921286219",
    "count_view": "17"
  },
  {
    "id": "921244347",
    "owner": "54968894@N00",
    "title": "05/03/2006 17:07",
    "realname": "Sammi Fang",
    "ownername": "sammifang",
    "datetaken": "2006-03-05 17:07:02",
    "max_width": 2828,
    "max_height": 4252,
    "url_max": "https://live.staticflickr.com/1260/921244347_fc4920b14d_o.jpg?s=eyJpIjo5MjEyNDQzNDcsImUiOjE3NjQ3MjIyMjgsInMiOiIwMzgyMTM4NDNlNjdlYzhjMTcxMDU3OTFkOTc3ZDRiNzFmYTYzMjE1IiwidiI6MX0",
    "max_width_2000": 1362,
    "max_height_2000": 2048,
    "url_max_2000": "https://live.staticflickr.com/1260/921244347_23ad40e527_k.jpg?s=eyJpIjo5MjEyNDQzNDcsImUiOjE3NjQ3MjIyMjgsInMiOiIwNWJkNjQzMWJjZDkyZDZiZjVjMGE0MDM1ZTczM2VhMmU0NGI4MjI4IiwidiI6MX0",
    "flickr_page": "https://www.flickr.com/photos/54968894@N00/921244347",
    "count_view": "29"
  },
  {
    "id": "921207301",
    "owner": "54968894@N00",
    "title": "05/03/2006 17:06",
    "realname": "Sammi Fang",
    "ownername": "sammifang",
    "datetaken": "2006-03-05 17:06:38",
    "max_width": 4307,
    "max_height": 2880,
    "url_max": "https://live.staticflickr.com/1158/921207301_bb5b3dc74b_o.jpg?s=eyJpIjo5MjEyMDczMDEsImUiOjE3NjQ3MjIyMjgsInMiOiI0OGEwMDk4ZmU1NGNiMTlkYmYyY2EzMThjNmYyN2MxM2I0NWFlNWRmIiwidiI6MX0",
    "max_width_2000": 1600,
    "max_height_2000": 1070,
    "url_max_2000": "https://live.staticflickr.com/1158/921207301_8f8e9270d7_h.jpg?s=eyJpIjo5MjEyMDczMDEsImUiOjE3NjQ3MjIyMjgsInMiOiIzODM0MjllZDg2YjI1N2Q3OTZjMjdjMDNmYmVjOGYwOTZlYjI3YTk3IiwidiI6MX0",
    "flickr_page": "https://www.flickr.com/photos/54968894@N00/921207301",
    "count_view": "18"
  },
  {
    "id": "922028584",
    "owner": "54968894@N00",
    "title": "05/03/2006 17:06",
    "realname": "Sammi Fang",
    "ownername": "sammifang",
    "datetaken": "2006-03-05 17:06:08",
    "max_width": 4350,
    "max_height": 2904,
    "url_max": "https://live.staticflickr.com/1107/922028584_77cd70506f_o.jpg?s=eyJpIjo5MjIwMjg1ODQsImUiOjE3NjQ3MjIyMjgsInMiOiJkMmQ5YWRkOGE2YTA1MDcxM2I3MGNmZjcxMDgxNzYzNzE4Yzc1N2UxIiwidiI6MX0",
    "max_width_2000": 1600,
    "max_height_2000": 1068,
    "url_max_2000": "https://live.staticflickr.com/1107/922028584_711f37baf4_h.jpg?s=eyJpIjo5MjIwMjg1ODQsImUiOjE3NjQ3MjIyMjgsInMiOiI5ZTVkMzgwMjVhYmMxYmU3N2RkOGRkYzE5MDUwNzJjMGQ0OGEwZmVjIiwidiI6MX0",
    "flickr_page": "https://www.flickr.com/photos/54968894@N00/922028584",
    "count_view": "16"
  },
  {
    "id": "919741143",
    "owner": "54968894@N00",
    "title": "25/02/2006 14:20",
    "realname": "Sammi Fang",
    "ownername": "sammifang",
    "datetaken": "2006-02-25 14:20:19",
    "max_width": 4000,
    "max_height": 2666,
    "url_max": "https://live.staticflickr.com/1330/919741143_f41a5ac3b3_4k.jpg?s=eyJpIjo5MTk3NDExNDMsImUiOjE3NjQ3MjIyMjgsInMiOiI5Nzk3MmIzZTliYWZjZjQ1MjE4ZTgwNzk0NjUxYjc4ZGVhMzJhZjM4IiwidiI6MX0",
    "max_width_2000": 1600,
    "max_height_2000": 1066,
    "url_max_2000": "https://live.staticflickr.com/1330/919741143_7c83af75e6_h.jpg?s=eyJpIjo5MTk3NDExNDMsImUiOjE3NjQ3MjIyMjgsInMiOiI0ZDkxN2I4ZmVkNGIzYWU3YzE4YTVlMzA2ODJkMzBlM2JjMzNhMWRiIiwidiI6MX0",
    "flickr_page": "https://www.flickr.com/photos/54968894@N00/919741143",
    "count_view": "298"
  },
  {
    "id": "914684778",
    "owner": "54968894@N00",
    "title": "18/02/2006 11:24",
    "realname": "Sammi Fang",
    "ownername": "sammifang",
    "datetaken": "2006-02-18 11:24:55",
    "max_width": 2666,
    "max_height": 4000,
    "url_max": "https://live.staticflickr.com/1327/914684778_fa09c64d09_4k.jpg?s=eyJpIjo5MTQ2ODQ3NzgsImUiOjE3NjQ3MjIyMjgsInMiOiJlNzZmZmFlN2RjZjYzMTg4ODJmM2M2Mzc2YTE0MjM3YjJmODYyOWZhIiwidiI6MX0",
    "max_width_2000": 1365,
    "max_height_2000": 2048,
    "url_max_2000": "https://live.staticflickr.com/1327/914684778_4fa472f466_k.jpg?s=eyJpIjo5MTQ2ODQ3NzgsImUiOjE3NjQ3MjIyMjgsInMiOiI1MTVjMjBkZDg2NmE1N2NiYzNkZjM3ZDUwYzNlY2ZlZmEwZTBkYTA4IiwidiI6MX0",
    "flickr_page": "https://www.flickr.com/photos/54968894@N00/914684778",
    "count_view": "278"
  },
  {
    "id": "914669086",
    "owner": "54968894@N00",
    "title": "18/02/2006 11:23",
    "realname": "Sammi Fang",
    "ownername": "sammifang",
    "datetaken": "2006-02-18 11:23:00",
    "max_width": 4000,
    "max_height": 2666,
    "url_max": "https://live.staticflickr.com/1423/914669086_b7096a76fe_4k.jpg?s=eyJpIjo5MTQ2NjkwODYsImUiOjE3NjQ3MjIyMzAsInMiOiI1NjAyZTNkMjdlMDg3NzRmZjAwZmEwNjdmOTUzYWNlMDY2YWE2MjZkIiwidiI6MX0",
    "max_width_2000": 1600,
    "max_height_2000": 1066,
    "url_max_2000": "https://live.staticflickr.com/1423/914669086_df3a5d778d_h.jpg?s=eyJpIjo5MTQ2NjkwODYsImUiOjE3NjQ3MjIyMzAsInMiOiJiZDNkMDA3NWEwYWIyNWRlMDc4Mzk5MTNhZmIxZmI1MGMzOWYzYTBkIiwidiI6MX0",
    "flickr_page": "https://www.flickr.com/photos/54968894@N00/914669086",
    "count_view": "44"
  },
  {
    "id": "914591816",
    "owner": "54968894@N00",
    "title": "18/02/2006 11:15",
    "realname": "Sammi Fang",
    "ownername": "sammifang",
    "datetaken": "2006-02-18 11:15:10",
    "max_width": 4000,
    "max_height": 2666,
    "url_max": "https://live.staticflickr.com/1295/914591816_9622ab5554_4k.jpg?s=eyJpIjo5MTQ1OTE4MTYsImUiOjE3NjQ3MjIyMzAsInMiOiJkZjdlZWM5ZTM5MjIxN2NlMjliNGZlZDNkZDYzYjdlNjA3YTdkNmI2IiwidiI6MX0",
    "max_width_2000": 1600,
    "max_height_2000": 1066,
    "url_max_2000": "https://live.staticflickr.com/1295/914591816_ecdd9076b9_h.jpg?s=eyJpIjo5MTQ1OTE4MTYsImUiOjE3NjQ3MjIyMzAsInMiOiI4NGRlMjYzN2Q2N2E5OWM1MzlhNDIzNjQwMWFkZmUwOTFmMWVkY2ZiIiwidiI6MX0",
    "flickr_page": "https://www.flickr.com/photos/54968894@N00/914591816",
    "count_view": "37"
  },
  {
    "id": "913723219",
    "owner": "54968894@N00",
    "title": "18/02/2006 11:13",
    "realname": "Sammi Fang",
    "ownername": "sammifang",
    "datetaken": "2006-02-18 11:13:48",
    "max_width": 4000,
    "max_height": 2666,
    "url_max": "https://live.staticflickr.com/1311/913723219_a9f383dd5d_4k.jpg?s=eyJpIjo5MTM3MjMyMTksImUiOjE3NjQ3MjIyMzAsInMiOiJmMDNhNWZmZmRiNjVkNjAxYzU2OWY5NjZiMmZhY2ViOWFkYmIxMDlkIiwidiI6MX0",
    "max_width_2000": 1600,
    "max_height_2000": 1066,
    "url_max_2000": "https://live.staticflickr.com/1311/913723219_6d9dc8d2d8_h.jpg?s=eyJpIjo5MTM3MjMyMTksImUiOjE3NjQ3MjIyMzAsInMiOiJkNGQzNTI3ZGNiOTM1ODg5ZDZjYWIzNmFjYjI5NTU1M2Y0ZDJhNzNlIiwidiI6MX0",
    "flickr_page": "https://www.flickr.com/photos/54968894@N00/913723219",
    "count_view": "25"
  },
  {
    "id": "914557634",
    "owner": "54968894@N00",
    "title": "18/02/2006 11:13",
    "realname": "Sammi Fang",
    "ownername": "sammifang",
    "datetaken": "2006-02-18 11:13:24",
    "max_width": 2666,
    "max_height": 4000,
    "url_max": "https://live.staticflickr.com/1116/914557634_8373c7eb50_4k.jpg?s=eyJpIjo5MTQ1NTc2MzQsImUiOjE3NjQ3MjIyMzAsInMiOiI5NGZmNTc2NDI5MzJiNzNkOGM1ZjRkNTBjZDU2ZmRmOWJlOTc0NTZiIiwidiI6MX0",
    "max_width_2000": 1365,
    "max_height_2000": 2048,
    "url_max_2000": "https://live.staticflickr.com/1116/914557634_4c3002e5f1_k.jpg?s=eyJpIjo5MTQ1NTc2MzQsImUiOjE3NjQ3MjIyMzAsInMiOiJlMWQ0ZmJkZDc5OGJlYTkzMjZiZjVjZDZmNDU3OWNkYTY5NTQyYThiIiwidiI6MX0",
    "flickr_page": "https://www.flickr.com/photos/54968894@N00/914557634",
    "count_view": "26"
  },
  {
    "id": "913657837",
    "owner": "54968894@N00",
    "title": "18/02/2006 11:09",
    "realname": "Sammi Fang",
    "ownername": "sammifang",
    "datetaken": "2006-02-18 11:09:24",
    "max_width": 2666,
    "max_height": 4000,
    "url_max": "https://live.staticflickr.com/1095/913657837_5bc7b81935_4k.jpg?s=eyJpIjo5MTM2NTc4MzcsImUiOjE3NjQ3MjIyMzAsInMiOiJmOTBkZDZhMzE0ZjZmMDYxZDgwN2E5NDljODc1ZWQzYTU3NTFlMTVhIiwidiI6MX0",
    "max_width_2000": 1365,
    "max_height_2000": 2048,
    "url_max_2000": "https://live.staticflickr.com/1095/913657837_31f4465a73_k.jpg?s=eyJpIjo5MTM2NTc4MzcsImUiOjE3NjQ3MjIyMzAsInMiOiJlZWEyMTU4N2M0ZDQ2YjMzZmNmMDkxN2YzNGFhMjZlY2E3YTU1YjU0IiwidiI6MX0",
    "flickr_page": "https://www.flickr.com/photos/54968894@N00/913657837",
    "count_view": "36"
  },
  {
    "id": "910453434",
    "owner": "54968894@N00",
    "title": "18/02/2006 14:54",
    "realname": "Sammi Fang",
    "ownername": "sammifang",
    "datetaken": "2006-02-18 14:54:06",
    "max_width": 2912,
    "max_height": 4368,
    "url_max": "https://live.staticflickr.com/1436/910453434_fdf5de60b5_o.jpg?s=eyJpIjo5MTA0NTM0MzQsImUiOjE3NjQ3MjIyMzAsInMiOiI4MmFmOGIzZGUxNTRlODE0YzQ5OTZkODNkZjVjZTcxMDFkZWQ2MTY3IiwidiI6MX0",
    "max_width_2000": 1365,
    "max_height_2000": 2048,
    "url_max_2000": "https://live.staticflickr.com/1436/910453434_0a484143a0_k.jpg?s=eyJpIjo5MTA0NTM0MzQsImUiOjE3NjQ3MjIyMzAsInMiOiIzMDBjYTc5OGFhMDdiMWY1NTYyYTMwZWIwNTEwODBmNmZlOGM1NGYzIiwidiI6MX0",
    "flickr_page": "https://www.flickr.com/photos/54968894@N00/910453434",
    "count_view": "34"
  },
  {
    "id": "904500491",
    "owner": "54968894@N00",
    "title": "11/02/2006 23:31",
    "realname": "Sammi Fang",
    "ownername": "sammifang",
    "datetaken": "2006-02-11 23:31:14",
    "max_width": 4368,
    "max_height": 2912,
    "url_max": "https://live.staticflickr.com/1358/904500491_bf04577f01_o.jpg?s=eyJpIjo5MDQ1MDA0OTEsImUiOjE3NjQ3MjIyMzAsInMiOiJlYjUxMjIyZjliYzI1OTc1ZTYxZDc1NGYyZGI0NjliMGY0MjRjODM2IiwidiI6MX0",
    "max_width_2000": 1600,
    "max_height_2000": 1067,
    "url_max_2000": "https://live.staticflickr.com/1358/904500491_d33e86c209_h.jpg?s=eyJpIjo5MDQ1MDA0OTEsImUiOjE3NjQ3MjIyMzAsInMiOiJhY2QxZjI1YWI5OGVhOWI2ZWQ5NDEyZjQwN2U4NmNkMmM1ODMzOWY1IiwidiI6MX0",
    "flickr_page": "https://www.flickr.com/photos/54968894@N00/904500491",
    "count_view": "13"
  },
  {
    "id": "904105193",
    "owner": "54968894@N00",
    "title": "11/02/2006 22:31",
    "realname": "Sammi Fang",
    "ownername": "sammifang",
    "datetaken": "2006-02-11 22:31:47",
    "max_width": 2912,
    "max_height": 4368,
    "url_max": "https://live.staticflickr.com/1401/904105193_a5a0dc4950_o.jpg?s=eyJpIjo5MDQxMDUxOTMsImUiOjE3NjQ3MjIyMzAsInMiOiI5Y2FlZmVhNDNmYWIyOGQwZTdjNzY1ZmQ4M2UzOWM5YWRmYjdkZTBjIiwidiI6MX0",
    "max_width_2000": 1365,
    "max_height_2000": 2048,
    "url_max_2000": "https://live.staticflickr.com/1401/904105193_f345df396a_k.jpg?s=eyJpIjo5MDQxMDUxOTMsImUiOjE3NjQ3MjIyMzAsInMiOiI2YjhjNjhmYmY1ZTBhMmI1MmIxYTlmNTIwM2MyYmU2MDg2ZjAwNTdhIiwidiI6MX0",
    "flickr_page": "https://www.flickr.com/photos/54968894@N00/904105193",
    "count_view": "17"
  },
  {
    "id": "901078568",
    "owner": "54968894@N00",
    "title": "11/02/2006 21:03",
    "realname": "Sammi Fang",
    "ownername": "sammifang",
    "datetaken": "2006-02-11 21:03:31",
    "max_width": 4368,
    "max_height": 2912,
    "url_max": "https://live.staticflickr.com/1139/901078568_d15acfbb8f_o.jpg?s=eyJpIjo5MDEwNzg1NjgsImUiOjE3NjQ3MjIyMzAsInMiOiJmNDZmMTIyMDlkMWY0MTI0YmMxMTVkMTA5ZDQ5NTYwODczNzgyNGYwIiwidiI6MX0",
    "max_width_2000": 1600,
    "max_height_2000": 1067,
    "url_max_2000": "https://live.staticflickr.com/1139/901078568_4ed167e1ae_h.jpg?s=eyJpIjo5MDEwNzg1NjgsImUiOjE3NjQ3MjIyMzAsInMiOiI2MWU4NmRlYWUwZjIwZmRhMzgyNzdkMDhjMTNmNzc3N2QxNDA5N2M5IiwidiI6MX0",
    "flickr_page": "https://www.flickr.com/photos/54968894@N00/901078568",
    "count_view": "32"
  },
  {
    "id": "900606960",
    "owner": "54968894@N00",
    "title": "11/02/2006 22:18",
    "realname": "Sammi Fang",
    "ownername": "sammifang",
    "datetaken": "2006-02-11 22:18:39",
    "max_width": 4276,
    "max_height": 2850,
    "url_max": "https://live.staticflickr.com/1036/900606960_859f7b9901_o.jpg?s=eyJpIjo5MDA2MDY5NjAsImUiOjE3NjQ3MjIyMzAsInMiOiJlNTVlYzEyYTlmN2NjYzBiNTk3NGU2ZDUzOTBhY2MzNGE0NDk2OWNiIiwidiI6MX0",
    "max_width_2000": 1600,
    "max_height_2000": 1066,
    "url_max_2000": "https://live.staticflickr.com/1036/900606960_8b916179a6_h.jpg?s=eyJpIjo5MDA2MDY5NjAsImUiOjE3NjQ3MjIyMzAsInMiOiI4YThkNTU2NjU1M2Q0N2NkY2UzOWM2ZWM1ZDU0NTcyYThlMzAzYjNhIiwidiI6MX0",
    "flickr_page": "https://www.flickr.com/photos/54968894@N00/900606960",
    "count_view": "268"
  },
  {
    "id": "897100724",
    "owner": "54968894@N00",
    "title": "IMG_2145",
    "realname": "Sammi Fang",
    "ownername": "sammifang",
    "datetaken": "2006-03-28 14:44:24",
    "max_width": 2912,
    "max_height": 4368,
    "url_max": "https://live.staticflickr.com/1249/897100724_104647a62b_o.jpg?s=eyJpIjo4OTcxMDA3MjQsImUiOjE3NjQ3MjIyMzAsInMiOiIwYjJhZTczMmUyYjM3ODVmNjM3ZjMwMGVhZDdlNTBjYzZiOTk0MzUyIiwidiI6MX0",
    "max_width_2000": 1365,
    "max_height_2000": 2048,
    "url_max_2000": "https://live.staticflickr.com/1249/897100724_9525642da9_k.jpg?s=eyJpIjo4OTcxMDA3MjQsImUiOjE3NjQ3MjIyMzAsInMiOiIyN2YxZDEwZjAwNjhlYmM3ZGRjMThjM2RkNGRiYjNlMGJhYzU5NTQzIiwidiI6MX0",
    "flickr_page": "https://www.flickr.com/photos/54968894@N00/897100724",
    "count_view": "251"
  },
  {
    "id": "897065760",
    "owner": "54968894@N00",
    "title": "IMG_2143",
    "realname": "Sammi Fang",
    "ownername": "sammifang",
    "datetaken": "2006-03-28 14:40:40",
    "max_width": 4368,
    "max_height": 2912,
    "url_max": "https://live.staticflickr.com/1405/897065760_308e7bdd54_o.jpg?s=eyJpIjo4OTcwNjU3NjAsImUiOjE3NjQ3MjIyMzAsInMiOiI2NWMzMTZmMWYxMGYwZDJkZmY0NWNhZWVkYWQ3MTdkZDllZTQ2NzM0IiwidiI6MX0",
    "max_width_2000": 1600,
    "max_height_2000": 1067,
    "url_max_2000": "https://live.staticflickr.com/1405/897065760_66be806edf_h.jpg?s=eyJpIjo4OTcwNjU3NjAsImUiOjE3NjQ3MjIyMzAsInMiOiIzMzU2ODJkNjEzYTk1ZTc4YjI5MjVlN2YyNTM0NTVlY2JlYTMwZGMxIiwidiI6MX0",
    "flickr_page": "https://www.flickr.com/photos/54968894@N00/897065760",
    "count_view": "20"
  },
  {
    "id": "896199055",
    "owner": "54968894@N00",
    "title": "IMG_2142",
    "realname": "Sammi Fang",
    "ownername": "sammifang",
    "datetaken": "2006-03-28 14:36:41",
    "max_width": 2691,
    "max_height": 3863,
    "url_max": "https://live.staticflickr.com/1005/896199055_5e97c26ee5_4k.jpg?s=eyJpIjo4OTYxOTkwNTUsImUiOjE3NjQ3MjIyMzAsInMiOiI2NDg1ZGI1YTYyNGJjMGFjNDI4MDc5NjVhNTBhZjZhOWIxYjRiNzZkIiwidiI6MX0",
    "max_width_2000": 1427,
    "max_height_2000": 2048,
    "url_max_2000": "https://live.staticflickr.com/1005/896199055_480cc84dcb_k.jpg?s=eyJpIjo4OTYxOTkwNTUsImUiOjE3NjQ3MjIyMzAsInMiOiI1MzVmOGEwNzNmMTI2NjYzNDQyMzNmNDIzZWIxMDJkMGY3MmQ1ODc1IiwidiI6MX0",
    "flickr_page": "https://www.flickr.com/photos/54968894@N00/896199055",
    "count_view": "28"
  },
  {
    "id": "896976178",
    "owner": "54968894@N00",
    "title": "IMG_2116",
    "realname": "Sammi Fang",
    "ownername": "sammifang",
    "datetaken": "2006-03-28 13:31:04",
    "max_width": 4368,
    "max_height": 2912,
    "url_max": "https://live.staticflickr.com/1203/896976178_34667b845f_o.jpg?s=eyJpIjo4OTY5NzYxNzgsImUiOjE3NjQ3MjIyMzIsInMiOiI3YjNlNDczZGJmNTAxZmI4MGRjMzNkYTEwMDQ1MjU3YTY0YmNmNmE0IiwidiI6MX0",
    "max_width_2000": 1600,
    "max_height_2000": 1067,
    "url_max_2000": "https://live.staticflickr.com/1203/896976178_c6944d9954_h.jpg?s=eyJpIjo4OTY5NzYxNzgsImUiOjE3NjQ3MjIyMzIsInMiOiJjODEyNWQzYjI4ZmFmMTg4NDllNGM5NjU5NGIwNzlkYmRhOWY0MWQ4IiwidiI6MX0",
    "flickr_page": "https://www.flickr.com/photos/54968894@N00/896976178",
    "count_view": "22"
  },
  {
    "id": "896105749",
    "owner": "54968894@N00",
    "title": "IMG_2115",
    "realname": "Sammi Fang",
    "ownername": "sammifang",
    "datetaken": "2006-03-28 13:30:29",
    "max_width": 4368,
    "max_height": 2912,
    "url_max": "https://live.staticflickr.com/1079/896105749_f9dddb9073_o.jpg?s=eyJpIjo4OTYxMDU3NDksImUiOjE3NjQ3MjIyMzIsInMiOiI1ZGRkZjFiNThjOTQ2YzBmZGQ0OWJhMWFlY2ViNjU3NThkMDg1NDU2IiwidiI6MX0",
    "max_width_2000": 1600,
    "max_height_2000": 1067,
    "url_max_2000": "https://live.staticflickr.com/1079/896105749_87b0bf3814_h.jpg?s=eyJpIjo4OTYxMDU3NDksImUiOjE3NjQ3MjIyMzIsInMiOiJjYjJhMWE2MDdkMjc5ZDhlYjY4ODQ0YWY4YjZlZTgyNzllZGE1ODZiIiwidiI6MX0",
    "flickr_page": "https://www.flickr.com/photos/54968894@N00/896105749",
    "count_view": "25"
  },
  {
    "id": "895931333",
    "owner": "54968894@N00",
    "title": "IMG_2069",
    "realname": "Sammi Fang",
    "ownername": "sammifang",
    "datetaken": "2006-03-28 12:40:28",
    "max_width": 2912,
    "max_height": 4368,
    "url_max": "https://live.staticflickr.com/1247/895931333_b32ae100bd_o.jpg?s=eyJpIjo4OTU5MzEzMzMsImUiOjE3NjQ3MjIyMzIsInMiOiI0MGY2ZDk2ZTI5OGE0NTdkMTEyYmMyYWE2NTM1MWNiZDdlODBlZjdjIiwidiI6MX0",
    "max_width_2000": 1365,
    "max_height_2000": 2048,
    "url_max_2000": "https://live.staticflickr.com/1247/895931333_ae3dcc15c0_k.jpg?s=eyJpIjo4OTU5MzEzMzMsImUiOjE3NjQ3MjIyMzIsInMiOiIzNDYxYzk4NGRhMDAxNGYyMWFiYTJhZjUwNDZmMDhiMWEyMDgxYWYxIiwidiI6MX0",
    "flickr_page": "https://www.flickr.com/photos/54968894@N00/895931333",
    "count_view": "24"
  },
  {
    "id": "896691764",
    "owner": "54968894@N00",
    "title": "IMG_2054",
    "realname": "Sammi Fang",
    "ownername": "sammifang",
    "datetaken": "2006-03-28 12:28:48",
    "max_width": 4368,
    "max_height": 2912,
    "url_max": "https://live.staticflickr.com/1249/896691764_001ec056b2_o.jpg?s=eyJpIjo4OTY2OTE3NjQsImUiOjE3NjQ3MjIyMzIsInMiOiIxMWJlZGUxMTU2ZWExNjJkOTNlZjljNTkzOWJjNGUzMzVhYWQwMTM0IiwidiI6MX0",
    "max_width_2000": 1600,
    "max_height_2000": 1067,
    "url_max_2000": "https://live.staticflickr.com/1249/896691764_c23625f623_h.jpg?s=eyJpIjo4OTY2OTE3NjQsImUiOjE3NjQ3MjIyMzIsInMiOiI1MDAxYzY5OTRkYTcxNzZjZGVhYTQ0MjI4YTM1MDFmZDgxNzhiMWI0IiwidiI6MX0",
    "flickr_page": "https://www.flickr.com/photos/54968894@N00/896691764",
    "count_view": "21"
  },
  {
    "id": "895829357",
    "owner": "54968894@N00",
    "title": "IMG_2040",
    "realname": "Sammi Fang",
    "ownername": "sammifang",
    "datetaken": "2006-03-28 11:48:52",
    "max_width": 4368,
    "max_height": 2912,
    "url_max": "https://live.staticflickr.com/1383/895829357_059ae1aa99_o.jpg?s=eyJpIjo4OTU4MjkzNTcsImUiOjE3NjQ3MjIyMzIsInMiOiI3N2EyOTIwZTA2NTZiMzk0Njg3NmM5OGYxMDM3ZDgxMmM1YmUyM2I5IiwidiI6MX0",
    "max_width_2000": 1600,
    "max_height_2000": 1067,
    "url_max_2000": "https://live.staticflickr.com/1383/895829357_af655e3c5e_h.jpg?s=eyJpIjo4OTU4MjkzNTcsImUiOjE3NjQ3MjIyMzIsInMiOiI3ZTI4MDI5N2M4YTlmMTNiN2Q1ZDE4ODE0NDI0YTY0Njk2YTdlMWMxIiwidiI6MX0",
    "flickr_page": "https://www.flickr.com/photos/54968894@N00/895829357",
    "count_view": "21"
  },
  {
    "id": "895766529",
    "owner": "54968894@N00",
    "title": "IMG_2024",
    "realname": "Sammi Fang",
    "ownername": "sammifang",
    "datetaken": "2006-03-28 10:22:32",
    "max_width": 4368,
    "max_height": 2912,
    "url_max": "https://live.staticflickr.com/1064/895766529_39474f2f4d_o.jpg?s=eyJpIjo4OTU3NjY1MjksImUiOjE3NjQ3MjIyMzIsInMiOiJmZmMxYzA3NWI5ZWE4NGE1MDk5OWQ2YjlhZGM1MTEwZDEyNjQzNDkzIiwidiI6MX0",
    "max_width_2000": 1600,
    "max_height_2000": 1067,
    "url_max_2000": "https://live.staticflickr.com/1064/895766529_75a7fc5bb5_h.jpg?s=eyJpIjo4OTU3NjY1MjksImUiOjE3NjQ3MjIyMzIsInMiOiJkZTcyMGIzM2E0ZmIyZTY4N2Y2ZDE5MDAwMThjZTFiODBjNmY4ZmIyIiwidiI6MX0",
    "flickr_page": "https://www.flickr.com/photos/54968894@N00/895766529",
    "count_view": "31"
  },
  {
    "id": "895736812",
    "owner": "54968894@N00",
    "title": "IMG_1955",
    "realname": "Sammi Fang",
    "ownername": "sammifang",
    "datetaken": "2006-03-21 18:44:12",
    "max_width": 4368,
    "max_height": 2912,
    "url_max": "https://live.staticflickr.com/1193/895736812_c6efe24e0b_o.jpg?s=eyJpIjo4OTU3MzY4MTIsImUiOjE3NjQ3MjIyMzIsInMiOiJhY2MzMWJiODI1YzhkZmFlMmExZGVkOThkZGMwYWVlYjkxMzQ3NGY3IiwidiI6MX0",
    "max_width_2000": 1600,
    "max_height_2000": 1067,
    "url_max_2000": "https://live.staticflickr.com/1193/895736812_e2e52ee05c_h.jpg?s=eyJpIjo4OTU3MzY4MTIsImUiOjE3NjQ3MjIyMzIsInMiOiIzYzU3ZjdmZmYwMWM1NWM2MzFlNzUzZWUxNzAyMWZhNThkNDIyNzkyIiwidiI6MX0",
    "flickr_page": "https://www.flickr.com/photos/54968894@N00/895736812",
    "count_view": "32"
  },
  {
    "id": "895727980",
    "owner": "54968894@N00",
    "title": "IMG_1953",
    "realname": "Sammi Fang",
    "ownername": "sammifang",
    "datetaken": "2006-03-21 18:40:15",
    "max_width": 4308,
    "max_height": 2823,
    "url_max": "https://live.staticflickr.com/1082/895727980_2876eb6acc_o.jpg?s=eyJpIjo4OTU3Mjc5ODAsImUiOjE3NjQ3MjIyMzIsInMiOiIzNzZlZDllY2I4ZDVlZWUxM2EyOGQwMjMzOTBmYjljZmE4Mjc5MjE1IiwidiI6MX0",
    "max_width_2000": 1600,
    "max_height_2000": 1048,
    "url_max_2000": "https://live.staticflickr.com/1082/895727980_492ed99450_h.jpg?s=eyJpIjo4OTU3Mjc5ODAsImUiOjE3NjQ3MjIyMzIsInMiOiIwZTQ3YmM4Yzk2ZWU5N2QwMDg4NDExODg5OTNkYzhlODg1OWM1MmYwIiwidiI6MX0",
    "flickr_page": "https://www.flickr.com/photos/54968894@N00/895727980",
    "count_view": "51"
  },
  {
    "id": "894871901",
    "owner": "54968894@N00",
    "title": "IMG_1951",
    "realname": "Sammi Fang",
    "ownername": "sammifang",
    "datetaken": "2006-03-21 18:38:55",
    "max_width": 4368,
    "max_height": 2912,
    "url_max": "https://live.staticflickr.com/1001/894871901_6441f03d9d_o.jpg?s=eyJpIjo4OTQ4NzE5MDEsImUiOjE3NjQ3MjIyMzIsInMiOiI4ODQ3MTY2MjQxMzVhYWU3YzYxMjY1NWFiZTc3OWUwMjkxMTYzNjVmIiwidiI6MX0",
    "max_width_2000": 1600,
    "max_height_2000": 1067,
    "url_max_2000": "https://live.staticflickr.com/1001/894871901_4d459ad292_h.jpg?s=eyJpIjo4OTQ4NzE5MDEsImUiOjE3NjQ3MjIyMzIsInMiOiJlNjU1YjAwZTA4MTg3MDhmMGE5MzcyMmY3MjllMDkyMTM3YjUxYzVmIiwidiI6MX0",
    "flickr_page": "https://www.flickr.com/photos/54968894@N00/894871901",
    "count_view": "24"
  },
  {
    "id": "894718553",
    "owner": "54968894@N00",
    "title": "IMG_1370",
    "realname": "Sammi Fang",
    "ownername": "sammifang",
    "datetaken": "2006-03-05 17:10:36",
    "max_width": 2788,
    "max_height": 4191,
    "url_max": "https://live.staticflickr.com/1220/894718553_99624ae5f3_o.jpg?s=eyJpIjo4OTQ3MTg1NTMsImUiOjE3NjQ3MjIyMzIsInMiOiI1NjZjMzQ1MGMwNjhlNjg0M2ZjY2M5NDMxODc5MWRkNTExMGYzMDc2IiwidiI6MX0",
    "max_width_2000": 1362,
    "max_height_2000": 2048,
    "url_max_2000": "https://live.staticflickr.com/1220/894718553_e6f8834c2e_k.jpg?s=eyJpIjo4OTQ3MTg1NTMsImUiOjE3NjQ3MjIyMzIsInMiOiJiYTNjZTIxMzU5MDliYWE0YTExM2Q3ZjU1YWUzY2NkNzg2ODI0OTVjIiwidiI6MX0",
    "flickr_page": "https://www.flickr.com/photos/54968894@N00/894718553",
    "count_view": "22"
  },
  {
    "id": "894709147",
    "owner": "54968894@N00",
    "title": "IMG_1365",
    "realname": "Sammi Fang",
    "ownername": "sammifang",
    "datetaken": "2006-03-05 17:07:31",
    "max_width": 4180,
    "max_height": 2806,
    "url_max": "https://live.staticflickr.com/1055/894709147_6d01dcda75_o.jpg?s=eyJpIjo4OTQ3MDkxNDcsImUiOjE3NjQ3MjIyMzIsInMiOiI1YWUxZTEyMTcwMjkwNDIxMjI3ZDMxZmQ1MDg1YmFlNjQzMDRjMTViIiwidiI6MX0",
    "max_width_2000": 1600,
    "max_height_2000": 1074,
    "url_max_2000": "https://live.staticflickr.com/1055/894709147_c846c3f5de_h.jpg?s=eyJpIjo4OTQ3MDkxNDcsImUiOjE3NjQ3MjIyMzIsInMiOiI1ODAzYmZjNDJjNTI1M2QzMzljNTBiNDdmMDUyMzQzYmJmZGM5MmY3IiwidiI6MX0",
    "flickr_page": "https://www.flickr.com/photos/54968894@N00/894709147",
    "count_view": "22"
  },
  {
    "id": "894691299",
    "owner": "54968894@N00",
    "title": "IMG_1360",
    "realname": "Sammi Fang",
    "ownername": "sammifang",
    "datetaken": "2006-03-05 17:06:27",
    "max_width": 4269,
    "max_height": 2574,
    "url_max": "https://live.staticflickr.com/1288/894691299_869fc0adfe_o.jpg?s=eyJpIjo4OTQ2OTEyOTksImUiOjE3NjQ3MjIyMzIsInMiOiI5NmNlNTViM2U1MjViMTUzYmZjMWE5M2VhMDEyMzU3ZTNhMDNlNGJlIiwidiI6MX0",
    "max_width_2000": 1600,
    "max_height_2000": 965,
    "url_max_2000": "https://live.staticflickr.com/1288/894691299_cb55bb6876_h.jpg?s=eyJpIjo4OTQ2OTEyOTksImUiOjE3NjQ3MjIyMzIsInMiOiI1NGZiZmJkNmZkMTZjMmVlZjAwZmUzYjM2Zjc0ODVmZTA2NzZjM2JiIiwidiI6MX0",
    "flickr_page": "https://www.flickr.com/photos/54968894@N00/894691299",
    "count_view": "108"
  },
  {
    "id": "894623313",
    "owner": "54968894@N00",
    "title": "IMG_1289",
    "realname": "Sammi Fang",
    "ownername": "sammifang",
    "datetaken": "2006-03-04 13:39:52",
    "max_width": 4368,
    "max_height": 2912,
    "url_max": "https://live.staticflickr.com/1241/894623313_0f8b17289d_o.jpg?s=eyJpIjo4OTQ2MjMzMTMsImUiOjE3NjQ3MjIyMzIsInMiOiJhNmJkMGRkMWUzMjdmNjgzMmQyMzA3MDI3NTgzZGE1MTI1NWZkOTQ4IiwidiI6MX0",
    "max_width_2000": 1600,
    "max_height_2000": 1067,
    "url_max_2000": "https://live.staticflickr.com/1241/894623313_4febf49c43_h.jpg?s=eyJpIjo4OTQ2MjMzMTMsImUiOjE3NjQ3MjIyMzIsInMiOiI2MDkzODc5OTc4NzY3NWE1MWM2M2RmMTc5ODVjZTRjNjZmMzBjZGVmIiwidiI6MX0",
    "flickr_page": "https://www.flickr.com/photos/54968894@N00/894623313",
    "count_view": "15"
  },
  {
    "id": "895433328",
    "owner": "54968894@N00",
    "title": "IMG_1284",
    "realname": "Sammi Fang",
    "ownername": "sammifang",
    "datetaken": "2006-03-04 13:37:44",
    "max_width": 2912,
    "max_height": 4368,
    "url_max": "https://live.staticflickr.com/1194/895433328_16db33de7f_o.jpg?s=eyJpIjo4OTU0MzMzMjgsImUiOjE3NjQ3MjIyMzIsInMiOiJhMDdlYTdmMDM3NDYwNGU0ODMyMmI2YjQ3ODlmNTA3MGFhN2E5NGQxIiwidiI6MX0",
    "max_width_2000": 1365,
    "max_height_2000": 2048,
    "url_max_2000": "https://live.staticflickr.com/1194/895433328_9eca3cce87_k.jpg?s=eyJpIjo4OTU0MzMzMjgsImUiOjE3NjQ3MjIyMzIsInMiOiI0YTAzMDNmZTY1NTdmZGEyMWY4ZDQwNjY4NWI1OWY4NjExNmI4MjFkIiwidiI6MX0",
    "flickr_page": "https://www.flickr.com/photos/54968894@N00/895433328",
    "count_view": "20"
  },
  {
    "id": "894523845",
    "owner": "54968894@N00",
    "title": "IMG_1269",
    "realname": "Sammi Fang",
    "ownername": "sammifang",
    "datetaken": "2006-03-04 11:25:02",
    "max_width": 4368,
    "max_height": 2912,
    "url_max": "https://live.staticflickr.com/1119/894523845_b274170da7_o.jpg?s=eyJpIjo4OTQ1MjM4NDUsImUiOjE3NjQ3MjIyMzIsInMiOiJhYjAzZjJkOGFmNWYzYTUyNGQ2MzFkYzM1NTFhOTc0MWNlOTQ2OWFlIiwidiI6MX0",
    "max_width_2000": 1600,
    "max_height_2000": 1067,
    "url_max_2000": "https://live.staticflickr.com/1119/894523845_29798dc8ae_h.jpg?s=eyJpIjo4OTQ1MjM4NDUsImUiOjE3NjQ3MjIyMzIsInMiOiJlMTI0MTQwNTQ3NGUyMTBmZjgzNDE3N2M4ZDBiZGY0MmEwMmFmOWRjIiwidiI6MX0",
    "flickr_page": "https://www.flickr.com/photos/54968894@N00/894523845",
    "count_view": "22"
  },
  {
    "id": "894491209",
    "owner": "54968894@N00",
    "title": "IMG_1262",
    "realname": "Sammi Fang",
    "ownername": "sammifang",
    "datetaken": "2006-03-04 11:13:57",
    "max_width": 4368,
    "max_height": 2912,
    "url_max": "https://live.staticflickr.com/1433/894491209_7f2ee1ea5a_o.jpg?s=eyJpIjo4OTQ0OTEyMDksImUiOjE3NjQ3MjIyMzIsInMiOiIwMDhkMWI5YzZkNTY5ODA5ZDE3YjU0Njg1NDI3MWJhNDU3OWIyYzA0IiwidiI6MX0",
    "max_width_2000": 1600,
    "max_height_2000": 1067,
    "url_max_2000": "https://live.staticflickr.com/1433/894491209_07279e7e12_h.jpg?s=eyJpIjo4OTQ0OTEyMDksImUiOjE3NjQ3MjIyMzIsInMiOiIxYjYzOThjYjU5NzIxOWI2Y2M0ZDQ5YmI2Y2MyMDYyMzAzNDMxYWYwIiwidiI6MX0",
    "flickr_page": "https://www.flickr.com/photos/54968894@N00/894491209",
    "count_view": "18"
  },
  {
    "id": "895312248",
    "owner": "54968894@N00",
    "title": "IMG_1256",
    "realname": "Sammi Fang",
    "ownername": "sammifang",
    "datetaken": "2006-03-03 18:16:46",
    "max_width": 4368,
    "max_height": 2912,
    "url_max": "https://live.staticflickr.com/1230/895312248_301e6da513_o.jpg?s=eyJpIjo4OTUzMTIyNDgsImUiOjE3NjQ3MjIyMzIsInMiOiIzZjJiMDMyMzU2N2U5YjZlYjA3ZTY5ZjczZjYxY2QwNzU2OTFlYmFkIiwidiI6MX0",
    "max_width_2000": 1600,
    "max_height_2000": 1067,
    "url_max_2000": "https://live.staticflickr.com/1230/895312248_ccc3965758_h.jpg?s=eyJpIjo4OTUzMTIyNDgsImUiOjE3NjQ3MjIyMzIsInMiOiIwNjBlZDA3NmYyYmY5NWQyNDcwN2RkODFkMDI2MzAyNDY0MWJhNjY2IiwidiI6MX0",
    "flickr_page": "https://www.flickr.com/photos/54968894@N00/895312248",
    "count_view": "101"
  },
  {
    "id": "894368335",
    "owner": "54968894@N00",
    "title": "IMG_1157",
    "realname": "Sammi Fang",
    "ownername": "sammifang",
    "datetaken": "2006-02-25 17:10:11",
    "max_width": 4368,
    "max_height": 2912,
    "url_max": "https://live.staticflickr.com/1399/894368335_c9ba773d2b_o.jpg?s=eyJpIjo4OTQzNjgzMzUsImUiOjE3NjQ3MjIyMzIsInMiOiI2MTc3MjdkYjJiMDU2Y2VhYjMxYjUwOTNmZDBkM2UzNGRlMDU0ZjEyIiwidiI6MX0",
    "max_width_2000": 1600,
    "max_height_2000": 1067,
    "url_max_2000": "https://live.staticflickr.com/1399/894368335_329652c2d4_h.jpg?s=eyJpIjo4OTQzNjgzMzUsImUiOjE3NjQ3MjIyMzIsInMiOiIyOTZhNDQzMTJkZDRlNjA3MDdjMWQzODdiMjdhMzkxODI5Y2RkODY2IiwidiI6MX0",
    "flickr_page": "https://www.flickr.com/photos/54968894@N00/894368335",
    "count_view": "21"
  },
  {
    "id": "895200856",
    "owner": "54968894@N00",
    "title": "IMG_1155",
    "realname": "Sammi Fang",
    "ownername": "sammifang",
    "datetaken": "2006-02-25 17:09:55",
    "max_width": 2912,
    "max_height": 4368,
    "url_max": "https://live.staticflickr.com/1320/895200856_98702ac6c1_o.jpg?s=eyJpIjo4OTUyMDA4NTYsImUiOjE3NjQ3MjIyMzIsInMiOiJmN2M1OTRiMzNkZjU1ZmZhYTg2NmVmNzdhY2M4NzE0ZTg1ZTVlNzgwIiwidiI6MX0",
    "max_width_2000": 1365,
    "max_height_2000": 2048,
    "url_max_2000": "https://live.staticflickr.com/1320/895200856_f2f098d38b_k.jpg?s=eyJpIjo4OTUyMDA4NTYsImUiOjE3NjQ3MjIyMzIsInMiOiIwZTQ1N2NlZmRmMGUwZDg2ZTMzYjU1ZGU0YjU2NmE0OWU5N2I5ZWI4IiwidiI6MX0",
    "flickr_page": "https://www.flickr.com/photos/54968894@N00/895200856",
    "count_view": "43"
  },
  {
    "id": "894202023",
    "owner": "54968894@N00",
    "title": "IMG_1112",
    "realname": "Sammi Fang",
    "ownername": "sammifang",
    "datetaken": "2006-02-25 16:23:31",
    "max_width": 4368,
    "max_height": 2912,
    "url_max": "https://live.staticflickr.com/1157/894202023_01f55b2f34_o.jpg?s=eyJpIjo4OTQyMDIwMjMsImUiOjE3NjQ3MjIyMzIsInMiOiJkZWQ3OWM1MTNjMTU0YTBkZjdiYWVkZWMzODA3ZTVkM2JhMWYyY2Y5IiwidiI6MX0",
    "max_width_2000": 1600,
    "max_height_2000": 1067,
    "url_max_2000": "https://live.staticflickr.com/1157/894202023_c4e967e46c_h.jpg?s=eyJpIjo4OTQyMDIwMjMsImUiOjE3NjQ3MjIyMzIsInMiOiI1M2RlOWZmYWM1OGY2ZWZkMTgwMzZiNGY5NTBiZmIxZjRhOTM0YjdjIiwidiI6MX0",
    "flickr_page": "https://www.flickr.com/photos/54968894@N00/894202023",
    "count_view": "20"
  },
  {
    "id": "891264590",
    "owner": "54968894@N00",
    "title": "01/02/2006 17:15",
    "realname": "Sammi Fang",
    "ownername": "sammifang",
    "datetaken": "2006-02-01 17:15:27",
    "max_width": 4368,
    "max_height": 2912,
    "url_max": "https://live.staticflickr.com/1001/891264590_db1d8013be_o.jpg?s=eyJpIjo4OTEyNjQ1OTAsImUiOjE3NjQ3MjIyMzQsInMiOiIzMTA5NmEwM2JmMDhiODJkYTU4YmU0ZDcwNjRiZjQ2MzZiMzJjM2Y2IiwidiI6MX0",
    "max_width_2000": 1600,
    "max_height_2000": 1067,
    "url_max_2000": "https://live.staticflickr.com/1001/891264590_24cc66fbe1_h.jpg?s=eyJpIjo4OTEyNjQ1OTAsImUiOjE3NjQ3MjIyMzQsInMiOiIwYjY1NTU5MGYzMTY3OGU4ZTQxYzhlZjIyMGNhNDIwMjUxNGY5ZDE5IiwidiI6MX0",
    "flickr_page": "https://www.flickr.com/photos/54968894@N00/891264590",
    "count_view": "72"
  },
  {
    "id": "890403791",
    "owner": "54968894@N00",
    "title": "01/02/2006 17:15",
    "realname": "Sammi Fang",
    "ownername": "sammifang",
    "datetaken": "2006-02-01 17:15:00",
    "max_width": 4368,
    "max_height": 2912,
    "url_max": "https://live.staticflickr.com/1431/890403791_be878e6179_o.jpg?s=eyJpIjo4OTA0MDM3OTEsImUiOjE3NjQ3MjIyMzQsInMiOiI1N2EwYjkwM2YxOWZmMjc1OGMxNzc0ZTgyNThjM2MxZjFkYjZiY2ExIiwidiI6MX0",
    "max_width_2000": 1600,
    "max_height_2000": 1067,
    "url_max_2000": "https://live.staticflickr.com/1431/890403791_240c2eac42_h.jpg?s=eyJpIjo4OTA0MDM3OTEsImUiOjE3NjQ3MjIyMzQsInMiOiI2ZTQyY2JlMTdhODA0YjMyOGU4MjFhNzA4Y2E0ZGE2OTBlN2I2MTRiIiwidiI6MX0",
    "flickr_page": "https://www.flickr.com/photos/54968894@N00/890403791",
    "count_view": "65"
  },
  {
    "id": "890374627",
    "owner": "54968894@N00",
    "title": "01/02/2006 17:13",
    "realname": "Sammi Fang",
    "ownername": "sammifang",
    "datetaken": "2006-02-01 17:13:12",
    "max_width": 4368,
    "max_height": 2912,
    "url_max": "https://live.staticflickr.com/1349/890374627_020fc55039_o.jpg?s=eyJpIjo4OTAzNzQ2MjcsImUiOjE3NjQ3MjIyMzQsInMiOiI2MDFmNWZmYzU3YTBiMzUwZTM5NzJkMTVlMjJkOTUzMDBjYzQ3NDc4IiwidiI6MX0",
    "max_width_2000": 1600,
    "max_height_2000": 1067,
    "url_max_2000": "https://live.staticflickr.com/1349/890374627_921ed777f5_h.jpg?s=eyJpIjo4OTAzNzQ2MjcsImUiOjE3NjQ3MjIyMzQsInMiOiI3MGQ5MGMwMTZiMjk1Y2M0MzM5ZjgwNjkxN2NkNzdlMGNlYzM3YmVhIiwidiI6MX0",
    "flickr_page": "https://www.flickr.com/photos/54968894@N00/890374627",
    "count_view": "52"
  },
  {
    "id": "890325997",
    "owner": "54968894@N00",
    "title": "01/02/2006 17:09",
    "realname": "Sammi Fang",
    "ownername": "sammifang",
    "datetaken": "2006-02-01 17:09:28",
    "max_width": 2912,
    "max_height": 4368,
    "url_max": "https://live.staticflickr.com/1092/890325997_3a06fec012_o.jpg?s=eyJpIjo4OTAzMjU5OTcsImUiOjE3NjQ3MjIyMzQsInMiOiI4NTRjYWY0NDVmZGU2NmZmZTAyMjM5YjBiYWQ5ODdmYjc4NTI1ZjUxIiwidiI6MX0",
    "max_width_2000": 1365,
    "max_height_2000": 2048,
    "url_max_2000": "https://live.staticflickr.com/1092/890325997_7f5d9aab48_k.jpg?s=eyJpIjo4OTAzMjU5OTcsImUiOjE3NjQ3MjIyMzQsInMiOiI4ZDdkYjMzNTg0ZGRjY2ExOWE4MjZkNjE4ODZkYjM1ZGM4YjE1ZTEzIiwidiI6MX0",
    "flickr_page": "https://www.flickr.com/photos/54968894@N00/890325997",
    "count_view": "61"
  },
  {
    "id": "890316801",
    "owner": "54968894@N00",
    "title": "01/02/2006 17:02",
    "realname": "Sammi Fang",
    "ownername": "sammifang",
    "datetaken": "2006-02-01 17:02:38",
    "max_width": 4368,
    "max_height": 2912,
    "url_max": "https://live.staticflickr.com/1137/890316801_3001616581_o.jpg?s=eyJpIjo4OTAzMTY4MDEsImUiOjE3NjQ3MjIyMzQsInMiOiJiNDcwNjNjNTlkYjYyNDZmNjMzZmFiZDFkNjE3NGZmYzMzYTVmN2M2IiwidiI6MX0",
    "max_width_2000": 1600,
    "max_height_2000": 1067,
    "url_max_2000": "https://live.staticflickr.com/1137/890316801_58d9a5bde4_h.jpg?s=eyJpIjo4OTAzMTY4MDEsImUiOjE3NjQ3MjIyMzQsInMiOiI3OGJiNDhiZTRiNDJiNGQwZTgzMzBkNDkyNTkxZjc1NGFkNWI3YzY3IiwidiI6MX0",
    "flickr_page": "https://www.flickr.com/photos/54968894@N00/890316801",
    "count_view": "107"
  },
  {
    "id": "890917840",
    "owner": "54968894@N00",
    "title": "01/02/2006 15:46",
    "realname": "Sammi Fang",
    "ownername": "sammifang",
    "datetaken": "2006-02-01 15:46:51",
    "max_width": 4368,
    "max_height": 2912,
    "url_max": "https://live.staticflickr.com/1222/890917840_7224e018ec_o.jpg?s=eyJpIjo4OTA5MTc4NDAsImUiOjE3NjQ3MjIyMzQsInMiOiI4NjU1MmYxZmNkYjM4YjgzMGUwZDhhOWFjNTY3OTdiZWE4MzI4MzE2IiwidiI6MX0",
    "max_width_2000": 1600,
    "max_height_2000": 1067,
    "url_max_2000": "https://live.staticflickr.com/1222/890917840_a2d5d56ed2_h.jpg?s=eyJpIjo4OTA5MTc4NDAsImUiOjE3NjQ3MjIyMzQsInMiOiI0N2FmZTFhM2QxNGM1MDE0NzU5MTU5NWM0YTcyMmYxOGYxOThmZWMwIiwidiI6MX0",
    "flickr_page": "https://www.flickr.com/photos/54968894@N00/890917840",
    "count_view": "43"
  },
  {
    "id": "890872450",
    "owner": "54968894@N00",
    "title": "30/01/2006 17:01",
    "realname": "Sammi Fang",
    "ownername": "sammifang",
    "datetaken": "2006-01-30 17:01:06",
    "max_width": 4368,
    "max_height": 2912,
    "url_max": "https://live.staticflickr.com/1010/890872450_f226f7d8bd_o.jpg?s=eyJpIjo4OTA4NzI0NTAsImUiOjE3NjQ3MjIyMzQsInMiOiJjNzY0ZjQzMWM3ZTdmZjQzZjM3NjA5OGI4ZDVjMTNhZmNkMDdjNDQwIiwidiI6MX0",
    "max_width_2000": 1600,
    "max_height_2000": 1067,
    "url_max_2000": "https://live.staticflickr.com/1010/890872450_8e5c580c65_h.jpg?s=eyJpIjo4OTA4NzI0NTAsImUiOjE3NjQ3MjIyMzQsInMiOiI1M2U5YjE3M2VmMThlZDQ0MmYyMmJlNmY5ODU3OGYyOGFlNjJiZWNkIiwidiI6MX0",
    "flickr_page": "https://www.flickr.com/photos/54968894@N00/890872450",
    "count_view": "48"
  },
  {
    "id": "890805998",
    "owner": "54968894@N00",
    "title": "30/01/2006 16:57",
    "realname": "Sammi Fang",
    "ownername": "sammifang",
    "datetaken": "2006-01-30 16:57:55",
    "max_width": 4368,
    "max_height": 2912,
    "url_max": "https://live.staticflickr.com/1028/890805998_bc11fdc8f5_o.jpg?s=eyJpIjo4OTA4MDU5OTgsImUiOjE3NjQ3MjIyMzQsInMiOiIwMzMzYjY1ODc4MDQxOGEwMDBlM2M1MTQzYTI5YmRhZTgwNWE5YTZjIiwidiI6MX0",
    "max_width_2000": 1600,
    "max_height_2000": 1067,
    "url_max_2000": "https://live.staticflickr.com/1028/890805998_172a3a96a8_h.jpg?s=eyJpIjo4OTA4MDU5OTgsImUiOjE3NjQ3MjIyMzQsInMiOiIxYjhiNmNjMTE1NjFjYjdhNzU5MjNmMmI0MGNiNzcyNjM5NTc0MzhiIiwidiI6MX0",
    "flickr_page": "https://www.flickr.com/photos/54968894@N00/890805998",
    "count_view": "41"
  },
  {
    "id": "890788894",
    "owner": "54968894@N00",
    "title": "30/01/2006 16:57",
    "realname": "Sammi Fang",
    "ownername": "sammifang",
    "datetaken": "2006-01-30 16:57:43",
    "max_width": 4287,
    "max_height": 2792,
    "url_max": "https://live.staticflickr.com/1259/890788894_767ac27e79_o.jpg?s=eyJpIjo4OTA3ODg4OTQsImUiOjE3NjQ3MjIyMzQsInMiOiI2ODI2NDM4N2EyNDdmZDYxNjhkMGZkZmZkOGFhYjFmNDI2N2YxN2EwIiwidiI6MX0",
    "max_width_2000": 1600,
    "max_height_2000": 1042,
    "url_max_2000": "https://live.staticflickr.com/1259/890788894_595c9c4cb2_h.jpg?s=eyJpIjo4OTA3ODg4OTQsImUiOjE3NjQ3MjIyMzQsInMiOiI5ZDQ4OGJlOWQ1YjZlZDU4YjM0NTU3ZDk5ZGE2NzRmMGM4YzUyYzBiIiwidiI6MX0",
    "flickr_page": "https://www.flickr.com/photos/54968894@N00/890788894",
    "count_view": "46"
  },
  {
    "id": "890689842",
    "owner": "54968894@N00",
    "title": "30/01/2006 16:53",
    "realname": "Sammi Fang",
    "ownername": "sammifang",
    "datetaken": "2006-01-30 16:53:02",
    "max_width": 4368,
    "max_height": 2912,
    "url_max": "https://live.staticflickr.com/1063/890689842_dee16fb51d_o.jpg?s=eyJpIjo4OTA2ODk4NDIsImUiOjE3NjQ3MjIyMzQsInMiOiI3MWUzZGVjMmQ4ZGRiNzM3Mzc1OWRmMmE5NTU0ZDQ0MWM4ZjRjNWUyIiwidiI6MX0",
    "max_width_2000": 1600,
    "max_height_2000": 1067,
    "url_max_2000": "https://live.staticflickr.com/1063/890689842_3c36ded9c9_h.jpg?s=eyJpIjo4OTA2ODk4NDIsImUiOjE3NjQ3MjIyMzQsInMiOiJlOWI5Yjc4ODgzMzRjODEzYTBhZGE2M2U5YjE3MTExMGI3YzIwZDM1IiwidiI6MX0",
    "flickr_page": "https://www.flickr.com/photos/54968894@N00/890689842",
    "count_view": "46"
  },
  {
    "id": "889836335",
    "owner": "54968894@N00",
    "title": "30/01/2006 16:52",
    "realname": "Sammi Fang",
    "ownername": "sammifang",
    "datetaken": "2006-01-30 16:52:20",
    "max_width": 4368,
    "max_height": 2912,
    "url_max": "https://live.staticflickr.com/1395/889836335_ae02266f29_o.jpg?s=eyJpIjo4ODk4MzYzMzUsImUiOjE3NjQ3MjIyMzQsInMiOiI3NzM1OTYwYmFmOGFlZGVkNjY1YmQwYWVmNzZhODJmMDRiZGI2YWE1IiwidiI6MX0",
    "max_width_2000": 1600,
    "max_height_2000": 1067,
    "url_max_2000": "https://live.staticflickr.com/1395/889836335_49e3d56131_h.jpg?s=eyJpIjo4ODk4MzYzMzUsImUiOjE3NjQ3MjIyMzQsInMiOiI1OTgwMWM2ODMxMTJkMTA4ODg3ZDQwNjhhMDVjOTA3MmNmODc0MDZmIiwidiI6MX0",
    "flickr_page": "https://www.flickr.com/photos/54968894@N00/889836335",
    "count_view": "49"
  },
  {
    "id": "890567142",
    "owner": "54968894@N00",
    "title": "28/01/2006 20:58",
    "realname": "Sammi Fang",
    "ownername": "sammifang",
    "datetaken": "2006-01-28 20:58:21",
    "max_width": 4368,
    "max_height": 2912,
    "url_max": "https://live.staticflickr.com/1332/890567142_caf0aad8c3_o.jpg?s=eyJpIjo4OTA1NjcxNDIsImUiOjE3NjQ3MjIyMzQsInMiOiI4MmRiOGYzNGQyYTUxZDI5ZWZiMTZlOTBhMDk4MzBlMzM0NjdhNGQ0IiwidiI6MX0",
    "max_width_2000": 1600,
    "max_height_2000": 1067,
    "url_max_2000": "https://live.staticflickr.com/1332/890567142_3ac0adf910_h.jpg?s=eyJpIjo4OTA1NjcxNDIsImUiOjE3NjQ3MjIyMzQsInMiOiI5OWI2MzIwOTZkYWIwMDVmMTExYTQwMDg4Yzk4NGZhOTdjNzZlM2Q1IiwidiI6MX0",
    "flickr_page": "https://www.flickr.com/photos/54968894@N00/890567142",
    "count_view": "24"
  },
  {
    "id": "890551056",
    "owner": "54968894@N00",
    "title": "28/01/2006 20:57",
    "realname": "Sammi Fang",
    "ownername": "sammifang",
    "datetaken": "2006-01-28 20:57:23",
    "max_width": 4368,
    "max_height": 2912,
    "url_max": "https://live.staticflickr.com/1185/890551056_646451bd17_o.jpg?s=eyJpIjo4OTA1NTEwNTYsImUiOjE3NjQ3MjIyMzQsInMiOiJmZWQ4ZmQ4ZjI1ZDUwZmE0YWU4NTM1MmMwMjZiYjVlZWI5NDNkNGExIiwidiI6MX0",
    "max_width_2000": 1600,
    "max_height_2000": 1067,
    "url_max_2000": "https://live.staticflickr.com/1185/890551056_738976034e_h.jpg?s=eyJpIjo4OTA1NTEwNTYsImUiOjE3NjQ3MjIyMzQsInMiOiJlOTk5MWM5ZjcxNGRiYTJhZDQ4NmI5YTZjMTEzOWRiMTM5N2I4ZjA5IiwidiI6MX0",
    "flickr_page": "https://www.flickr.com/photos/54968894@N00/890551056",
    "count_view": "22"
  },
  {
    "id": "890534438",
    "owner": "54968894@N00",
    "title": "28/01/2006 20:56",
    "realname": "Sammi Fang",
    "ownername": "sammifang",
    "datetaken": "2006-01-28 20:56:10",
    "max_width": 2912,
    "max_height": 4368,
    "url_max": "https://live.staticflickr.com/1332/890534438_f0f9bed007_o.jpg?s=eyJpIjo4OTA1MzQ0MzgsImUiOjE3NjQ3MjIyMzQsInMiOiI4OTJjMmVlMDdiZTA2ZmZjZDg0YmVmZWE4ZjExYjhlNTkxMmQyYjFhIiwidiI6MX0",
    "max_width_2000": 1365,
    "max_height_2000": 2048,
    "url_max_2000": "https://live.staticflickr.com/1332/890534438_183ce20027_k.jpg?s=eyJpIjo4OTA1MzQ0MzgsImUiOjE3NjQ3MjIyMzQsInMiOiJkYmNjNTBiYTVmYmIxMjk0YmMyOWM0ZjNkY2Q3N2RmNTM5YTBjNDViIiwidiI6MX0",
    "flickr_page": "https://www.flickr.com/photos/54968894@N00/890534438",
    "count_view": "40"
  },
  {
    "id": "889286763",
    "owner": "54968894@N00",
    "title": "26/01/2006 16:07",
    "realname": "Sammi Fang",
    "ownername": "sammifang",
    "datetaken": "2006-01-26 16:07:52",
    "max_width": 2776,
    "max_height": 4121,
    "url_max": "https://live.staticflickr.com/1120/889286763_008bf53dd2_o.jpg?s=eyJpIjo4ODkyODY3NjMsImUiOjE3NjQ3MjIyMzQsInMiOiI5OGRjOTI3OWVjNGNlYWU2NzdhN2MyZmE0YjJhY2I1NzVlMGMxMmY4IiwidiI6MX0",
    "max_width_2000": 1380,
    "max_height_2000": 2048,
    "url_max_2000": "https://live.staticflickr.com/1120/889286763_0cd02e1218_k.jpg?s=eyJpIjo4ODkyODY3NjMsImUiOjE3NjQ3MjIyMzQsInMiOiIxN2U0MzlhNWU2ZTMxMDkwY2JiZmIyOTA1ZjMxY2QyNmFiYTRlNTRmIiwidiI6MX0",
    "flickr_page": "https://www.flickr.com/photos/54968894@N00/889286763",
    "count_view": "41"
  },
  {
    "id": "888130187",
    "owner": "54968894@N00",
    "title": "20/01/2006 16:41",
    "realname": "Sammi Fang",
    "ownername": "sammifang",
    "datetaken": "2006-01-20 16:41:16",
    "max_width": 4000,
    "max_height": 2666,
    "url_max": "https://live.staticflickr.com/1265/888130187_74abae5ac7_4k.jpg?s=eyJpIjo4ODgxMzAxODcsImUiOjE3NjQ3MjIyMzQsInMiOiIxZWRiZjViMDk2YmMzMGM2ZjhjZjM2ZTI0YTUyN2I5MWNjZTM0Yjc0IiwidiI6MX0",
    "max_width_2000": 1600,
    "max_height_2000": 1066,
    "url_max_2000": "https://live.staticflickr.com/1265/888130187_7e11491030_h.jpg?s=eyJpIjo4ODgxMzAxODcsImUiOjE3NjQ3MjIyMzQsInMiOiI1ZWNiODRmZmM1YmNjYTVkMDM0OGE3YzMxNDFiYjk0YzgxYWRkYzg0IiwidiI6MX0",
    "flickr_page": "https://www.flickr.com/photos/54968894@N00/888130187",
    "count_view": "17"
  },
  {
    "id": "888932380",
    "owner": "54968894@N00",
    "title": "20/01/2006 16:33",
    "realname": "Sammi Fang",
    "ownername": "sammifang",
    "datetaken": "2006-01-20 16:33:28",
    "max_width": 4000,
    "max_height": 2666,
    "url_max": "https://live.staticflickr.com/1101/888932380_11cd161c0f_4k.jpg?s=eyJpIjo4ODg5MzIzODAsImUiOjE3NjQ3MjIyMzQsInMiOiIyNTkzNDEzYTUyYmRmNTQ5OGM3NGVlOWY2ZTBlNThiYjc4YTMyNmExIiwidiI6MX0",
    "max_width_2000": 1600,
    "max_height_2000": 1066,
    "url_max_2000": "https://live.staticflickr.com/1101/888932380_636179311b_h.jpg?s=eyJpIjo4ODg5MzIzODAsImUiOjE3NjQ3MjIyMzQsInMiOiI3MDk1ZTZiM2MzMTA3YmY2ZDVhNTY2NjkxZjljZGQ4ZmU1YmJhMGM1IiwidiI6MX0",
    "flickr_page": "https://www.flickr.com/photos/54968894@N00/888932380",
    "count_view": "251"
  },
  {
    "id": "885969008",
    "owner": "54968894@N00",
    "title": "20/01/2006 17:29",
    "realname": "Sammi Fang",
    "ownername": "sammifang",
    "datetaken": "2006-01-20 17:29:36",
    "max_width": 4000,
    "max_height": 2666,
    "url_max": "https://live.staticflickr.com/1155/885969008_a49c683823_4k.jpg?s=eyJpIjo4ODU5NjkwMDgsImUiOjE3NjQ3MjIyMzQsInMiOiI1MDg0ZGIxOWNlMmZlYjM5NTA2NWE4NjZkMDUzZTgwODViMWRmYjFmIiwidiI6MX0",
    "max_width_2000": 1600,
    "max_height_2000": 1066,
    "url_max_2000": "https://live.staticflickr.com/1155/885969008_fb4d8b9c63_h.jpg?s=eyJpIjo4ODU5NjkwMDgsImUiOjE3NjQ3MjIyMzQsInMiOiI5YTlkYjAzMDM0Yzg4Y2I0ODI2Yzk2MmEyNzU5ZDM2YzEwOTIyOTljIiwidiI6MX0",
    "flickr_page": "https://www.flickr.com/photos/54968894@N00/885969008",
    "count_view": "44"
  },
  {
    "id": "885058583",
    "owner": "54968894@N00",
    "title": "20/01/2006 17:03",
    "realname": "Sammi Fang",
    "ownername": "sammifang",
    "datetaken": "2006-01-20 17:03:06",
    "max_width": 4000,
    "max_height": 1718,
    "url_max": "https://live.staticflickr.com/1053/885058583_cc3f155aa7_4k.jpg?s=eyJpIjo4ODUwNTg1ODMsImUiOjE3NjQ3MjIyMzQsInMiOiI2N2EwY2NlY2RlNTcyMTc5YTg5NjYzZjMyYmUzNmQ2Y2UxNDVhN2JiIiwidiI6MX0",
    "max_width_2000": 1600,
    "max_height_2000": 687,
    "url_max_2000": "https://live.staticflickr.com/1053/885058583_1e14748f63_h.jpg?s=eyJpIjo4ODUwNTg1ODMsImUiOjE3NjQ3MjIyMzQsInMiOiIyZWViMzkwODY3OTNkMGI5MTcwOTU4NTRiZWQyOWU0NzFhNThhYWVjIiwidiI6MX0",
    "flickr_page": "https://www.flickr.com/photos/54968894@N00/885058583",
    "count_view": "283"
  },
  {
    "id": "885051968",
    "owner": "54968894@N00",
    "title": "16/01/2006 20:41",
    "realname": "Sammi Fang",
    "ownername": "sammifang",
    "datetaken": "2006-01-16 20:41:38",
    "max_width": 4000,
    "max_height": 2666,
    "url_max": "https://live.staticflickr.com/1280/885051968_03b3152ede_4k.jpg?s=eyJpIjo4ODUwNTE5NjgsImUiOjE3NjQ3MjIyMzUsInMiOiI2M2YyMzZlY2Y1NWIzMmM2ZDg3YWI1NmJkMzEzNTBjYTRiZGVmN2UyIiwidiI6MX0",
    "max_width_2000": 1600,
    "max_height_2000": 1066,
    "url_max_2000": "https://live.staticflickr.com/1280/885051968_9f4446acb9_h.jpg?s=eyJpIjo4ODUwNTE5NjgsImUiOjE3NjQ3MjIyMzUsInMiOiJjOTAzZDVlMTBhOTQ3MTY0NDFhYmY1OTIzNjkxZjQwY2UyOWM3MGE0IiwidiI6MX0",
    "flickr_page": "https://www.flickr.com/photos/54968894@N00/885051968",
    "count_view": "24"
  },
  {
    "id": "885010392",
    "owner": "54968894@N00",
    "title": "16/01/2006 21:31",
    "realname": "Sammi Fang",
    "ownername": "sammifang",
    "datetaken": "2006-01-16 21:31:18",
    "max_width": 4368,
    "max_height": 2912,
    "url_max": "https://live.staticflickr.com/1291/885010392_c0e4441a2f_o.jpg?s=eyJpIjo4ODUwMTAzOTIsImUiOjE3NjQ3MjIyMzYsInMiOiJiZmVlN2U5MjZkMzVhNDNlMmI0MzM5YzY2MThiN2I2MWZjYmVhOWQ2IiwidiI6MX0",
    "max_width_2000": 1600,
    "max_height_2000": 1067,
    "url_max_2000": "https://live.staticflickr.com/1291/885010392_4c9d764505_h.jpg?s=eyJpIjo4ODUwMTAzOTIsImUiOjE3NjQ3MjIyMzYsInMiOiIzYmJiYWNkYTE4NzcyYjE3ZmE0N2FkYzRhOGQ3MDE1MzFhMDNmYWQyIiwidiI6MX0",
    "flickr_page": "https://www.flickr.com/photos/54968894@N00/885010392",
    "count_view": "57"
  },
  {
    "id": "884146543",
    "owner": "54968894@N00",
    "title": "16/01/2006 21:31",
    "realname": "Sammi Fang",
    "ownername": "sammifang",
    "datetaken": "2006-01-16 21:31:06",
    "max_width": 4368,
    "max_height": 2912,
    "url_max": "https://live.staticflickr.com/1291/884146543_26bc1edfde_o.jpg?s=eyJpIjo4ODQxNDY1NDMsImUiOjE3NjQ3MjIyMzYsInMiOiIzYzY0MjJiZTI2YTdlYjExN2YzNGFkYjA3M2U5Y2IzMTdlZjNhMTIwIiwidiI6MX0",
    "max_width_2000": 1600,
    "max_height_2000": 1067,
    "url_max_2000": "https://live.staticflickr.com/1291/884146543_b2bef50ba2_h.jpg?s=eyJpIjo4ODQxNDY1NDMsImUiOjE3NjQ3MjIyMzYsInMiOiJkZDkzMjYyNGMyZjQxYmE2NTc4ZDg3ZjQ4NGNjZmYzNGMzNGZlZmU0IiwidiI6MX0",
    "flickr_page": "https://www.flickr.com/photos/54968894@N00/884146543",
    "count_view": "22"
  },
  {
    "id": "884129177",
    "owner": "54968894@N00",
    "title": "16/01/2006 21:30",
    "realname": "Sammi Fang",
    "ownername": "sammifang",
    "datetaken": "2006-01-16 21:30:13",
    "max_width": 4368,
    "max_height": 2912,
    "url_max": "https://live.staticflickr.com/1239/884129177_69beba826b_o.jpg?s=eyJpIjo4ODQxMjkxNzcsImUiOjE3NjQ3MjIyMzYsInMiOiJhYWM2NGRhNWEyZTdjOTkxYzE3NWEyMTZiMjNjYWM3ZDFlM2E1YTcxIiwidiI6MX0",
    "max_width_2000": 1600,
    "max_height_2000": 1067,
    "url_max_2000": "https://live.staticflickr.com/1239/884129177_dee2bf833a_h.jpg?s=eyJpIjo4ODQxMjkxNzcsImUiOjE3NjQ3MjIyMzYsInMiOiJlYzVlMjdmM2MwODJlMDQ4NTczOTcxNDI2NjgzMTAyZmYyYjAwMDhkIiwidiI6MX0",
    "flickr_page": "https://www.flickr.com/photos/54968894@N00/884129177",
    "count_view": "19"
  },
  {
    "id": "884096019",
    "owner": "54968894@N00",
    "title": "16/01/2006 21:29",
    "realname": "Sammi Fang",
    "ownername": "sammifang",
    "datetaken": "2006-01-16 21:29:25",
    "max_width": 4368,
    "max_height": 2912,
    "url_max": "https://live.staticflickr.com/1425/884096019_4335976a55_o.jpg?s=eyJpIjo4ODQwOTYwMTksImUiOjE3NjQ3MjIyMzYsInMiOiI2MTA0NmRkNzA1NDczMWUzYzJjMDAyMDA4Yzg5OTFlYjJhZjBmZTMwIiwidiI6MX0",
    "max_width_2000": 1600,
    "max_height_2000": 1067,
    "url_max_2000": "https://live.staticflickr.com/1425/884096019_cc01112556_h.jpg?s=eyJpIjo4ODQwOTYwMTksImUiOjE3NjQ3MjIyMzYsInMiOiJhZDc4N2EwYzc1YTI4NjJlNzYxYzM1NTVlZmIzNGQ5MTIyNTVmODg4IiwidiI6MX0",
    "flickr_page": "https://www.flickr.com/photos/54968894@N00/884096019",
    "count_view": "21"
  },
  {
    "id": "884929124",
    "owner": "54968894@N00",
    "title": "16/01/2006 21:01",
    "realname": "Sammi Fang",
    "ownername": "sammifang",
    "datetaken": "2006-01-16 21:01:00",
    "max_width": 4368,
    "max_height": 2912,
    "url_max": "https://live.staticflickr.com/1396/884929124_e330acb99f_o.jpg?s=eyJpIjo4ODQ5MjkxMjQsImUiOjE3NjQ3MjIyMzYsInMiOiI4MGZlZDIzMTU4MzZjNjg1MmZhZWE0NDAwYzBlZjIxMDRiOTNmMDkwIiwidiI6MX0",
    "max_width_2000": 1600,
    "max_height_2000": 1067,
    "url_max_2000": "https://live.staticflickr.com/1396/884929124_170a4c9bfc_h.jpg?s=eyJpIjo4ODQ5MjkxMjQsImUiOjE3NjQ3MjIyMzYsInMiOiI3ODc0NGQ1Mjg1NTRjYThjODUyMmViMmY5YmI3M2IzYzMxZjE2YmY3IiwidiI6MX0",
    "flickr_page": "https://www.flickr.com/photos/54968894@N00/884929124",
    "count_view": "257"
  },
  {
    "id": "884061799",
    "owner": "54968894@N00",
    "title": "16/01/2006 21:00",
    "realname": "Sammi Fang",
    "ownername": "sammifang",
    "datetaken": "2006-01-16 21:00:51",
    "max_width": 4368,
    "max_height": 2912,
    "url_max": "https://live.staticflickr.com/1262/884061799_7b9cb98a76_o.jpg?s=eyJpIjo4ODQwNjE3OTksImUiOjE3NjQ3MjIyMzYsInMiOiIwODI1NWUyZWI1ZDBlZWEzOWE1ZmMxZTE2ZTYyNjUzMjJkMjRjMGJjIiwidiI6MX0",
    "max_width_2000": 1600,
    "max_height_2000": 1067,
    "url_max_2000": "https://live.staticflickr.com/1262/884061799_53b4b21500_h.jpg?s=eyJpIjo4ODQwNjE3OTksImUiOjE3NjQ3MjIyMzYsInMiOiJjZWM1ZDM3YTZiYmU4MDViMmQwOWUyYzc3Y2YwODYyZDBkNWUxN2JiIiwidiI6MX0",
    "flickr_page": "https://www.flickr.com/photos/54968894@N00/884061799",
    "count_view": "36"
  },
  {
    "id": "884896016",
    "owner": "54968894@N00",
    "title": "16/01/2006 20:58",
    "realname": "Sammi Fang",
    "ownername": "sammifang",
    "datetaken": "2006-01-16 20:58:06",
    "max_width": 4368,
    "max_height": 2912,
    "url_max": "https://live.staticflickr.com/1372/884896016_aeb15ac7cd_o.jpg?s=eyJpIjo4ODQ4OTYwMTYsImUiOjE3NjQ3MjIyMzYsInMiOiI0MDc5M2Y4NjI2NTY4NGFhM2M2MTcxYWZiMjZkNTIwMGU4ZWI2YzBlIiwidiI6MX0",
    "max_width_2000": 1600,
    "max_height_2000": 1067,
    "url_max_2000": "https://live.staticflickr.com/1372/884896016_08d9053024_h.jpg?s=eyJpIjo4ODQ4OTYwMTYsImUiOjE3NjQ3MjIyMzYsInMiOiI2ODJmYzJmZTU2Nzg1ODUyZDQxOTNlMDhmMDE3YWNmNzMzMjk3YmYzIiwidiI6MX0",
    "flickr_page": "https://www.flickr.com/photos/54968894@N00/884896016",
    "count_view": "40"
  },
  {
    "id": "884880670",
    "owner": "54968894@N00",
    "title": "16/01/2006 20:53",
    "realname": "Sammi Fang",
    "ownername": "sammifang",
    "datetaken": "2006-01-16 20:53:29",
    "max_width": 4368,
    "max_height": 2912,
    "url_max": "https://live.staticflickr.com/1244/884880670_8c73e42e20_o.jpg?s=eyJpIjo4ODQ4ODA2NzAsImUiOjE3NjQ3MjIyMzYsInMiOiI0OGY0YjIzNmMwYWQ5MDFjNmRkNGVkNTgyMjQxZDZjMDM1OWUyYzIwIiwidiI6MX0",
    "max_width_2000": 1600,
    "max_height_2000": 1067,
    "url_max_2000": "https://live.staticflickr.com/1244/884880670_839aea4bbb_h.jpg?s=eyJpIjo4ODQ4ODA2NzAsImUiOjE3NjQ3MjIyMzYsInMiOiIxZDg4N2JhZjlmZGNlNGI0ZWJhMWM3NWRkMDkxOTgxZDZhYjAyYTVlIiwidiI6MX0",
    "flickr_page": "https://www.flickr.com/photos/54968894@N00/884880670",
    "count_view": "38"
  },
  {
    "id": "884011085",
    "owner": "54968894@N00",
    "title": "16/01/2006 20:48",
    "realname": "Sammi Fang",
    "ownername": "sammifang",
    "datetaken": "2006-01-16 20:48:56",
    "max_width": 4368,
    "max_height": 2912,
    "url_max": "https://live.staticflickr.com/1302/884011085_f04c5a41bf_o.jpg?s=eyJpIjo4ODQwMTEwODUsImUiOjE3NjQ3MjIyMzYsInMiOiI3MTNmNjE5MjI1OTdhZWM5NmRjMGYwZmEzMWJkZTRjM2U3ODU3OWM4IiwidiI6MX0",
    "max_width_2000": 1600,
    "max_height_2000": 1067,
    "url_max_2000": "https://live.staticflickr.com/1302/884011085_88d62334a9_h.jpg?s=eyJpIjo4ODQwMTEwODUsImUiOjE3NjQ3MjIyMzYsInMiOiI5NGI4ZDkwZmI1ODA1MWUwNGIxYTkzODMwNDVjMTI1MDI5NzBmNjc4IiwidiI6MX0",
    "flickr_page": "https://www.flickr.com/photos/54968894@N00/884011085",
    "count_view": "35"
  },
  {
    "id": "883992521",
    "owner": "54968894@N00",
    "title": "16/01/2006 20:46",
    "realname": "Sammi Fang",
    "ownername": "sammifang",
    "datetaken": "2006-01-16 20:46:47",
    "max_width": 2912,
    "max_height": 4368,
    "url_max": "https://live.staticflickr.com/1292/883992521_db8d7e7708_o.jpg?s=eyJpIjo4ODM5OTI1MjEsImUiOjE3NjQ3MjIyMzYsInMiOiIzNzEwYTJhMTIxYTRkNmNlMTk5ODVmMTVmZWFjM2I0MzhmNDhlOWI1IiwidiI6MX0",
    "max_width_2000": 1365,
    "max_height_2000": 2048,
    "url_max_2000": "https://live.staticflickr.com/1292/883992521_736b0bfc7f_k.jpg?s=eyJpIjo4ODM5OTI1MjEsImUiOjE3NjQ3MjIyMzYsInMiOiI4N2ZmM2E0ZTRhNDY5NmE1MjE0ZjQ1ZDAxODg0MzM3MDdkZWQwMDhiIiwidiI6MX0",
    "flickr_page": "https://www.flickr.com/photos/54968894@N00/883992521",
    "count_view": "36"
  },
  {
    "id": "884828880",
    "owner": "54968894@N00",
    "title": "16/01/2006 20:46",
    "realname": "Sammi Fang",
    "ownername": "sammifang",
    "datetaken": "2006-01-16 20:46:35",
    "max_width": 4368,
    "max_height": 2912,
    "url_max": "https://live.staticflickr.com/1145/884828880_e1b0ce6d23_o.jpg?s=eyJpIjo4ODQ4Mjg4ODAsImUiOjE3NjQ3MjIyMzYsInMiOiI5N2NjNmY3MmMwMjhjZGIzZjk1MDU1ZDcxYzJiNzVjNDMzZDU0MjRmIiwidiI6MX0",
    "max_width_2000": 1600,
    "max_height_2000": 1067,
    "url_max_2000": "https://live.staticflickr.com/1145/884828880_8dca365025_h.jpg?s=eyJpIjo4ODQ4Mjg4ODAsImUiOjE3NjQ3MjIyMzYsInMiOiI3YjU3NTU4MTcxNzRjMzk4YjQ1YTYwN2VkNjY4MGNiZjFhNjAxNDYzIiwidiI6MX0",
    "flickr_page": "https://www.flickr.com/photos/54968894@N00/884828880",
    "count_view": "35"
  },
  {
    "id": "884812666",
    "owner": "54968894@N00",
    "title": "16/01/2006 20:45",
    "realname": "Sammi Fang",
    "ownername": "sammifang",
    "datetaken": "2006-01-16 20:45:47",
    "max_width": 4368,
    "max_height": 2912,
    "url_max": "https://live.staticflickr.com/1438/884812666_56d1777b2c_o.jpg?s=eyJpIjo4ODQ4MTI2NjYsImUiOjE3NjQ3MjIyMzYsInMiOiI0NjVmMDQ0NjZjMGJiMDk0NTc3MzBjODE4NDY5MDA3YzBhOGJlMWMwIiwidiI6MX0",
    "max_width_2000": 1600,
    "max_height_2000": 1067,
    "url_max_2000": "https://live.staticflickr.com/1438/884812666_4354c053ce_h.jpg?s=eyJpIjo4ODQ4MTI2NjYsImUiOjE3NjQ3MjIyMzYsInMiOiJjOTBjZGU1NDI5NmIzMWUzZDY0ZGUzOTc1YjIzNmU4NTQ0ODFkNWI5IiwidiI6MX0",
    "flickr_page": "https://www.flickr.com/photos/54968894@N00/884812666",
    "count_view": "37"
  },
  {
    "id": "883836041",
    "owner": "54968894@N00",
    "title": "15/01/2006 19:26",
    "realname": "Sammi Fang",
    "ownername": "sammifang",
    "datetaken": "2006-01-15 19:26:47",
    "max_width": 4368,
    "max_height": 2912,
    "url_max": "https://live.staticflickr.com/1374/883836041_4483ddb5ed_o.jpg?s=eyJpIjo4ODM4MzYwNDEsImUiOjE3NjQ3MjIyMzYsInMiOiIwN2I5MTE1ZDE0YmViYjM4OGJlNjg0YjJmYWI2MzZmOTJjZmE0YTUwIiwidiI6MX0",
    "max_width_2000": 1600,
    "max_height_2000": 1067,
    "url_max_2000": "https://live.staticflickr.com/1374/883836041_b0e4d40b22_h.jpg?s=eyJpIjo4ODM4MzYwNDEsImUiOjE3NjQ3MjIyMzYsInMiOiJkYzI4YjVkYjhhZTU5OWU5MWM0NjFhMzk2NGZjYmQ5Zjg5YjM0MTA0IiwidiI6MX0",
    "flickr_page": "https://www.flickr.com/photos/54968894@N00/883836041",
    "count_view": "306"
  },
  {
    "id": "884669012",
    "owner": "54968894@N00",
    "title": "15/01/2006 19:22",
    "realname": "Sammi Fang",
    "ownername": "sammifang",
    "datetaken": "2006-01-15 19:22:23",
    "max_width": 4368,
    "max_height": 2912,
    "url_max": "https://live.staticflickr.com/1414/884669012_3da395857a_o.jpg?s=eyJpIjo4ODQ2NjkwMTIsImUiOjE3NjQ3MjIyMzYsInMiOiI3YWJjMGFlZWY0MTNhOGJjZjMzZGVjOWY5Mjk0YjgwNmYzMGM3NGNhIiwidiI6MX0",
    "max_width_2000": 1600,
    "max_height_2000": 1067,
    "url_max_2000": "https://live.staticflickr.com/1414/884669012_b2dd2fbb1c_h.jpg?s=eyJpIjo4ODQ2NjkwMTIsImUiOjE3NjQ3MjIyMzYsInMiOiI2ODZlYmNhYzhlMTQ2YmMwNmM2MTJjMDMyNzcxM2I4NjQwN2JiYjNhIiwidiI6MX0",
    "flickr_page": "https://www.flickr.com/photos/54968894@N00/884669012",
    "count_view": "60"
  },
  {
    "id": "883806613",
    "owner": "54968894@N00",
    "title": "15/01/2006 19:20",
    "realname": "Sammi Fang",
    "ownername": "sammifang",
    "datetaken": "2006-01-15 19:20:04",
    "max_width": 4368,
    "max_height": 2912,
    "url_max": "https://live.staticflickr.com/1333/883806613_fb57d3f899_o.jpg?s=eyJpIjo4ODM4MDY2MTMsImUiOjE3NjQ3MjIyMzYsInMiOiJhZGRjOGJiZjczZTk2ZmU5YzNkOTZhYmM0YjQyMmM3MmMyNmM5NDA4IiwidiI6MX0",
    "max_width_2000": 1600,
    "max_height_2000": 1067,
    "url_max_2000": "https://live.staticflickr.com/1333/883806613_04445f2b17_h.jpg?s=eyJpIjo4ODM4MDY2MTMsImUiOjE3NjQ3MjIyMzYsInMiOiJjNzU3NzhlMWNjNTI3ZWFmNjMzOTI3NzkzMjEyMWRiYWFlM2ZkMjQ0IiwidiI6MX0",
    "flickr_page": "https://www.flickr.com/photos/54968894@N00/883806613",
    "count_view": "60"
  },
  {
    "id": "883792711",
    "owner": "54968894@N00",
    "title": "15/01/2006 19:19",
    "realname": "Sammi Fang",
    "ownername": "sammifang",
    "datetaken": "2006-01-15 19:19:46",
    "max_width": 4368,
    "max_height": 2912,
    "url_max": "https://live.staticflickr.com/1233/883792711_4d64bb7764_o.jpg?s=eyJpIjo4ODM3OTI3MTEsImUiOjE3NjQ3MjIyMzYsInMiOiIxMjE5NzBmNzBhNjBjYWZlODBmNmUyNzgyNTUyMTMzMjI0YTNjOWZiIiwidiI6MX0",
    "max_width_2000": 1600,
    "max_height_2000": 1067,
    "url_max_2000": "https://live.staticflickr.com/1233/883792711_2cce1d90ea_h.jpg?s=eyJpIjo4ODM3OTI3MTEsImUiOjE3NjQ3MjIyMzYsInMiOiI3OTA2YmViZjIzMDQ0NGVhMTg4MTUxNGZhYTk3NDA1MmExMTllNjE1IiwidiI6MX0",
    "flickr_page": "https://www.flickr.com/photos/54968894@N00/883792711",
    "count_view": "62"
  },
  {
    "id": "884630366",
    "owner": "54968894@N00",
    "title": "15/01/2006 19:19",
    "realname": "Sammi Fang",
    "ownername": "sammifang",
    "datetaken": "2006-01-15 19:19:20",
    "max_width": 4368,
    "max_height": 2912,
    "url_max": "https://live.staticflickr.com/1172/884630366_4a217101aa_o.jpg?s=eyJpIjo4ODQ2MzAzNjYsImUiOjE3NjQ3MjIyMzYsInMiOiI2YjI3ZjhmNTQyZTNiMTU1OWQ2OTY1OGYxMTk1ZWU4ZmQzM2YyYTM0IiwidiI6MX0",
    "max_width_2000": 1600,
    "max_height_2000": 1067,
    "url_max_2000": "https://live.staticflickr.com/1172/884630366_74534fc8af_h.jpg?s=eyJpIjo4ODQ2MzAzNjYsImUiOjE3NjQ3MjIyMzYsInMiOiIxZmE4NDYxZWE3MTExYWVmMzA2MzY2NjlkMGFjMTI5MGRjZDMxMGUyIiwidiI6MX0",
    "flickr_page": "https://www.flickr.com/photos/54968894@N00/884630366",
    "count_view": "41"
  },
  {
    "id": "883768385",
    "owner": "54968894@N00",
    "title": "15/01/2006 19:18",
    "realname": "Sammi Fang",
    "ownername": "sammifang",
    "datetaken": "2006-01-15 19:18:54",
    "max_width": 4368,
    "max_height": 2912,
    "url_max": "https://live.staticflickr.com/1304/883768385_11dd16de2f_o.jpg?s=eyJpIjo4ODM3NjgzODUsImUiOjE3NjQ3MjIyMzYsInMiOiJkOGFjNjNkMzQxMmRlNWZkYWY3ODgxYWNkYzFhOTAzZjE0NTdmN2I4IiwidiI6MX0",
    "max_width_2000": 1600,
    "max_height_2000": 1067,
    "url_max_2000": "https://live.staticflickr.com/1304/883768385_92134c17b7_h.jpg?s=eyJpIjo4ODM3NjgzODUsImUiOjE3NjQ3MjIyMzYsInMiOiJiMGY5NDE3M2JiODM1Y2ExOTg4YjMzODg4NTdiMGNjY2JmOTUwZWU1IiwidiI6MX0",
    "flickr_page": "https://www.flickr.com/photos/54968894@N00/883768385",
    "count_view": "54"
  }
]