[
  {
    "id": "996730813",
    "owner": "54968894@N00",
    "title": "07/05/2006 12:51",
    "realname": "Sammi Fang",
    "ownername": "sammifang",
    "datetaken": "2006-05-07 12:51:33",
    "max_width": 2666,
    "max_height": 4000,
    "url_max": "https://live.staticflickr.com/1222/996730813_72ba9e76af_4k.jpg?s=eyJpIjo5OTY3MzA4MTMsImUiOjE3NjQ3MjIyMTgsInMiOiI2ODE3OTE2Y2I1NTBlZmQ0YTc1MTg5Zjg1MzI5ZmIxYmY1YzA1ZjQ5IiwidiI6MX0",
    "max_width_2000": 1365,
    "max_height_2000": 2048,
    "url_max_2000": "https://live.staticflickr.com/1222/996730813_c76b222eb1_k.jpg?s=eyJpIjo5OTY3MzA4MTMsImUiOjE3NjQ3MjIyMTgsInMiOiI4YmQyNjg3YTY3ZWIzMzNhMmM0MDkwY2E5ODU1NWZlMmQyMjQwYjRhIiwidiI6MX0",
    "flickr_page": "https://www.flickr.com/photos/54968894@N00/996730813",
    "count_view": "25"
  },
  {
    "id": "995630793",
    "owner": "54968894@N00",
    "title": "07/05/2006 12:39",
    "realname": "Sammi Fang",
    "ownername": "sammifang",
    "datetaken": "2006-05-07 12:39:12",
    "max_width": 4368,
    "max_height": 2912,
    "url_max": "https://live.staticflickr.com/1293/995630793_a923f365c5_o.jpg?s=eyJpIjo5OTU2MzA3OTMsImUiOjE3NjQ3MjIyMTgsInMiOiIxOTdlNjA2ZDk1MTY5MGExMDMzNmQ3YjYxOGFkYzUyODBiMjk5MTY3IiwidiI6MX0",
    "max_width_2000": 1600,
    "max_height_2000": 1067,
    "url_max_2000": "https://live.staticflickr.com/1293/995630793_4ebca561aa_h.jpg?s=eyJpIjo5OTU2MzA3OTMsImUiOjE3NjQ3MjIyMTgsInMiOiI5Yjk4ZDc4NTFlOGVmZjJkMGM1NjBkYjE1NzY4NWYyMDY5YWRkM2I5IiwidiI6MX0",
    "flickr_page": "https://www.flickr.com/photos/54968894@N00/995630793",
    "count_view": "26"
  },
  {
    "id": "996691968",
    "owner": "54968894@N00",
    "title": "07/05/2006 12:35",
    "realname": "Sammi Fang",
    "ownername": "sammifang",
    "datetaken": "2006-05-07 12:35:44",
    "max_width": 4368,
    "max_height": 2912,
    "url_max": "https://live.staticflickr.com/1286/996691968_3c209fa54f_o.jpg?s=eyJpIjo5OTY2OTE5NjgsImUiOjE3NjQ3MjIyMTgsInMiOiI4MDUzZTZiZDA2YmIwYTg1ZGM1NmY3YzQ4NDM2YWY3YmZjY2M0ODkwIiwidiI6MX0",
    "max_width_2000": 1600,
    "max_height_2000": 1067,
    "url_max_2000": "https://live.staticflickr.com/1286/996691968_9f7ad04604_h.jpg?s=eyJpIjo5OTY2OTE5NjgsImUiOjE3NjQ3MjIyMTgsInMiOiI2YjQ5YjM4M2E4NDg3N2ZmMTE2ZTlmN2RjZTdkOTJkNDA3ZTExNDhiIiwidiI6MX0",
    "flickr_page": "https://www.flickr.com/photos/54968894@N00/996691968",
    "count_view": "35"
  },
  {
    "id": "996843434",
    "owner": "54968894@N00",
    "title": "07/05/2006 12:35",
    "realname": "Sammi Fang",
    "ownername": "sammifang",
    "datetaken": "2006-05-07 12:35:20",
    "max_width": 4368,
    "max_height": 2912,
    "url_max": "https://live.staticflickr.com/1300/996843434_9b07f57f24_o.jpg?s=eyJpIjo5OTY4NDM0MzQsImUiOjE3NjQ3MjIyMTgsInMiOiJiN2M2YjcxNTkzNGIyMDUyYzhjYTc4NjhiY2FiNmYyNTE4YmZjMzU3IiwidiI6MX0",
    "max_width_2000": 1600,
    "max_height_2000": 1067,
    "url_max_2000": "https://live.staticflickr.com/1300/996843434_c94dcc02ab_h.jpg?s=eyJpIjo5OTY4NDM0MzQsImUiOjE3NjQ3MjIyMTgsInMiOiI2NzA2M2NhZDhmNTQ4NDY5ODNhNTQ2YTM1YmZjMWQwNjY3ZDllOTgxIiwidiI6MX0",
    "flickr_page": "https://www.flickr.com/photos/54968894@N00/996843434",
    "count_view": "30"
  },
  {
    "id": "972269072",
    "owner": "54968894@N00",
    "title": "06/05/2006 18:28",
    "realname": "Sammi Fang",
    "ownername": "sammifang",
    "datetaken": "2006-05-06 18:28:02",
    "max_width": 2666,
    "max_height": 4000,
    "url_max": "https://live.staticflickr.com/1079/972269072_27d3035c86_4k.jpg?s=eyJpIjo5NzIyNjkwNzIsImUiOjE3NjQ3MjIyMjIsInMiOiIwMzA5ZGJjNTE2NTUxMDE2MTU1NzMzZjA2OTI1MDE2MjcwOWEzMDg4IiwidiI6MX0",
    "max_width_2000": 1365,
    "max_height_2000": 2048,
    "url_max_2000": "https://live.staticflickr.com/1079/972269072_6f3d1c1431_k.jpg?s=eyJpIjo5NzIyNjkwNzIsImUiOjE3NjQ3MjIyMjIsInMiOiI1MDM5YWE4ZTE1MGZiZDhjZTVkMjRkNmYxY2NlMzM3Njg2MjBkNjcwIiwidiI6MX0",
    "flickr_page": "https://www.flickr.com/photos/54968894@N00/972269072",
    "count_view": "52"
  },
  {
    "id": "972228546",
    "owner": "54968894@N00",
    "title": "06/05/2006 18:23",
    "realname": "Sammi Fang",
    "ownername": "sammifang",
    "datetaken": "2006-05-06 18:23:33",
    "max_width": 4000,
    "max_height": 2666,
    "url_max": "https://live.staticflickr.com/1033/972228546_1e243dd58a_4k.jpg?s=eyJpIjo5NzIyMjg1NDYsImUiOjE3NjQ3MjIyMjIsInMiOiI5YTViOGJiMDhlOWJlZjM0ZmJlNTQwNzBhNjgzNzU1ZmNmMzIyOTFhIiwidiI6MX0",
    "max_width_2000": 1600,
    "max_height_2000": 1066,
    "url_max_2000": "https://live.staticflickr.com/1033/972228546_62100a4d74_h.jpg?s=eyJpIjo5NzIyMjg1NDYsImUiOjE3NjQ3MjIyMjIsInMiOiIzYThkZDU3ZDk2OTQ5YmM5N2YwMmM1NTVlODQ1NWIzYTJkM2RjOWQ2IiwidiI6MX0",
    "flickr_page": "https://www.flickr.com/photos/54968894@N00/972228546",
    "count_view": "31"
  },
  {
    "id": "971500293",
    "owner": "54968894@N00",
    "title": "06/05/2006 15:03",
    "realname": "Sammi Fang",
    "ownername": "sammifang",
    "datetaken": "2006-05-06 15:03:25",
    "max_width": 2666,
    "max_height": 4000,
    "url_max": "https://live.staticflickr.com/1282/971500293_eb19c9845d_4k.jpg?s=eyJpIjo5NzE1MDAyOTMsImUiOjE3NjQ3MjIyMjAsInMiOiJlZWQ0MWRhMTc5ZDQyY2E5Y2IwY2NkOTU0NjcwOWI5OTAxOWYyNzc1IiwidiI6MX0",
    "max_width_2000": 1365,
    "max_height_2000": 2048,
    "url_max_2000": "https://live.staticflickr.com/1282/971500293_66419ab144_k.jpg?s=eyJpIjo5NzE1MDAyOTMsImUiOjE3NjQ3MjIyMjAsInMiOiIyZmQ4YTI4ZTQyMGUxOTIwZmRkMzQ3NTVjZDUwMjQ2MjQwMmZjZDBiIiwidiI6MX0",
    "flickr_page": "https://www.flickr.com/photos/54968894@N00/971500293",
    "count_view": "19"
  },
  {
    "id": "971485357",
    "owner": "54968894@N00",
    "title": "06/05/2006 15:03",
    "realname": "Sammi Fang",
    "ownername": "sammifang",
    "datetaken": "2006-05-06 15:03:00",
    "max_width": 2666,
    "max_height": 4000,
    "url_max": "https://live.staticflickr.com/1295/971485357_63ecaf74e0_4k.jpg?s=eyJpIjo5NzE0ODUzNTcsImUiOjE3NjQ3MjIyMjAsInMiOiJjMmYxZTgxYTI4ZmNiN2NmOTAzNTM4OTAzNTFkNGUyOWQ3NjRkMzIyIiwidiI6MX0",
    "max_width_2000": 1365,
    "max_height_2000": 2048,
    "url_max_2000": "https://live.staticflickr.com/1295/971485357_5b9f123ec5_k.jpg?s=eyJpIjo5NzE0ODUzNTcsImUiOjE3NjQ3MjIyMjAsInMiOiIxZDM3YmI1MDQxYzQ1NWI1MGU2ODdmMjQ0ODgyMTBkMTM5MjEyNThkIiwidiI6MX0",
    "flickr_page": "https://www.flickr.com/photos/54968894@N00/971485357",
    "count_view": "24"
  },
  {
    "id": "971454075",
    "owner": "54968894@N00",
    "title": "06/05/2006 14:57",
    "realname": "Sammi Fang",
    "ownername": "sammifang",
    "datetaken": "2006-05-06 14:57:26",
    "max_width": 4000,
    "max_height": 2666,
    "url_max": "https://live.staticflickr.com/1425/971454075_364b6b8515_4k.jpg?s=eyJpIjo5NzE0NTQwNzUsImUiOjE3NjQ3MjIyMjAsInMiOiI5ODA0NDZmN2VhNTFkZDQ4NjI3ZTEzOTE2NTAxYTk3ZGEzYzliMTY5IiwidiI6MX0",
    "max_width_2000": 1600,
    "max_height_2000": 1066,
    "url_max_2000": "https://live.staticflickr.com/1425/971454075_b3ab372422_h.jpg?s=eyJpIjo5NzE0NTQwNzUsImUiOjE3NjQ3MjIyMjAsInMiOiI1YjUwNzBlNzIxZTc0YTBiMTI3NGVlNTJiODY2NDRjNjU1YzUxNzZiIiwidiI6MX0",
    "flickr_page": "https://www.flickr.com/photos/54968894@N00/971454075",
    "count_view": "23"
  },
  {
    "id": "971442521",
    "owner": "54968894@N00",
    "title": "06/05/2006 14:54",
    "realname": "Sammi Fang",
    "ownername": "sammifang",
    "datetaken": "2006-05-06 14:54:58",
    "max_width": 4000,
    "max_height": 2666,
    "url_max": "https://live.staticflickr.com/1305/971442521_bce49fba68_4k.jpg?s=eyJpIjo5NzE0NDI1MjEsImUiOjE3NjQ3MjIyMjAsInMiOiIyOTZiYTUyNjMzMmMxZDcxMDNiMjNkZDYzOGE1YmFiMWUwNzRjOTk0IiwidiI6MX0",
    "max_width_2000": 1600,
    "max_height_2000": 1066,
    "url_max_2000": "https://live.staticflickr.com/1305/971442521_4a265ef6a8_h.jpg?s=eyJpIjo5NzE0NDI1MjEsImUiOjE3NjQ3MjIyMjAsInMiOiJmN2E5YTQxOWM4Y2FkM2JjMzEzOGI4ZWExMGJkOTBlOTlmYzhmOWU3IiwidiI6MX0",
    "flickr_page": "https://www.flickr.com/photos/54968894@N00/971442521",
    "count_view": "19"
  },
  {
    "id": "972294126",
    "owner": "54968894@N00",
    "title": "06/05/2006 14:53",
    "realname": "Sammi Fang",
    "ownername": "sammifang",
    "datetaken": "2006-05-06 14:53:46",
    "max_width": 4000,
    "max_height": 2666,
    "url_max": "https://live.staticflickr.com/1426/972294126_9294fa4152_4k.jpg?s=eyJpIjo5NzIyOTQxMjYsImUiOjE3NjQ3MjIyMjAsInMiOiJiNmM2NzI4MjMyYzE3ZTY4MmJmZGE5ZTBmZWIwMjQ5ZGNjYTdiNWFlIiwidiI6MX0",
    "max_width_2000": 1600,
    "max_height_2000": 1066,
    "url_max_2000": "https://live.staticflickr.com/1426/972294126_839432462b_h.jpg?s=eyJpIjo5NzIyOTQxMjYsImUiOjE3NjQ3MjIyMjAsInMiOiJkMjEzODA3YWI5YmM4YjI2OTU0MmY4YTMxZjkyYTZmMjBkYmJjMmI1IiwidiI6MX0",
    "flickr_page": "https://www.flickr.com/photos/54968894@N00/972294126",
    "count_view": "18"
  },
  {
    "id": "971424775",
    "owner": "54968894@N00",
    "title": "06/05/2006 14:52",
    "realname": "Sammi Fang",
    "ownername": "sammifang",
    "datetaken": "2006-05-06 14:52:05",
    "max_width": 2666,
    "max_height": 4000,
    "url_max": "https://live.staticflickr.com/1231/971424775_453382a2a0_4k.jpg?s=eyJpIjo5NzE0MjQ3NzUsImUiOjE3NjQ3MjIyMjAsInMiOiJjMGJhYWU5MjMwNmQ3Zjc3ZTI5MDdhNjMxZDlkNzBhZDYzMjNmMDI0IiwidiI6MX0",
    "max_width_2000": 1365,
    "max_height_2000": 2048,
    "url_max_2000": "https://live.staticflickr.com/1231/971424775_94314fce42_k.jpg?s=eyJpIjo5NzE0MjQ3NzUsImUiOjE3NjQ3MjIyMjAsInMiOiI1YTI5MGY5ZDgxZjg4MmQ0MGYxMTlmMzQyNTVkNWRkMmZhOWE2MWRlIiwidiI6MX0",
    "flickr_page": "https://www.flickr.com/photos/54968894@N00/971424775",
    "count_view": "24"
  },
  {
    "id": "967438143",
    "owner": "54968894@N00",
    "title": "04/05/2006 21:43",
    "realname": "Sammi Fang",
    "ownername": "sammifang",
    "datetaken": "2006-05-04 21:43:06",
    "max_width": 4368,
    "max_height": 2912,
    "url_max": "https://live.staticflickr.com/1020/967438143_a1bf6cf25f_o.jpg?s=eyJpIjo5Njc0MzgxNDMsImUiOjE3NjQ3MjIyMjIsInMiOiJlOTdiODM0ZTdjOTIyNThlMWI5MDc5NmRjZjY1MDlkYTU1NjFjNjJiIiwidiI6MX0",
    "max_width_2000": 1600,
    "max_height_2000": 1067,
    "url_max_2000": "https://live.staticflickr.com/1020/967438143_1c944c685d_h.jpg?s=eyJpIjo5Njc0MzgxNDMsImUiOjE3NjQ3MjIyMjIsInMiOiI3OWFiYzEzMzY1YjkyZDY3MTQ4MGE0MzRlYjA5MTI2MzllZTNlYjljIiwidiI6MX0",
    "flickr_page": "https://www.flickr.com/photos/54968894@N00/967438143",
    "count_view": "16"
  },
  {
    "id": "968330560",
    "owner": "54968894@N00",
    "title": "04/05/2006 21:14",
    "realname": "Sammi Fang",
    "ownername": "sammifang",
    "datetaken": "2006-05-04 21:14:32",
    "max_width": 2912,
    "max_height": 4368,
    "url_max": "https://live.staticflickr.com/1170/968330560_9b4c946e61_o.jpg?s=eyJpIjo5NjgzMzA1NjAsImUiOjE3NjQ3MjIyMjIsInMiOiJkMzYyNTEyYjA2MWQ4NTVmMDc5ZmFlNjgwMTY3N2RkYzdiNWQ0NjQxIiwidiI6MX0",
    "max_width_2000": 1365,
    "max_height_2000": 2048,
    "url_max_2000": "https://live.staticflickr.com/1170/968330560_7247b68599_k.jpg?s=eyJpIjo5NjgzMzA1NjAsImUiOjE3NjQ3MjIyMjIsInMiOiJjZTdkMjI3MDJmMjI4MzBkYjg3NWFiOWQxZjk5YzJjYjE4YTFhMjRiIiwidiI6MX0",
    "flickr_page": "https://www.flickr.com/photos/54968894@N00/968330560",
    "count_view": "83"
  },
  {
    "id": "967377943",
    "owner": "54968894@N00",
    "title": "04/05/2006 17:54",
    "realname": "Sammi Fang",
    "ownername": "sammifang",
    "datetaken": "2006-05-04 17:54:40",
    "max_width": 2912,
    "max_height": 4368,
    "url_max": "https://live.staticflickr.com/1022/967377943_4f5768280c_o.jpg?s=eyJpIjo5NjczNzc5NDMsImUiOjE3NjQ3MjIyMjIsInMiOiJlZTcyMDY1NTI5OGYyZjljM2Q5NTU2OTZhNmYzZWVhOGE2MTliYzMyIiwidiI6MX0",
    "max_width_2000": 1365,
    "max_height_2000": 2048,
    "url_max_2000": "https://live.staticflickr.com/1022/967377943_1278ed5f53_k.jpg?s=eyJpIjo5NjczNzc5NDMsImUiOjE3NjQ3MjIyMjIsInMiOiI0ZTVmM2QwMGFhYmMzYTE0Y2MzOTE5ZTVhNzQzZDE1ZjdlMTQyNjk0IiwidiI6MX0",
    "flickr_page": "https://www.flickr.com/photos/54968894@N00/967377943",
    "count_view": "27"
  },
  {
    "id": "968303676",
    "owner": "54968894@N00",
    "title": "04/05/2006 16:47",
    "realname": "Sammi Fang",
    "ownername": "sammifang",
    "datetaken": "2006-05-04 16:47:31",
    "max_width": 2912,
    "max_height": 4368,
    "url_max": "https://live.staticflickr.com/1147/968303676_53fc25b893_o.jpg?s=eyJpIjo5NjgzMDM2NzYsImUiOjE3NjQ3MjIyMjIsInMiOiI0MTg1M2I2MjcyYmFlZGRjNjcxMjc1NTFjYzA5OGM2ZjgwMzc4NjNkIiwidiI6MX0",
    "max_width_2000": 1365,
    "max_height_2000": 2048,
    "url_max_2000": "https://live.staticflickr.com/1147/968303676_d6b102c6a8_k.jpg?s=eyJpIjo5NjgzMDM2NzYsImUiOjE3NjQ3MjIyMjIsInMiOiJiZDMxNWMzYTBhNjQ5ZWY4MDZjZWUwMmVjN2MzMzYwMzliZmQ3ZGM5IiwidiI6MX0",
    "flickr_page": "https://www.flickr.com/photos/54968894@N00/968303676",
    "count_view": "82"
  },
  {
    "id": "967709672",
    "owner": "54968894@N00",
    "title": "01/05/2006 17:41",
    "realname": "Sammi Fang",
    "ownername": "sammifang",
    "datetaken": "2006-05-01 17:41:54",
    "max_width": 4000,
    "max_height": 2666,
    "url_max": "https://live.staticflickr.com/1246/967709672_ada336b3bc_4k.jpg?s=eyJpIjo5Njc3MDk2NzIsImUiOjE3NjQ3MjIyMjIsInMiOiJhNjlmYTUyNDRjOTU5NmQ5OWI5YjdhZTRkNGY1MDI4YjAyOGRmMmYxIiwidiI6MX0",
    "max_width_2000": 1600,
    "max_height_2000": 1066,
    "url_max_2000": "https://live.staticflickr.com/1246/967709672_d0e747178c_h.jpg?s=eyJpIjo5Njc3MDk2NzIsImUiOjE3NjQ3MjIyMjIsInMiOiI5NmUwYWRiODY4MDU4Y2NmYTBjNjJiYzVjM2MyODQ2ZDI5N2UwNGNmIiwidiI6MX0",
    "flickr_page": "https://www.flickr.com/photos/54968894@N00/967709672",
    "count_view": "130"
  },
  {
    "id": "967645528",
    "owner": "54968894@N00",
    "title": "01/05/2006 17:40",
    "realname": "Sammi Fang",
    "ownername": "sammifang",
    "datetaken": "2006-05-01 17:40:53",
    "max_width": 4000,
    "max_height": 2666,
    "url_max": "https://live.staticflickr.com/1255/967645528_9fa59c7c26_4k.jpg?s=eyJpIjo5Njc2NDU1MjgsImUiOjE3NjQ3MjIyMjIsInMiOiI0ZGY2MWNlNWMxZmQ3NWVjZTYwNmVjZWYzYWM5NzA4OWEzYmM0MzQ4IiwidiI6MX0",
    "max_width_2000": 1600,
    "max_height_2000": 1066,
    "url_max_2000": "https://live.staticflickr.com/1255/967645528_10d90a2c1f_h.jpg?s=eyJpIjo5Njc2NDU1MjgsImUiOjE3NjQ3MjIyMjIsInMiOiJhOGI1NmU2NTlhYTIxMGZjODI5NmFhMDNlNDVkNThkYmQ4ODFlZjcyIiwidiI6MX0",
    "flickr_page": "https://www.flickr.com/photos/54968894@N00/967645528",
    "count_view": "65"
  },
  {
    "id": "967634230",
    "owner": "54968894@N00",
    "title": "01/05/2006 17:36",
    "realname": "Sammi Fang",
    "ownername": "sammifang",
    "datetaken": "2006-05-01 17:36:03",
    "max_width": 4000,
    "max_height": 2666,
    "url_max": "https://live.staticflickr.com/1082/967634230_676753516e_4k.jpg?s=eyJpIjo5Njc2MzQyMzAsImUiOjE3NjQ3MjIyMjIsInMiOiIyNWQ1ZGU1MWZhNDAxMjBiZjVlZjY0ZGU4ODBlYmUwYTUwMGQ3ZGE1IiwidiI6MX0",
    "max_width_2000": 1600,
    "max_height_2000": 1066,
    "url_max_2000": "https://live.staticflickr.com/1082/967634230_e90b70d83a_h.jpg?s=eyJpIjo5Njc2MzQyMzAsImUiOjE3NjQ3MjIyMjIsInMiOiIxZjcyZWQ0NWVmMGZiNGU1ZjI2M2NiMDRjNTViOTIxOWZlMDZmNDYwIiwidiI6MX0",
    "flickr_page": "https://www.flickr.com/photos/54968894@N00/967634230",
    "count_view": "48"
  },
  {
    "id": "966765605",
    "owner": "54968894@N00",
    "title": "01/05/2006 17:34",
    "realname": "Sammi Fang",
    "ownername": "sammifang",
    "datetaken": "2006-05-01 17:34:34",
    "max_width": 4000,
    "max_height": 2666,
    "url_max": "https://live.staticflickr.com/1348/966765605_064c3be093_4k.jpg?s=eyJpIjo5NjY3NjU2MDUsImUiOjE3NjQ3MjIyMjIsInMiOiI1MDQ5ZWNmNmYxNjY1M2JjZWNkMzZjYjRjY2VmZGFkODlhNTc4MzI2IiwidiI6MX0",
    "max_width_2000": 1600,
    "max_height_2000": 1066,
    "url_max_2000": "https://live.staticflickr.com/1348/966765605_e144bc4b18_h.jpg?s=eyJpIjo5NjY3NjU2MDUsImUiOjE3NjQ3MjIyMjIsInMiOiI1NWRkOTAwYWIzNGRkNjVkNzIwYzNmMDk0ODAwM2Q4MWZjMTI3ZTEzIiwidiI6MX0",
    "flickr_page": "https://www.flickr.com/photos/54968894@N00/966765605",
    "count_view": "57"
  },
  {
    "id": "966733389",
    "owner": "54968894@N00",
    "title": "01/05/2006 17:32",
    "realname": "Sammi Fang",
    "ownername": "sammifang",
    "datetaken": "2006-05-01 17:32:55",
    "max_width": 4000,
    "max_height": 2666,
    "url_max": "https://live.staticflickr.com/1320/966733389_20a099c3cd_4k.jpg?s=eyJpIjo5NjY3MzMzODksImUiOjE3NjQ3MjIyMjIsInMiOiJmNzhjYWJiMDJkMWMxNTU3MTNkZTZhYTE3NDE5YWJiMTdjZjEwMzBiIiwidiI6MX0",
    "max_width_2000": 1600,
    "max_height_2000": 1066,
    "url_max_2000": "https://live.staticflickr.com/1320/966733389_9555a08194_h.jpg?s=eyJpIjo5NjY3MzMzODksImUiOjE3NjQ3MjIyMjIsInMiOiIyYzVjN2IwOThmZjI5YWJmM2MzMmI1OTYxM2RmOTQzOGQ1ZDQ3NzFjIiwidiI6MX0",
    "flickr_page": "https://www.flickr.com/photos/54968894@N00/966733389",
    "count_view": "63"
  },
  {
    "id": "967697798",
    "owner": "54968894@N00",
    "title": "01/05/2006 17:30",
    "realname": "Sammi Fang",
    "ownername": "sammifang",
    "datetaken": "2006-05-01 17:30:07",
    "max_width": 4000,
    "max_height": 2666,
    "url_max": "https://live.staticflickr.com/1103/967697798_eaf0b23c1e_4k.jpg?s=eyJpIjo5Njc2OTc3OTgsImUiOjE3NjQ3MjIyMjIsInMiOiI4NzU5NDI0ZDkyMzI2Y2NjMzNhMzQxNzBlNzU5NGNlZjUzN2JhOGJhIiwidiI6MX0",
    "max_width_2000": 1600,
    "max_height_2000": 1066,
    "url_max_2000": "https://live.staticflickr.com/1103/967697798_df8d80ac8a_h.jpg?s=eyJpIjo5Njc2OTc3OTgsImUiOjE3NjQ3MjIyMjIsInMiOiJiMTliZTY4ZTc0YjFlNjliZTQxN2E4MjI3ZDhjNTVkMWMxMmU3NzVhIiwidiI6MX0",
    "flickr_page": "https://www.flickr.com/photos/54968894@N00/967697798",
    "count_view": "82"
  },
  {
    "id": "967687830",
    "owner": "54968894@N00",
    "title": "01/05/2006 17:28",
    "realname": "Sammi Fang",
    "ownername": "sammifang",
    "datetaken": "2006-05-01 17:28:14",
    "max_width": 4000,
    "max_height": 2666,
    "url_max": "https://live.staticflickr.com/1338/967687830_ef03e57d96_4k.jpg?s=eyJpIjo5Njc2ODc4MzAsImUiOjE3NjQ3MjIyMjIsInMiOiI2NjZhYWVmMjYwODUwM2RiNjIyODQ4NDc0OWQxY2RlMTJjYmRhZDgzIiwidiI6MX0",
    "max_width_2000": 1600,
    "max_height_2000": 1066,
    "url_max_2000": "https://live.staticflickr.com/1338/967687830_94eaad95fe_h.jpg?s=eyJpIjo5Njc2ODc4MzAsImUiOjE3NjQ3MjIyMjIsInMiOiI4NzM0MzQzYzA5ODNiYjQ3ZjQ1ZTBiMTdiNjkzYzE0YWVkNzRhMWY5IiwidiI6MX0",
    "flickr_page": "https://www.flickr.com/photos/54968894@N00/967687830",
    "count_view": "84"
  },
  {
    "id": "966712809",
    "owner": "54968894@N00",
    "title": "01/05/2006 17:25",
    "realname": "Sammi Fang",
    "ownername": "sammifang",
    "datetaken": "2006-05-01 17:25:38",
    "max_width": 4000,
    "max_height": 2666,
    "url_max": "https://live.staticflickr.com/1181/966712809_08d98ca6fa_4k.jpg?s=eyJpIjo5NjY3MTI4MDksImUiOjE3NjQ3MjIyMjIsInMiOiIwNzAxNzAyOWM1OWNmYzU2YjFmNGQ5NTYyODBhZTNmNTM1ZWFlYmYwIiwidiI6MX0",
    "max_width_2000": 1600,
    "max_height_2000": 1066,
    "url_max_2000": "https://live.staticflickr.com/1181/966712809_386fd4dd2e_h.jpg?s=eyJpIjo5NjY3MTI4MDksImUiOjE3NjQ3MjIyMjIsInMiOiIxMjk4YTRiOThkYzk5NDI0OWFlMjc0NjE5MmIyNTI1OTgxYzk1M2M1IiwidiI6MX0",
    "flickr_page": "https://www.flickr.com/photos/54968894@N00/966712809",
    "count_view": "60"
  },
  {
    "id": "966706501",
    "owner": "54968894@N00",
    "title": "01/05/2006 17:15",
    "realname": "Sammi Fang",
    "ownername": "sammifang",
    "datetaken": "2006-05-01 17:15:04",
    "max_width": 4000,
    "max_height": 2666,
    "url_max": "https://live.staticflickr.com/1182/966706501_d45dbc7760_4k.jpg?s=eyJpIjo5NjY3MDY1MDEsImUiOjE3NjQ3MjIyMjIsInMiOiI2NmI5NjU4M2ExNmFkZDFiMzg2N2I4NzQ2ZDliZmIxMmY0NzE2M2UyIiwidiI6MX0",
    "max_width_2000": 1600,
    "max_height_2000": 1066,
    "url_max_2000": "https://live.staticflickr.com/1182/966706501_e54ad4d207_h.jpg?s=eyJpIjo5NjY3MDY1MDEsImUiOjE3NjQ3MjIyMjIsInMiOiJlMjBiOGFlNGE2ZmU1NGYwNmUzZWU5ZGQ5OTE3N2Y4ZGY4MzNiZTVjIiwidiI6MX0",
    "flickr_page": "https://www.flickr.com/photos/54968894@N00/966706501",
    "count_view": "59"
  },
  {
    "id": "967550078",
    "owner": "54968894@N00",
    "title": "01/05/2006 17:14",
    "realname": "Sammi Fang",
    "ownername": "sammifang",
    "datetaken": "2006-05-01 17:14:41",
    "max_width": 4000,
    "max_height": 2666,
    "url_max": "https://live.staticflickr.com/1061/967550078_3a769a12d8_4k.jpg?s=eyJpIjo5Njc1NTAwNzgsImUiOjE3NjQ3MjIyMjIsInMiOiI4NmQwMjYyMGQyNzE2MWM1ODk3Mjg2Yjc1NDdlNjJiMDkyMGI3NGNlIiwidiI6MX0",
    "max_width_2000": 1600,
    "max_height_2000": 1066,
    "url_max_2000": "https://live.staticflickr.com/1061/967550078_e723f836d2_h.jpg?s=eyJpIjo5Njc1NTAwNzgsImUiOjE3NjQ3MjIyMjIsInMiOiJhNWNlNDViNTI0NmQ4ODgxYjY2MTI0MjZiNjQ1NmMwZDJhZjk4NWY3IiwidiI6MX0",
    "flickr_page": "https://www.flickr.com/photos/54968894@N00/967550078",
    "count_view": "48"
  },
  {
    "id": "967537122",
    "owner": "54968894@N00",
    "title": "01/05/2006 17:12",
    "realname": "Sammi Fang",
    "ownername": "sammifang",
    "datetaken": "2006-05-01 17:12:28",
    "max_width": 4000,
    "max_height": 2666,
    "url_max": "https://live.staticflickr.com/1031/967537122_8fb13b8689_4k.jpg?s=eyJpIjo5Njc1MzcxMjIsImUiOjE3NjQ3MjIyMjIsInMiOiI2ZjRmOWU3ZjhlN2E5YjgxYTNjZWY3ZTI5OGVjMDBkZmNkZGY0NzIzIiwidiI6MX0",
    "max_width_2000": 1600,
    "max_height_2000": 1066,
    "url_max_2000": "https://live.staticflickr.com/1031/967537122_7ad71883b1_h.jpg?s=eyJpIjo5Njc1MzcxMjIsImUiOjE3NjQ3MjIyMjIsInMiOiIwZDlhNDY2YzZmOTRmODUzZjVjOGFhNWJkMmMzZmQyMzc5MjlmODJmIiwidiI6MX0",
    "flickr_page": "https://www.flickr.com/photos/54968894@N00/967537122",
    "count_view": "180"
  },
  {
    "id": "966662953",
    "owner": "54968894@N00",
    "title": "01/05/2006 17:10",
    "realname": "Sammi Fang",
    "ownername": "sammifang",
    "datetaken": "2006-05-01 17:10:53",
    "max_width": 4000,
    "max_height": 2666,
    "url_max": "https://live.staticflickr.com/1133/966662953_28bd686cd7_4k.jpg?s=eyJpIjo5NjY2NjI5NTMsImUiOjE3NjQ3MjIyMjIsInMiOiJiMGRhMGY5NjVkYjkzNmU0YzM0YzIxZjZjODU0OTYwNDI3MGVhNzBkIiwidiI6MX0",
    "max_width_2000": 1600,
    "max_height_2000": 1066,
    "url_max_2000": "https://live.staticflickr.com/1133/966662953_258cbd03ef_h.jpg?s=eyJpIjo5NjY2NjI5NTMsImUiOjE3NjQ3MjIyMjIsInMiOiIxMGYzYmEzOTBkNjcyNmUyYWU2ZDc1OWZhYTU5ODVhZTEyNWFiZDQ3IiwidiI6MX0",
    "flickr_page": "https://www.flickr.com/photos/54968894@N00/966662953",
    "count_view": "52"
  },
  {
    "id": "967500994",
    "owner": "54968894@N00",
    "title": "01/05/2006 17:07",
    "realname": "Sammi Fang",
    "ownername": "sammifang",
    "datetaken": "2006-05-01 17:07:51",
    "max_width": 4000,
    "max_height": 2666,
    "url_max": "https://live.staticflickr.com/1135/967500994_cc9603cbf2_4k.jpg?s=eyJpIjo5Njc1MDA5OTQsImUiOjE3NjQ3MjIyMjIsInMiOiJmN2FlMWQ1OGM2MjQ5MTI0ZjYzNzVjZjg2MWU4ODRmOTNlYjYyMjBkIiwidiI6MX0",
    "max_width_2000": 1600,
    "max_height_2000": 1066,
    "url_max_2000": "https://live.staticflickr.com/1135/967500994_5803a169eb_h.jpg?s=eyJpIjo5Njc1MDA5OTQsImUiOjE3NjQ3MjIyMjIsInMiOiJlNGY4OTM2MDZiNmY2MzE0MDRjYWQ1ODQzZjEwODI4Y2Y3M2U3MjdhIiwidiI6MX0",
    "flickr_page": "https://www.flickr.com/photos/54968894@N00/967500994",
    "count_view": "119"
  },
  {
    "id": "966588871",
    "owner": "54968894@N00",
    "title": "01/05/2006 17:02",
    "realname": "Sammi Fang",
    "ownername": "sammifang",
    "datetaken": "2006-05-01 17:02:08",
    "max_width": 4000,
    "max_height": 2666,
    "url_max": "https://live.staticflickr.com/1359/966588871_14da0459c4_4k.jpg?s=eyJpIjo5NjY1ODg4NzEsImUiOjE3NjQ3MjIyMjIsInMiOiJhNGI4YzE2OWRlZTEwZjU3NDc4MmJhNzI3OTc1MjQ3NDhlODEwZjM0IiwidiI6MX0",
    "max_width_2000": 1600,
    "max_height_2000": 1066,
    "url_max_2000": "https://live.staticflickr.com/1359/966588871_f4c3eeefba_h.jpg?s=eyJpIjo5NjY1ODg4NzEsImUiOjE3NjQ3MjIyMjIsInMiOiIzOGZiNzYyY2YyOWFiNjA5NmM1OTJkZTRhN2EyOWQxYmNhN2QxZjg2IiwidiI6MX0",
    "flickr_page": "https://www.flickr.com/photos/54968894@N00/966588871",
    "count_view": "70"
  },
  {
    "id": "967428872",
    "owner": "54968894@N00",
    "title": "01/05/2006 16:58",
    "realname": "Sammi Fang",
    "ownername": "sammifang",
    "datetaken": "2006-05-01 16:58:18",
    "max_width": 4000,
    "max_height": 2666,
    "url_max": "https://live.staticflickr.com/1112/967428872_b702e97794_4k.jpg?s=eyJpIjo5Njc0Mjg4NzIsImUiOjE3NjQ3MjIyMjMsInMiOiJiMmFjN2E5MzA3ZGNkMmUxNTc3NDRmNzc0YzQzODkxYjFhYzgwOGYwIiwidiI6MX0",
    "max_width_2000": 1600,
    "max_height_2000": 1066,
    "url_max_2000": "https://live.staticflickr.com/1112/967428872_5eb8443696_h.jpg?s=eyJpIjo5Njc0Mjg4NzIsImUiOjE3NjQ3MjIyMjMsInMiOiJmOTJkYzUyN2UzNThmY2I5NDlkODU4ZjA5NGJmYzEzN2FjYzViZWZkIiwidiI6MX0",
    "flickr_page": "https://www.flickr.com/photos/54968894@N00/967428872",
    "count_view": "382"
  },
  {
    "id": "968099948",
    "owner": "54968894@N00",
    "title": "01/05/2006 16:21",
    "realname": "Sammi Fang",
    "ownername": "sammifang",
    "datetaken": "2006-05-01 16:21:11",
    "max_width": 4000,
    "max_height": 2666,
    "url_max": "https://live.staticflickr.com/1356/968099948_dd872a0ce6_4k.jpg?s=eyJpIjo5NjgwOTk5NDgsImUiOjE3NjQ3MjIyMjIsInMiOiI4NzI0ZWE4ZDllNzgzNWMwMzljOWE3YWM1ZjNkYzc0YTA0NDc5OTMyIiwidiI6MX0",
    "max_width_2000": 1600,
    "max_height_2000": 1066,
    "url_max_2000": "https://live.staticflickr.com/1356/968099948_7281bbdf1f_h.jpg?s=eyJpIjo5NjgwOTk5NDgsImUiOjE3NjQ3MjIyMjIsInMiOiI2ZjNiNWUzYTRiMWQ0ZjJkMTAzNzBhMjEzYTUwZjBhOWY5NTEwNDI3IiwidiI6MX0",
    "flickr_page": "https://www.flickr.com/photos/54968894@N00/968099948",
    "count_view": "31"
  },
  {
    "id": "960383527",
    "owner": "54968894@N00",
    "title": "01/05/2006 16:15",
    "realname": "Sammi Fang",
    "ownername": "sammifang",
    "datetaken": "2006-05-01 16:15:43",
    "max_width": 2671,
    "max_height": 4204,
    "url_max": "https://live.staticflickr.com/1354/960383527_c66d6cdcc9_o.jpg?s=eyJpIjo5NjAzODM1MjcsImUiOjE3NjQ3MjIyMjMsInMiOiI2ZGNlZDc5ZjY5MDliNDFiY2ZkZGZlMzJmN2JlM2MyMTYzODUzMWJiIiwidiI6MX0",
    "max_width_2000": 1952,
    "max_height_2000": 3072,
    "url_max_2000": "https://live.staticflickr.com/1354/960383527_cb723dda67_3k.jpg?s=eyJpIjo5NjAzODM1MjcsImUiOjE3NjQ3MjIyMjMsInMiOiIxMjhkZDExZDIyNTliZTdiYjFjM2Q1MDJkMDYzOWM0YmEwMjBkNDc4IiwidiI6MX0",
    "flickr_page": "https://www.flickr.com/photos/54968894@N00/960383527",
    "count_view": "262"
  },
  {
    "id": "954076752",
    "owner": "54968894@N00",
    "title": "09/04/2006 20:40",
    "realname": "Sammi Fang",
    "ownername": "sammifang",
    "datetaken": "2006-04-09 20:40:08",
    "max_width": 4000,
    "max_height": 3000,
    "url_max": "https://live.staticflickr.com/1228/954076752_fcfa1afb6f_4k.jpg?s=eyJpIjo5NTQwNzY3NTIsImUiOjE3NjQ3MjIyMjMsInMiOiI5NGNiMDI1ZmJlMWRjYjQ0YmY5NDE4NmE0NWY3ZWFiZWI5NmVlNzM3IiwidiI6MX0",
    "max_width_2000": 1600,
    "max_height_2000": 1200,
    "url_max_2000": "https://live.staticflickr.com/1228/954076752_b2b405f3c6_h.jpg?s=eyJpIjo5NTQwNzY3NTIsImUiOjE3NjQ3MjIyMjMsInMiOiJjMDYzZGZmNjU1ODhiYmViNzI3MTkzNjJhYWQ4YzhlNTBlY2E3ZGM5IiwidiI6MX0",
    "flickr_page": "https://www.flickr.com/photos/54968894@N00/954076752",
    "count_view": "45"
  },
  {
    "id": "948497283",
    "owner": "54968894@N00",
    "title": "04/04/2006 00:58",
    "realname": "Sammi Fang",
    "ownername": "sammifang",
    "datetaken": "2006-04-04 00:58:37",
    "max_width": 4368,
    "max_height": 2912,
    "url_max": "https://live.staticflickr.com/1271/948497283_1554908671_o.jpg?s=eyJpIjo5NDg0OTcyODMsImUiOjE3NjQ3MjIyMjQsInMiOiJmMjg3MTIwNjRkNjA2NDNhMmI2YTgyNDczZTdmYTk5ZTA2ZTQ5NjQxIiwidiI6MX0",
    "max_width_2000": 1600,
    "max_height_2000": 1067,
    "url_max_2000": "https://live.staticflickr.com/1271/948497283_af190c8301_h.jpg?s=eyJpIjo5NDg0OTcyODMsImUiOjE3NjQ3MjIyMjQsInMiOiI5MjJkYTc5MjA1N2ZhYjNlNGVmY2RkYTIxYWZlM2IyNjI5ODQ3ODg5IiwidiI6MX0",
    "flickr_page": "https://www.flickr.com/photos/54968894@N00/948497283",
    "count_view": "31"
  },
  {
    "id": "949277648",
    "owner": "54968894@N00",
    "title": "04/04/2006 00:33",
    "realname": "Sammi Fang",
    "ownername": "sammifang",
    "datetaken": "2006-04-04 00:33:17",
    "max_width": 4368,
    "max_height": 2912,
    "url_max": "https://live.staticflickr.com/1090/949277648_da72dc7d7a_o.jpg?s=eyJpIjo5NDkyNzc2NDgsImUiOjE3NjQ3MjIyMjQsInMiOiI2MWRlM2VmMmQxMWI0ZDJiZjQ4NmFmODVjYzk3YTljODA5ZWE1NWRlIiwidiI6MX0",
    "max_width_2000": 1600,
    "max_height_2000": 1067,
    "url_max_2000": "https://live.staticflickr.com/1090/949277648_ed4b36eeec_h.jpg?s=eyJpIjo5NDkyNzc2NDgsImUiOjE3NjQ3MjIyMjQsInMiOiI4NDM3M2IzNzY3Y2FlOGQ2Y2RkMTNkYWFjMzhhOWYwMjc5M2M4MDZiIiwidiI6MX0",
    "flickr_page": "https://www.flickr.com/photos/54968894@N00/949277648",
    "count_view": "24"
  },
  {
    "id": "949256268",
    "owner": "54968894@N00",
    "title": "04/04/2006 00:29",
    "realname": "Sammi Fang",
    "ownername": "sammifang",
    "datetaken": "2006-04-04 00:29:30",
    "max_width": 4368,
    "max_height": 2912,
    "url_max": "https://live.staticflickr.com/1420/949256268_70fc32a8d8_o.jpg?s=eyJpIjo5NDkyNTYyNjgsImUiOjE3NjQ3MjIyMjQsInMiOiIxODBiYzE2ZWY2NDA2NjNmMGU0Yzk0M2VlOGVkOTBhYzQ4NWE1ZTg2IiwidiI6MX0",
    "max_width_2000": 1600,
    "max_height_2000": 1067,
    "url_max_2000": "https://live.staticflickr.com/1420/949256268_d2b8a253c2_h.jpg?s=eyJpIjo5NDkyNTYyNjgsImUiOjE3NjQ3MjIyMjQsInMiOiIxZDViMGYyMDY0MmE3ZmFkMjViNTA2ODk2ZmMyNjU1OGYxY2QxNzNlIiwidiI6MX0",
    "flickr_page": "https://www.flickr.com/photos/54968894@N00/949256268",
    "count_view": "22"
  },
  {
    "id": "949026718",
    "owner": "54968894@N00",
    "title": "31/03/2006 17:09",
    "realname": "Sammi Fang",
    "ownername": "sammifang",
    "datetaken": "2006-03-31 17:09:26",
    "max_width": 4000,
    "max_height": 2666,
    "url_max": "https://live.staticflickr.com/1305/949026718_828e6dca7b_4k.jpg?s=eyJpIjo5NDkwMjY3MTgsImUiOjE3NjQ3MjIyMjQsInMiOiJlZjZmN2JmYWE0YWIxODM4ZTFkZTU3MGE5ZDZlY2NjMTA3ODU4YTVkIiwidiI6MX0",
    "max_width_2000": 1600,
    "max_height_2000": 1066,
    "url_max_2000": "https://live.staticflickr.com/1305/949026718_f06f783fc6_h.jpg?s=eyJpIjo5NDkwMjY3MTgsImUiOjE3NjQ3MjIyMjQsInMiOiI0MjBiZDBlNDIzM2FmOGIyNGQ2ZmM5MmExYjM5ZmQwOGFkNTZlZDg2IiwidiI6MX0",
    "flickr_page": "https://www.flickr.com/photos/54968894@N00/949026718",
    "count_view": "21"
  },
  {
    "id": "948144767",
    "owner": "54968894@N00",
    "title": "31/03/2006 17:07",
    "realname": "Sammi Fang",
    "ownername": "sammifang",
    "datetaken": "2006-03-31 17:07:07",
    "max_width": 4000,
    "max_height": 2666,
    "url_max": "https://live.staticflickr.com/1406/948144767_0e18869756_4k.jpg?s=eyJpIjo5NDgxNDQ3NjcsImUiOjE3NjQ3MjIyMjQsInMiOiI0ODRiZWE5MmEyYzdiZGZmY2E2ZDE1M2RlODFiZTRjZGYwYjM4ODU0IiwidiI6MX0",
    "max_width_2000": 1600,
    "max_height_2000": 1066,
    "url_max_2000": "https://live.staticflickr.com/1406/948144767_7301422e2b_h.jpg?s=eyJpIjo5NDgxNDQ3NjcsImUiOjE3NjQ3MjIyMjQsInMiOiIzYmFiNmE5MjNkMTgwZTAxMTliNTk3NWM5MDIxYWFmZmQ0Y2QyMDE5IiwidiI6MX0",
    "flickr_page": "https://www.flickr.com/photos/54968894@N00/948144767",
    "count_view": "23"
  },
  {
    "id": "945360848",
    "owner": "54968894@N00",
    "title": "31/03/2006 17:02",
    "realname": "Sammi Fang",
    "ownername": "sammifang",
    "datetaken": "2006-03-31 17:02:46",
    "max_width": 2912,
    "max_height": 4368,
    "url_max": "https://live.staticflickr.com/1100/945360848_e58a0629d4_o.jpg?s=eyJpIjo5NDUzNjA4NDgsImUiOjE3NjQ3MjIyMjQsInMiOiJhNmVkNzZlOTc4MGE0MWU4ODc3Mjg0ZjlmMjM2MzY4ZDg3YmFiMjcwIiwidiI6MX0",
    "max_width_2000": 1365,
    "max_height_2000": 2048,
    "url_max_2000": "https://live.staticflickr.com/1100/945360848_52cfb65f00_k.jpg?s=eyJpIjo5NDUzNjA4NDgsImUiOjE3NjQ3MjIyMjQsInMiOiJkYmY4YTNjNzlhNmEwMDMyODM1NThlZmMwOTMyOWFlMjQwZWFmNDE1IiwidiI6MX0",
    "flickr_page": "https://www.flickr.com/photos/54968894@N00/945360848",
    "count_view": "14"
  },
  {
    "id": "943544383",
    "owner": "54968894@N00",
    "title": "29/03/2006 15:38",
    "realname": "Sammi Fang",
    "ownername": "sammifang",
    "datetaken": "2006-03-29 15:38:21",
    "max_width": 2912,
    "max_height": 4368,
    "url_max": "https://live.staticflickr.com/1121/943544383_e7936a7270_o.jpg?s=eyJpIjo5NDM1NDQzODMsImUiOjE3NjQ3MjIyMjQsInMiOiJlNDBlMzMzNjkwNzQ1ZWY2OWRjZmI4MWUxMzYxNzJlOGVmMzU4Y2ZlIiwidiI6MX0",
    "max_width_2000": 1365,
    "max_height_2000": 2048,
    "url_max_2000": "https://live.staticflickr.com/1121/943544383_780ebdfa07_k.jpg?s=eyJpIjo5NDM1NDQzODMsImUiOjE3NjQ3MjIyMjQsInMiOiIxMWIwOWU4MzY3ODVhZTQ1YzMyZTI2NzgzZTI4MDhkODk4MDk5OGQ2IiwidiI6MX0",
    "flickr_page": "https://www.flickr.com/photos/54968894@N00/943544383",
    "count_view": "13"
  },
  {
    "id": "945051850",
    "owner": "54968894@N00",
    "title": "29/03/2006 11:49",
    "realname": "Sammi Fang",
    "ownername": "sammifang",
    "datetaken": "2006-03-29 11:49:58",
    "max_width": 4368,
    "max_height": 2912,
    "url_max": "https://live.staticflickr.com/1334/945051850_5f4abbef87_o.jpg?s=eyJpIjo5NDUwNTE4NTAsImUiOjE3NjQ3MjIyMjQsInMiOiJhOGNkNDJiMjZhODM5OGM1MjA5YWM2YWRmOWJkZDI3OGM4ZTY5ZGY1IiwidiI6MX0",
    "max_width_2000": 1600,
    "max_height_2000": 1067,
    "url_max_2000": "https://live.staticflickr.com/1334/945051850_8e43d682b2_h.jpg?s=eyJpIjo5NDUwNTE4NTAsImUiOjE3NjQ3MjIyMjQsInMiOiIwZjdmOGIwZGIxODQwMjcxNmFlOGZjYjQzOWIyMjEwMTllNWU2NzljIiwidiI6MX0",
    "flickr_page": "https://www.flickr.com/photos/54968894@N00/945051850",
    "count_view": "24"
  },
  {
    "id": "897100724",
    "owner": "54968894@N00",
    "title": "IMG_2145",
    "realname": "Sammi Fang",
    "ownername": "sammifang",
    "datetaken": "2006-03-28 14:44:24",
    "max_width": 2912,
    "max_height": 4368,
    "url_max": "https://live.staticflickr.com/1249/897100724_104647a62b_o.jpg?s=eyJpIjo4OTcxMDA3MjQsImUiOjE3NjQ3MjIyMzAsInMiOiIwYjJhZTczMmUyYjM3ODVmNjM3ZjMwMGVhZDdlNTBjYzZiOTk0MzUyIiwidiI6MX0",
    "max_width_2000": 1365,
    "max_height_2000": 2048,
    "url_max_2000": "https://live.staticflickr.com/1249/897100724_9525642da9_k.jpg?s=eyJpIjo4OTcxMDA3MjQsImUiOjE3NjQ3MjIyMzAsInMiOiIyN2YxZDEwZjAwNjhlYmM3ZGRjMThjM2RkNGRiYjNlMGJhYzU5NTQzIiwidiI6MX0",
    "flickr_page": "https://www.flickr.com/photos/54968894@N00/897100724",
    "count_view": "251"
  },
  {
    "id": "897065760",
    "owner": "54968894@N00",
    "title": "IMG_2143",
    "realname": "Sammi Fang",
    "ownername": "sammifang",
    "datetaken": "2006-03-28 14:40:40",
    "max_width": 4368,
    "max_height": 2912,
    "url_max": "https://live.staticflickr.com/1405/897065760_308e7bdd54_o.jpg?s=eyJpIjo4OTcwNjU3NjAsImUiOjE3NjQ3MjIyMzAsInMiOiI2NWMzMTZmMWYxMGYwZDJkZmY0NWNhZWVkYWQ3MTdkZDllZTQ2NzM0IiwidiI6MX0",
    "max_width_2000": 1600,
    "max_height_2000": 1067,
    "url_max_2000": "https://live.staticflickr.com/1405/897065760_66be806edf_h.jpg?s=eyJpIjo4OTcwNjU3NjAsImUiOjE3NjQ3MjIyMzAsInMiOiIzMzU2ODJkNjEzYTk1ZTc4YjI5MjVlN2YyNTM0NTVlY2JlYTMwZGMxIiwidiI6MX0",
    "flickr_page": "https://www.flickr.com/photos/54968894@N00/897065760",
    "count_view": "20"
  },
  {
    "id": "896199055",
    "owner": "54968894@N00",
    "title": "IMG_2142",
    "realname": "Sammi Fang",
    "ownername": "sammifang",
    "datetaken": "2006-03-28 14:36:41",
    "max_width": 2691,
    "max_height": 3863,
    "url_max": "https://live.staticflickr.com/1005/896199055_5e97c26ee5_4k.jpg?s=eyJpIjo4OTYxOTkwNTUsImUiOjE3NjQ3MjIyMzAsInMiOiI2NDg1ZGI1YTYyNGJjMGFjNDI4MDc5NjVhNTBhZjZhOWIxYjRiNzZkIiwidiI6MX0",
    "max_width_2000": 1427,
    "max_height_2000": 2048,
    "url_max_2000": "https://live.staticflickr.com/1005/896199055_480cc84dcb_k.jpg?s=eyJpIjo4OTYxOTkwNTUsImUiOjE3NjQ3MjIyMzAsInMiOiI1MzVmOGEwNzNmMTI2NjYzNDQyMzNmNDIzZWIxMDJkMGY3MmQ1ODc1IiwidiI6MX0",
    "flickr_page": "https://www.flickr.com/photos/54968894@N00/896199055",
    "count_view": "28"
  },
  {
    "id": "943866304",
    "owner": "54968894@N00",
    "title": "28/03/2006 13:47",
    "realname": "Sammi Fang",
    "ownername": "sammifang",
    "datetaken": "2006-03-28 13:47:37",
    "max_width": 4000,
    "max_height": 2666,
    "url_max": "https://live.staticflickr.com/1137/943866304_4c13f888a1_4k.jpg?s=eyJpIjo5NDM4NjYzMDQsImUiOjE3NjQ3MjIyMjQsInMiOiJmNWIyMWRmYTk0Y2Y1MmU4YWYwNDYxYTgxZjhiODRhOTVhYmI0NTUwIiwidiI6MX0",
    "max_width_2000": 1600,
    "max_height_2000": 1066,
    "url_max_2000": "https://live.staticflickr.com/1137/943866304_2884ac305c_h.jpg?s=eyJpIjo5NDM4NjYzMDQsImUiOjE3NjQ3MjIyMjQsInMiOiI2NDQwNzc2NWU4ODQ3Y2MxNWE3NWU4OGEzNTIwMzUxOGJiYjcxOGI3IiwidiI6MX0",
    "flickr_page": "https://www.flickr.com/photos/54968894@N00/943866304",
    "count_view": "27"
  },
  {
    "id": "943817462",
    "owner": "54968894@N00",
    "title": "28/03/2006 13:43",
    "realname": "Sammi Fang",
    "ownername": "sammifang",
    "datetaken": "2006-03-28 13:43:22",
    "max_width": 2666,
    "max_height": 4000,
    "url_max": "https://live.staticflickr.com/1176/943817462_73461073d5_4k.jpg?s=eyJpIjo5NDM4MTc0NjIsImUiOjE3NjQ3MjIyMjQsInMiOiIyYzc0OWRiY2FkNTc1ZGU0MTczMTMyYTMxYjViNjE2NDBkYzgxMGRiIiwidiI6MX0",
    "max_width_2000": 1365,
    "max_height_2000": 2048,
    "url_max_2000": "https://live.staticflickr.com/1176/943817462_d42bc974c5_k.jpg?s=eyJpIjo5NDM4MTc0NjIsImUiOjE3NjQ3MjIyMjQsInMiOiI3OTM0M2M4MjRkMTQ4YjYwNjJkODRjMmI5M2U3ZWUxNDExMTM4ZGEyIiwidiI6MX0",
    "flickr_page": "https://www.flickr.com/photos/54968894@N00/943817462",
    "count_view": "20"
  },
  {
    "id": "896976178",
    "owner": "54968894@N00",
    "title": "IMG_2116",
    "realname": "Sammi Fang",
    "ownername": "sammifang",
    "datetaken": "2006-03-28 13:31:04",
    "max_width": 4368,
    "max_height": 2912,
    "url_max": "https://live.staticflickr.com/1203/896976178_34667b845f_o.jpg?s=eyJpIjo4OTY5NzYxNzgsImUiOjE3NjQ3MjIyMzIsInMiOiI3YjNlNDczZGJmNTAxZmI4MGRjMzNkYTEwMDQ1MjU3YTY0YmNmNmE0IiwidiI6MX0",
    "max_width_2000": 1600,
    "max_height_2000": 1067,
    "url_max_2000": "https://live.staticflickr.com/1203/896976178_c6944d9954_h.jpg?s=eyJpIjo4OTY5NzYxNzgsImUiOjE3NjQ3MjIyMzIsInMiOiJjODEyNWQzYjI4ZmFmMTg4NDllNGM5NjU5NGIwNzlkYmRhOWY0MWQ4IiwidiI6MX0",
    "flickr_page": "https://www.flickr.com/photos/54968894@N00/896976178",
    "count_view": "22"
  },
  {
    "id": "896105749",
    "owner": "54968894@N00",
    "title": "IMG_2115",
    "realname": "Sammi Fang",
    "ownername": "sammifang",
    "datetaken": "2006-03-28 13:30:29",
    "max_width": 4368,
    "max_height": 2912,
    "url_max": "https://live.staticflickr.com/1079/896105749_f9dddb9073_o.jpg?s=eyJpIjo4OTYxMDU3NDksImUiOjE3NjQ3MjIyMzIsInMiOiI1ZGRkZjFiNThjOTQ2YzBmZGQ0OWJhMWFlY2ViNjU3NThkMDg1NDU2IiwidiI6MX0",
    "max_width_2000": 1600,
    "max_height_2000": 1067,
    "url_max_2000": "https://live.staticflickr.com/1079/896105749_87b0bf3814_h.jpg?s=eyJpIjo4OTYxMDU3NDksImUiOjE3NjQ3MjIyMzIsInMiOiJjYjJhMWE2MDdkMjc5ZDhlYjY4ODQ0YWY4YjZlZTgyNzllZGE1ODZiIiwidiI6MX0",
    "flickr_page": "https://www.flickr.com/photos/54968894@N00/896105749",
    "count_view": "25"
  },
  {
    "id": "895931333",
    "owner": "54968894@N00",
    "title": "IMG_2069",
    "realname": "Sammi Fang",
    "ownername": "sammifang",
    "datetaken": "2006-03-28 12:40:28",
    "max_width": 2912,
    "max_height": 4368,
    "url_max": "https://live.staticflickr.com/1247/895931333_b32ae100bd_o.jpg?s=eyJpIjo4OTU5MzEzMzMsImUiOjE3NjQ3MjIyMzIsInMiOiI0MGY2ZDk2ZTI5OGE0NTdkMTEyYmMyYWE2NTM1MWNiZDdlODBlZjdjIiwidiI6MX0",
    "max_width_2000": 1365,
    "max_height_2000": 2048,
    "url_max_2000": "https://live.staticflickr.com/1247/895931333_ae3dcc15c0_k.jpg?s=eyJpIjo4OTU5MzEzMzMsImUiOjE3NjQ3MjIyMzIsInMiOiIzNDYxYzk4NGRhMDAxNGYyMWFiYTJhZjUwNDZmMDhiMWEyMDgxYWYxIiwidiI6MX0",
    "flickr_page": "https://www.flickr.com/photos/54968894@N00/895931333",
    "count_view": "24"
  },
  {
    "id": "896691764",
    "owner": "54968894@N00",
    "title": "IMG_2054",
    "realname": "Sammi Fang",
    "ownername": "sammifang",
    "datetaken": "2006-03-28 12:28:48",
    "max_width": 4368,
    "max_height": 2912,
    "url_max": "https://live.staticflickr.com/1249/896691764_001ec056b2_o.jpg?s=eyJpIjo4OTY2OTE3NjQsImUiOjE3NjQ3MjIyMzIsInMiOiIxMWJlZGUxMTU2ZWExNjJkOTNlZjljNTkzOWJjNGUzMzVhYWQwMTM0IiwidiI6MX0",
    "max_width_2000": 1600,
    "max_height_2000": 1067,
    "url_max_2000": "https://live.staticflickr.com/1249/896691764_c23625f623_h.jpg?s=eyJpIjo4OTY2OTE3NjQsImUiOjE3NjQ3MjIyMzIsInMiOiI1MDAxYzY5OTRkYTcxNzZjZGVhYTQ0MjI4YTM1MDFmZDgxNzhiMWI0IiwidiI6MX0",
    "flickr_page": "https://www.flickr.com/photos/54968894@N00/896691764",
    "count_view": "21"
  },
  {
    "id": "895829357",
    "owner": "54968894@N00",
    "title": "IMG_2040",
    "realname": "Sammi Fang",
    "ownername": "sammifang",
    "datetaken": "2006-03-28 11:48:52",
    "max_width": 4368,
    "max_height": 2912,
    "url_max": "https://live.staticflickr.com/1383/895829357_059ae1aa99_o.jpg?s=eyJpIjo4OTU4MjkzNTcsImUiOjE3NjQ3MjIyMzIsInMiOiI3N2EyOTIwZTA2NTZiMzk0Njg3NmM5OGYxMDM3ZDgxMmM1YmUyM2I5IiwidiI6MX0",
    "max_width_2000": 1600,
    "max_height_2000": 1067,
    "url_max_2000": "https://live.staticflickr.com/1383/895829357_af655e3c5e_h.jpg?s=eyJpIjo4OTU4MjkzNTcsImUiOjE3NjQ3MjIyMzIsInMiOiI3ZTI4MDI5N2M4YTlmMTNiN2Q1ZDE4ODE0NDI0YTY0Njk2YTdlMWMxIiwidiI6MX0",
    "flickr_page": "https://www.flickr.com/photos/54968894@N00/895829357",
    "count_view": "21"
  },
  {
    "id": "895766529",
    "owner": "54968894@N00",
    "title": "IMG_2024",
    "realname": "Sammi Fang",
    "ownername": "sammifang",
    "datetaken": "2006-03-28 10:22:32",
    "max_width": 4368,
    "max_height": 2912,
    "url_max": "https://live.staticflickr.com/1064/895766529_39474f2f4d_o.jpg?s=eyJpIjo4OTU3NjY1MjksImUiOjE3NjQ3MjIyMzIsInMiOiJmZmMxYzA3NWI5ZWE4NGE1MDk5OWQ2YjlhZGM1MTEwZDEyNjQzNDkzIiwidiI6MX0",
    "max_width_2000": 1600,
    "max_height_2000": 1067,
    "url_max_2000": "https://live.staticflickr.com/1064/895766529_75a7fc5bb5_h.jpg?s=eyJpIjo4OTU3NjY1MjksImUiOjE3NjQ3MjIyMzIsInMiOiJkZTcyMGIzM2E0ZmIyZTY4N2Y2ZDE5MDAwMThjZTFiODBjNmY4ZmIyIiwidiI6MX0",
    "flickr_page": "https://www.flickr.com/photos/54968894@N00/895766529",
    "count_view": "31"
  },
  {
    "id": "941300595",
    "owner": "54968894@N00",
    "title": "28/03/2006 09:50",
    "realname": "Sammi Fang",
    "ownername": "sammifang",
    "datetaken": "2006-03-28 09:50:17",
    "max_width": 4368,
    "max_height": 2912,
    "url_max": "https://live.staticflickr.com/1406/941300595_5aa6d69ea3_o.jpg?s=eyJpIjo5NDEzMDA1OTUsImUiOjE3NjQ3MjIyMjYsInMiOiIyM2UwMGUxYjIzNmJkZDFiOGRjOGUwNzE4NDk0ZTc3YjhkYmU4ODA3IiwidiI6MX0",
    "max_width_2000": 1600,
    "max_height_2000": 1067,
    "url_max_2000": "https://live.staticflickr.com/1406/941300595_21ea478db1_h.jpg?s=eyJpIjo5NDEzMDA1OTUsImUiOjE3NjQ3MjIyMjYsInMiOiIzOGVlN2NkN2ZkZjVhZDcwYjc3MTczNGI3MGE5YWE4MDA2YjhkMjE3IiwidiI6MX0",
    "flickr_page": "https://www.flickr.com/photos/54968894@N00/941300595",
    "count_view": "20"
  },
  {
    "id": "943105852",
    "owner": "54968894@N00",
    "title": "23/03/2006 15:11",
    "realname": "Sammi Fang",
    "ownername": "sammifang",
    "datetaken": "2006-03-23 15:11:50",
    "max_width": 4000,
    "max_height": 2666,
    "url_max": "https://live.staticflickr.com/1046/943105852_c45c072e00_4k.jpg?s=eyJpIjo5NDMxMDU4NTIsImUiOjE3NjQ3MjIyMjQsInMiOiI1MDlkNzVjOWU3NWY1NjlkY2JjZmVjZTVhODUwZTU3NjI0NTRkMmJlIiwidiI6MX0",
    "max_width_2000": 1600,
    "max_height_2000": 1066,
    "url_max_2000": "https://live.staticflickr.com/1046/943105852_f994f44c9c_h.jpg?s=eyJpIjo5NDMxMDU4NTIsImUiOjE3NjQ3MjIyMjQsInMiOiIyZDc5NjY3ZWExNDQ1YWM4NjVlNzQwOTQ5NTgzNDZhZTQ5MzQzNmI1IiwidiI6MX0",
    "flickr_page": "https://www.flickr.com/photos/54968894@N00/943105852",
    "count_view": "18"
  },
  {
    "id": "942254995",
    "owner": "54968894@N00",
    "title": "23/03/2006 15:10",
    "realname": "Sammi Fang",
    "ownername": "sammifang",
    "datetaken": "2006-03-23 15:10:38",
    "max_width": 4000,
    "max_height": 2666,
    "url_max": "https://live.staticflickr.com/1174/942254995_2cc49cc5f2_4k.jpg?s=eyJpIjo5NDIyNTQ5OTUsImUiOjE3NjQ3MjIyMjUsInMiOiI3NWJmY2FkNDA4ODlmZjU5ZDA2OTkwMjEyNmZhZGIzZmMwM2IxMThmIiwidiI6MX0",
    "max_width_2000": 1600,
    "max_height_2000": 1066,
    "url_max_2000": "https://live.staticflickr.com/1174/942254995_196a3296e8_h.jpg?s=eyJpIjo5NDIyNTQ5OTUsImUiOjE3NjQ3MjIyMjUsInMiOiI0ODEwNjBjZGMwMjAzMjdmMDQwMGRiMjk1YjM3Y2NjYjY5YTA3YzI0IiwidiI6MX0",
    "flickr_page": "https://www.flickr.com/photos/54968894@N00/942254995",
    "count_view": "15"
  },
  {
    "id": "943180678",
    "owner": "54968894@N00",
    "title": "21/03/2006 18:44",
    "realname": "Sammi Fang",
    "ownername": "sammifang",
    "datetaken": "2006-03-21 18:44:12",
    "max_width": 4000,
    "max_height": 2666,
    "url_max": "https://live.staticflickr.com/1009/943180678_9f94d423f2_4k.jpg?s=eyJpIjo5NDMxODA2NzgsImUiOjE3NjQ3MjIyMjQsInMiOiI2MzZjZWMzYzVhYjllZGE2MjM3YzliMWRiMjRlZjU4MTdmYmJhZDJlIiwidiI6MX0",
    "max_width_2000": 1600,
    "max_height_2000": 1066,
    "url_max_2000": "https://live.staticflickr.com/1009/943180678_c3a02e06a9_h.jpg?s=eyJpIjo5NDMxODA2NzgsImUiOjE3NjQ3MjIyMjQsInMiOiI0Yzc0M2I5NTY3MTU4MTA4ZWRjOWQzYTZlMzgyOTg4ZWI4NzgxODRhIiwidiI6MX0",
    "flickr_page": "https://www.flickr.com/photos/54968894@N00/943180678",
    "count_view": "24"
  },
  {
    "id": "895736812",
    "owner": "54968894@N00",
    "title": "IMG_1955",
    "realname": "Sammi Fang",
    "ownername": "sammifang",
    "datetaken": "2006-03-21 18:44:12",
    "max_width": 4368,
    "max_height": 2912,
    "url_max": "https://live.staticflickr.com/1193/895736812_c6efe24e0b_o.jpg?s=eyJpIjo4OTU3MzY4MTIsImUiOjE3NjQ3MjIyMzIsInMiOiJhY2MzMWJiODI1YzhkZmFlMmExZGVkOThkZGMwYWVlYjkxMzQ3NGY3IiwidiI6MX0",
    "max_width_2000": 1600,
    "max_height_2000": 1067,
    "url_max_2000": "https://live.staticflickr.com/1193/895736812_e2e52ee05c_h.jpg?s=eyJpIjo4OTU3MzY4MTIsImUiOjE3NjQ3MjIyMzIsInMiOiIzYzU3ZjdmZmYwMWM1NWM2MzFlNzUzZWUxNzAyMWZhNThkNDIyNzkyIiwidiI6MX0",
    "flickr_page": "https://www.flickr.com/photos/54968894@N00/895736812",
    "count_view": "32"
  },
  {
    "id": "943175336",
    "owner": "54968894@N00",
    "title": "21/03/2006 18:40",
    "realname": "Sammi Fang",
    "ownername": "sammifang",
    "datetaken": "2006-03-21 18:40:15",
    "max_width": 4000,
    "max_height": 2621,
    "url_max": "https://live.staticflickr.com/1172/943175336_4d42f27ab7_4k.jpg?s=eyJpIjo5NDMxNzUzMzYsImUiOjE3NjQ3MjIyMjQsInMiOiI5OWExYjQwNzNhYjUwMjNmMmQ2M2NhOTQwNjY0NWI1MTY2YmEzZDQwIiwidiI6MX0",
    "max_width_2000": 1600,
    "max_height_2000": 1048,
    "url_max_2000": "https://live.staticflickr.com/1172/943175336_f47a820f87_h.jpg?s=eyJpIjo5NDMxNzUzMzYsImUiOjE3NjQ3MjIyMjQsInMiOiJiZDc1YzQ1MjE4NDdjZGZiNjI2ODJlMGZkNWI3ZmIzODNjOTI5OTk1IiwidiI6MX0",
    "flickr_page": "https://www.flickr.com/photos/54968894@N00/943175336",
    "count_view": "40"
  },
  {
    "id": "895727980",
    "owner": "54968894@N00",
    "title": "IMG_1953",
    "realname": "Sammi Fang",
    "ownername": "sammifang",
    "datetaken": "2006-03-21 18:40:15",
    "max_width": 4308,
    "max_height": 2823,
    "url_max": "https://live.staticflickr.com/1082/895727980_2876eb6acc_o.jpg?s=eyJpIjo4OTU3Mjc5ODAsImUiOjE3NjQ3MjIyMzIsInMiOiIzNzZlZDllY2I4ZDVlZWUxM2EyOGQwMjMzOTBmYjljZmE4Mjc5MjE1IiwidiI6MX0",
    "max_width_2000": 1600,
    "max_height_2000": 1048,
    "url_max_2000": "https://live.staticflickr.com/1082/895727980_492ed99450_h.jpg?s=eyJpIjo4OTU3Mjc5ODAsImUiOjE3NjQ3MjIyMzIsInMiOiIwZTQ3YmM4Yzk2ZWU5N2QwMDg4NDExODg5OTNkYzhlODg1OWM1MmYwIiwidiI6MX0",
    "flickr_page": "https://www.flickr.com/photos/54968894@N00/895727980",
    "count_view": "51"
  },
  {
    "id": "535878535",
    "owner": "54968894@N00",
    "title": "21/03/2006 18:40",
    "realname": "Sammi Fang",
    "ownername": "sammifang",
    "datetaken": "2006-03-21 18:40:15",
    "max_width": 4308,
    "max_height": 2823,
    "url_max": "https://live.staticflickr.com/218/535878535_12eb9d4011_o.jpg?s=eyJpIjo1MzU4Nzg1MzUsImUiOjE3NjQ3MjIyODQsInMiOiJmMTUyMGY1MDAzZmZhODk3MDRkMTU1ZWE4ZjBjMWJjZDdkZTM4YTg2IiwidiI6MX0",
    "max_width_2000": 1600,
    "max_height_2000": 1048,
    "url_max_2000": "https://live.staticflickr.com/218/535878535_721d7da968_h.jpg?s=eyJpIjo1MzU4Nzg1MzUsImUiOjE3NjQ3MjIyODQsInMiOiJiNjgxZTQxYWNhYzc3NmIwNDMyZmIyZjM5NGQ2NTRhZjhkNzc1NTRhIiwidiI6MX0",
    "flickr_page": "https://www.flickr.com/photos/54968894@N00/535878535",
    "count_view": "41"
  },
  {
    "id": "942323137",
    "owner": "54968894@N00",
    "title": "21/03/2006 18:38",
    "realname": "Sammi Fang",
    "ownername": "sammifang",
    "datetaken": "2006-03-21 18:38:55",
    "max_width": 4000,
    "max_height": 2666,
    "url_max": "https://live.staticflickr.com/1412/942323137_0c0e528514_4k.jpg?s=eyJpIjo5NDIzMjMxMzcsImUiOjE3NjQ3MjIyMjQsInMiOiI0OGVjNzRmNDE0YjZjZDgwNDJkNDBkMTZhMDE3NzFmYWQ5YjI0YmRiIiwidiI6MX0",
    "max_width_2000": 1600,
    "max_height_2000": 1066,
    "url_max_2000": "https://live.staticflickr.com/1412/942323137_9d258a8f4b_h.jpg?s=eyJpIjo5NDIzMjMxMzcsImUiOjE3NjQ3MjIyMjQsInMiOiJiYjM3MzcwYWI3Mzc0NTI4MDAxNjczYzhkMTJiYzc2ODY2N2RhM2YwIiwidiI6MX0",
    "flickr_page": "https://www.flickr.com/photos/54968894@N00/942323137",
    "count_view": "23"
  },
  {
    "id": "894871901",
    "owner": "54968894@N00",
    "title": "IMG_1951",
    "realname": "Sammi Fang",
    "ownername": "sammifang",
    "datetaken": "2006-03-21 18:38:55",
    "max_width": 4368,
    "max_height": 2912,
    "url_max": "https://live.staticflickr.com/1001/894871901_6441f03d9d_o.jpg?s=eyJpIjo4OTQ4NzE5MDEsImUiOjE3NjQ3MjIyMzIsInMiOiI4ODQ3MTY2MjQxMzVhYWU3YzYxMjY1NWFiZTc3OWUwMjkxMTYzNjVmIiwidiI6MX0",
    "max_width_2000": 1600,
    "max_height_2000": 1067,
    "url_max_2000": "https://live.staticflickr.com/1001/894871901_4d459ad292_h.jpg?s=eyJpIjo4OTQ4NzE5MDEsImUiOjE3NjQ3MjIyMzIsInMiOiJlNjU1YjAwZTA4MTg3MDhmMGE5MzcyMmY3MjllMDkyMTM3YjUxYzVmIiwidiI6MX0",
    "flickr_page": "https://www.flickr.com/photos/54968894@N00/894871901",
    "count_view": "24"
  },
  {
    "id": "937835137",
    "owner": "54968894@N00",
    "title": "19/03/2006 17:34",
    "realname": "Sammi Fang",
    "ownername": "sammifang",
    "datetaken": "2006-03-19 17:34:43",
    "max_width": 4000,
    "max_height": 2666,
    "url_max": "https://live.staticflickr.com/1090/937835137_7471ff566c_4k.jpg?s=eyJpIjo5Mzc4MzUxMzcsImUiOjE3NjQ3MjIyMjYsInMiOiJmOWM2YmVlMmFkMjAzYzNkOTQ0Mzg2N2Y4MGRjYWY5NTBhN2NkMGM3IiwidiI6MX0",
    "max_width_2000": 1600,
    "max_height_2000": 1066,
    "url_max_2000": "https://live.staticflickr.com/1090/937835137_88624fdf1d_h.jpg?s=eyJpIjo5Mzc4MzUxMzcsImUiOjE3NjQ3MjIyMjYsInMiOiJkNzIyZWEzZjdmN2I3OGUyZTY3Zjc5ZDM1ODAyMGExMGQwYTk4ZjIyIiwidiI6MX0",
    "flickr_page": "https://www.flickr.com/photos/54968894@N00/937835137",
    "count_view": "17"
  },
  {
    "id": "938638342",
    "owner": "54968894@N00",
    "title": "19/03/2006 17:32",
    "realname": "Sammi Fang",
    "ownername": "sammifang",
    "datetaken": "2006-03-19 17:32:44",
    "max_width": 4000,
    "max_height": 2666,
    "url_max": "https://live.staticflickr.com/1072/938638342_29c47eb770_4k.jpg?s=eyJpIjo5Mzg2MzgzNDIsImUiOjE3NjQ3MjIyMjYsInMiOiI3OGNlNmU4YjYyMDEwYWIzMjVmNWE2MGE5MmY4NzNjMjYyMjk5YzgwIiwidiI6MX0",
    "max_width_2000": 1600,
    "max_height_2000": 1066,
    "url_max_2000": "https://live.staticflickr.com/1072/938638342_043a75d8b4_h.jpg?s=eyJpIjo5Mzg2MzgzNDIsImUiOjE3NjQ3MjIyMjYsInMiOiJhMjkxNjI3ODI1Yzk1MDA0YzhlMDJmMmIwNTIxODAzYWQ1YjEzMWY2IiwidiI6MX0",
    "flickr_page": "https://www.flickr.com/photos/54968894@N00/938638342",
    "count_view": "10"
  },
  {
    "id": "938659684",
    "owner": "54968894@N00",
    "title": "19/03/2006 17:32",
    "realname": "Sammi Fang",
    "ownername": "sammifang",
    "datetaken": "2006-03-19 17:32:39",
    "max_width": 4000,
    "max_height": 2666,
    "url_max": "https://live.staticflickr.com/1355/938659684_948ab4cd36_4k.jpg?s=eyJpIjo5Mzg2NTk2ODQsImUiOjE3NjQ3MjIyMjYsInMiOiIxYTYwOWI0YjExN2YwYjJiYzcxMGM0NGRmZjkyNzIzNTBmZDNjNjQ3IiwidiI6MX0",
    "max_width_2000": 1600,
    "max_height_2000": 1066,
    "url_max_2000": "https://live.staticflickr.com/1355/938659684_72cc021b97_h.jpg?s=eyJpIjo5Mzg2NTk2ODQsImUiOjE3NjQ3MjIyMjYsInMiOiJjNDFhN2E2YzA5YjFhY2EzNGRhNjg5ZWVlYTljNzcxZTI4OTgzYThiIiwidiI6MX0",
    "flickr_page": "https://www.flickr.com/photos/54968894@N00/938659684",
    "count_view": "15"
  },
  {
    "id": "938620834",
    "owner": "54968894@N00",
    "title": "19/03/2006 17:28",
    "realname": "Sammi Fang",
    "ownername": "sammifang",
    "datetaken": "2006-03-19 17:28:48",
    "max_width": 4000,
    "max_height": 2666,
    "url_max": "https://live.staticflickr.com/1374/938620834_a27c6fa54c_4k.jpg?s=eyJpIjo5Mzg2MjA4MzQsImUiOjE3NjQ3MjIyMjYsInMiOiJkOTZjNjE4ZmMzZjkyZTMzNTUyYjlmYmM0NWM4ZDY4MTg2NTI4Njk5IiwidiI6MX0",
    "max_width_2000": 1600,
    "max_height_2000": 1066,
    "url_max_2000": "https://live.staticflickr.com/1374/938620834_4d19201db1_h.jpg?s=eyJpIjo5Mzg2MjA4MzQsImUiOjE3NjQ3MjIyMjYsInMiOiJmZTcyZjFjNTBkNDY2OWQyYWYxMWQxZmRiNzg4ZDkxZDU1Y2JmNzk0IiwidiI6MX0",
    "flickr_page": "https://www.flickr.com/photos/54968894@N00/938620834",
    "count_view": "11"
  },
  {
    "id": "937761701",
    "owner": "54968894@N00",
    "title": "19/03/2006 17:28",
    "realname": "Sammi Fang",
    "ownername": "sammifang",
    "datetaken": "2006-03-19 17:28:42",
    "max_width": 2666,
    "max_height": 4000,
    "url_max": "https://live.staticflickr.com/1229/937761701_777c356cf6_4k.jpg?s=eyJpIjo5Mzc3NjE3MDEsImUiOjE3NjQ3MjIyMjYsInMiOiIxMmY4YzE2YjkxMzc3YTVkYTJjYzYyN2Y1NjU4MjA5YzBhZTYzMjhhIiwidiI6MX0",
    "max_width_2000": 1365,
    "max_height_2000": 2048,
    "url_max_2000": "https://live.staticflickr.com/1229/937761701_6ea20c37b2_k.jpg?s=eyJpIjo5Mzc3NjE3MDEsImUiOjE3NjQ3MjIyMjYsInMiOiI2MjM0OGEzM2MzNTk4MGQwYzJlMmQ0OTZjYmFjMzlhZWNhMzBhYjcyIiwidiI6MX0",
    "flickr_page": "https://www.flickr.com/photos/54968894@N00/937761701",
    "count_view": "10"
  },
  {
    "id": "938586244",
    "owner": "54968894@N00",
    "title": "19/03/2006 17:28",
    "realname": "Sammi Fang",
    "ownername": "sammifang",
    "datetaken": "2006-03-19 17:28:22",
    "max_width": 4000,
    "max_height": 2666,
    "url_max": "https://live.staticflickr.com/1006/938586244_8927170089_4k.jpg?s=eyJpIjo5Mzg1ODYyNDQsImUiOjE3NjQ3MjIyMjYsInMiOiI2ZGI2MWQwYTI1YjcxZmMzYjhmMzJkMWU3MTliMWY3MjEyMjZhNGIzIiwidiI6MX0",
    "max_width_2000": 1600,
    "max_height_2000": 1066,
    "url_max_2000": "https://live.staticflickr.com/1006/938586244_444535f73e_h.jpg?s=eyJpIjo5Mzg1ODYyNDQsImUiOjE3NjQ3MjIyMjYsInMiOiIyMWY3NjMxYTczYWI5ZDJiMzE2YWYwOGJjYmU0NDY5YjFkZjUxYWNmIiwidiI6MX0",
    "flickr_page": "https://www.flickr.com/photos/54968894@N00/938586244",
    "count_view": "15"
  },
  {
    "id": "937722611",
    "owner": "54968894@N00",
    "title": "19/03/2006 17:27",
    "realname": "Sammi Fang",
    "ownername": "sammifang",
    "datetaken": "2006-03-19 17:27:49",
    "max_width": 4000,
    "max_height": 2666,
    "url_max": "https://live.staticflickr.com/1056/937722611_e8f601e330_4k.jpg?s=eyJpIjo5Mzc3MjI2MTEsImUiOjE3NjQ3MjIyMjYsInMiOiJmMmE5ODhkYmFlMmMwYzQ0MjUyMGNhMzVkYmZlOTk0YWY2NjQxOTczIiwidiI6MX0",
    "max_width_2000": 1600,
    "max_height_2000": 1066,
    "url_max_2000": "https://live.staticflickr.com/1056/937722611_71c9bff9ed_h.jpg?s=eyJpIjo5Mzc3MjI2MTEsImUiOjE3NjQ3MjIyMjYsInMiOiJhZmZhYzlkYzQyYTk4Mzk1ZjA1YTNiYzdiOTU3NTllYzFiZDZhMTY4IiwidiI6MX0",
    "flickr_page": "https://www.flickr.com/photos/54968894@N00/937722611",
    "count_view": "12"
  },
  {
    "id": "937663907",
    "owner": "54968894@N00",
    "title": "19/03/2006 17:27",
    "realname": "Sammi Fang",
    "ownername": "sammifang",
    "datetaken": "2006-03-19 17:27:38",
    "max_width": 4000,
    "max_height": 2666,
    "url_max": "https://live.staticflickr.com/1271/937663907_bc25b9fcad_4k.jpg?s=eyJpIjo5Mzc2NjM5MDcsImUiOjE3NjQ3MjIyMjYsInMiOiJhYTZkMzUxZDdiOTFjYWIwNDc4ZDQ5NzlkZTFkN2I1MjU3MDgxMWUyIiwidiI6MX0",
    "max_width_2000": 1600,
    "max_height_2000": 1066,
    "url_max_2000": "https://live.staticflickr.com/1271/937663907_d453e8348a_h.jpg?s=eyJpIjo5Mzc2NjM5MDcsImUiOjE3NjQ3MjIyMjYsInMiOiIzMDFiODgyODdlODc3MDE5NjQxY2FmN2IwYmM5ODZkNGVlYzk4ODc3IiwidiI6MX0",
    "flickr_page": "https://www.flickr.com/photos/54968894@N00/937663907",
    "count_view": "11"
  },
  {
    "id": "937682819",
    "owner": "54968894@N00",
    "title": "19/03/2006 17:27",
    "realname": "Sammi Fang",
    "ownername": "sammifang",
    "datetaken": "2006-03-19 17:27:07",
    "max_width": 4000,
    "max_height": 2666,
    "url_max": "https://live.staticflickr.com/1407/937682819_4191cc4f1f_4k.jpg?s=eyJpIjo5Mzc2ODI4MTksImUiOjE3NjQ3MjIyMjYsInMiOiI3ZDRkZDIzZjA5ODZkZDZiNjFiZDgwMGZlYTI0MTNkNjRjMzYyOWYyIiwidiI6MX0",
    "max_width_2000": 1600,
    "max_height_2000": 1066,
    "url_max_2000": "https://live.staticflickr.com/1407/937682819_4bbed17262_h.jpg?s=eyJpIjo5Mzc2ODI4MTksImUiOjE3NjQ3MjIyMjYsInMiOiI3MTRlYTdjNjJkMGQ3ODk4NmEzN2VmY2IxM2VlMTkyNGQ0M2RiMDMwIiwidiI6MX0",
    "flickr_page": "https://www.flickr.com/photos/54968894@N00/937682819",
    "count_view": "10"
  },
  {
    "id": "938543540",
    "owner": "54968894@N00",
    "title": "19/03/2006 17:26",
    "realname": "Sammi Fang",
    "ownername": "sammifang",
    "datetaken": "2006-03-19 17:26:32",
    "max_width": 4000,
    "max_height": 2360,
    "url_max": "https://live.staticflickr.com/1393/938543540_3e6ffc6ec8_4k.jpg?s=eyJpIjo5Mzg1NDM1NDAsImUiOjE3NjQ3MjIyMjYsInMiOiI3NDllNWNhZTk2Y2UxOWRlZTYzYmZhNGY4MWE5MDE0MTA1ZGIzNDAxIiwidiI6MX0",
    "max_width_2000": 1600,
    "max_height_2000": 944,
    "url_max_2000": "https://live.staticflickr.com/1393/938543540_be4e43b986_h.jpg?s=eyJpIjo5Mzg1NDM1NDAsImUiOjE3NjQ3MjIyMjYsInMiOiJhNTY1YmZlN2I2NTEzZWI1OTc1MjY4NzRjMjJlY2EzNzM0ZDk3MDdhIiwidiI6MX0",
    "flickr_page": "https://www.flickr.com/photos/54968894@N00/938543540",
    "count_view": "14"
  },
  {
    "id": "927052501",
    "owner": "54968894@N00",
    "title": "18/03/2006 15:37",
    "realname": "Sammi Fang",
    "ownername": "sammifang",
    "datetaken": "2006-03-18 15:37:57",
    "max_width": 2666,
    "max_height": 4000,
    "url_max": "https://live.staticflickr.com/1263/927052501_7a7dc6f348_4k.jpg?s=eyJpIjo5MjcwNTI1MDEsImUiOjE3NjQ3MjIyMjgsInMiOiJkZTdkMTQ5NjlmOGQwMTQzNTBmMWM4ZTgyYzRiZDM0MDIwMjk5OWQ3IiwidiI6MX0",
    "max_width_2000": 1365,
    "max_height_2000": 2048,
    "url_max_2000": "https://live.staticflickr.com/1263/927052501_13e45d4872_k.jpg?s=eyJpIjo5MjcwNTI1MDEsImUiOjE3NjQ3MjIyMjgsInMiOiJhZWFhZDk0NDM1ZWQ0NmVjNzllMzg1MWI3YTU0YWUxZDg2MzYyMmE1IiwidiI6MX0",
    "flickr_page": "https://www.flickr.com/photos/54968894@N00/927052501",
    "count_view": "20"
  },
  {
    "id": "926886693",
    "owner": "54968894@N00",
    "title": "18/03/2006 14:32",
    "realname": "Sammi Fang",
    "ownername": "sammifang",
    "datetaken": "2006-03-18 14:32:39",
    "max_width": 4000,
    "max_height": 2666,
    "url_max": "https://live.staticflickr.com/1100/926886693_2ec3cda8a8_4k.jpg?s=eyJpIjo5MjY4ODY2OTMsImUiOjE3NjQ3MjIyMjgsInMiOiJhZDE4NTVjYzlmMzRmZTAwYTIyYzgwYmFmODVkMDRjN2FlYmMyOGVmIiwidiI6MX0",
    "max_width_2000": 1600,
    "max_height_2000": 1066,
    "url_max_2000": "https://live.staticflickr.com/1100/926886693_f5d8da6a44_h.jpg?s=eyJpIjo5MjY4ODY2OTMsImUiOjE3NjQ3MjIyMjgsInMiOiJjZGM5YmY2MjJkNWY2MzBlMmZjZjBlZTRiYjExNTk4ODExNjZhMjE0IiwidiI6MX0",
    "flickr_page": "https://www.flickr.com/photos/54968894@N00/926886693",
    "count_view": "16"
  },
  {
    "id": "927542040",
    "owner": "54968894@N00",
    "title": "18/03/2006 14:15",
    "realname": "Sammi Fang",
    "ownername": "sammifang",
    "datetaken": "2006-03-18 14:15:54",
    "max_width": 4000,
    "max_height": 2666,
    "url_max": "https://live.staticflickr.com/1135/927542040_bb468a7ad2_4k.jpg?s=eyJpIjo5Mjc1NDIwNDAsImUiOjE3NjQ3MjIyMjgsInMiOiJmZDdiM2VhZGRlMzQ0NzRkYmUyZDE3MjFhZGYzNzg5Njk5NTdiYTBkIiwidiI6MX0",
    "max_width_2000": 1600,
    "max_height_2000": 1066,
    "url_max_2000": "https://live.staticflickr.com/1135/927542040_e7902e88e9_h.jpg?s=eyJpIjo5Mjc1NDIwNDAsImUiOjE3NjQ3MjIyMjgsInMiOiI3YzQ1YTc2MDBkOTY0NGU3OGMzZDlhODg4ZDA2N2RjYmYyYmNmMGNkIiwidiI6MX0",
    "flickr_page": "https://www.flickr.com/photos/54968894@N00/927542040",
    "count_view": "17"
  },
  {
    "id": "929139509",
    "owner": "54968894@N00",
    "title": "18/03/2006 14:06",
    "realname": "Sammi Fang",
    "ownername": "sammifang",
    "datetaken": "2006-03-18 14:06:46",
    "max_width": 4000,
    "max_height": 2666,
    "url_max": "https://live.staticflickr.com/1253/929139509_21dec46f83_4k.jpg?s=eyJpIjo5MjkxMzk1MDksImUiOjE3NjQ3MjIyMjYsInMiOiI1MDdjMWFiZjdmYmJjYjcyMWIyNzhlYjIyZjg5ODA3OWY0YjM2NmVlIiwidiI6MX0",
    "max_width_2000": 1600,
    "max_height_2000": 1066,
    "url_max_2000": "https://live.staticflickr.com/1253/929139509_b7260387aa_h.jpg?s=eyJpIjo5MjkxMzk1MDksImUiOjE3NjQ3MjIyMjYsInMiOiJkYzI4Y2Y5Y2IxZGRiNmQwODdkZTUzYjcxZmIxZDdiZDljMTYwOGU2IiwidiI6MX0",
    "flickr_page": "https://www.flickr.com/photos/54968894@N00/929139509",
    "count_view": "16"
  },
  {
    "id": "929971026",
    "owner": "54968894@N00",
    "title": "18/03/2006 14:05",
    "realname": "Sammi Fang",
    "ownername": "sammifang",
    "datetaken": "2006-03-18 14:05:17",
    "max_width": 4000,
    "max_height": 2666,
    "url_max": "https://live.staticflickr.com/1382/929971026_4a7ca57797_4k.jpg?s=eyJpIjo5Mjk5NzEwMjYsImUiOjE3NjQ3MjIyMjYsInMiOiIxYzBhNmM3ZGMxYmE3ZWEyMDM4MTBjNjE4NjNkMDcxNDM0OTE3ZDRkIiwidiI6MX0",
    "max_width_2000": 1600,
    "max_height_2000": 1066,
    "url_max_2000": "https://live.staticflickr.com/1382/929971026_a918efd367_h.jpg?s=eyJpIjo5Mjk5NzEwMjYsImUiOjE3NjQ3MjIyMjYsInMiOiJlZTQ3MWE2YThhMTk3Y2M0ZDY3YzAyYzkwMWVjYmQ1YzU4OWQ2M2YwIiwidiI6MX0",
    "flickr_page": "https://www.flickr.com/photos/54968894@N00/929971026",
    "count_view": "19"
  },
  {
    "id": "929089861",
    "owner": "54968894@N00",
    "title": "18/03/2006 14:04",
    "realname": "Sammi Fang",
    "ownername": "sammifang",
    "datetaken": "2006-03-18 14:04:19",
    "max_width": 4000,
    "max_height": 2666,
    "url_max": "https://live.staticflickr.com/1159/929089861_960ef766de_4k.jpg?s=eyJpIjo5MjkwODk4NjEsImUiOjE3NjQ3MjIyMjYsInMiOiI2NzU2ZmY4YzM5OThhMjcwYzIxODAyMDM2NmUzYTE3ZDIxODY1NDY4IiwidiI6MX0",
    "max_width_2000": 1600,
    "max_height_2000": 1066,
    "url_max_2000": "https://live.staticflickr.com/1159/929089861_db091b5a5f_h.jpg?s=eyJpIjo5MjkwODk4NjEsImUiOjE3NjQ3MjIyMjYsInMiOiI2Y2FjYzRkM2NmNDJhOTg3NjE1N2YyNzE2NTlmNGI5MTA5ZWQ0NDM5IiwidiI6MX0",
    "flickr_page": "https://www.flickr.com/photos/54968894@N00/929089861",
    "count_view": "23"
  },
  {
    "id": "929078257",
    "owner": "54968894@N00",
    "title": "18/03/2006 14:02",
    "realname": "Sammi Fang",
    "ownername": "sammifang",
    "datetaken": "2006-03-18 14:02:44",
    "max_width": 4000,
    "max_height": 2666,
    "url_max": "https://live.staticflickr.com/1093/929078257_43cba12924_4k.jpg?s=eyJpIjo5MjkwNzgyNTcsImUiOjE3NjQ3MjIyMjYsInMiOiIyZGJlYzM1NjY4MzNhMzE5NWI5MGY3MWU0YjMyNTA2NjJhOTYyNWY4IiwidiI6MX0",
    "max_width_2000": 1600,
    "max_height_2000": 1066,
    "url_max_2000": "https://live.staticflickr.com/1093/929078257_fdf03d7838_h.jpg?s=eyJpIjo5MjkwNzgyNTcsImUiOjE3NjQ3MjIyMjYsInMiOiI0ODA5OWIwZGViMWQwMzVhNmQ3ZjkyZjM0OGJkYjJiMmE1NWM5MmZmIiwidiI6MX0",
    "flickr_page": "https://www.flickr.com/photos/54968894@N00/929078257",
    "count_view": "14"
  },
  {
    "id": "929900088",
    "owner": "54968894@N00",
    "title": "18/03/2006 14:01",
    "realname": "Sammi Fang",
    "ownername": "sammifang",
    "datetaken": "2006-03-18 14:01:40",
    "max_width": 4000,
    "max_height": 2666,
    "url_max": "https://live.staticflickr.com/1362/929900088_efdee71e1f_4k.jpg?s=eyJpIjo5Mjk5MDAwODgsImUiOjE3NjQ3MjIyMjYsInMiOiJlZjlmOTgzMWVlY2M2ZTQ1MmJkNTQxMjRkYmM0ODlmYWI4ODc2ZTYxIiwidiI6MX0",
    "max_width_2000": 1600,
    "max_height_2000": 1066,
    "url_max_2000": "https://live.staticflickr.com/1362/929900088_d8c87ef420_h.jpg?s=eyJpIjo5Mjk5MDAwODgsImUiOjE3NjQ3MjIyMjYsInMiOiJmZjNlM2E1OTFiZWI0NWU1NjVmMmQ3NzBhOGJmN2Q5ZWQ0OGQzMTU1IiwidiI6MX0",
    "flickr_page": "https://www.flickr.com/photos/54968894@N00/929900088",
    "count_view": "15"
  },
  {
    "id": "929042797",
    "owner": "54968894@N00",
    "title": "18/03/2006 13:55",
    "realname": "Sammi Fang",
    "ownername": "sammifang",
    "datetaken": "2006-03-18 13:55:57",
    "max_width": 4000,
    "max_height": 2666,
    "url_max": "https://live.staticflickr.com/1150/929042797_fc002de720_4k.jpg?s=eyJpIjo5MjkwNDI3OTcsImUiOjE3NjQ3MjIyMjYsInMiOiI2NjJhMTllZWZhNmNlNDk0NDE2NGE5MGVkMTI0MmQxYmU3ZmMxMTkzIiwidiI6MX0",
    "max_width_2000": 1600,
    "max_height_2000": 1066,
    "url_max_2000": "https://live.staticflickr.com/1150/929042797_579324a98d_h.jpg?s=eyJpIjo5MjkwNDI3OTcsImUiOjE3NjQ3MjIyMjYsInMiOiJhZmFkMmUyYTdkZDEyMDI4OGNiNDI3M2NlM2NmMmVlY2Y2YTczNGU4IiwidiI6MX0",
    "flickr_page": "https://www.flickr.com/photos/54968894@N00/929042797",
    "count_view": "17"
  },
  {
    "id": "929030565",
    "owner": "54968894@N00",
    "title": "18/03/2006 13:03",
    "realname": "Sammi Fang",
    "ownername": "sammifang",
    "datetaken": "2006-03-18 13:03:20",
    "max_width": 2666,
    "max_height": 4000,
    "url_max": "https://live.staticflickr.com/1251/929030565_60729a66e3_4k.jpg?s=eyJpIjo5MjkwMzA1NjUsImUiOjE3NjQ3MjIyMjYsInMiOiI2ZmI1ZDAyODE1MTkzYjg5MWQ4YTIyMjZiMWIyMDE2NWVlZmEyYmMwIiwidiI6MX0",
    "max_width_2000": 1365,
    "max_height_2000": 2048,
    "url_max_2000": "https://live.staticflickr.com/1251/929030565_4265a01389_k.jpg?s=eyJpIjo5MjkwMzA1NjUsImUiOjE3NjQ3MjIyMjYsInMiOiIzMWVlNmJiMDY5Yjk0MWVlZjEyYjc1Y2EzOTEwMDliNjRjNWExZGY3IiwidiI6MX0",
    "flickr_page": "https://www.flickr.com/photos/54968894@N00/929030565",
    "count_view": "18"
  },
  {
    "id": "933311076",
    "owner": "54968894@N00",
    "title": "18/03/2006 11:36",
    "realname": "Sammi Fang",
    "ownername": "sammifang",
    "datetaken": "2006-03-18 11:36:56",
    "max_width": 2666,
    "max_height": 4000,
    "url_max": "https://live.staticflickr.com/1303/933311076_671a684162_4k.jpg?s=eyJpIjo5MzMzMTEwNzYsImUiOjE3NjQ3MjIyMjYsInMiOiJlODMzYzcxY2FiYTdjMDFjZTY2ZWU4MzM1NmY1OWQ1NDQyOTViMjVjIiwidiI6MX0",
    "max_width_2000": 1365,
    "max_height_2000": 2048,
    "url_max_2000": "https://live.staticflickr.com/1303/933311076_0669eb58f5_k.jpg?s=eyJpIjo5MzMzMTEwNzYsImUiOjE3NjQ3MjIyMjYsInMiOiJmMmFlNmE1YTQ3NTAyM2YxMTI0NGNmYzhkNGVkNjZhNDI0YWEyOTAwIiwidiI6MX0",
    "flickr_page": "https://www.flickr.com/photos/54968894@N00/933311076",
    "count_view": "254"
  },
  {
    "id": "929020781",
    "owner": "54968894@N00",
    "title": "18/03/2006 11:08",
    "realname": "Sammi Fang",
    "ownername": "sammifang",
    "datetaken": "2006-03-18 11:08:41",
    "max_width": 4000,
    "max_height": 2666,
    "url_max": "https://live.staticflickr.com/1327/929020781_46dd6b4819_4k.jpg?s=eyJpIjo5MjkwMjA3ODEsImUiOjE3NjQ3MjIyMjYsInMiOiI4MDFkYWE2OTU5NzZkZDY0NjhiNTAyOWNkYzc5ZmM0M2FhMzM3NjRlIiwidiI6MX0",
    "max_width_2000": 1600,
    "max_height_2000": 1066,
    "url_max_2000": "https://live.staticflickr.com/1327/929020781_a1b3283530_h.jpg?s=eyJpIjo5MjkwMjA3ODEsImUiOjE3NjQ3MjIyMjYsInMiOiI4YmE2ZTA3MzdkN2ViNTZmNTY2YTlkODQ4NDE1Mjg4YjIwZTIxYzMyIiwidiI6MX0",
    "flickr_page": "https://www.flickr.com/photos/54968894@N00/929020781",
    "count_view": "15"
  },
  {
    "id": "929856644",
    "owner": "54968894@N00",
    "title": "18/03/2006 10:30",
    "realname": "Sammi Fang",
    "ownername": "sammifang",
    "datetaken": "2006-03-18 10:30:50",
    "max_width": 4000,
    "max_height": 2666,
    "url_max": "https://live.staticflickr.com/1196/929856644_fffc853bf0_4k.jpg?s=eyJpIjo5Mjk4NTY2NDQsImUiOjE3NjQ3MjIyMjYsInMiOiJlZjdkY2QxNzY4MzUwZTg0NzkwNzdmYWY5ZTdmYjJjN2E4YTRkZDA5IiwidiI6MX0",
    "max_width_2000": 1600,
    "max_height_2000": 1066,
    "url_max_2000": "https://live.staticflickr.com/1196/929856644_6b187b9829_h.jpg?s=eyJpIjo5Mjk4NTY2NDQsImUiOjE3NjQ3MjIyMjYsInMiOiI0MzcyZTU4NTc0NjQ1ZjRmYjFkZjYwOTNlOGVkOGMxMWQ5MWM0NGJiIiwidiI6MX0",
    "flickr_page": "https://www.flickr.com/photos/54968894@N00/929856644",
    "count_view": "17"
  },
  {
    "id": "929846580",
    "owner": "54968894@N00",
    "title": "18/03/2006 10:01",
    "realname": "Sammi Fang",
    "ownername": "sammifang",
    "datetaken": "2006-03-18 10:01:25",
    "max_width": 4000,
    "max_height": 2666,
    "url_max": "https://live.staticflickr.com/1220/929846580_f415afc88d_4k.jpg?s=eyJpIjo5Mjk4NDY1ODAsImUiOjE3NjQ3MjIyMjYsInMiOiIyMGQ1NTViMzczNzkxMzcwODJhYjZiYWVlODJlN2RhYzI2NzdlZTRjIiwidiI6MX0",
    "max_width_2000": 1600,
    "max_height_2000": 1066,
    "url_max_2000": "https://live.staticflickr.com/1220/929846580_02aff4695b_h.jpg?s=eyJpIjo5Mjk4NDY1ODAsImUiOjE3NjQ3MjIyMjYsInMiOiI0Y2YyOTE0NDIzN2M3MGEwODEyZjVmMWIxZmJlNjY3NDEzYTA3NGNhIiwidiI6MX0",
    "flickr_page": "https://www.flickr.com/photos/54968894@N00/929846580",
    "count_view": "16"
  },
  {
    "id": "928990105",
    "owner": "54968894@N00",
    "title": "18/03/2006 09:54",
    "realname": "Sammi Fang",
    "ownername": "sammifang",
    "datetaken": "2006-03-18 09:54:16",
    "max_width": 4000,
    "max_height": 2666,
    "url_max": "https://live.staticflickr.com/1196/928990105_8ed30037e9_4k.jpg?s=eyJpIjo5Mjg5OTAxMDUsImUiOjE3NjQ3MjIyMjcsInMiOiI3OWJhNjQ4ODBjNDFmNjUyOGEwYjJlMzU1ZTliMmU5NTBmYmNhNjBiIiwidiI6MX0",
    "max_width_2000": 1600,
    "max_height_2000": 1066,
    "url_max_2000": "https://live.staticflickr.com/1196/928990105_76c0212fcb_h.jpg?s=eyJpIjo5Mjg5OTAxMDUsImUiOjE3NjQ3MjIyMjcsInMiOiJjMzQwMGZiMTRlYmE4YmExYzYxMTZiOTRjZjA2ODg3MTQ3YjBjMDA5IiwidiI6MX0",
    "flickr_page": "https://www.flickr.com/photos/54968894@N00/928990105",
    "count_view": "20"
  },
  {
    "id": "928967677",
    "owner": "54968894@N00",
    "title": "18/03/2006 09:43",
    "realname": "Sammi Fang",
    "ownername": "sammifang",
    "datetaken": "2006-03-18 09:43:26",
    "max_width": 2666,
    "max_height": 4000,
    "url_max": "https://live.staticflickr.com/1182/928967677_406dacfc27_4k.jpg?s=eyJpIjo5Mjg5Njc2NzcsImUiOjE3NjQ3MjIyMjcsInMiOiIxM2U2YjkxYzFmODBiYjJmNGNiYWZkYjIzNGQ0ZDdhZGQ5YTY3MTNmIiwidiI6MX0",
    "max_width_2000": 1365,
    "max_height_2000": 2048,
    "url_max_2000": "https://live.staticflickr.com/1182/928967677_61ef2a0b02_k.jpg?s=eyJpIjo5Mjg5Njc2NzcsImUiOjE3NjQ3MjIyMjcsInMiOiIyNzBhYzMzNDYyNTdkYWMzOGQ3MmFhODFlMjM0NGM1OGI5ODRhZjZhIiwidiI6MX0",
    "flickr_page": "https://www.flickr.com/photos/54968894@N00/928967677",
    "count_view": "19"
  },
  {
    "id": "928959569",
    "owner": "54968894@N00",
    "title": "18/03/2006 09:26",
    "realname": "Sammi Fang",
    "ownername": "sammifang",
    "datetaken": "2006-03-18 09:26:52",
    "max_width": 4000,
    "max_height": 2666,
    "url_max": "https://live.staticflickr.com/1207/928959569_acf433ed6b_4k.jpg?s=eyJpIjo5Mjg5NTk1NjksImUiOjE3NjQ3MjIyMjcsInMiOiIxYTZiY2I1NjhkODI0OGI5ZmIyZjlkMjdlZWJmMTI3MzI3NDgyYWU1IiwidiI6MX0",
    "max_width_2000": 1600,
    "max_height_2000": 1066,
    "url_max_2000": "https://live.staticflickr.com/1207/928959569_76cb5e33e7_h.jpg?s=eyJpIjo5Mjg5NTk1NjksImUiOjE3NjQ3MjIyMjcsInMiOiI2YzgwNjE3YWFhZjA3N2MwZGM4NDUyNDc1MjU3ZGFmNGJkNDUxOTFlIiwidiI6MX0",
    "flickr_page": "https://www.flickr.com/photos/54968894@N00/928959569",
    "count_view": "16"
  },
  {
    "id": "926690186",
    "owner": "54968894@N00",
    "title": "17/03/2006 17:41",
    "realname": "Sammi Fang",
    "ownername": "sammifang",
    "datetaken": "2006-03-17 17:41:27",
    "max_width": 2912,
    "max_height": 4368,
    "url_max": "https://live.staticflickr.com/1404/926690186_f80c6bbdab_o.jpg?s=eyJpIjo5MjY2OTAxODYsImUiOjE3NjQ3MjIyMjgsInMiOiI4ZTE3OWZjOTY4NDk0NGRiNDc2MWMxY2EyZDhmYzQwYmE0MzdhZDYyIiwidiI6MX0",
    "max_width_2000": 1365,
    "max_height_2000": 2048,
    "url_max_2000": "https://live.staticflickr.com/1404/926690186_88eb6f827c_k.jpg?s=eyJpIjo5MjY2OTAxODYsImUiOjE3NjQ3MjIyMjgsInMiOiJmZDRkZGY0MzUwYWUyYjJlYWRiYTM1ODk4M2U2YzQ4MzVkNWYxZTE4IiwidiI6MX0",
    "flickr_page": "https://www.flickr.com/photos/54968894@N00/926690186",
    "count_view": "248"
  },
  {
    "id": "926672110",
    "owner": "54968894@N00",
    "title": "17/03/2006 17:40",
    "realname": "Sammi Fang",
    "ownername": "sammifang",
    "datetaken": "2006-03-17 17:40:34",
    "max_width": 4368,
    "max_height": 2912,
    "url_max": "https://live.staticflickr.com/1032/926672110_1a1cb88cfc_o.jpg?s=eyJpIjo5MjY2NzIxMTAsImUiOjE3NjQ3MjIyMjgsInMiOiI3NWFiZTFjOWE5ZmU5ZjAyYmQyNDg5ZjNhYWM0YjY3OTg5ZmNkYjAwIiwidiI6MX0",
    "max_width_2000": 1600,
    "max_height_2000": 1067,
    "url_max_2000": "https://live.staticflickr.com/1032/926672110_dea35bd641_h.jpg?s=eyJpIjo5MjY2NzIxMTAsImUiOjE3NjQ3MjIyMjgsInMiOiIzZmViMGYzNjljMjQ3Y2NkZDcyMTM5YTk5YjU4ODI4NDcyNDNlZTdhIiwidiI6MX0",
    "flickr_page": "https://www.flickr.com/photos/54968894@N00/926672110",
    "count_view": "22"
  },
  {
    "id": "926592636",
    "owner": "54968894@N00",
    "title": "17/03/2006 17:34",
    "realname": "Sammi Fang",
    "ownername": "sammifang",
    "datetaken": "2006-03-17 17:34:19",
    "max_width": 4368,
    "max_height": 2912,
    "url_max": "https://live.staticflickr.com/1258/926592636_2dd262c601_o.jpg?s=eyJpIjo5MjY1OTI2MzYsImUiOjE3NjQ3MjIyMjgsInMiOiJjZGNlZWMyMWQyNTM1OWU5MDE2YTMzZGJiZWM5M2YzNTUyZWE0NTQ5IiwidiI6MX0",
    "max_width_2000": 1600,
    "max_height_2000": 1067,
    "url_max_2000": "https://live.staticflickr.com/1258/926592636_a889349b29_h.jpg?s=eyJpIjo5MjY1OTI2MzYsImUiOjE3NjQ3MjIyMjgsInMiOiI4ZWZlOTNjNTVhY2JiMDFlNmM0OTRkNDYwMGM3OGMwODQxOGMxMDBlIiwidiI6MX0",
    "flickr_page": "https://www.flickr.com/photos/54968894@N00/926592636",
    "count_view": "42"
  },
  {
    "id": "928858849",
    "owner": "54968894@N00",
    "title": "17/03/2006 16:02",
    "realname": "Sammi Fang",
    "ownername": "sammifang",
    "datetaken": "2006-03-17 16:02:39",
    "max_width": 4000,
    "max_height": 2666,
    "url_max": "https://live.staticflickr.com/1084/928858849_967a2a4a4f_4k.jpg?s=eyJpIjo5Mjg4NTg4NDksImUiOjE3NjQ3MjIyMjgsInMiOiJiMzI1MDcwMjExZTNkNThiODI4NGY2MjU3OWYxZjY0ZTk0N2Q0NjY0IiwidiI6MX0",
    "max_width_2000": 1600,
    "max_height_2000": 1066,
    "url_max_2000": "https://live.staticflickr.com/1084/928858849_10aa396470_h.jpg?s=eyJpIjo5Mjg4NTg4NDksImUiOjE3NjQ3MjIyMjgsInMiOiJiYzViMjkyNDY4ODc3NWVjMzhlNDkxOTQ3NDliMDZjOTNiY2Q5YjMyIiwidiI6MX0",
    "flickr_page": "https://www.flickr.com/photos/54968894@N00/928858849",
    "count_view": "20"
  },
  {
    "id": "929692712",
    "owner": "54968894@N00",
    "title": "17/03/2006 15:51",
    "realname": "Sammi Fang",
    "ownername": "sammifang",
    "datetaken": "2006-03-17 15:51:31",
    "max_width": 2666,
    "max_height": 4000,
    "url_max": "https://live.staticflickr.com/1203/929692712_898e443079_4k.jpg?s=eyJpIjo5Mjk2OTI3MTIsImUiOjE3NjQ3MjIyMjgsInMiOiJiM2Q3MzZmMzUyMzFhOTUxOTMxOWVmMGQ0N2Y3MzQ2YTE5Y2FmMjcwIiwidiI6MX0",
    "max_width_2000": 1365,
    "max_height_2000": 2048,
    "url_max_2000": "https://live.staticflickr.com/1203/929692712_23df14769a_k.jpg?s=eyJpIjo5Mjk2OTI3MTIsImUiOjE3NjQ3MjIyMjgsInMiOiI3OWJiZTdjM2VlMzI4YjAyNWY2MDM2NjcyYTU1ZDdlMGYxNzhiNmU2IiwidiI6MX0",
    "flickr_page": "https://www.flickr.com/photos/54968894@N00/929692712",
    "count_view": "21"
  },
  {
    "id": "929684540",
    "owner": "54968894@N00",
    "title": "17/03/2006 15:49",
    "realname": "Sammi Fang",
    "ownername": "sammifang",
    "datetaken": "2006-03-17 15:49:49",
    "max_width": 2666,
    "max_height": 4000,
    "url_max": "https://live.staticflickr.com/1032/929684540_dd97e91bc2_4k.jpg?s=eyJpIjo5Mjk2ODQ1NDAsImUiOjE3NjQ3MjIyMjgsInMiOiJkYWZhY2MzZjBkNTc5NTk1NmY0YTA2YTFjODQ0MGMyYzI3N2I2MjZhIiwidiI6MX0",
    "max_width_2000": 1365,
    "max_height_2000": 2048,
    "url_max_2000": "https://live.staticflickr.com/1032/929684540_8ff5282a66_k.jpg?s=eyJpIjo5Mjk2ODQ1NDAsImUiOjE3NjQ3MjIyMjgsInMiOiJjMzZiZWQ2OGNkNzU4MTNmMjZkNmE3YmE3OGE0ZDZmNTJiZDkyODY5IiwidiI6MX0",
    "flickr_page": "https://www.flickr.com/photos/54968894@N00/929684540",
    "count_view": "21"
  },
  {
    "id": "929675444",
    "owner": "54968894@N00",
    "title": "17/03/2006 15:38",
    "realname": "Sammi Fang",
    "ownername": "sammifang",
    "datetaken": "2006-03-17 15:38:04",
    "max_width": 4000,
    "max_height": 2662,
    "url_max": "https://live.staticflickr.com/1083/929675444_99487e0df4_4k.jpg?s=eyJpIjo5Mjk2NzU0NDQsImUiOjE3NjQ3MjIyMjgsInMiOiIxMDBhODdiNjYwMzQxOTI4Mzk2Zjc5ZTYwN2NiZDNkMjc5OTczMmExIiwidiI6MX0",
    "max_width_2000": 1600,
    "max_height_2000": 1065,
    "url_max_2000": "https://live.staticflickr.com/1083/929675444_2179b572ac_h.jpg?s=eyJpIjo5Mjk2NzU0NDQsImUiOjE3NjQ3MjIyMjgsInMiOiJkM2YwZjJlMGViZDMxZDg3YTA2OTI1YjNiOTFhNTE5YmNiNGE4MjA1IiwidiI6MX0",
    "flickr_page": "https://www.flickr.com/photos/54968894@N00/929675444",
    "count_view": "17"
  },
  {
    "id": "929659380",
    "owner": "54968894@N00",
    "title": "17/03/2006 15:08",
    "realname": "Sammi Fang",
    "ownername": "sammifang",
    "datetaken": "2006-03-17 15:08:07",
    "max_width": 4000,
    "max_height": 2666,
    "url_max": "https://live.staticflickr.com/1110/929659380_03246ed96b_4k.jpg?s=eyJpIjo5Mjk2NTkzODAsImUiOjE3NjQ3MjIyMjgsInMiOiI0NzU0YzliNmM3NWZhYTQzMmMxZjExNWJmODhlZmRjNDY2ZTUyYzRhIiwidiI6MX0",
    "max_width_2000": 1600,
    "max_height_2000": 1066,
    "url_max_2000": "https://live.staticflickr.com/1110/929659380_7770413bf7_h.jpg?s=eyJpIjo5Mjk2NTkzODAsImUiOjE3NjQ3MjIyMjgsInMiOiI3OWFhOTQxOTlmNWRiYTE0MWI5ZDI1ZjU1MjdhMDhjZGJjNzNlYjdlIiwidiI6MX0",
    "flickr_page": "https://www.flickr.com/photos/54968894@N00/929659380",
    "count_view": "22"
  },
  {
    "id": "928795737",
    "owner": "54968894@N00",
    "title": "17/03/2006 14:55",
    "realname": "Sammi Fang",
    "ownername": "sammifang",
    "datetaken": "2006-03-17 14:55:23",
    "max_width": 4000,
    "max_height": 2666,
    "url_max": "https://live.staticflickr.com/1230/928795737_6d3d736c48_4k.jpg?s=eyJpIjo5Mjg3OTU3MzcsImUiOjE3NjQ3MjIyMjgsInMiOiI5OTUyOTJjYTkwN2U5MjcyZjNhZjg5MmUwZTM4NmQyZGYwMmUxZDgzIiwidiI6MX0",
    "max_width_2000": 1600,
    "max_height_2000": 1066,
    "url_max_2000": "https://live.staticflickr.com/1230/928795737_9bf70ff5c7_h.jpg?s=eyJpIjo5Mjg3OTU3MzcsImUiOjE3NjQ3MjIyMjgsInMiOiI5MjBjYzUwMDYyNTc2NDllMDVkZjEwYzc4MWFkYjZmYjczNjIwNGJjIiwidiI6MX0",
    "flickr_page": "https://www.flickr.com/photos/54968894@N00/928795737",
    "count_view": "25"
  },
  {
    "id": "928787047",
    "owner": "54968894@N00",
    "title": "17/03/2006 14:41",
    "realname": "Sammi Fang",
    "ownername": "sammifang",
    "datetaken": "2006-03-17 14:41:26",
    "max_width": 4000,
    "max_height": 2666,
    "url_max": "https://live.staticflickr.com/1058/928787047_978e398c50_4k.jpg?s=eyJpIjo5Mjg3ODcwNDcsImUiOjE3NjQ3MjIyMjgsInMiOiIxNjVlMjNlY2RhNzU2YTBkYThmNmIyMzRmMjhhMmMyNmIyMWE3YTRhIiwidiI6MX0",
    "max_width_2000": 1600,
    "max_height_2000": 1066,
    "url_max_2000": "https://live.staticflickr.com/1058/928787047_857915f4de_h.jpg?s=eyJpIjo5Mjg3ODcwNDcsImUiOjE3NjQ3MjIyMjgsInMiOiJiZDRlOWU5ZGE4ZDczOTBjNGE4YzkwNDA0MGIwYTNiMTQ0YjZhNGYxIiwidiI6MX0",
    "flickr_page": "https://www.flickr.com/photos/54968894@N00/928787047",
    "count_view": "18"
  }
]