[
  {
    "id": "928775599",
    "owner": "54968894@N00",
    "title": "17/03/2006 14:41",
    "realname": "Sammi Fang",
    "ownername": "sammifang",
    "datetaken": "2006-03-17 14:41:21",
    "max_width": 4000,
    "max_height": 2666,
    "url_max": "https://live.staticflickr.com/1253/928775599_5fe81b1167_4k.jpg?s=eyJpIjo5Mjg3NzU1OTksImUiOjE3NjQ3MjIyMjgsInMiOiJmOTEwZTlkYzVlY2E3MjY1ZTBhNzZmNDJkNjk5NjNlMGFlYTQwZjdjIiwidiI6MX0",
    "max_width_2000": 1600,
    "max_height_2000": 1066,
    "url_max_2000": "https://live.staticflickr.com/1253/928775599_26168bad19_h.jpg?s=eyJpIjo5Mjg3NzU1OTksImUiOjE3NjQ3MjIyMjgsInMiOiJlNjNkOGM5MmZhMDBjNjBiNmE1MWM4ODA2YzAyMGVmZDdlMjk3Y2QyIiwidiI6MX0",
    "flickr_page": "https://www.flickr.com/photos/54968894@N00/928775599",
    "count_view": "16"
  },
  {
    "id": "925740178",
    "owner": "54968894@N00",
    "title": "05/03/2006 17:13",
    "realname": "Sammi Fang",
    "ownername": "sammifang",
    "datetaken": "2006-03-05 17:13:25",
    "max_width": 4000,
    "max_height": 2625,
    "url_max": "https://live.staticflickr.com/1354/925740178_3efad0b337_4k.jpg?s=eyJpIjo5MjU3NDAxNzgsImUiOjE3NjQ3MjIyMjgsInMiOiJjNTIzNDBkOTlkYzI1OTE2ZDViNGJiMWQ2MTFkM2Q5NjkzYTFmNDVkIiwidiI6MX0",
    "max_width_2000": 1600,
    "max_height_2000": 1050,
    "url_max_2000": "https://live.staticflickr.com/1354/925740178_d410b6adac_h.jpg?s=eyJpIjo5MjU3NDAxNzgsImUiOjE3NjQ3MjIyMjgsInMiOiIzZTRmODUxYjY2YjM5YTJhOTZiNmE1NzdiMmRlNzdhMzhmOWQ3NjgxIiwidiI6MX0",
    "flickr_page": "https://www.flickr.com/photos/54968894@N00/925740178",
    "count_view": "178"
  },
  {
    "id": "894718553",
    "owner": "54968894@N00",
    "title": "IMG_1370",
    "realname": "Sammi Fang",
    "ownername": "sammifang",
    "datetaken": "2006-03-05 17:10:36",
    "max_width": 2788,
    "max_height": 4191,
    "url_max": "https://live.staticflickr.com/1220/894718553_99624ae5f3_o.jpg?s=eyJpIjo4OTQ3MTg1NTMsImUiOjE3NjQ3MjIyMzIsInMiOiI1NjZjMzQ1MGMwNjhlNjg0M2ZjY2M5NDMxODc5MWRkNTExMGYzMDc2IiwidiI6MX0",
    "max_width_2000": 1362,
    "max_height_2000": 2048,
    "url_max_2000": "https://live.staticflickr.com/1220/894718553_e6f8834c2e_k.jpg?s=eyJpIjo4OTQ3MTg1NTMsImUiOjE3NjQ3MjIyMzIsInMiOiJiYTNjZTIxMzU5MDliYWE0YTExM2Q3ZjU1YWUzY2NkNzg2ODI0OTVjIiwidiI6MX0",
    "flickr_page": "https://www.flickr.com/photos/54968894@N00/894718553",
    "count_view": "22"
  },
  {
    "id": "922194202",
    "owner": "54968894@N00",
    "title": "05/03/2006 17:08",
    "realname": "Sammi Fang",
    "ownername": "sammifang",
    "datetaken": "2006-03-05 17:08:59",
    "max_width": 4236,
    "max_height": 2730,
    "url_max": "https://live.staticflickr.com/1378/922194202_e962c4979c_o.jpg?s=eyJpIjo5MjIxOTQyMDIsImUiOjE3NjQ3MjIyMjgsInMiOiI4M2RlYWM1MWVlM2I4NTZlOTU0MmEyODg5YzU1M2ZiODRhNGVmY2RhIiwidiI6MX0",
    "max_width_2000": 1600,
    "max_height_2000": 1031,
    "url_max_2000": "https://live.staticflickr.com/1378/922194202_fd1a79bb6b_h.jpg?s=eyJpIjo5MjIxOTQyMDIsImUiOjE3NjQ3MjIyMjgsInMiOiI1OWE0NGMzMzA0YWY3ZGRjOTBhN2QzYzBiOGUyNTU5NDZlM2ZlODdjIiwidiI6MX0",
    "flickr_page": "https://www.flickr.com/photos/54968894@N00/922194202",
    "count_view": "16"
  },
  {
    "id": "894709147",
    "owner": "54968894@N00",
    "title": "IMG_1365",
    "realname": "Sammi Fang",
    "ownername": "sammifang",
    "datetaken": "2006-03-05 17:07:31",
    "max_width": 4180,
    "max_height": 2806,
    "url_max": "https://live.staticflickr.com/1055/894709147_6d01dcda75_o.jpg?s=eyJpIjo4OTQ3MDkxNDcsImUiOjE3NjQ3MjIyMzIsInMiOiI1YWUxZTEyMTcwMjkwNDIxMjI3ZDMxZmQ1MDg1YmFlNjQzMDRjMTViIiwidiI6MX0",
    "max_width_2000": 1600,
    "max_height_2000": 1074,
    "url_max_2000": "https://live.staticflickr.com/1055/894709147_c846c3f5de_h.jpg?s=eyJpIjo4OTQ3MDkxNDcsImUiOjE3NjQ3MjIyMzIsInMiOiI1ODAzYmZjNDJjNTI1M2QzMzljNTBiNDdmMDUyMzQzYmJmZGM5MmY3IiwidiI6MX0",
    "flickr_page": "https://www.flickr.com/photos/54968894@N00/894709147",
    "count_view": "22"
  },
  {
    "id": "535761382",
    "owner": "54968894@N00",
    "title": "05/03/2006 17:07",
    "realname": "Sammi Fang",
    "ownername": "sammifang",
    "datetaken": "2006-03-05 17:07:31",
    "max_width": 4180,
    "max_height": 2806,
    "url_max": "https://live.staticflickr.com/220/535761382_152ba7dcfc_o.jpg?s=eyJpIjo1MzU3NjEzODIsImUiOjE3NjQ3MjIyODQsInMiOiIxYmJmNzc5NDIxY2Q4MTlmMTM4NmUwY2NiNjY4YTE5Yjk2NjhjYzI1IiwidiI6MX0",
    "max_width_2000": 1600,
    "max_height_2000": 1074,
    "url_max_2000": "https://live.staticflickr.com/220/535761382_7f8414f2a7_h.jpg?s=eyJpIjo1MzU3NjEzODIsImUiOjE3NjQ3MjIyODQsInMiOiJhNzk4MDBhMTk2MTQ3NDkwMDhhYjAxMmVjMDYyYWRmNjdmZmJlNjUwIiwidiI6MX0",
    "flickr_page": "https://www.flickr.com/photos/54968894@N00/535761382",
    "count_view": "25"
  },
  {
    "id": "921286219",
    "owner": "54968894@N00",
    "title": "05/03/2006 17:07",
    "realname": "Sammi Fang",
    "ownername": "sammifang",
    "datetaken": "2006-03-05 17:07:13",
    "max_width": 4315,
    "max_height": 2883,
    "url_max": "https://live.staticflickr.com/1031/921286219_d8edd1e158_o.jpg?s=eyJpIjo5MjEyODYyMTksImUiOjE3NjQ3MjIyMjgsInMiOiI4YTkzMGY0YWI4ZjExZDFiODc2ODIwNjFkN2ZiMGU4OTc2NWYwOWUxIiwidiI6MX0",
    "max_width_2000": 1600,
    "max_height_2000": 1069,
    "url_max_2000": "https://live.staticflickr.com/1031/921286219_542821877e_h.jpg?s=eyJpIjo5MjEyODYyMTksImUiOjE3NjQ3MjIyMjgsInMiOiJlOWFlZjYxM2EzY2Y0M2EzYTdjYTE4NDE4ZjJmMTdiYmZkMzU1YTdiIiwidiI6MX0",
    "flickr_page": "https://www.flickr.com/photos/54968894@N00/921286219",
    "count_view": "17"
  },
  {
    "id": "921244347",
    "owner": "54968894@N00",
    "title": "05/03/2006 17:07",
    "realname": "Sammi Fang",
    "ownername": "sammifang",
    "datetaken": "2006-03-05 17:07:02",
    "max_width": 2828,
    "max_height": 4252,
    "url_max": "https://live.staticflickr.com/1260/921244347_fc4920b14d_o.jpg?s=eyJpIjo5MjEyNDQzNDcsImUiOjE3NjQ3MjIyMjgsInMiOiIwMzgyMTM4NDNlNjdlYzhjMTcxMDU3OTFkOTc3ZDRiNzFmYTYzMjE1IiwidiI6MX0",
    "max_width_2000": 1362,
    "max_height_2000": 2048,
    "url_max_2000": "https://live.staticflickr.com/1260/921244347_23ad40e527_k.jpg?s=eyJpIjo5MjEyNDQzNDcsImUiOjE3NjQ3MjIyMjgsInMiOiIwNWJkNjQzMWJjZDkyZDZiZjVjMGE0MDM1ZTczM2VhMmU0NGI4MjI4IiwidiI6MX0",
    "flickr_page": "https://www.flickr.com/photos/54968894@N00/921244347",
    "count_view": "29"
  },
  {
    "id": "921207301",
    "owner": "54968894@N00",
    "title": "05/03/2006 17:06",
    "realname": "Sammi Fang",
    "ownername": "sammifang",
    "datetaken": "2006-03-05 17:06:38",
    "max_width": 4307,
    "max_height": 2880,
    "url_max": "https://live.staticflickr.com/1158/921207301_bb5b3dc74b_o.jpg?s=eyJpIjo5MjEyMDczMDEsImUiOjE3NjQ3MjIyMjgsInMiOiI0OGEwMDk4ZmU1NGNiMTlkYmYyY2EzMThjNmYyN2MxM2I0NWFlNWRmIiwidiI6MX0",
    "max_width_2000": 1600,
    "max_height_2000": 1070,
    "url_max_2000": "https://live.staticflickr.com/1158/921207301_8f8e9270d7_h.jpg?s=eyJpIjo5MjEyMDczMDEsImUiOjE3NjQ3MjIyMjgsInMiOiIzODM0MjllZDg2YjI1N2Q3OTZjMjdjMDNmYmVjOGYwOTZlYjI3YTk3IiwidiI6MX0",
    "flickr_page": "https://www.flickr.com/photos/54968894@N00/921207301",
    "count_view": "18"
  },
  {
    "id": "894691299",
    "owner": "54968894@N00",
    "title": "IMG_1360",
    "realname": "Sammi Fang",
    "ownername": "sammifang",
    "datetaken": "2006-03-05 17:06:27",
    "max_width": 4269,
    "max_height": 2574,
    "url_max": "https://live.staticflickr.com/1288/894691299_869fc0adfe_o.jpg?s=eyJpIjo4OTQ2OTEyOTksImUiOjE3NjQ3MjIyMzIsInMiOiI5NmNlNTViM2U1MjViMTUzYmZjMWE5M2VhMDEyMzU3ZTNhMDNlNGJlIiwidiI6MX0",
    "max_width_2000": 1600,
    "max_height_2000": 965,
    "url_max_2000": "https://live.staticflickr.com/1288/894691299_cb55bb6876_h.jpg?s=eyJpIjo4OTQ2OTEyOTksImUiOjE3NjQ3MjIyMzIsInMiOiI1NGZiZmJkNmZkMTZjMmVlZjAwZmUzYjM2Zjc0ODVmZTA2NzZjM2JiIiwidiI6MX0",
    "flickr_page": "https://www.flickr.com/photos/54968894@N00/894691299",
    "count_view": "108"
  },
  {
    "id": "922028584",
    "owner": "54968894@N00",
    "title": "05/03/2006 17:06",
    "realname": "Sammi Fang",
    "ownername": "sammifang",
    "datetaken": "2006-03-05 17:06:08",
    "max_width": 4350,
    "max_height": 2904,
    "url_max": "https://live.staticflickr.com/1107/922028584_77cd70506f_o.jpg?s=eyJpIjo5MjIwMjg1ODQsImUiOjE3NjQ3MjIyMjgsInMiOiJkMmQ5YWRkOGE2YTA1MDcxM2I3MGNmZjcxMDgxNzYzNzE4Yzc1N2UxIiwidiI6MX0",
    "max_width_2000": 1600,
    "max_height_2000": 1068,
    "url_max_2000": "https://live.staticflickr.com/1107/922028584_711f37baf4_h.jpg?s=eyJpIjo5MjIwMjg1ODQsImUiOjE3NjQ3MjIyMjgsInMiOiI5ZTVkMzgwMjVhYmMxYmU3N2RkOGRkYzE5MDUwNzJjMGQ0OGEwZmVjIiwidiI6MX0",
    "flickr_page": "https://www.flickr.com/photos/54968894@N00/922028584",
    "count_view": "16"
  },
  {
    "id": "894623313",
    "owner": "54968894@N00",
    "title": "IMG_1289",
    "realname": "Sammi Fang",
    "ownername": "sammifang",
    "datetaken": "2006-03-04 13:39:52",
    "max_width": 4368,
    "max_height": 2912,
    "url_max": "https://live.staticflickr.com/1241/894623313_0f8b17289d_o.jpg?s=eyJpIjo4OTQ2MjMzMTMsImUiOjE3NjQ3MjIyMzIsInMiOiJhNmJkMGRkMWUzMjdmNjgzMmQyMzA3MDI3NTgzZGE1MTI1NWZkOTQ4IiwidiI6MX0",
    "max_width_2000": 1600,
    "max_height_2000": 1067,
    "url_max_2000": "https://live.staticflickr.com/1241/894623313_4febf49c43_h.jpg?s=eyJpIjo4OTQ2MjMzMTMsImUiOjE3NjQ3MjIyMzIsInMiOiI2MDkzODc5OTc4NzY3NWE1MWM2M2RmMTc5ODVjZTRjNjZmMzBjZGVmIiwidiI6MX0",
    "flickr_page": "https://www.flickr.com/photos/54968894@N00/894623313",
    "count_view": "15"
  },
  {
    "id": "895433328",
    "owner": "54968894@N00",
    "title": "IMG_1284",
    "realname": "Sammi Fang",
    "ownername": "sammifang",
    "datetaken": "2006-03-04 13:37:44",
    "max_width": 2912,
    "max_height": 4368,
    "url_max": "https://live.staticflickr.com/1194/895433328_16db33de7f_o.jpg?s=eyJpIjo4OTU0MzMzMjgsImUiOjE3NjQ3MjIyMzIsInMiOiJhMDdlYTdmMDM3NDYwNGU0ODMyMmI2YjQ3ODlmNTA3MGFhN2E5NGQxIiwidiI6MX0",
    "max_width_2000": 1365,
    "max_height_2000": 2048,
    "url_max_2000": "https://live.staticflickr.com/1194/895433328_9eca3cce87_k.jpg?s=eyJpIjo4OTU0MzMzMjgsImUiOjE3NjQ3MjIyMzIsInMiOiI0YTAzMDNmZTY1NTdmZGEyMWY4ZDQwNjY4NWI1OWY4NjExNmI4MjFkIiwidiI6MX0",
    "flickr_page": "https://www.flickr.com/photos/54968894@N00/895433328",
    "count_view": "20"
  },
  {
    "id": "535875991",
    "owner": "54968894@N00",
    "title": "04/03/2006 13:24",
    "realname": "Sammi Fang",
    "ownername": "sammifang",
    "datetaken": "2006-03-04 13:24:51",
    "max_width": 4368,
    "max_height": 2912,
    "url_max": "https://live.staticflickr.com/251/535875991_1802735166_o.jpg?s=eyJpIjo1MzU4NzU5OTEsImUiOjE3NjQ3MjIyODQsInMiOiI2ZDljM2YzNDQ4NWRhMGY1NDk3MjVjNGEwYWVhOWRjNmQxNDcyNDg2IiwidiI6MX0",
    "max_width_2000": 1600,
    "max_height_2000": 1067,
    "url_max_2000": "https://live.staticflickr.com/251/535875991_ccf27b110f_h.jpg?s=eyJpIjo1MzU4NzU5OTEsImUiOjE3NjQ3MjIyODQsInMiOiJhODBiZTUyMWEyM2RjMjQ4YWNiN2E0OWI5MTRhYmE1ODI3MzRiNjFjIiwidiI6MX0",
    "flickr_page": "https://www.flickr.com/photos/54968894@N00/535875991",
    "count_view": "27"
  },
  {
    "id": "894523845",
    "owner": "54968894@N00",
    "title": "IMG_1269",
    "realname": "Sammi Fang",
    "ownername": "sammifang",
    "datetaken": "2006-03-04 11:25:02",
    "max_width": 4368,
    "max_height": 2912,
    "url_max": "https://live.staticflickr.com/1119/894523845_b274170da7_o.jpg?s=eyJpIjo4OTQ1MjM4NDUsImUiOjE3NjQ3MjIyMzIsInMiOiJhYjAzZjJkOGFmNWYzYTUyNGQ2MzFkYzM1NTFhOTc0MWNlOTQ2OWFlIiwidiI6MX0",
    "max_width_2000": 1600,
    "max_height_2000": 1067,
    "url_max_2000": "https://live.staticflickr.com/1119/894523845_29798dc8ae_h.jpg?s=eyJpIjo4OTQ1MjM4NDUsImUiOjE3NjQ3MjIyMzIsInMiOiJlMTI0MTQwNTQ3NGUyMTBmZjgzNDE3N2M4ZDBiZGY0MmEwMmFmOWRjIiwidiI6MX0",
    "flickr_page": "https://www.flickr.com/photos/54968894@N00/894523845",
    "count_view": "22"
  },
  {
    "id": "894491209",
    "owner": "54968894@N00",
    "title": "IMG_1262",
    "realname": "Sammi Fang",
    "ownername": "sammifang",
    "datetaken": "2006-03-04 11:13:57",
    "max_width": 4368,
    "max_height": 2912,
    "url_max": "https://live.staticflickr.com/1433/894491209_7f2ee1ea5a_o.jpg?s=eyJpIjo4OTQ0OTEyMDksImUiOjE3NjQ3MjIyMzIsInMiOiIwMDhkMWI5YzZkNTY5ODA5ZDE3YjU0Njg1NDI3MWJhNDU3OWIyYzA0IiwidiI6MX0",
    "max_width_2000": 1600,
    "max_height_2000": 1067,
    "url_max_2000": "https://live.staticflickr.com/1433/894491209_07279e7e12_h.jpg?s=eyJpIjo4OTQ0OTEyMDksImUiOjE3NjQ3MjIyMzIsInMiOiIxYjYzOThjYjU5NzIxOWI2Y2M0ZDQ5YmI2Y2MyMDYyMzAzNDMxYWYwIiwidiI6MX0",
    "flickr_page": "https://www.flickr.com/photos/54968894@N00/894491209",
    "count_view": "18"
  },
  {
    "id": "895312248",
    "owner": "54968894@N00",
    "title": "IMG_1256",
    "realname": "Sammi Fang",
    "ownername": "sammifang",
    "datetaken": "2006-03-03 18:16:46",
    "max_width": 4368,
    "max_height": 2912,
    "url_max": "https://live.staticflickr.com/1230/895312248_301e6da513_o.jpg?s=eyJpIjo4OTUzMTIyNDgsImUiOjE3NjQ3MjIyMzIsInMiOiIzZjJiMDMyMzU2N2U5YjZlYjA3ZTY5ZjczZjYxY2QwNzU2OTFlYmFkIiwidiI6MX0",
    "max_width_2000": 1600,
    "max_height_2000": 1067,
    "url_max_2000": "https://live.staticflickr.com/1230/895312248_ccc3965758_h.jpg?s=eyJpIjo4OTUzMTIyNDgsImUiOjE3NjQ3MjIyMzIsInMiOiIwNjBlZDA3NmYyYmY5NWQyNDcwN2RkODFkMDI2MzAyNDY0MWJhNjY2IiwidiI6MX0",
    "flickr_page": "https://www.flickr.com/photos/54968894@N00/895312248",
    "count_view": "101"
  },
  {
    "id": "894368335",
    "owner": "54968894@N00",
    "title": "IMG_1157",
    "realname": "Sammi Fang",
    "ownername": "sammifang",
    "datetaken": "2006-02-25 17:10:11",
    "max_width": 4368,
    "max_height": 2912,
    "url_max": "https://live.staticflickr.com/1399/894368335_c9ba773d2b_o.jpg?s=eyJpIjo4OTQzNjgzMzUsImUiOjE3NjQ3MjIyMzIsInMiOiI2MTc3MjdkYjJiMDU2Y2VhYjMxYjUwOTNmZDBkM2UzNGRlMDU0ZjEyIiwidiI6MX0",
    "max_width_2000": 1600,
    "max_height_2000": 1067,
    "url_max_2000": "https://live.staticflickr.com/1399/894368335_329652c2d4_h.jpg?s=eyJpIjo4OTQzNjgzMzUsImUiOjE3NjQ3MjIyMzIsInMiOiIyOTZhNDQzMTJkZDRlNjA3MDdjMWQzODdiMjdhMzkxODI5Y2RkODY2IiwidiI6MX0",
    "flickr_page": "https://www.flickr.com/photos/54968894@N00/894368335",
    "count_view": "21"
  },
  {
    "id": "535758212",
    "owner": "54968894@N00",
    "title": "25/02/2006 17:10",
    "realname": "Sammi Fang",
    "ownername": "sammifang",
    "datetaken": "2006-02-25 17:10:11",
    "max_width": 4368,
    "max_height": 2912,
    "url_max": "https://live.staticflickr.com/202/535758212_cf387452c8_o.jpg?s=eyJpIjo1MzU3NTgyMTIsImUiOjE3NjQ3MjIyODQsInMiOiJkYTdmM2EyYThmOGUxN2M0OWYwZjNkNGZkYzczOTg1ZTIwNmEzNzIzIiwidiI6MX0",
    "max_width_2000": 1600,
    "max_height_2000": 1067,
    "url_max_2000": "https://live.staticflickr.com/202/535758212_e8f8b4061e_h.jpg?s=eyJpIjo1MzU3NTgyMTIsImUiOjE3NjQ3MjIyODQsInMiOiJlMDM5ZGIyMDFkZTUzNWJmN2E5NjhiNDkzYjc3MDVjMjlhNTUzYTRkIiwidiI6MX0",
    "flickr_page": "https://www.flickr.com/photos/54968894@N00/535758212",
    "count_view": "33"
  },
  {
    "id": "895200856",
    "owner": "54968894@N00",
    "title": "IMG_1155",
    "realname": "Sammi Fang",
    "ownername": "sammifang",
    "datetaken": "2006-02-25 17:09:55",
    "max_width": 2912,
    "max_height": 4368,
    "url_max": "https://live.staticflickr.com/1320/895200856_98702ac6c1_o.jpg?s=eyJpIjo4OTUyMDA4NTYsImUiOjE3NjQ3MjIyMzIsInMiOiJmN2M1OTRiMzNkZjU1ZmZhYTg2NmVmNzdhY2M4NzE0ZTg1ZTVlNzgwIiwidiI6MX0",
    "max_width_2000": 1365,
    "max_height_2000": 2048,
    "url_max_2000": "https://live.staticflickr.com/1320/895200856_f2f098d38b_k.jpg?s=eyJpIjo4OTUyMDA4NTYsImUiOjE3NjQ3MjIyMzIsInMiOiIwZTQ1N2NlZmRmMGUwZDg2ZTMzYjU1ZGU0YjU2NmE0OWU5N2I5ZWI4IiwidiI6MX0",
    "flickr_page": "https://www.flickr.com/photos/54968894@N00/895200856",
    "count_view": "43"
  },
  {
    "id": "894202023",
    "owner": "54968894@N00",
    "title": "IMG_1112",
    "realname": "Sammi Fang",
    "ownername": "sammifang",
    "datetaken": "2006-02-25 16:23:31",
    "max_width": 4368,
    "max_height": 2912,
    "url_max": "https://live.staticflickr.com/1157/894202023_01f55b2f34_o.jpg?s=eyJpIjo4OTQyMDIwMjMsImUiOjE3NjQ3MjIyMzIsInMiOiJkZWQ3OWM1MTNjMTU0YTBkZjdiYWVkZWMzODA3ZTVkM2JhMWYyY2Y5IiwidiI6MX0",
    "max_width_2000": 1600,
    "max_height_2000": 1067,
    "url_max_2000": "https://live.staticflickr.com/1157/894202023_c4e967e46c_h.jpg?s=eyJpIjo4OTQyMDIwMjMsImUiOjE3NjQ3MjIyMzIsInMiOiI1M2RlOWZmYWM1OGY2ZWZkMTgwMzZiNGY5NTBiZmIxZjRhOTM0YjdjIiwidiI6MX0",
    "flickr_page": "https://www.flickr.com/photos/54968894@N00/894202023",
    "count_view": "20"
  },
  {
    "id": "919741143",
    "owner": "54968894@N00",
    "title": "25/02/2006 14:20",
    "realname": "Sammi Fang",
    "ownername": "sammifang",
    "datetaken": "2006-02-25 14:20:19",
    "max_width": 4000,
    "max_height": 2666,
    "url_max": "https://live.staticflickr.com/1330/919741143_f41a5ac3b3_4k.jpg?s=eyJpIjo5MTk3NDExNDMsImUiOjE3NjQ3MjIyMjgsInMiOiI5Nzk3MmIzZTliYWZjZjQ1MjE4ZTgwNzk0NjUxYjc4ZGVhMzJhZjM4IiwidiI6MX0",
    "max_width_2000": 1600,
    "max_height_2000": 1066,
    "url_max_2000": "https://live.staticflickr.com/1330/919741143_7c83af75e6_h.jpg?s=eyJpIjo5MTk3NDExNDMsImUiOjE3NjQ3MjIyMjgsInMiOiI0ZDkxN2I4ZmVkNGIzYWU3YzE4YTVlMzA2ODJkMzBlM2JjMzNhMWRiIiwidiI6MX0",
    "flickr_page": "https://www.flickr.com/photos/54968894@N00/919741143",
    "count_view": "298"
  },
  {
    "id": "535756442",
    "owner": "54968894@N00",
    "title": "25/02/2006 14:13",
    "realname": "Sammi Fang",
    "ownername": "sammifang",
    "datetaken": "2006-02-25 14:13:42",
    "max_width": 2912,
    "max_height": 4368,
    "url_max": "https://live.staticflickr.com/228/535756442_f46176b0fe_o.jpg?s=eyJpIjo1MzU3NTY0NDIsImUiOjE3NjQ3MjIyODQsInMiOiI1MjJiODExZjNlZWZhZmU0ZWU0MzkxOGYxZTM4MWZmMTZmYjJkZjY1IiwidiI6MX0",
    "max_width_2000": 1365,
    "max_height_2000": 2048,
    "url_max_2000": "https://live.staticflickr.com/228/535756442_bdbe6c1c3d_k.jpg?s=eyJpIjo1MzU3NTY0NDIsImUiOjE3NjQ3MjIyODQsInMiOiI1MWJlNGE5ZjlkNDcwZDE1OTMzZDA0MGRkNzFiNjBmMTk1YTJiNTNiIiwidiI6MX0",
    "flickr_page": "https://www.flickr.com/photos/54968894@N00/535756442",
    "count_view": "258"
  },
  {
    "id": "910453434",
    "owner": "54968894@N00",
    "title": "18/02/2006 14:54",
    "realname": "Sammi Fang",
    "ownername": "sammifang",
    "datetaken": "2006-02-18 14:54:06",
    "max_width": 2912,
    "max_height": 4368,
    "url_max": "https://live.staticflickr.com/1436/910453434_fdf5de60b5_o.jpg?s=eyJpIjo5MTA0NTM0MzQsImUiOjE3NjQ3MjIyMzAsInMiOiI4MmFmOGIzZGUxNTRlODE0YzQ5OTZkODNkZjVjZTcxMDFkZWQ2MTY3IiwidiI6MX0",
    "max_width_2000": 1365,
    "max_height_2000": 2048,
    "url_max_2000": "https://live.staticflickr.com/1436/910453434_0a484143a0_k.jpg?s=eyJpIjo5MTA0NTM0MzQsImUiOjE3NjQ3MjIyMzAsInMiOiIzMDBjYTc5OGFhMDdiMWY1NTYyYTMwZWIwNTEwODBmNmZlOGM1NGYzIiwidiI6MX0",
    "flickr_page": "https://www.flickr.com/photos/54968894@N00/910453434",
    "count_view": "34"
  },
  {
    "id": "315996646",
    "owner": "54968894@N00",
    "title": "18/02/2006 14:34",
    "realname": "Sammi Fang",
    "ownername": "sammifang",
    "datetaken": "2006-02-18 14:34:54",
    "max_width": 2912,
    "max_height": 4368,
    "url_max": "https://live.staticflickr.com/104/315996646_0f2a93f25f_o.jpg?s=eyJpIjozMTU5OTY2NDYsImUiOjE3NjQ3MjI0MTUsInMiOiI5ZjI3ZWVkNTRiYTU2YjBjZTQ3ZjM3NzdiYTFjMDdhMDY0Y2M1NWFjIiwidiI6MX0",
    "max_width_2000": 1365,
    "max_height_2000": 2048,
    "url_max_2000": "https://live.staticflickr.com/104/315996646_e59c72e438_k.jpg?s=eyJpIjozMTU5OTY2NDYsImUiOjE3NjQ3MjI0MTUsInMiOiI5ZmZkYTYwM2RiZTYwY2Y5NGUyZGEwOGZlODRkZTZjYmRhY2M3ODc2IiwidiI6MX0",
    "flickr_page": "https://www.flickr.com/photos/54968894@N00/315996646",
    "count_view": "238"
  },
  {
    "id": "914684778",
    "owner": "54968894@N00",
    "title": "18/02/2006 11:24",
    "realname": "Sammi Fang",
    "ownername": "sammifang",
    "datetaken": "2006-02-18 11:24:55",
    "max_width": 2666,
    "max_height": 4000,
    "url_max": "https://live.staticflickr.com/1327/914684778_fa09c64d09_4k.jpg?s=eyJpIjo5MTQ2ODQ3NzgsImUiOjE3NjQ3MjIyMjgsInMiOiJlNzZmZmFlN2RjZjYzMTg4ODJmM2M2Mzc2YTE0MjM3YjJmODYyOWZhIiwidiI6MX0",
    "max_width_2000": 1365,
    "max_height_2000": 2048,
    "url_max_2000": "https://live.staticflickr.com/1327/914684778_4fa472f466_k.jpg?s=eyJpIjo5MTQ2ODQ3NzgsImUiOjE3NjQ3MjIyMjgsInMiOiI1MTVjMjBkZDg2NmE1N2NiYzNkZjM3ZDUwYzNlY2ZlZmEwZTBkYTA4IiwidiI6MX0",
    "flickr_page": "https://www.flickr.com/photos/54968894@N00/914684778",
    "count_view": "278"
  },
  {
    "id": "914669086",
    "owner": "54968894@N00",
    "title": "18/02/2006 11:23",
    "realname": "Sammi Fang",
    "ownername": "sammifang",
    "datetaken": "2006-02-18 11:23:00",
    "max_width": 4000,
    "max_height": 2666,
    "url_max": "https://live.staticflickr.com/1423/914669086_b7096a76fe_4k.jpg?s=eyJpIjo5MTQ2NjkwODYsImUiOjE3NjQ3MjIyMzAsInMiOiI1NjAyZTNkMjdlMDg3NzRmZjAwZmEwNjdmOTUzYWNlMDY2YWE2MjZkIiwidiI6MX0",
    "max_width_2000": 1600,
    "max_height_2000": 1066,
    "url_max_2000": "https://live.staticflickr.com/1423/914669086_df3a5d778d_h.jpg?s=eyJpIjo5MTQ2NjkwODYsImUiOjE3NjQ3MjIyMzAsInMiOiJiZDNkMDA3NWEwYWIyNWRlMDc4Mzk5MTNhZmIxZmI1MGMzOWYzYTBkIiwidiI6MX0",
    "flickr_page": "https://www.flickr.com/photos/54968894@N00/914669086",
    "count_view": "44"
  },
  {
    "id": "914591816",
    "owner": "54968894@N00",
    "title": "18/02/2006 11:15",
    "realname": "Sammi Fang",
    "ownername": "sammifang",
    "datetaken": "2006-02-18 11:15:10",
    "max_width": 4000,
    "max_height": 2666,
    "url_max": "https://live.staticflickr.com/1295/914591816_9622ab5554_4k.jpg?s=eyJpIjo5MTQ1OTE4MTYsImUiOjE3NjQ3MjIyMzAsInMiOiJkZjdlZWM5ZTM5MjIxN2NlMjliNGZlZDNkZDYzYjdlNjA3YTdkNmI2IiwidiI6MX0",
    "max_width_2000": 1600,
    "max_height_2000": 1066,
    "url_max_2000": "https://live.staticflickr.com/1295/914591816_ecdd9076b9_h.jpg?s=eyJpIjo5MTQ1OTE4MTYsImUiOjE3NjQ3MjIyMzAsInMiOiI4NGRlMjYzN2Q2N2E5OWM1MzlhNDIzNjQwMWFkZmUwOTFmMWVkY2ZiIiwidiI6MX0",
    "flickr_page": "https://www.flickr.com/photos/54968894@N00/914591816",
    "count_view": "37"
  },
  {
    "id": "913723219",
    "owner": "54968894@N00",
    "title": "18/02/2006 11:13",
    "realname": "Sammi Fang",
    "ownername": "sammifang",
    "datetaken": "2006-02-18 11:13:48",
    "max_width": 4000,
    "max_height": 2666,
    "url_max": "https://live.staticflickr.com/1311/913723219_a9f383dd5d_4k.jpg?s=eyJpIjo5MTM3MjMyMTksImUiOjE3NjQ3MjIyMzAsInMiOiJmMDNhNWZmZmRiNjVkNjAxYzU2OWY5NjZiMmZhY2ViOWFkYmIxMDlkIiwidiI6MX0",
    "max_width_2000": 1600,
    "max_height_2000": 1066,
    "url_max_2000": "https://live.staticflickr.com/1311/913723219_6d9dc8d2d8_h.jpg?s=eyJpIjo5MTM3MjMyMTksImUiOjE3NjQ3MjIyMzAsInMiOiJkNGQzNTI3ZGNiOTM1ODg5ZDZjYWIzNmFjYjI5NTU1M2Y0ZDJhNzNlIiwidiI6MX0",
    "flickr_page": "https://www.flickr.com/photos/54968894@N00/913723219",
    "count_view": "25"
  },
  {
    "id": "914557634",
    "owner": "54968894@N00",
    "title": "18/02/2006 11:13",
    "realname": "Sammi Fang",
    "ownername": "sammifang",
    "datetaken": "2006-02-18 11:13:24",
    "max_width": 2666,
    "max_height": 4000,
    "url_max": "https://live.staticflickr.com/1116/914557634_8373c7eb50_4k.jpg?s=eyJpIjo5MTQ1NTc2MzQsImUiOjE3NjQ3MjIyMzAsInMiOiI5NGZmNTc2NDI5MzJiNzNkOGM1ZjRkNTBjZDU2ZmRmOWJlOTc0NTZiIiwidiI6MX0",
    "max_width_2000": 1365,
    "max_height_2000": 2048,
    "url_max_2000": "https://live.staticflickr.com/1116/914557634_4c3002e5f1_k.jpg?s=eyJpIjo5MTQ1NTc2MzQsImUiOjE3NjQ3MjIyMzAsInMiOiJlMWQ0ZmJkZDc5OGJlYTkzMjZiZjVjZDZmNDU3OWNkYTY5NTQyYThiIiwidiI6MX0",
    "flickr_page": "https://www.flickr.com/photos/54968894@N00/914557634",
    "count_view": "26"
  },
  {
    "id": "913657837",
    "owner": "54968894@N00",
    "title": "18/02/2006 11:09",
    "realname": "Sammi Fang",
    "ownername": "sammifang",
    "datetaken": "2006-02-18 11:09:24",
    "max_width": 2666,
    "max_height": 4000,
    "url_max": "https://live.staticflickr.com/1095/913657837_5bc7b81935_4k.jpg?s=eyJpIjo5MTM2NTc4MzcsImUiOjE3NjQ3MjIyMzAsInMiOiJmOTBkZDZhMzE0ZjZmMDYxZDgwN2E5NDljODc1ZWQzYTU3NTFlMTVhIiwidiI6MX0",
    "max_width_2000": 1365,
    "max_height_2000": 2048,
    "url_max_2000": "https://live.staticflickr.com/1095/913657837_31f4465a73_k.jpg?s=eyJpIjo5MTM2NTc4MzcsImUiOjE3NjQ3MjIyMzAsInMiOiJlZWEyMTU4N2M0ZDQ2YjMzZmNmMDkxN2YzNGFhMjZlY2E3YTU1YjU0IiwidiI6MX0",
    "flickr_page": "https://www.flickr.com/photos/54968894@N00/913657837",
    "count_view": "36"
  },
  {
    "id": "315969579",
    "owner": "54968894@N00",
    "title": "18/02/2006 10:44",
    "realname": "Sammi Fang",
    "ownername": "sammifang",
    "datetaken": "2006-02-18 10:44:38",
    "max_width": 2912,
    "max_height": 4368,
    "url_max": "https://live.staticflickr.com/122/315969579_5381fdedc6_o.jpg?s=eyJpIjozMTU5Njk1NzksImUiOjE3NjQ3MjI0MTUsInMiOiIxODEwMjk4ODY5Y2Q0MDVlNTIyZmVjODdlNTkyMDNiNTJhMjM5M2ExIiwidiI6MX0",
    "max_width_2000": 1365,
    "max_height_2000": 2048,
    "url_max_2000": "https://live.staticflickr.com/122/315969579_4cc3f26e25_k.jpg?s=eyJpIjozMTU5Njk1NzksImUiOjE3NjQ3MjI0MTUsInMiOiIyYzFjZmIzMzJhZGQxYjMwNGJmMjczOWViMWIyYWM4MWIwYmM2YWQxIiwidiI6MX0",
    "flickr_page": "https://www.flickr.com/photos/54968894@N00/315969579",
    "count_view": "29"
  },
  {
    "id": "904500491",
    "owner": "54968894@N00",
    "title": "11/02/2006 23:31",
    "realname": "Sammi Fang",
    "ownername": "sammifang",
    "datetaken": "2006-02-11 23:31:14",
    "max_width": 4368,
    "max_height": 2912,
    "url_max": "https://live.staticflickr.com/1358/904500491_bf04577f01_o.jpg?s=eyJpIjo5MDQ1MDA0OTEsImUiOjE3NjQ3MjIyMzAsInMiOiJlYjUxMjIyZjliYzI1OTc1ZTYxZDc1NGYyZGI0NjliMGY0MjRjODM2IiwidiI6MX0",
    "max_width_2000": 1600,
    "max_height_2000": 1067,
    "url_max_2000": "https://live.staticflickr.com/1358/904500491_d33e86c209_h.jpg?s=eyJpIjo5MDQ1MDA0OTEsImUiOjE3NjQ3MjIyMzAsInMiOiJhY2QxZjI1YWI5OGVhOWI2ZWQ5NDEyZjQwN2U4NmNkMmM1ODMzOWY1IiwidiI6MX0",
    "flickr_page": "https://www.flickr.com/photos/54968894@N00/904500491",
    "count_view": "13"
  },
  {
    "id": "904105193",
    "owner": "54968894@N00",
    "title": "11/02/2006 22:31",
    "realname": "Sammi Fang",
    "ownername": "sammifang",
    "datetaken": "2006-02-11 22:31:47",
    "max_width": 2912,
    "max_height": 4368,
    "url_max": "https://live.staticflickr.com/1401/904105193_a5a0dc4950_o.jpg?s=eyJpIjo5MDQxMDUxOTMsImUiOjE3NjQ3MjIyMzAsInMiOiI5Y2FlZmVhNDNmYWIyOGQwZTdjNzY1ZmQ4M2UzOWM5YWRmYjdkZTBjIiwidiI6MX0",
    "max_width_2000": 1365,
    "max_height_2000": 2048,
    "url_max_2000": "https://live.staticflickr.com/1401/904105193_f345df396a_k.jpg?s=eyJpIjo5MDQxMDUxOTMsImUiOjE3NjQ3MjIyMzAsInMiOiI2YjhjNjhmYmY1ZTBhMmI1MmIxYTlmNTIwM2MyYmU2MDg2ZjAwNTdhIiwidiI6MX0",
    "flickr_page": "https://www.flickr.com/photos/54968894@N00/904105193",
    "count_view": "17"
  },
  {
    "id": "900606960",
    "owner": "54968894@N00",
    "title": "11/02/2006 22:18",
    "realname": "Sammi Fang",
    "ownername": "sammifang",
    "datetaken": "2006-02-11 22:18:39",
    "max_width": 4276,
    "max_height": 2850,
    "url_max": "https://live.staticflickr.com/1036/900606960_859f7b9901_o.jpg?s=eyJpIjo5MDA2MDY5NjAsImUiOjE3NjQ3MjIyMzAsInMiOiJlNTVlYzEyYTlmN2NjYzBiNTk3NGU2ZDUzOTBhY2MzNGE0NDk2OWNiIiwidiI6MX0",
    "max_width_2000": 1600,
    "max_height_2000": 1066,
    "url_max_2000": "https://live.staticflickr.com/1036/900606960_8b916179a6_h.jpg?s=eyJpIjo5MDA2MDY5NjAsImUiOjE3NjQ3MjIyMzAsInMiOiI4YThkNTU2NjU1M2Q0N2NkY2UzOWM2ZWM1ZDU0NTcyYThlMzAzYjNhIiwidiI6MX0",
    "flickr_page": "https://www.flickr.com/photos/54968894@N00/900606960",
    "count_view": "268"
  },
  {
    "id": "901078568",
    "owner": "54968894@N00",
    "title": "11/02/2006 21:03",
    "realname": "Sammi Fang",
    "ownername": "sammifang",
    "datetaken": "2006-02-11 21:03:31",
    "max_width": 4368,
    "max_height": 2912,
    "url_max": "https://live.staticflickr.com/1139/901078568_d15acfbb8f_o.jpg?s=eyJpIjo5MDEwNzg1NjgsImUiOjE3NjQ3MjIyMzAsInMiOiJmNDZmMTIyMDlkMWY0MTI0YmMxMTVkMTA5ZDQ5NTYwODczNzgyNGYwIiwidiI6MX0",
    "max_width_2000": 1600,
    "max_height_2000": 1067,
    "url_max_2000": "https://live.staticflickr.com/1139/901078568_4ed167e1ae_h.jpg?s=eyJpIjo5MDEwNzg1NjgsImUiOjE3NjQ3MjIyMzAsInMiOiI2MWU4NmRlYWUwZjIwZmRhMzgyNzdkMDhjMTNmNzc3N2QxNDA5N2M5IiwidiI6MX0",
    "flickr_page": "https://www.flickr.com/photos/54968894@N00/901078568",
    "count_view": "32"
  },
  {
    "id": "891264590",
    "owner": "54968894@N00",
    "title": "01/02/2006 17:15",
    "realname": "Sammi Fang",
    "ownername": "sammifang",
    "datetaken": "2006-02-01 17:15:27",
    "max_width": 4368,
    "max_height": 2912,
    "url_max": "https://live.staticflickr.com/1001/891264590_db1d8013be_o.jpg?s=eyJpIjo4OTEyNjQ1OTAsImUiOjE3NjQ3MjIyMzQsInMiOiIzMTA5NmEwM2JmMDhiODJkYTU4YmU0ZDcwNjRiZjQ2MzZiMzJjM2Y2IiwidiI6MX0",
    "max_width_2000": 1600,
    "max_height_2000": 1067,
    "url_max_2000": "https://live.staticflickr.com/1001/891264590_24cc66fbe1_h.jpg?s=eyJpIjo4OTEyNjQ1OTAsImUiOjE3NjQ3MjIyMzQsInMiOiIwYjY1NTU5MGYzMTY3OGU4ZTQxYzhlZjIyMGNhNDIwMjUxNGY5ZDE5IiwidiI6MX0",
    "flickr_page": "https://www.flickr.com/photos/54968894@N00/891264590",
    "count_view": "72"
  },
  {
    "id": "890403791",
    "owner": "54968894@N00",
    "title": "01/02/2006 17:15",
    "realname": "Sammi Fang",
    "ownername": "sammifang",
    "datetaken": "2006-02-01 17:15:00",
    "max_width": 4368,
    "max_height": 2912,
    "url_max": "https://live.staticflickr.com/1431/890403791_be878e6179_o.jpg?s=eyJpIjo4OTA0MDM3OTEsImUiOjE3NjQ3MjIyMzQsInMiOiI1N2EwYjkwM2YxOWZmMjc1OGMxNzc0ZTgyNThjM2MxZjFkYjZiY2ExIiwidiI6MX0",
    "max_width_2000": 1600,
    "max_height_2000": 1067,
    "url_max_2000": "https://live.staticflickr.com/1431/890403791_240c2eac42_h.jpg?s=eyJpIjo4OTA0MDM3OTEsImUiOjE3NjQ3MjIyMzQsInMiOiI2ZTQyY2JlMTdhODA0YjMyOGU4MjFhNzA4Y2E0ZGE2OTBlN2I2MTRiIiwidiI6MX0",
    "flickr_page": "https://www.flickr.com/photos/54968894@N00/890403791",
    "count_view": "65"
  },
  {
    "id": "890374627",
    "owner": "54968894@N00",
    "title": "01/02/2006 17:13",
    "realname": "Sammi Fang",
    "ownername": "sammifang",
    "datetaken": "2006-02-01 17:13:12",
    "max_width": 4368,
    "max_height": 2912,
    "url_max": "https://live.staticflickr.com/1349/890374627_020fc55039_o.jpg?s=eyJpIjo4OTAzNzQ2MjcsImUiOjE3NjQ3MjIyMzQsInMiOiI2MDFmNWZmYzU3YTBiMzUwZTM5NzJkMTVlMjJkOTUzMDBjYzQ3NDc4IiwidiI6MX0",
    "max_width_2000": 1600,
    "max_height_2000": 1067,
    "url_max_2000": "https://live.staticflickr.com/1349/890374627_921ed777f5_h.jpg?s=eyJpIjo4OTAzNzQ2MjcsImUiOjE3NjQ3MjIyMzQsInMiOiI3MGQ5MGMwMTZiMjk1Y2M0MzM5ZjgwNjkxN2NkNzdlMGNlYzM3YmVhIiwidiI6MX0",
    "flickr_page": "https://www.flickr.com/photos/54968894@N00/890374627",
    "count_view": "52"
  },
  {
    "id": "890325997",
    "owner": "54968894@N00",
    "title": "01/02/2006 17:09",
    "realname": "Sammi Fang",
    "ownername": "sammifang",
    "datetaken": "2006-02-01 17:09:28",
    "max_width": 2912,
    "max_height": 4368,
    "url_max": "https://live.staticflickr.com/1092/890325997_3a06fec012_o.jpg?s=eyJpIjo4OTAzMjU5OTcsImUiOjE3NjQ3MjIyMzQsInMiOiI4NTRjYWY0NDVmZGU2NmZmZTAyMjM5YjBiYWQ5ODdmYjc4NTI1ZjUxIiwidiI6MX0",
    "max_width_2000": 1365,
    "max_height_2000": 2048,
    "url_max_2000": "https://live.staticflickr.com/1092/890325997_7f5d9aab48_k.jpg?s=eyJpIjo4OTAzMjU5OTcsImUiOjE3NjQ3MjIyMzQsInMiOiI4ZDdkYjMzNTg0ZGRjY2ExOWE4MjZkNjE4ODZkYjM1ZGM4YjE1ZTEzIiwidiI6MX0",
    "flickr_page": "https://www.flickr.com/photos/54968894@N00/890325997",
    "count_view": "61"
  },
  {
    "id": "890316801",
    "owner": "54968894@N00",
    "title": "01/02/2006 17:02",
    "realname": "Sammi Fang",
    "ownername": "sammifang",
    "datetaken": "2006-02-01 17:02:38",
    "max_width": 4368,
    "max_height": 2912,
    "url_max": "https://live.staticflickr.com/1137/890316801_3001616581_o.jpg?s=eyJpIjo4OTAzMTY4MDEsImUiOjE3NjQ3MjIyMzQsInMiOiJiNDcwNjNjNTlkYjYyNDZmNjMzZmFiZDFkNjE3NGZmYzMzYTVmN2M2IiwidiI6MX0",
    "max_width_2000": 1600,
    "max_height_2000": 1067,
    "url_max_2000": "https://live.staticflickr.com/1137/890316801_58d9a5bde4_h.jpg?s=eyJpIjo4OTAzMTY4MDEsImUiOjE3NjQ3MjIyMzQsInMiOiI3OGJiNDhiZTRiNDJiNGQwZTgzMzBkNDkyNTkxZjc1NGFkNWI3YzY3IiwidiI6MX0",
    "flickr_page": "https://www.flickr.com/photos/54968894@N00/890316801",
    "count_view": "107"
  },
  {
    "id": "890917840",
    "owner": "54968894@N00",
    "title": "01/02/2006 15:46",
    "realname": "Sammi Fang",
    "ownername": "sammifang",
    "datetaken": "2006-02-01 15:46:51",
    "max_width": 4368,
    "max_height": 2912,
    "url_max": "https://live.staticflickr.com/1222/890917840_7224e018ec_o.jpg?s=eyJpIjo4OTA5MTc4NDAsImUiOjE3NjQ3MjIyMzQsInMiOiI4NjU1MmYxZmNkYjM4YjgzMGUwZDhhOWFjNTY3OTdiZWE4MzI4MzE2IiwidiI6MX0",
    "max_width_2000": 1600,
    "max_height_2000": 1067,
    "url_max_2000": "https://live.staticflickr.com/1222/890917840_a2d5d56ed2_h.jpg?s=eyJpIjo4OTA5MTc4NDAsImUiOjE3NjQ3MjIyMzQsInMiOiI0N2FmZTFhM2QxNGM1MDE0NzU5MTU5NWM0YTcyMmYxOGYxOThmZWMwIiwidiI6MX0",
    "flickr_page": "https://www.flickr.com/photos/54968894@N00/890917840",
    "count_view": "43"
  },
  {
    "id": "890872450",
    "owner": "54968894@N00",
    "title": "30/01/2006 17:01",
    "realname": "Sammi Fang",
    "ownername": "sammifang",
    "datetaken": "2006-01-30 17:01:06",
    "max_width": 4368,
    "max_height": 2912,
    "url_max": "https://live.staticflickr.com/1010/890872450_f226f7d8bd_o.jpg?s=eyJpIjo4OTA4NzI0NTAsImUiOjE3NjQ3MjIyMzQsInMiOiJjNzY0ZjQzMWM3ZTdmZjQzZjM3NjA5OGI4ZDVjMTNhZmNkMDdjNDQwIiwidiI6MX0",
    "max_width_2000": 1600,
    "max_height_2000": 1067,
    "url_max_2000": "https://live.staticflickr.com/1010/890872450_8e5c580c65_h.jpg?s=eyJpIjo4OTA4NzI0NTAsImUiOjE3NjQ3MjIyMzQsInMiOiI1M2U5YjE3M2VmMThlZDQ0MmYyMmJlNmY5ODU3OGYyOGFlNjJiZWNkIiwidiI6MX0",
    "flickr_page": "https://www.flickr.com/photos/54968894@N00/890872450",
    "count_view": "48"
  },
  {
    "id": "890805998",
    "owner": "54968894@N00",
    "title": "30/01/2006 16:57",
    "realname": "Sammi Fang",
    "ownername": "sammifang",
    "datetaken": "2006-01-30 16:57:55",
    "max_width": 4368,
    "max_height": 2912,
    "url_max": "https://live.staticflickr.com/1028/890805998_bc11fdc8f5_o.jpg?s=eyJpIjo4OTA4MDU5OTgsImUiOjE3NjQ3MjIyMzQsInMiOiIwMzMzYjY1ODc4MDQxOGEwMDBlM2M1MTQzYTI5YmRhZTgwNWE5YTZjIiwidiI6MX0",
    "max_width_2000": 1600,
    "max_height_2000": 1067,
    "url_max_2000": "https://live.staticflickr.com/1028/890805998_172a3a96a8_h.jpg?s=eyJpIjo4OTA4MDU5OTgsImUiOjE3NjQ3MjIyMzQsInMiOiIxYjhiNmNjMTE1NjFjYjdhNzU5MjNmMmI0MGNiNzcyNjM5NTc0MzhiIiwidiI6MX0",
    "flickr_page": "https://www.flickr.com/photos/54968894@N00/890805998",
    "count_view": "41"
  },
  {
    "id": "890788894",
    "owner": "54968894@N00",
    "title": "30/01/2006 16:57",
    "realname": "Sammi Fang",
    "ownername": "sammifang",
    "datetaken": "2006-01-30 16:57:43",
    "max_width": 4287,
    "max_height": 2792,
    "url_max": "https://live.staticflickr.com/1259/890788894_767ac27e79_o.jpg?s=eyJpIjo4OTA3ODg4OTQsImUiOjE3NjQ3MjIyMzQsInMiOiI2ODI2NDM4N2EyNDdmZDYxNjhkMGZkZmZkOGFhYjFmNDI2N2YxN2EwIiwidiI6MX0",
    "max_width_2000": 1600,
    "max_height_2000": 1042,
    "url_max_2000": "https://live.staticflickr.com/1259/890788894_595c9c4cb2_h.jpg?s=eyJpIjo4OTA3ODg4OTQsImUiOjE3NjQ3MjIyMzQsInMiOiI5ZDQ4OGJlOWQ1YjZlZDU4YjM0NTU3ZDk5ZGE2NzRmMGM4YzUyYzBiIiwidiI6MX0",
    "flickr_page": "https://www.flickr.com/photos/54968894@N00/890788894",
    "count_view": "46"
  },
  {
    "id": "890689842",
    "owner": "54968894@N00",
    "title": "30/01/2006 16:53",
    "realname": "Sammi Fang",
    "ownername": "sammifang",
    "datetaken": "2006-01-30 16:53:02",
    "max_width": 4368,
    "max_height": 2912,
    "url_max": "https://live.staticflickr.com/1063/890689842_dee16fb51d_o.jpg?s=eyJpIjo4OTA2ODk4NDIsImUiOjE3NjQ3MjIyMzQsInMiOiI3MWUzZGVjMmQ4ZGRiNzM3Mzc1OWRmMmE5NTU0ZDQ0MWM4ZjRjNWUyIiwidiI6MX0",
    "max_width_2000": 1600,
    "max_height_2000": 1067,
    "url_max_2000": "https://live.staticflickr.com/1063/890689842_3c36ded9c9_h.jpg?s=eyJpIjo4OTA2ODk4NDIsImUiOjE3NjQ3MjIyMzQsInMiOiJlOWI5Yjc4ODgzMzRjODEzYTBhZGE2M2U5YjE3MTExMGI3YzIwZDM1IiwidiI6MX0",
    "flickr_page": "https://www.flickr.com/photos/54968894@N00/890689842",
    "count_view": "46"
  },
  {
    "id": "889836335",
    "owner": "54968894@N00",
    "title": "30/01/2006 16:52",
    "realname": "Sammi Fang",
    "ownername": "sammifang",
    "datetaken": "2006-01-30 16:52:20",
    "max_width": 4368,
    "max_height": 2912,
    "url_max": "https://live.staticflickr.com/1395/889836335_ae02266f29_o.jpg?s=eyJpIjo4ODk4MzYzMzUsImUiOjE3NjQ3MjIyMzQsInMiOiI3NzM1OTYwYmFmOGFlZGVkNjY1YmQwYWVmNzZhODJmMDRiZGI2YWE1IiwidiI6MX0",
    "max_width_2000": 1600,
    "max_height_2000": 1067,
    "url_max_2000": "https://live.staticflickr.com/1395/889836335_49e3d56131_h.jpg?s=eyJpIjo4ODk4MzYzMzUsImUiOjE3NjQ3MjIyMzQsInMiOiI1OTgwMWM2ODMxMTJkMTA4ODg3ZDQwNjhhMDVjOTA3MmNmODc0MDZmIiwidiI6MX0",
    "flickr_page": "https://www.flickr.com/photos/54968894@N00/889836335",
    "count_view": "49"
  },
  {
    "id": "890567142",
    "owner": "54968894@N00",
    "title": "28/01/2006 20:58",
    "realname": "Sammi Fang",
    "ownername": "sammifang",
    "datetaken": "2006-01-28 20:58:21",
    "max_width": 4368,
    "max_height": 2912,
    "url_max": "https://live.staticflickr.com/1332/890567142_caf0aad8c3_o.jpg?s=eyJpIjo4OTA1NjcxNDIsImUiOjE3NjQ3MjIyMzQsInMiOiI4MmRiOGYzNGQyYTUxZDI5ZWZiMTZlOTBhMDk4MzBlMzM0NjdhNGQ0IiwidiI6MX0",
    "max_width_2000": 1600,
    "max_height_2000": 1067,
    "url_max_2000": "https://live.staticflickr.com/1332/890567142_3ac0adf910_h.jpg?s=eyJpIjo4OTA1NjcxNDIsImUiOjE3NjQ3MjIyMzQsInMiOiI5OWI2MzIwOTZkYWIwMDVmMTExYTQwMDg4Yzk4NGZhOTdjNzZlM2Q1IiwidiI6MX0",
    "flickr_page": "https://www.flickr.com/photos/54968894@N00/890567142",
    "count_view": "24"
  },
  {
    "id": "890551056",
    "owner": "54968894@N00",
    "title": "28/01/2006 20:57",
    "realname": "Sammi Fang",
    "ownername": "sammifang",
    "datetaken": "2006-01-28 20:57:23",
    "max_width": 4368,
    "max_height": 2912,
    "url_max": "https://live.staticflickr.com/1185/890551056_646451bd17_o.jpg?s=eyJpIjo4OTA1NTEwNTYsImUiOjE3NjQ3MjIyMzQsInMiOiJmZWQ4ZmQ4ZjI1ZDUwZmE0YWU4NTM1MmMwMjZiYjVlZWI5NDNkNGExIiwidiI6MX0",
    "max_width_2000": 1600,
    "max_height_2000": 1067,
    "url_max_2000": "https://live.staticflickr.com/1185/890551056_738976034e_h.jpg?s=eyJpIjo4OTA1NTEwNTYsImUiOjE3NjQ3MjIyMzQsInMiOiJlOTk5MWM5ZjcxNGRiYTJhZDQ4NmI5YTZjMTEzOWRiMTM5N2I4ZjA5IiwidiI6MX0",
    "flickr_page": "https://www.flickr.com/photos/54968894@N00/890551056",
    "count_view": "22"
  },
  {
    "id": "890534438",
    "owner": "54968894@N00",
    "title": "28/01/2006 20:56",
    "realname": "Sammi Fang",
    "ownername": "sammifang",
    "datetaken": "2006-01-28 20:56:10",
    "max_width": 2912,
    "max_height": 4368,
    "url_max": "https://live.staticflickr.com/1332/890534438_f0f9bed007_o.jpg?s=eyJpIjo4OTA1MzQ0MzgsImUiOjE3NjQ3MjIyMzQsInMiOiI4OTJjMmVlMDdiZTA2ZmZjZDg0YmVmZWE4ZjExYjhlNTkxMmQyYjFhIiwidiI6MX0",
    "max_width_2000": 1365,
    "max_height_2000": 2048,
    "url_max_2000": "https://live.staticflickr.com/1332/890534438_183ce20027_k.jpg?s=eyJpIjo4OTA1MzQ0MzgsImUiOjE3NjQ3MjIyMzQsInMiOiJkYmNjNTBiYTVmYmIxMjk0YmMyOWM0ZjNkY2Q3N2RmNTM5YTBjNDViIiwidiI6MX0",
    "flickr_page": "https://www.flickr.com/photos/54968894@N00/890534438",
    "count_view": "40"
  },
  {
    "id": "798021861",
    "owner": "54968894@N00",
    "title": "28/01/2006 16:56",
    "realname": "Sammi Fang",
    "ownername": "sammifang",
    "datetaken": "2006-01-28 16:56:03",
    "max_width": 4368,
    "max_height": 2912,
    "url_max": "https://live.staticflickr.com/1262/798021861_5e2486e042_o.jpg?s=eyJpIjo3OTgwMjE4NjEsImUiOjE3NjQ3MjIyNTQsInMiOiIxMTIzMWJhODZhYjZlYTI3OWIyMTYwNDA3NjQ2MmY4ODE2YzM3OWE5IiwidiI6MX0",
    "max_width_2000": 1600,
    "max_height_2000": 1067,
    "url_max_2000": "https://live.staticflickr.com/1262/798021861_f46c426295_h.jpg?s=eyJpIjo3OTgwMjE4NjEsImUiOjE3NjQ3MjIyNTQsInMiOiIzMjg3OGI4ODRkYjUzYjRmZTQzNjNhNWQxM2NlN2M1YTUyMzZmYjEwIiwidiI6MX0",
    "flickr_page": "https://www.flickr.com/photos/54968894@N00/798021861",
    "count_view": "17"
  },
  {
    "id": "889286763",
    "owner": "54968894@N00",
    "title": "26/01/2006 16:07",
    "realname": "Sammi Fang",
    "ownername": "sammifang",
    "datetaken": "2006-01-26 16:07:52",
    "max_width": 2776,
    "max_height": 4121,
    "url_max": "https://live.staticflickr.com/1120/889286763_008bf53dd2_o.jpg?s=eyJpIjo4ODkyODY3NjMsImUiOjE3NjQ3MjIyMzQsInMiOiI5OGRjOTI3OWVjNGNlYWU2NzdhN2MyZmE0YjJhY2I1NzVlMGMxMmY4IiwidiI6MX0",
    "max_width_2000": 1380,
    "max_height_2000": 2048,
    "url_max_2000": "https://live.staticflickr.com/1120/889286763_0cd02e1218_k.jpg?s=eyJpIjo4ODkyODY3NjMsImUiOjE3NjQ3MjIyMzQsInMiOiIxN2U0MzlhNWU2ZTMxMDkwY2JiZmIyOTA1ZjMxY2QyNmFiYTRlNTRmIiwidiI6MX0",
    "flickr_page": "https://www.flickr.com/photos/54968894@N00/889286763",
    "count_view": "41"
  },
  {
    "id": "798912856",
    "owner": "54968894@N00",
    "title": "26/01/2006 15:21",
    "realname": "Sammi Fang",
    "ownername": "sammifang",
    "datetaken": "2006-01-26 15:21:19",
    "max_width": 4368,
    "max_height": 2912,
    "url_max": "https://live.staticflickr.com/1379/798912856_7c9fd20fa2_o.jpg?s=eyJpIjo3OTg5MTI4NTYsImUiOjE3NjQ3MjIyNTQsInMiOiI5NmFhMGJkYWZkMmNmZGFhMzM0N2QwM2U1NGEyOWFlNzQ0NzhkM2E0IiwidiI6MX0",
    "max_width_2000": 1600,
    "max_height_2000": 1067,
    "url_max_2000": "https://live.staticflickr.com/1379/798912856_27e588c206_h.jpg?s=eyJpIjo3OTg5MTI4NTYsImUiOjE3NjQ3MjIyNTQsInMiOiIyNGI5NzNmOGYxYjI3ZjU4NTRkMTYxMzZiODEyNDQ3MjQ1MDBjZTgxIiwidiI6MX0",
    "flickr_page": "https://www.flickr.com/photos/54968894@N00/798912856",
    "count_view": "28"
  },
  {
    "id": "885969008",
    "owner": "54968894@N00",
    "title": "20/01/2006 17:29",
    "realname": "Sammi Fang",
    "ownername": "sammifang",
    "datetaken": "2006-01-20 17:29:36",
    "max_width": 4000,
    "max_height": 2666,
    "url_max": "https://live.staticflickr.com/1155/885969008_a49c683823_4k.jpg?s=eyJpIjo4ODU5NjkwMDgsImUiOjE3NjQ3MjIyMzQsInMiOiI1MDg0ZGIxOWNlMmZlYjM5NTA2NWE4NjZkMDUzZTgwODViMWRmYjFmIiwidiI6MX0",
    "max_width_2000": 1600,
    "max_height_2000": 1066,
    "url_max_2000": "https://live.staticflickr.com/1155/885969008_fb4d8b9c63_h.jpg?s=eyJpIjo4ODU5NjkwMDgsImUiOjE3NjQ3MjIyMzQsInMiOiI5YTlkYjAzMDM0Yzg4Y2I0ODI2Yzk2MmEyNzU5ZDM2YzEwOTIyOTljIiwidiI6MX0",
    "flickr_page": "https://www.flickr.com/photos/54968894@N00/885969008",
    "count_view": "44"
  },
  {
    "id": "885058583",
    "owner": "54968894@N00",
    "title": "20/01/2006 17:03",
    "realname": "Sammi Fang",
    "ownername": "sammifang",
    "datetaken": "2006-01-20 17:03:06",
    "max_width": 4000,
    "max_height": 1718,
    "url_max": "https://live.staticflickr.com/1053/885058583_cc3f155aa7_4k.jpg?s=eyJpIjo4ODUwNTg1ODMsImUiOjE3NjQ3MjIyMzQsInMiOiI2N2EwY2NlY2RlNTcyMTc5YTg5NjYzZjMyYmUzNmQ2Y2UxNDVhN2JiIiwidiI6MX0",
    "max_width_2000": 1600,
    "max_height_2000": 687,
    "url_max_2000": "https://live.staticflickr.com/1053/885058583_1e14748f63_h.jpg?s=eyJpIjo4ODUwNTg1ODMsImUiOjE3NjQ3MjIyMzQsInMiOiIyZWViMzkwODY3OTNkMGI5MTcwOTU4NTRiZWQyOWU0NzFhNThhYWVjIiwidiI6MX0",
    "flickr_page": "https://www.flickr.com/photos/54968894@N00/885058583",
    "count_view": "283"
  },
  {
    "id": "888130187",
    "owner": "54968894@N00",
    "title": "20/01/2006 16:41",
    "realname": "Sammi Fang",
    "ownername": "sammifang",
    "datetaken": "2006-01-20 16:41:16",
    "max_width": 4000,
    "max_height": 2666,
    "url_max": "https://live.staticflickr.com/1265/888130187_74abae5ac7_4k.jpg?s=eyJpIjo4ODgxMzAxODcsImUiOjE3NjQ3MjIyMzQsInMiOiIxZWRiZjViMDk2YmMzMGM2ZjhjZjM2ZTI0YTUyN2I5MWNjZTM0Yjc0IiwidiI6MX0",
    "max_width_2000": 1600,
    "max_height_2000": 1066,
    "url_max_2000": "https://live.staticflickr.com/1265/888130187_7e11491030_h.jpg?s=eyJpIjo4ODgxMzAxODcsImUiOjE3NjQ3MjIyMzQsInMiOiI1ZWNiODRmZmM1YmNjYTVkMDM0OGE3YzMxNDFiYjk0YzgxYWRkYzg0IiwidiI6MX0",
    "flickr_page": "https://www.flickr.com/photos/54968894@N00/888130187",
    "count_view": "17"
  },
  {
    "id": "888932380",
    "owner": "54968894@N00",
    "title": "20/01/2006 16:33",
    "realname": "Sammi Fang",
    "ownername": "sammifang",
    "datetaken": "2006-01-20 16:33:28",
    "max_width": 4000,
    "max_height": 2666,
    "url_max": "https://live.staticflickr.com/1101/888932380_11cd161c0f_4k.jpg?s=eyJpIjo4ODg5MzIzODAsImUiOjE3NjQ3MjIyMzQsInMiOiIyNTkzNDEzYTUyYmRmNTQ5OGM3NGVlOWY2ZTBlNThiYjc4YTMyNmExIiwidiI6MX0",
    "max_width_2000": 1600,
    "max_height_2000": 1066,
    "url_max_2000": "https://live.staticflickr.com/1101/888932380_636179311b_h.jpg?s=eyJpIjo4ODg5MzIzODAsImUiOjE3NjQ3MjIyMzQsInMiOiI3MDk1ZTZiM2MzMTA3YmY2ZDVhNTY2NjkxZjljZGQ4ZmU1YmJhMGM1IiwidiI6MX0",
    "flickr_page": "https://www.flickr.com/photos/54968894@N00/888932380",
    "count_view": "251"
  },
  {
    "id": "885010392",
    "owner": "54968894@N00",
    "title": "16/01/2006 21:31",
    "realname": "Sammi Fang",
    "ownername": "sammifang",
    "datetaken": "2006-01-16 21:31:18",
    "max_width": 4368,
    "max_height": 2912,
    "url_max": "https://live.staticflickr.com/1291/885010392_c0e4441a2f_o.jpg?s=eyJpIjo4ODUwMTAzOTIsImUiOjE3NjQ3MjIyMzYsInMiOiJiZmVlN2U5MjZkMzVhNDNlMmI0MzM5YzY2MThiN2I2MWZjYmVhOWQ2IiwidiI6MX0",
    "max_width_2000": 1600,
    "max_height_2000": 1067,
    "url_max_2000": "https://live.staticflickr.com/1291/885010392_4c9d764505_h.jpg?s=eyJpIjo4ODUwMTAzOTIsImUiOjE3NjQ3MjIyMzYsInMiOiIzYmJiYWNkYTE4NzcyYjE3ZmE0N2FkYzRhOGQ3MDE1MzFhMDNmYWQyIiwidiI6MX0",
    "flickr_page": "https://www.flickr.com/photos/54968894@N00/885010392",
    "count_view": "57"
  },
  {
    "id": "884146543",
    "owner": "54968894@N00",
    "title": "16/01/2006 21:31",
    "realname": "Sammi Fang",
    "ownername": "sammifang",
    "datetaken": "2006-01-16 21:31:06",
    "max_width": 4368,
    "max_height": 2912,
    "url_max": "https://live.staticflickr.com/1291/884146543_26bc1edfde_o.jpg?s=eyJpIjo4ODQxNDY1NDMsImUiOjE3NjQ3MjIyMzYsInMiOiIzYzY0MjJiZTI2YTdlYjExN2YzNGFkYjA3M2U5Y2IzMTdlZjNhMTIwIiwidiI6MX0",
    "max_width_2000": 1600,
    "max_height_2000": 1067,
    "url_max_2000": "https://live.staticflickr.com/1291/884146543_b2bef50ba2_h.jpg?s=eyJpIjo4ODQxNDY1NDMsImUiOjE3NjQ3MjIyMzYsInMiOiJkZDkzMjYyNGMyZjQxYmE2NTc4ZDg3ZjQ4NGNjZmYzNGMzNGZlZmU0IiwidiI6MX0",
    "flickr_page": "https://www.flickr.com/photos/54968894@N00/884146543",
    "count_view": "22"
  },
  {
    "id": "884129177",
    "owner": "54968894@N00",
    "title": "16/01/2006 21:30",
    "realname": "Sammi Fang",
    "ownername": "sammifang",
    "datetaken": "2006-01-16 21:30:13",
    "max_width": 4368,
    "max_height": 2912,
    "url_max": "https://live.staticflickr.com/1239/884129177_69beba826b_o.jpg?s=eyJpIjo4ODQxMjkxNzcsImUiOjE3NjQ3MjIyMzYsInMiOiJhYWM2NGRhNWEyZTdjOTkxYzE3NWEyMTZiMjNjYWM3ZDFlM2E1YTcxIiwidiI6MX0",
    "max_width_2000": 1600,
    "max_height_2000": 1067,
    "url_max_2000": "https://live.staticflickr.com/1239/884129177_dee2bf833a_h.jpg?s=eyJpIjo4ODQxMjkxNzcsImUiOjE3NjQ3MjIyMzYsInMiOiJlYzVlMjdmM2MwODJlMDQ4NTczOTcxNDI2NjgzMTAyZmYyYjAwMDhkIiwidiI6MX0",
    "flickr_page": "https://www.flickr.com/photos/54968894@N00/884129177",
    "count_view": "19"
  },
  {
    "id": "884096019",
    "owner": "54968894@N00",
    "title": "16/01/2006 21:29",
    "realname": "Sammi Fang",
    "ownername": "sammifang",
    "datetaken": "2006-01-16 21:29:25",
    "max_width": 4368,
    "max_height": 2912,
    "url_max": "https://live.staticflickr.com/1425/884096019_4335976a55_o.jpg?s=eyJpIjo4ODQwOTYwMTksImUiOjE3NjQ3MjIyMzYsInMiOiI2MTA0NmRkNzA1NDczMWUzYzJjMDAyMDA4Yzg5OTFlYjJhZjBmZTMwIiwidiI6MX0",
    "max_width_2000": 1600,
    "max_height_2000": 1067,
    "url_max_2000": "https://live.staticflickr.com/1425/884096019_cc01112556_h.jpg?s=eyJpIjo4ODQwOTYwMTksImUiOjE3NjQ3MjIyMzYsInMiOiJhZDc4N2EwYzc1YTI4NjJlNzYxYzM1NTVlZmIzNGQ5MTIyNTVmODg4IiwidiI6MX0",
    "flickr_page": "https://www.flickr.com/photos/54968894@N00/884096019",
    "count_view": "21"
  },
  {
    "id": "884929124",
    "owner": "54968894@N00",
    "title": "16/01/2006 21:01",
    "realname": "Sammi Fang",
    "ownername": "sammifang",
    "datetaken": "2006-01-16 21:01:00",
    "max_width": 4368,
    "max_height": 2912,
    "url_max": "https://live.staticflickr.com/1396/884929124_e330acb99f_o.jpg?s=eyJpIjo4ODQ5MjkxMjQsImUiOjE3NjQ3MjIyMzYsInMiOiI4MGZlZDIzMTU4MzZjNjg1MmZhZWE0NDAwYzBlZjIxMDRiOTNmMDkwIiwidiI6MX0",
    "max_width_2000": 1600,
    "max_height_2000": 1067,
    "url_max_2000": "https://live.staticflickr.com/1396/884929124_170a4c9bfc_h.jpg?s=eyJpIjo4ODQ5MjkxMjQsImUiOjE3NjQ3MjIyMzYsInMiOiI3ODc0NGQ1Mjg1NTRjYThjODUyMmViMmY5YmI3M2IzYzMxZjE2YmY3IiwidiI6MX0",
    "flickr_page": "https://www.flickr.com/photos/54968894@N00/884929124",
    "count_view": "257"
  },
  {
    "id": "884061799",
    "owner": "54968894@N00",
    "title": "16/01/2006 21:00",
    "realname": "Sammi Fang",
    "ownername": "sammifang",
    "datetaken": "2006-01-16 21:00:51",
    "max_width": 4368,
    "max_height": 2912,
    "url_max": "https://live.staticflickr.com/1262/884061799_7b9cb98a76_o.jpg?s=eyJpIjo4ODQwNjE3OTksImUiOjE3NjQ3MjIyMzYsInMiOiIwODI1NWUyZWI1ZDBlZWEzOWE1ZmMxZTE2ZTYyNjUzMjJkMjRjMGJjIiwidiI6MX0",
    "max_width_2000": 1600,
    "max_height_2000": 1067,
    "url_max_2000": "https://live.staticflickr.com/1262/884061799_53b4b21500_h.jpg?s=eyJpIjo4ODQwNjE3OTksImUiOjE3NjQ3MjIyMzYsInMiOiJjZWM1ZDM3YTZiYmU4MDViMmQwOWUyYzc3Y2YwODYyZDBkNWUxN2JiIiwidiI6MX0",
    "flickr_page": "https://www.flickr.com/photos/54968894@N00/884061799",
    "count_view": "36"
  },
  {
    "id": "884896016",
    "owner": "54968894@N00",
    "title": "16/01/2006 20:58",
    "realname": "Sammi Fang",
    "ownername": "sammifang",
    "datetaken": "2006-01-16 20:58:06",
    "max_width": 4368,
    "max_height": 2912,
    "url_max": "https://live.staticflickr.com/1372/884896016_aeb15ac7cd_o.jpg?s=eyJpIjo4ODQ4OTYwMTYsImUiOjE3NjQ3MjIyMzYsInMiOiI0MDc5M2Y4NjI2NTY4NGFhM2M2MTcxYWZiMjZkNTIwMGU4ZWI2YzBlIiwidiI6MX0",
    "max_width_2000": 1600,
    "max_height_2000": 1067,
    "url_max_2000": "https://live.staticflickr.com/1372/884896016_08d9053024_h.jpg?s=eyJpIjo4ODQ4OTYwMTYsImUiOjE3NjQ3MjIyMzYsInMiOiI2ODJmYzJmZTU2Nzg1ODUyZDQxOTNlMDhmMDE3YWNmNzMzMjk3YmYzIiwidiI6MX0",
    "flickr_page": "https://www.flickr.com/photos/54968894@N00/884896016",
    "count_view": "40"
  },
  {
    "id": "884880670",
    "owner": "54968894@N00",
    "title": "16/01/2006 20:53",
    "realname": "Sammi Fang",
    "ownername": "sammifang",
    "datetaken": "2006-01-16 20:53:29",
    "max_width": 4368,
    "max_height": 2912,
    "url_max": "https://live.staticflickr.com/1244/884880670_8c73e42e20_o.jpg?s=eyJpIjo4ODQ4ODA2NzAsImUiOjE3NjQ3MjIyMzYsInMiOiI0OGY0YjIzNmMwYWQ5MDFjNmRkNGVkNTgyMjQxZDZjMDM1OWUyYzIwIiwidiI6MX0",
    "max_width_2000": 1600,
    "max_height_2000": 1067,
    "url_max_2000": "https://live.staticflickr.com/1244/884880670_839aea4bbb_h.jpg?s=eyJpIjo4ODQ4ODA2NzAsImUiOjE3NjQ3MjIyMzYsInMiOiIxZDg4N2JhZjlmZGNlNGI0ZWJhMWM3NWRkMDkxOTgxZDZhYjAyYTVlIiwidiI6MX0",
    "flickr_page": "https://www.flickr.com/photos/54968894@N00/884880670",
    "count_view": "38"
  },
  {
    "id": "884011085",
    "owner": "54968894@N00",
    "title": "16/01/2006 20:48",
    "realname": "Sammi Fang",
    "ownername": "sammifang",
    "datetaken": "2006-01-16 20:48:56",
    "max_width": 4368,
    "max_height": 2912,
    "url_max": "https://live.staticflickr.com/1302/884011085_f04c5a41bf_o.jpg?s=eyJpIjo4ODQwMTEwODUsImUiOjE3NjQ3MjIyMzYsInMiOiI3MTNmNjE5MjI1OTdhZWM5NmRjMGYwZmEzMWJkZTRjM2U3ODU3OWM4IiwidiI6MX0",
    "max_width_2000": 1600,
    "max_height_2000": 1067,
    "url_max_2000": "https://live.staticflickr.com/1302/884011085_88d62334a9_h.jpg?s=eyJpIjo4ODQwMTEwODUsImUiOjE3NjQ3MjIyMzYsInMiOiI5NGI4ZDkwZmI1ODA1MWUwNGIxYTkzODMwNDVjMTI1MDI5NzBmNjc4IiwidiI6MX0",
    "flickr_page": "https://www.flickr.com/photos/54968894@N00/884011085",
    "count_view": "35"
  },
  {
    "id": "883992521",
    "owner": "54968894@N00",
    "title": "16/01/2006 20:46",
    "realname": "Sammi Fang",
    "ownername": "sammifang",
    "datetaken": "2006-01-16 20:46:47",
    "max_width": 2912,
    "max_height": 4368,
    "url_max": "https://live.staticflickr.com/1292/883992521_db8d7e7708_o.jpg?s=eyJpIjo4ODM5OTI1MjEsImUiOjE3NjQ3MjIyMzYsInMiOiIzNzEwYTJhMTIxYTRkNmNlMTk5ODVmMTVmZWFjM2I0MzhmNDhlOWI1IiwidiI6MX0",
    "max_width_2000": 1365,
    "max_height_2000": 2048,
    "url_max_2000": "https://live.staticflickr.com/1292/883992521_736b0bfc7f_k.jpg?s=eyJpIjo4ODM5OTI1MjEsImUiOjE3NjQ3MjIyMzYsInMiOiI4N2ZmM2E0ZTRhNDY5NmE1MjE0ZjQ1ZDAxODg0MzM3MDdkZWQwMDhiIiwidiI6MX0",
    "flickr_page": "https://www.flickr.com/photos/54968894@N00/883992521",
    "count_view": "36"
  },
  {
    "id": "884828880",
    "owner": "54968894@N00",
    "title": "16/01/2006 20:46",
    "realname": "Sammi Fang",
    "ownername": "sammifang",
    "datetaken": "2006-01-16 20:46:35",
    "max_width": 4368,
    "max_height": 2912,
    "url_max": "https://live.staticflickr.com/1145/884828880_e1b0ce6d23_o.jpg?s=eyJpIjo4ODQ4Mjg4ODAsImUiOjE3NjQ3MjIyMzYsInMiOiI5N2NjNmY3MmMwMjhjZGIzZjk1MDU1ZDcxYzJiNzVjNDMzZDU0MjRmIiwidiI6MX0",
    "max_width_2000": 1600,
    "max_height_2000": 1067,
    "url_max_2000": "https://live.staticflickr.com/1145/884828880_8dca365025_h.jpg?s=eyJpIjo4ODQ4Mjg4ODAsImUiOjE3NjQ3MjIyMzYsInMiOiI3YjU3NTU4MTcxNzRjMzk4YjQ1YTYwN2VkNjY4MGNiZjFhNjAxNDYzIiwidiI6MX0",
    "flickr_page": "https://www.flickr.com/photos/54968894@N00/884828880",
    "count_view": "35"
  },
  {
    "id": "884812666",
    "owner": "54968894@N00",
    "title": "16/01/2006 20:45",
    "realname": "Sammi Fang",
    "ownername": "sammifang",
    "datetaken": "2006-01-16 20:45:47",
    "max_width": 4368,
    "max_height": 2912,
    "url_max": "https://live.staticflickr.com/1438/884812666_56d1777b2c_o.jpg?s=eyJpIjo4ODQ4MTI2NjYsImUiOjE3NjQ3MjIyMzYsInMiOiI0NjVmMDQ0NjZjMGJiMDk0NTc3MzBjODE4NDY5MDA3YzBhOGJlMWMwIiwidiI6MX0",
    "max_width_2000": 1600,
    "max_height_2000": 1067,
    "url_max_2000": "https://live.staticflickr.com/1438/884812666_4354c053ce_h.jpg?s=eyJpIjo4ODQ4MTI2NjYsImUiOjE3NjQ3MjIyMzYsInMiOiJjOTBjZGU1NDI5NmIzMWUzZDY0ZGUzOTc1YjIzNmU4NTQ0ODFkNWI5IiwidiI6MX0",
    "flickr_page": "https://www.flickr.com/photos/54968894@N00/884812666",
    "count_view": "37"
  },
  {
    "id": "885051968",
    "owner": "54968894@N00",
    "title": "16/01/2006 20:41",
    "realname": "Sammi Fang",
    "ownername": "sammifang",
    "datetaken": "2006-01-16 20:41:38",
    "max_width": 4000,
    "max_height": 2666,
    "url_max": "https://live.staticflickr.com/1280/885051968_03b3152ede_4k.jpg?s=eyJpIjo4ODUwNTE5NjgsImUiOjE3NjQ3MjIyMzUsInMiOiI2M2YyMzZlY2Y1NWIzMmM2ZDg3YWI1NmJkMzEzNTBjYTRiZGVmN2UyIiwidiI6MX0",
    "max_width_2000": 1600,
    "max_height_2000": 1066,
    "url_max_2000": "https://live.staticflickr.com/1280/885051968_9f4446acb9_h.jpg?s=eyJpIjo4ODUwNTE5NjgsImUiOjE3NjQ3MjIyMzUsInMiOiJjOTAzZDVlMTBhOTQ3MTY0NDFhYmY1OTIzNjkxZjQwY2UyOWM3MGE0IiwidiI6MX0",
    "flickr_page": "https://www.flickr.com/photos/54968894@N00/885051968",
    "count_view": "24"
  },
  {
    "id": "883836041",
    "owner": "54968894@N00",
    "title": "15/01/2006 19:26",
    "realname": "Sammi Fang",
    "ownername": "sammifang",
    "datetaken": "2006-01-15 19:26:47",
    "max_width": 4368,
    "max_height": 2912,
    "url_max": "https://live.staticflickr.com/1374/883836041_4483ddb5ed_o.jpg?s=eyJpIjo4ODM4MzYwNDEsImUiOjE3NjQ3MjIyMzYsInMiOiIwN2I5MTE1ZDE0YmViYjM4OGJlNjg0YjJmYWI2MzZmOTJjZmE0YTUwIiwidiI6MX0",
    "max_width_2000": 1600,
    "max_height_2000": 1067,
    "url_max_2000": "https://live.staticflickr.com/1374/883836041_b0e4d40b22_h.jpg?s=eyJpIjo4ODM4MzYwNDEsImUiOjE3NjQ3MjIyMzYsInMiOiJkYzI4YjVkYjhhZTU5OWU5MWM0NjFhMzk2NGZjYmQ5Zjg5YjM0MTA0IiwidiI6MX0",
    "flickr_page": "https://www.flickr.com/photos/54968894@N00/883836041",
    "count_view": "306"
  },
  {
    "id": "884669012",
    "owner": "54968894@N00",
    "title": "15/01/2006 19:22",
    "realname": "Sammi Fang",
    "ownername": "sammifang",
    "datetaken": "2006-01-15 19:22:23",
    "max_width": 4368,
    "max_height": 2912,
    "url_max": "https://live.staticflickr.com/1414/884669012_3da395857a_o.jpg?s=eyJpIjo4ODQ2NjkwMTIsImUiOjE3NjQ3MjIyMzYsInMiOiI3YWJjMGFlZWY0MTNhOGJjZjMzZGVjOWY5Mjk0YjgwNmYzMGM3NGNhIiwidiI6MX0",
    "max_width_2000": 1600,
    "max_height_2000": 1067,
    "url_max_2000": "https://live.staticflickr.com/1414/884669012_b2dd2fbb1c_h.jpg?s=eyJpIjo4ODQ2NjkwMTIsImUiOjE3NjQ3MjIyMzYsInMiOiI2ODZlYmNhYzhlMTQ2YmMwNmM2MTJjMDMyNzcxM2I4NjQwN2JiYjNhIiwidiI6MX0",
    "flickr_page": "https://www.flickr.com/photos/54968894@N00/884669012",
    "count_view": "60"
  },
  {
    "id": "883806613",
    "owner": "54968894@N00",
    "title": "15/01/2006 19:20",
    "realname": "Sammi Fang",
    "ownername": "sammifang",
    "datetaken": "2006-01-15 19:20:04",
    "max_width": 4368,
    "max_height": 2912,
    "url_max": "https://live.staticflickr.com/1333/883806613_fb57d3f899_o.jpg?s=eyJpIjo4ODM4MDY2MTMsImUiOjE3NjQ3MjIyMzYsInMiOiJhZGRjOGJiZjczZTk2ZmU5YzNkOTZhYmM0YjQyMmM3MmMyNmM5NDA4IiwidiI6MX0",
    "max_width_2000": 1600,
    "max_height_2000": 1067,
    "url_max_2000": "https://live.staticflickr.com/1333/883806613_04445f2b17_h.jpg?s=eyJpIjo4ODM4MDY2MTMsImUiOjE3NjQ3MjIyMzYsInMiOiJjNzU3NzhlMWNjNTI3ZWFmNjMzOTI3NzkzMjEyMWRiYWFlM2ZkMjQ0IiwidiI6MX0",
    "flickr_page": "https://www.flickr.com/photos/54968894@N00/883806613",
    "count_view": "60"
  },
  {
    "id": "883792711",
    "owner": "54968894@N00",
    "title": "15/01/2006 19:19",
    "realname": "Sammi Fang",
    "ownername": "sammifang",
    "datetaken": "2006-01-15 19:19:46",
    "max_width": 4368,
    "max_height": 2912,
    "url_max": "https://live.staticflickr.com/1233/883792711_4d64bb7764_o.jpg?s=eyJpIjo4ODM3OTI3MTEsImUiOjE3NjQ3MjIyMzYsInMiOiIxMjE5NzBmNzBhNjBjYWZlODBmNmUyNzgyNTUyMTMzMjI0YTNjOWZiIiwidiI6MX0",
    "max_width_2000": 1600,
    "max_height_2000": 1067,
    "url_max_2000": "https://live.staticflickr.com/1233/883792711_2cce1d90ea_h.jpg?s=eyJpIjo4ODM3OTI3MTEsImUiOjE3NjQ3MjIyMzYsInMiOiI3OTA2YmViZjIzMDQ0NGVhMTg4MTUxNGZhYTk3NDA1MmExMTllNjE1IiwidiI6MX0",
    "flickr_page": "https://www.flickr.com/photos/54968894@N00/883792711",
    "count_view": "62"
  },
  {
    "id": "884630366",
    "owner": "54968894@N00",
    "title": "15/01/2006 19:19",
    "realname": "Sammi Fang",
    "ownername": "sammifang",
    "datetaken": "2006-01-15 19:19:20",
    "max_width": 4368,
    "max_height": 2912,
    "url_max": "https://live.staticflickr.com/1172/884630366_4a217101aa_o.jpg?s=eyJpIjo4ODQ2MzAzNjYsImUiOjE3NjQ3MjIyMzYsInMiOiI2YjI3ZjhmNTQyZTNiMTU1OWQ2OTY1OGYxMTk1ZWU4ZmQzM2YyYTM0IiwidiI6MX0",
    "max_width_2000": 1600,
    "max_height_2000": 1067,
    "url_max_2000": "https://live.staticflickr.com/1172/884630366_74534fc8af_h.jpg?s=eyJpIjo4ODQ2MzAzNjYsImUiOjE3NjQ3MjIyMzYsInMiOiIxZmE4NDYxZWE3MTExYWVmMzA2MzY2NjlkMGFjMTI5MGRjZDMxMGUyIiwidiI6MX0",
    "flickr_page": "https://www.flickr.com/photos/54968894@N00/884630366",
    "count_view": "41"
  },
  {
    "id": "883768385",
    "owner": "54968894@N00",
    "title": "15/01/2006 19:18",
    "realname": "Sammi Fang",
    "ownername": "sammifang",
    "datetaken": "2006-01-15 19:18:54",
    "max_width": 4368,
    "max_height": 2912,
    "url_max": "https://live.staticflickr.com/1304/883768385_11dd16de2f_o.jpg?s=eyJpIjo4ODM3NjgzODUsImUiOjE3NjQ3MjIyMzYsInMiOiJkOGFjNjNkMzQxMmRlNWZkYWY3ODgxYWNkYzFhOTAzZjE0NTdmN2I4IiwidiI6MX0",
    "max_width_2000": 1600,
    "max_height_2000": 1067,
    "url_max_2000": "https://live.staticflickr.com/1304/883768385_92134c17b7_h.jpg?s=eyJpIjo4ODM3NjgzODUsImUiOjE3NjQ3MjIyMzYsInMiOiJiMGY5NDE3M2JiODM1Y2ExOTg4YjMzODg4NTdiMGNjY2JmOTUwZWU1IiwidiI6MX0",
    "flickr_page": "https://www.flickr.com/photos/54968894@N00/883768385",
    "count_view": "54"
  },
  {
    "id": "884608022",
    "owner": "54968894@N00",
    "title": "15/01/2006 19:15",
    "realname": "Sammi Fang",
    "ownername": "sammifang",
    "datetaken": "2006-01-15 19:15:17",
    "max_width": 4368,
    "max_height": 2912,
    "url_max": "https://live.staticflickr.com/1440/884608022_8ab2f02d9d_o.jpg?s=eyJpIjo4ODQ2MDgwMjIsImUiOjE3NjQ3MjIyMzYsInMiOiJkZDkyN2UxN2QxYjhiNGNkM2I5MmQ3ZjkxYjQ4NDI0Njg4ODY0ODMzIiwidiI6MX0",
    "max_width_2000": 1600,
    "max_height_2000": 1067,
    "url_max_2000": "https://live.staticflickr.com/1440/884608022_d84f057e22_h.jpg?s=eyJpIjo4ODQ2MDgwMjIsImUiOjE3NjQ3MjIyMzYsInMiOiI1YTBhNTJkZWU0NDExN2Q1YmFmYzczNmVhZWFjMWFhMDUxZjViMmYyIiwidiI6MX0",
    "flickr_page": "https://www.flickr.com/photos/54968894@N00/884608022",
    "count_view": "52"
  },
  {
    "id": "883744157",
    "owner": "54968894@N00",
    "title": "15/01/2006 19:15",
    "realname": "Sammi Fang",
    "ownername": "sammifang",
    "datetaken": "2006-01-15 19:15:04",
    "max_width": 4368,
    "max_height": 2912,
    "url_max": "https://live.staticflickr.com/1019/883744157_b974e2a7e9_o.jpg?s=eyJpIjo4ODM3NDQxNTcsImUiOjE3NjQ3MjIyMzYsInMiOiJiZDg0YjNhYjNlNjI1Yzc4Y2MxYWQ3ZWMwM2RkM2NiMDZjYjIzZjVkIiwidiI6MX0",
    "max_width_2000": 1600,
    "max_height_2000": 1067,
    "url_max_2000": "https://live.staticflickr.com/1019/883744157_8f913f10cf_h.jpg?s=eyJpIjo4ODM3NDQxNTcsImUiOjE3NjQ3MjIyMzYsInMiOiI1NTU4ZDIxMzRjOGY0MzVhMTEyMDAwY2JhZDM5NjY3MzU1NmMxY2MzIiwidiI6MX0",
    "flickr_page": "https://www.flickr.com/photos/54968894@N00/883744157",
    "count_view": "61"
  },
  {
    "id": "883730965",
    "owner": "54968894@N00",
    "title": "15/01/2006 19:14",
    "realname": "Sammi Fang",
    "ownername": "sammifang",
    "datetaken": "2006-01-15 19:14:52",
    "max_width": 4368,
    "max_height": 2912,
    "url_max": "https://live.staticflickr.com/1389/883730965_dd7afda7a7_o.jpg?s=eyJpIjo4ODM3MzA5NjUsImUiOjE3NjQ3MjIyMzYsInMiOiIwZjVkNzJiMjMzMDU5Y2FmZWM5ZDI3ZGUwNTY2MGU5MTdkMGZmZGYxIiwidiI6MX0",
    "max_width_2000": 1600,
    "max_height_2000": 1067,
    "url_max_2000": "https://live.staticflickr.com/1389/883730965_ad994cab1a_h.jpg?s=eyJpIjo4ODM3MzA5NjUsImUiOjE3NjQ3MjIyMzYsInMiOiJhOTFiM2IxMWNlMTRhZDk3NThkNmI4NGIxZjJhMTRjNWJkZTcyM2YyIiwidiI6MX0",
    "flickr_page": "https://www.flickr.com/photos/54968894@N00/883730965",
    "count_view": "61"
  },
  {
    "id": "884567424",
    "owner": "54968894@N00",
    "title": "15/01/2006 19:12",
    "realname": "Sammi Fang",
    "ownername": "sammifang",
    "datetaken": "2006-01-15 19:12:54",
    "max_width": 4368,
    "max_height": 2912,
    "url_max": "https://live.staticflickr.com/1321/884567424_4b0b2acfb4_o.jpg?s=eyJpIjo4ODQ1Njc0MjQsImUiOjE3NjQ3MjIyMzYsInMiOiJkNThjZjFlZTAyYmIwZDI4NGI0Y2U5ZDE5Njc3ZTMyNzU1MjUxYzMzIiwidiI6MX0",
    "max_width_2000": 1600,
    "max_height_2000": 1067,
    "url_max_2000": "https://live.staticflickr.com/1321/884567424_3f99c2fa63_h.jpg?s=eyJpIjo4ODQ1Njc0MjQsImUiOjE3NjQ3MjIyMzYsInMiOiJhNWI2NGJjYzY2YWRiNzYwOGM1YTZhOGU1NWVhZDgwMmJjNzlkZDMzIiwidiI6MX0",
    "flickr_page": "https://www.flickr.com/photos/54968894@N00/884567424",
    "count_view": "45"
  },
  {
    "id": "883703613",
    "owner": "54968894@N00",
    "title": "15/01/2006 19:10",
    "realname": "Sammi Fang",
    "ownername": "sammifang",
    "datetaken": "2006-01-15 19:10:31",
    "max_width": 4368,
    "max_height": 2912,
    "url_max": "https://live.staticflickr.com/1010/883703613_aea206c087_o.jpg?s=eyJpIjo4ODM3MDM2MTMsImUiOjE3NjQ3MjIyMzYsInMiOiJiNTQ3NGZkMTIwNDQwOWY5ZTRkM2ZhYWNjNjFhMTI4ZTY3MGRjYThlIiwidiI6MX0",
    "max_width_2000": 1600,
    "max_height_2000": 1067,
    "url_max_2000": "https://live.staticflickr.com/1010/883703613_4f230089f5_h.jpg?s=eyJpIjo4ODM3MDM2MTMsImUiOjE3NjQ3MjIyMzYsInMiOiI1Zjc5ZTc1ZjFjMGE3OWU1MTZkZTE1YTE4ZDBlMzZiYmU0MzdlMDBlIiwidiI6MX0",
    "flickr_page": "https://www.flickr.com/photos/54968894@N00/883703613",
    "count_view": "38"
  },
  {
    "id": "884542734",
    "owner": "54968894@N00",
    "title": "15/01/2006 19:09",
    "realname": "Sammi Fang",
    "ownername": "sammifang",
    "datetaken": "2006-01-15 19:09:50",
    "max_width": 2912,
    "max_height": 4368,
    "url_max": "https://live.staticflickr.com/1198/884542734_e5d6976585_o.jpg?s=eyJpIjo4ODQ1NDI3MzQsImUiOjE3NjQ3MjIyMzcsInMiOiIwNDg5NGRjMzNiMmJiNDcxYzM2ODQzYmY5NDFhODhjNGU5NDc1ZWM1IiwidiI6MX0",
    "max_width_2000": 1365,
    "max_height_2000": 2048,
    "url_max_2000": "https://live.staticflickr.com/1198/884542734_3ef538c5bc_k.jpg?s=eyJpIjo4ODQ1NDI3MzQsImUiOjE3NjQ3MjIyMzcsInMiOiJmZmY4MzkxYmNiMmYzZjY1MzU2OTBhZTBhMGVkNWNmNDZhNDIwMTNlIiwidiI6MX0",
    "flickr_page": "https://www.flickr.com/photos/54968894@N00/884542734",
    "count_view": "62"
  },
  {
    "id": "883683425",
    "owner": "54968894@N00",
    "title": "15/01/2006 16:44",
    "realname": "Sammi Fang",
    "ownername": "sammifang",
    "datetaken": "2006-01-15 16:44:45",
    "max_width": 4368,
    "max_height": 2912,
    "url_max": "https://live.staticflickr.com/1072/883683425_77a53bf842_o.jpg?s=eyJpIjo4ODM2ODM0MjUsImUiOjE3NjQ3MjIyMzcsInMiOiJmYjA3MWU2MjE5NDFjNTI4YWQ3YTVlMWI1ODMwNDRjNmI4Y2Q4ZDcwIiwidiI6MX0",
    "max_width_2000": 1600,
    "max_height_2000": 1067,
    "url_max_2000": "https://live.staticflickr.com/1072/883683425_44dcba8786_h.jpg?s=eyJpIjo4ODM2ODM0MjUsImUiOjE3NjQ3MjIyMzcsInMiOiI1MTdhZDNmZWFjNzE0NzBlMGJkZjJlYTA2YjVlNWQ0ZDJiZGYyNTIwIiwidiI6MX0",
    "flickr_page": "https://www.flickr.com/photos/54968894@N00/883683425",
    "count_view": "1171"
  },
  {
    "id": "884498346",
    "owner": "54968894@N00",
    "title": "15/01/2006 16:43",
    "realname": "Sammi Fang",
    "ownername": "sammifang",
    "datetaken": "2006-01-15 16:43:29",
    "max_width": 4368,
    "max_height": 2912,
    "url_max": "https://live.staticflickr.com/1149/884498346_054db80fe6_o.jpg?s=eyJpIjo4ODQ0OTgzNDYsImUiOjE3NjQ3MjIyMzcsInMiOiI3ZGU4MDVkYjQxMTE2ZWViNTliZTQ3NzVmMWU5MzRmYzllZGM0YTZkIiwidiI6MX0",
    "max_width_2000": 1600,
    "max_height_2000": 1067,
    "url_max_2000": "https://live.staticflickr.com/1149/884498346_e64b9d1b30_h.jpg?s=eyJpIjo4ODQ0OTgzNDYsImUiOjE3NjQ3MjIyMzcsInMiOiIwMzZkNzYzMmU2NTI4NGE2ODkzYjUxMTY0YWZjNDc0NjdkN2NiMjRmIiwidiI6MX0",
    "flickr_page": "https://www.flickr.com/photos/54968894@N00/884498346",
    "count_view": "383"
  },
  {
    "id": "881280324",
    "owner": "54968894@N00",
    "title": "10/01/2006 21:45",
    "realname": "Sammi Fang",
    "ownername": "sammifang",
    "datetaken": "2006-01-10 21:45:49",
    "max_width": 4368,
    "max_height": 2912,
    "url_max": "https://live.staticflickr.com/1114/881280324_a11d2915f3_o.jpg?s=eyJpIjo4ODEyODAzMjQsImUiOjE3NjQ3MjIyMzcsInMiOiI3MWI5ZTY3N2MwMzU5MmQ3OWJhZjIyMjBhYjU0Y2Y2MmJhNTdlNjYwIiwidiI6MX0",
    "max_width_2000": 1600,
    "max_height_2000": 1067,
    "url_max_2000": "https://live.staticflickr.com/1114/881280324_60ad92ae7e_h.jpg?s=eyJpIjo4ODEyODAzMjQsImUiOjE3NjQ3MjIyMzcsInMiOiI1MmNlNGE0Y2ExOGM5ZTZiNTcxNmYyNzY5MDQxODEzNDk2MGYwOWYxIiwidiI6MX0",
    "flickr_page": "https://www.flickr.com/photos/54968894@N00/881280324",
    "count_view": "21"
  },
  {
    "id": "881262058",
    "owner": "54968894@N00",
    "title": "10/01/2006 21:45",
    "realname": "Sammi Fang",
    "ownername": "sammifang",
    "datetaken": "2006-01-10 21:45:28",
    "max_width": 4368,
    "max_height": 2912,
    "url_max": "https://live.staticflickr.com/1307/881262058_e1df177847_o.jpg?s=eyJpIjo4ODEyNjIwNTgsImUiOjE3NjQ3MjIyMzcsInMiOiI0MjRkZjZlMzE1ZjYyZTYzMjczMDcwODRjYjdjZWJlNzY3ZDRkZTU3IiwidiI6MX0",
    "max_width_2000": 1600,
    "max_height_2000": 1067,
    "url_max_2000": "https://live.staticflickr.com/1307/881262058_daf1ba790a_h.jpg?s=eyJpIjo4ODEyNjIwNTgsImUiOjE3NjQ3MjIyMzcsInMiOiJkZDY3Zjc2Y2I4ZTI4NmQwMTAwNmI1NmY0NDYyNWRlNjI0OWZjZjVkIiwidiI6MX0",
    "flickr_page": "https://www.flickr.com/photos/54968894@N00/881262058",
    "count_view": "28"
  },
  {
    "id": "880395109",
    "owner": "54968894@N00",
    "title": "10/01/2006 21:43",
    "realname": "Sammi Fang",
    "ownername": "sammifang",
    "datetaken": "2006-01-10 21:43:39",
    "max_width": 4368,
    "max_height": 2912,
    "url_max": "https://live.staticflickr.com/1176/880395109_8ad0283e70_o.jpg?s=eyJpIjo4ODAzOTUxMDksImUiOjE3NjQ3MjIyMzcsInMiOiI2MzAzMTk4NjhjZTZmMTI1Njk3ZjFlM2NlYTExZjVlZjdhZjI4MTk5IiwidiI6MX0",
    "max_width_2000": 1600,
    "max_height_2000": 1067,
    "url_max_2000": "https://live.staticflickr.com/1176/880395109_387fbc33fc_h.jpg?s=eyJpIjo4ODAzOTUxMDksImUiOjE3NjQ3MjIyMzcsInMiOiI2YmYzYjkzM2E4MjJjMjRiMmZkMGI3YjA0NGM3ODE3ZjlkNjA2Y2NlIiwidiI6MX0",
    "flickr_page": "https://www.flickr.com/photos/54968894@N00/880395109",
    "count_view": "28"
  },
  {
    "id": "881215294",
    "owner": "54968894@N00",
    "title": "10/01/2006 20:26",
    "realname": "Sammi Fang",
    "ownername": "sammifang",
    "datetaken": "2006-01-10 20:26:40",
    "max_width": 4368,
    "max_height": 2912,
    "url_max": "https://live.staticflickr.com/1193/881215294_ae4cac8455_o.jpg?s=eyJpIjo4ODEyMTUyOTQsImUiOjE3NjQ3MjIyMzcsInMiOiIxYjAyZTE4MTRhMjVhNWQ1YWUwZDEwYjE5ZjIwMjllZDMzOTY0OTE5IiwidiI6MX0",
    "max_width_2000": 1600,
    "max_height_2000": 1067,
    "url_max_2000": "https://live.staticflickr.com/1193/881215294_9b209d3bcc_h.jpg?s=eyJpIjo4ODEyMTUyOTQsImUiOjE3NjQ3MjIyMzcsInMiOiJjN2Q1NTJiYjk3MWMwZDFmMzVlNjVhYmQxMTgyYzY1ZDA3OTY4NjQ1IiwidiI6MX0",
    "flickr_page": "https://www.flickr.com/photos/54968894@N00/881215294",
    "count_view": "19"
  },
  {
    "id": "880349123",
    "owner": "54968894@N00",
    "title": "10/01/2006 20:26",
    "realname": "Sammi Fang",
    "ownername": "sammifang",
    "datetaken": "2006-01-10 20:26:02",
    "max_width": 4368,
    "max_height": 2912,
    "url_max": "https://live.staticflickr.com/1062/880349123_9a13667c67_o.jpg?s=eyJpIjo4ODAzNDkxMjMsImUiOjE3NjQ3MjIyMzgsInMiOiIxMGYwZjY4NGY3OTUxZDYwMWQ0NDM0YTE4NTk1OTE2Y2YxOTgzNWU4IiwidiI6MX0",
    "max_width_2000": 1600,
    "max_height_2000": 1067,
    "url_max_2000": "https://live.staticflickr.com/1062/880349123_3682552222_h.jpg?s=eyJpIjo4ODAzNDkxMjMsImUiOjE3NjQ3MjIyMzgsInMiOiJhOGQwNTQwNjg3MDYxNTdiODhlMmRiYzEyMmVkZDU3NmNiNDU5MDdmIiwidiI6MX0",
    "flickr_page": "https://www.flickr.com/photos/54968894@N00/880349123",
    "count_view": "23"
  },
  {
    "id": "422281082",
    "owner": "54968894@N00",
    "title": "Portrait WAWA10272005 028",
    "realname": "Sammi Fang",
    "ownername": "sammifang",
    "datetaken": "2005-10-27 14:11:20",
    "max_width": 4096,
    "max_height": 2723,
    "url_max": "https://live.staticflickr.com/158/422281082_e835c0f7c4_4k.jpg?s=eyJpIjo0MjIyODEwODIsImUiOjE3NjQ3MjIzMzYsInMiOiI4NDQxYzcwZmY1YTNiMWY0MWVkMzY2MzE3M2RkY2MxOWU5MjA2NWM4IiwidiI6MX0",
    "max_width_2000": 1600,
    "max_height_2000": 1064,
    "url_max_2000": "https://live.staticflickr.com/158/422281082_3b4a8d7b0d_h.jpg?s=eyJpIjo0MjIyODEwODIsImUiOjE3NjQ3MjIzMzYsInMiOiJmYjU0Zjk1NWRkMTJjNzkzOWI5NTYzMzk4MjBmOGIzYjhhYmNjMDNlIiwidiI6MX0",
    "flickr_page": "https://www.flickr.com/photos/54968894@N00/422281082",
    "count_view": "290"
  },
  {
    "id": "1217630262",
    "owner": "54968894@N00",
    "title": "22/09/2002 04:03 AM",
    "realname": "Sammi Fang",
    "ownername": "sammifang",
    "datetaken": "2002-09-22 04:03:42",
    "max_width": 4845,
    "max_height": 1527,
    "url_max": "https://live.staticflickr.com/1198/1217630262_0f78775d7b_5k.jpg?s=eyJpIjoxMjE3NjMwMjYyLCJlIjoxNzY0NzIyMTg2LCJzIjoiNDY5ZjUwYmVkZjEwMTNiYTE1NzBjMjI4Mjk3ZjUyMTIzN2Y4ODg1MCIsInYiOjF9",
    "max_width_2000": 1600,
    "max_height_2000": 504,
    "url_max_2000": "https://live.staticflickr.com/1198/1217630262_1457671bbf_h.jpg?s=eyJpIjoxMjE3NjMwMjYyLCJlIjoxNzY0NzIyMTg2LCJzIjoiYjcxZTYxYTE0MzU5NjY2MjA5ODY0OGMzYjBkNWJlMTE3ZGUyZjFjYSIsInYiOjF9",
    "flickr_page": "https://www.flickr.com/photos/54968894@N00/1217630262",
    "count_view": "45"
  }
]